article_id,author_id,publish_on,summary,content
2310195,25120,2014-07-11T06:36:11-04:00,"Analysts at Barclays turn bullish on Autodesk.The transition into a subscription based business model is moving along fine, although it impacts the current financial performance.I remain cautious given the still high valuation on estimated post-transition valuation multiples.","Shares of Autodesk (NASDAQ:ADSK) failed to gain ground in a bearish trading session on Thursday despite receiving an upgrade from analysts at Barclays.Like many of its competitors, those are software-driven companies delivering solutions to a wide range of clients, Autodesk is in the middle of a shift in its business model. The company is shifting from licenses and upfront software packages and solutions to the ¨cloud¨ and subscription-based business models.While I understand that current earnings and revenues are depressed by this change, I fail to see the upside even after accounting for the ¨understatement¨ of the current performance.Barclays Turns BullishAnalysts at Barclays raised their rating on Autodesk from equal-weight to overweight, attaching a $65 price target for the end of 2015.The focus on the subscription model is limiting the company's GAAP growth numbers during this transition phase. Like many other companies including Adobe Systems (NASDAQ:ADBE) for instance, Autodesk is shifting to subscriptions over upfront software packages.During the transition phase, and in the years following, Autodesk should be able to contribute to cash flows and be able to boost margins. The price target is based on a 12% compounded annual growth rate, operating margins of 30% and nearly $1 billion in free cash flows.Autodesk's Overview And PlansBack in March, Autodesk gave an investor webcast stressing the Building Information Modeling (BIM) solutions which focus on planning, designing, building and management of assets.A continued increase in adoption of the BIM principle is expected to be the driver behind future anticipated revenue growth. Usage of these principles and software reduces risks for the wider construction sector, allowing for the optimization of design, among others. Opportunities are large with the construction sector in general still lagging in the adoption of IT spending.While the BIM solutions are very attractive in the long run, Autodesk already has great diversification in its businesses. The company is operating in platform solutions, architecture, engineering & construction, manufacturing and media & entertainment. In terms of actual products, the company still derives 50% of sales from its flagship product.Important to consider as I discussed the shift to the cloud, Autodesk's subscription revenues are close to making up 50% of total sales at the moment.Valuing AutodeskBack in May, Autodesk released its first quarter results. The company ended the quarter with nearly $2.4 billion in cash, equivalents and marketable securities. The company has nearly $750 million in debt outstanding, resulting in a solid net cash position of around $1.65 billion.Trading around $55 per share, Autodesk is valued at about $12.65 billion which values operating assets around $11 billion. On a trailing basis, Autodesk has posted sales of $2.30 billion on which it net earned $202 million.This values operating assets at 4.8 times trailing sales and roughly 55 times earnings.Despite the solid earnings and strong financial position, Autodesk does not pay a dividend at the moment.Looking At The PastAutodesk is of course switching to subscription based models to appeal to customers, but also generate recurring revenues and highly predictable cash flows. Yet the shift from recognizing all upfront revenues compared to a monthly recognition, has slowed down reported revenue growth recently. This is a result of the GAAP accounting system, and to get a better clue about revenue growth one should consider watching the billings being reported.As such sales have been flat between 2012 and 2014 around the $2.2 billion mark. At the same time deferred revenues have increased and are approaching a billion, as a result of the shift in the business model as discussed above. As such growth is still likely, with even understated and reported revenues having nearly doubled over the past decade.Earnings have been stagnant at best, coming in at $202 million on a trailing basis, still far below reported earnings of around $350 million in 2008. Just like revenues, earnings are understated as well due the transition and reported numbers should be adjusted to account for this.With exception of lows around $10-$15 during the financial crisis, shares have traded in a $25-$50 trading range over the past decade. Following returns of 60% over the past year, shares have advanced to current levels at $55 per share.Final TakeawayThe operating margin target of 30% as issued by Barclays seems rather ambitious in my eyes, resulting in net earnings margins of 20% per annum assuming statutory tax rates. This would translate into revenues of about $500 million per annum based on anticipated growth in sales. Even then shares trade at 22 times operating assets based on these highly optimistic assumptions.Back in May of this year I last had a look at Autodesk's prospects following the release of the first quarter results. I concluded that to get a true clue about the valuation of the business, one should look at the estimated performance of the business after the transition into the cloud has been completed. This is of course as the transition phase depresses current revenues.While the transition to the cloud could result in higher operating margins as argued by many, I believe competition is heating up as well. Therefore I apply historical net profit margins of 10-15%. The cloud business model reduces distribution costs, but I anticipate that most of these gains will be made undone by competition. Even when applying net margins of 15% on a revenue base of $2.5 billion, earnings are seen around $375 million, or close to 30 times earnings.The lack of dividends and lack of share repurchases in recent times is disappointing as well given the solid financial position. It is noteworthy that between 1989 and 2005, the company paid a quarterly dividend of $0.015 per quarter, yet it has halted those dividends. For this reason, the already high valuation and optimistic analysts, I remain cautious and stay on the sidelines.Disclosure: The author has no positions in any stocks mentioned, and no plans to initiate any positions within the next 72 hours. The author wrote this article themselves, and it expresses their own opinions. The author is not receiving compensation for it (other than from Seeking Alpha). The author has no business relationship with any company whose stock is mentioned in this article."
2116063,25289,2014-03-30T02:54:39-04:00,Eight insiders sold Autodesk stock within one month.The stock was not purchased by any insiders in the month of intensive selling.All eight of these insiders decreased their holdings by more than 10%.,"Autodesk (NASDAQ:ADSK) operates as a design software and services company worldwide. Its Platform Solutions and Emerging Business segment offers AutoCAD software.Insider selling during the last 30 daysHere is a table of Autodesk's insider activity during the last 30 days.There have been 218,069 shares sold by insiders during the last 30 days. Jan Becker, Pascal Di Fronzo, Mark Hawkins, Carl Bass, Steven Blum, and Crawford Beveridge sold shares pursuant to the Rule 10b5-1 plan. More details about the Rule 10b5-1 trading plan can be found from this link.Insider selling by calendar monthHere is a table of Autodesk's insider activity by calendar month.There have been 2,507,552 shares sold, and there have been zero shares purchased by insiders since January 2013.FinancialsAutodesk reported the fiscal 2014 full-year, which ended January 31, financial results on February 26 with the following highlights:The eight insiders sold their shares after these results.Autodesk had a negative quarterly revenue growth year-over-year in the fourth quarter.OutlookAutodesk's fiscal 2015 first-quarter guidance is as follows:Autodesk's fiscal 2015 full-year guidance is as follows:CompetitionAutodesk's competitors include Adobe Systems (NASDAQ:ADBE), Dassault Systemes SA (OTCPK:DASTY), and PTC Inc. (NASDAQ:PTC). Here is a table comparing these companies.Autodesk has the weakest revenue growth among these four companies.Here is a table of these competitors' insider activities this year.Adobe Systems has also seen intensive insider selling during the last 30 days.ConclusionThere have been eight different insiders selling Autodesk, and there have not been any insiders buying Autodesk during the last 30 days. All eight of these insiders decreased their holdings by more than 10%. Autodesk has an insider ownership of 0.30%.Autodesk has a $37 price target from the Point & Figure chart. I believe there is an opportunity for a short entry with the $37 price target. I would place a stop loss at $59, which is the all-time high. The three main reasons for the proposed short entry are a bearish Point & Figure chart, negative revenue growth, and the intensive insider-selling activity.Disclosure: I have no positions in any stocks mentioned, but may initiate a short position in ADSK over the next 72 hours. I wrote this article myself, and it expresses my own opinions. I am not receiving compensation for it (other than from Seeking Alpha). I have no business relationship with any company whose stock is mentioned in this article."
2491235,71765,2014-09-12T13:02:51-04:00,"The company has expectations of revenues of $590 million-$605 million in FQ3, though analysts expect that revenues could go up to $588.2 million.Autodesk's billings and revenues for FY 2015 are expected to go up to 10%-12% and 7%-9%, up from 7%-9% and 4%-6%, respectively.According to Autodesk CEO Carl Bass, strong global demand and adoption needs of suite solutions resulted in billings and record revenue results.Revenues for Autodesk in America alone grew by 11% to $223 million compared to revenues in the second quarter last year.","Autodesk (NASDAQ:ADSK) has gone up sharply, and its volumes are already over 5x the daily average. The company has expectations of revenues of $590 million-$605 million in FQ3, though analysts think that revenues could go up to $588.2 million. At the same time, EPS for Autodesk is expected to range between $0.17 and $0.23, vs. a consensus of $0.28 EPS. Other companies, like Nuance (NASDAQ:NUAN) and Adobe (NASDAQ:ADBE), might have their near-term EPS pressured by a shift from licenses to subscriptions. We believe that the strong earnings revision cycle for Autodesk is likely to last, due to its positive performance in FQ2 and FY15 guidance.Autodesk's billings and revenues for the FY15 are expected to go up to 10%-12% and 7%-9% from 7%-9% and 4%-6%, respectively. The expected number of future subscribers has increased by 50,000 and now ranges between 200,000 and 250,000.The announcement of its FQ2 results were above expectations and the company showed a 27% year-on-year increase in its billings. As compared to FQ1's 10% increase, the results of FQ2 are much more promising for the company. In absolute terms, revenues amounted to $637 million, which is a 13% increase compared to the second quarter of FY14 that exceeded the consensus of $604 million. Subscriptions grew by 74,000 to reach a high 2.01 million.Deferred revenue balances, which were $981 million, grew quarter on quarter by 2%, while the year-on-year growth was 22%. This is basically an indication that Autodesk is reeling in customers through its cloud offerings. At the same time, due to the new customer contracts, the total contract value of the company is expected to go up by 20% -- especially when existing customers migrate to the cloud.Based on these facts and figures, it seems as if this positive earnings cycle for Autodesk is bound to last, and the software corporation is the right direction to go in to live through the 3-D printing revolution.Citi and RBC: Their Take on Autodesk's PerformanceOn the other hand, ADSK achieved a record revenue growth solely due to the upgrading of current licenses' rather than the issuance of new ones. The license upgrades have picked up the pace mainly because of a promotion scheme that is led by ADSK, which is likely to end in FY15. Citi does not look impressed with Autodesk's addition of about 200,000-250,000 subscribers for FY15, and this is mainly due to the fact that Citi managed to add about 250,000 subscribers to its own list in FY13. That, too, is with the help of fewer promotions.RBC, as opposed to Citi, thinks that Autodesk's numbers are pretty impressive and is of the view that the improvement in macroeconomic conditions has led to this impressive growth. RBC, however, is uncertain about the growth that is to be expected in FY16, though it does think that the cloud growth, license sales, and maintenance could help the company to grow its sales.According to Autodesk CEO Carl Bass, strong global demand and adoption needs of suite solutions resulted in billings and record revenue results. He added that the company has also progressed in the transition to a more recurring and subscription-based business, which added approximately 74,000 maintenance, desktop (rental), and cloud subscriptions.Revenues for Autodesk in America alone grew by 11% to $223 million compared to the revenues of the second quarter last year. EMEA revenue registered a growth of 21% to settle at $244 million. The revenue in APAC was approximately $170 million, which was an 8% increase compared to the second quarter of the last year.ConclusionBased on the turnaround that Autodesk has made from its licensing system to a subscription-based one, and outperforming the consensus of analysts, it is expected that the company's stock will be more bullish. This is mostly because of the diversity of the products that Autodesk provides. Autodesk has some of the most common software used in different processes -- including construction, where its AEC business segment seems to be doing immensely well compared to the company's other segments.Looking at the subscription approach from a small business viewpoint, the less cash-rich businesses can benefit from this as they will be able to use the software without incurring higher purchase costs. In other words, now that the company has shifted from licensing to subscriptions, it could increase revenues by registering an increase in demand for its products based on the fact that they may be more affordable vs. earlier ones.Keeping in view how the company has changed its approach to retain and attract more customers and has improved revenue growth every fiscal year, shares of Autodesk are a likely buy-and-hold investment due to the strong potential growth."
2068303,22775,2014-03-05T07:34:55-05:00,,"We said in our January article that Autodesk (NASDAQ:ADSK) was likely to keep surprising on the upside, as the company's two main verticals benefited from an increasingly supportive environment. Indeed, Autodesk delivered strong Q4 figures, with both revenues ($587m vs. consensus of $573m) and EPS ($0.40 vs. consensus of $0.34) coming in ahead of expectations, despite the continued transition to a rental model (~$30m impact on revenues). Importantly, the group also provided a sound FY15 3%-5% revenue growth guidance (vs. flat growth expected by consensus) that, in our view, is likely to remove investor concerns about the model shift, as the negative impact appears well under control at the top-line level.Unsurprisingly, Autodesk was constructive on its two main verticals. Construction (32% of revenues) grew 8% in the quarter, confirming our positive stance. Leading indicators such as the Architecture Billings Index continue to point to an improvement, confirming the usual pattern (commercial/industrial construction typically lags residential construction recoveries by 6-12 months).Manufacturing (25% of revenues) is also likely to remain supportive, as macro and PMI across the world have been improving in recent months, notably in two key geographies (Japan and Europe).If short-term revenue growth is expected to pick up, the mid-term outlook is also attractive, as Autodesk is expected to be a key beneficiary in the advent of 3D printing. 3D printing will sharply increase the number of design software users globally and spark rising interest for PLM solutions. 3D printing is also expected to open a huge market for Autodesk, the consumer market, that could be worth several billions in a few years (see our assumptions in our previous article).New model perfectly suited to the consumer marketWhile still early in its business model transition, Autodesk now has roughly 45% of recurring revenues and 1.9m subscribers. The group is thus well on track to reach its mid-term 70% recurring revenues target.Despite the slight short-term pressure on revenues and margins (FY15 non-GAAP operating margin guided to 14%-16% vs. consensus at 20%), the transition from a traditional license model to a rental and usage-based model remains a clear positive, in our view. Revenue streams become more predictable as they are based on subscriptions, new paying users are likely to join as upfront costs are attractive (vs. licenses) and piracy is likely to be reduced through the use of cloud-based authentication.In all, this model is perfectly suited to the consumer market and could enable Autodesk to fully benefit from the expected take-off of 3D printing for the mass market, for which the product pricing is key.ConclusionHigher revenues will come with lower commercial costs in the mid and long-term, suggesting that the new model is likely to deliver higher margins and cash flows in the long run.We reiterate our view that Autodesk is a different and safer way to play the 3D printing revolution, with valuation levels and earnings expectations much more decent than 3D printing stocks such as 3D Systems (NYSE:DDD), leaving room for upside.Disclosure: I have no positions in any stocks mentioned, and no plans to initiate any positions within the next 72 hours. I wrote this article myself, and it expresses my own opinions. I am not receiving compensation for it (other than from Seeking Alpha). I have no business relationship with any company whose stock is mentioned in this article."
1939931,25289,2014-01-11T09:19:00-05:00,,"In this article, I will feature one tech stock that has seen intensive insider selling during the last 30 days. Intensive insider selling can be defined by the following three criteria:Autodesk (NASDAQ:ADSK) operates as a design software and services company worldwide. Its Platform Solutions and Emerging Business segment offers AutoCAD software.Insider selling during the last 30 daysHere is a table of Autodesk's insider-trading activity during the last 30 days by insider.There have been 984,984 shares sold by insiders during the last 30 days. Carl Bass, Steven Blum, Mark Hawkins, and Crawford Beveridge sold shares pursuant to the Rule 10b5-1 plan.SEC Rule 10b5-1 is a regulation enacted by the United States Securities and Exchange Commission (SEC) in 2000. The SEC states that Rule 10b5-1 was enacted in order to resolve an unsettled issue over the definition of insider trading, which is prohibited by SEC Rule 10b-5. After Rule 10b5-1 was enacted, the SEC staff publicly took the position that canceling a planned trade made under the safe harbor does not constitute insider trading, even if the person was aware of the inside information when canceling the trade. This staff interpretation raises the possibility that executives can exploit this safe harbor by entering into 10b5-1 trading plans before they have inside information while retaining the option to later cancel those plans based on inside information.For example, a CEO of a company could call a broker on January 1 and enter into a plan to sell a particular quantity of shares of his company's stock on March 1, find out terrible news about his company on February 1 that will not become public until April 1, and then go forward with the March 1 sale anyway, saving himself from losing money when the bad news becomes public. Under the terms of Rule 10b5-1(b) this is insider trading because the CEO ""was aware"" of the inside information when he made the trade. But he can assert an affirmative defense under Rule 10b5-1(c), because he planned the trade before he learned the inside information.In general, it is a safer way for an insider to sell shares pursuant to a Rule 10b5-1 trading plan than without it.Insider selling by calendar monthHere is a table of Autodesk's insider-trading activity by calendar month.There have been 2,259,107 shares sold, and there have been zero shares purchased by insiders since January 2013. The month of January 2014 has seen the most insider selling.FinancialsAutodesk reported the fiscal 2014 third-quarter, which ended October 31, financial results on November 21 with the following highlights:OutlookAutodesk's guidance is as follows:CompetitionAutodesk's competitors include Adobe Systems (NASDAQ:ADBE), Dassault Systemes SA (OTCPK:DASTY), and PTC Inc. (NASDAQ:PTC). Here is a table comparing these companies.Autodesk has the highest P/B ratio among these four companies.Here is a table of these competitors' insider-trading activities during the last 30 days.Adobe Systems has also seen intensive insider selling during the last 30 days.ConclusionThere have been eight different insiders selling Autodesk, and there have not been any insiders buying Autodesk during the last 30 days. All eight of these insiders decreased their holdings by more than 10%. Autodesk has an insider ownership of 0.30%.There are seven analyst buy ratings, 12 neutral ratings, and zero sell ratings with an average price target of $48.71. Before entering short Autodesk, I would like to get a bearish confirmation from the Point and Figure chart. The two main reasons for the proposed short entry are bearish analyst price targets, and the intensive insider-selling activity.Disclosure: I have no positions in any stocks mentioned, and no plans to initiate any positions within the next 72 hours. I wrote this article myself, and it expresses my own opinions. I am not receiving compensation for it (other than from Seeking Alpha). I have no business relationship with any company whose stock is mentioned in this article."
