article_id,author_id,publish_on,summary,content
4374535,74695,2020-09-15T19:14:46-04:00,Autodesk continues to experience robust growth despite macroeconomic headwinds.Autodesk's investments into cloud technologies are starting to pay off in a big way.Autodesk's surprising billings decline hint at potential growth issues in the near term.,"Software giant Autodesk (ADSK) continues to perform well despite industry-wide headwinds. The company reported solid Q2 results, outperforming on several important metrics. Autodesk notably increases revenue by 14.6% Y/Y to $913.1 million, beating expectations by $11.34 million. Despite macroeconomic headwinds, Autodesk is well-positioned moving forward.Autodesk has performed incredibly well over the past few years. The pandemic will likely only accelerate trends that are favorable to Autodesk.Source: YChartsThe adoption of cloud-based technologies has been accelerating for years now. Autodesk is successfully capitalizing on this trend as a leader in cloud-based solutions. Autodesk has been investing in the cloud for years now, putting it in a far better position than its competitors. In fact, Autodesk launched the cloud-based forge initiative, which included a $100 million investment fund, back in 2015 in order to accelerate its cloud ecosystem.Cloud solutions have become more important than ever as a result of the pandemic. Social distancing measures have made cloud collaboration tools particularly attractive especially in the workplace. Autodesk's cloud collaboration solution BIM 360 Design, for instance, has seen its usage almost double over the past year.With major industries like manufacturing moving towards a more distributed network, cloud technologies will only grow demand moving forward. Autodesk already spent years investing in cloud technologies, putting the company in a great position to grow its customer base especially during the pandemic.Autodesk's investments in cloud technologies are paying off, particularly during the pandemic.Source: technexaDigitization in AEC (architecture, engineering, and construction) has started to accelerate in recent years. Given how much more powerful tools like computer-assisted design have become, it is not surprising to see the AEC industry continue to digitize.Considering how much time and money is saved by using products like AutoCAD, organizations will be increasingly incentivized to use such tools. Autodesk is a great position to capitalize on this trend as a provider of some of the most powerful software tools in AEC.Autodesk is growing at a healthy pace despite pandemic-related headwinds. Not only did Autodesk grow its revenue by 15% Y/Y in its latest quarter, but it also increased its GAAP operating margin by seven percentage points Y/Y. However, Autodesk's billings expectation for fiscal 2021 has been lowered despite strong quarterly growth results.Autodesk's billing decreased 12% Y/Y to $787 million during the quarter. The fact that Autodesk's billings growth is falling far behind its revenue growth is somewhat troubling. Although Autodesk has in part explained this by stating that the pace of closing larger transactions has slowed down, investors should still keep an eye on the company's billings trend over the next few quarters.If Autodesk's billings continue on a negative growth trend, it is hard to see how the company would hit its revenue targets. Autodesk did, however, see double-digit billings growth on its online channel in Q2. With how important online channels are becoming, the company's growth in this area is encouraging.Autodesk has lowered its billings expectations for fiscal 2021.Source: AutodeskAutodesk still has upside at its current market capitalization of $50 billion. While Autodesk has a relatively high forward P/E ratio of 59, the company's long-term potential more than justifies it. Autodesk is a leader in the fast-growing industries like CAD and continues to successfully capitalize on secular trends."
4352700,74695,2020-06-09T00:59:04-04:00,Autodesk is cementing its place as a premier software giant.It is being bolstered by long-term societal and technological trends.The company's move towards a subscription model is paying off.,"Autodesk (ADSK) is a software giant that services the manufacturing, architecture, construction, and entertainment industries, among many others. The company utilizes computer software to perform a plethora of tasks for customers, from designing to modeling. The advancements being made in AI, virtualization, and general computing are making Autodesk's products more relevant than ever in modern industry.While the stock initially plunged as a result of the coronavirus, it has since surged even higher than it was prior to the outbreak. Although most companies are experiencing a partial rebound, very few are experiencing the upward momentum that Autodesk is experiencing. It is now valued at $51 billion, making it one of the largest software companies in the world.Autodesk has experienced a stunning rebound in recent months.Data by YChartsAutodesk is arguably in a better position than it was prior to the pandemic. The current period of social distancing is accelerating the adoption of more virtualized technologies. The ability to design, model, and render in a virtual setting is becoming an increasingly invaluable component of many companies. Autodesk is an industry leader in such software. Moreover, the technology behind its products is advancing at an increasingly fast pace.It is far more cost-effective to design, prototype, and model in a virtualized setting, for obvious reasons. As computing technologies advance even further, the benefits of performing such activities in a virtual setting will become even greater. Many of the most advanced technology companies, like Tesla (TSLA) and Northrop Grumman (NOC), are already heavily reliant upon such technologies.Popular Autodesk products like AutoCAD and Revit helps customers design and model projects by utilizing sophisticated computer software. Such products are rapidly becoming an integral tool for engineers, architects, designers, contractors, etc. Autodesk is also successfully diversifying its product offering to more fully capture the market for software solutions.Products like the AutoCAD allow customers to operate in an increasingly sophisticated virtual environment.Source: AutoCADThe exponential progress being made in AI, machine learning, cloud technology, and advanced computing will only further bolster Autodesk moving forward. The company's tools and services will become more powerful and complex as these technologies progress. The application of Autodesk's software is only growing with every passing year.Autodesk recently reported strong Q1 results amidst the pandemic. The company largely beat expectations with non-GAAP EPS and revenue of $0.85 and $885.7 million, respectively. It also improved its operating margin by 11%, resulting in a Q1 operating margin of 15%. The global pandemic did not appear to have a large negative impact on Autodesk in Q1.Autodesk's move towards a subscription model is starting to pay off. In fact, the company's subscription plan revenue grew 35% to $803 million. The company's growing focus on a cloud-based subscription model is allowing for a greater degree of predictability and stability. This proven model, which is also being employed by software giants like Microsoft (MSFT) and Adobe (ADBE), could help push Autodesk to greater heights.The coronavirus adds an element of uncertainty to Autodesk. The company could start to feel the negative impacts of the coronavirus over the next few quarters, especially considering its exposure to construction and manufacturing. While many investors clearly believe that COVID-19 concerns are overblown considering Autodesk's recent recovery, COVID-19 still poses many near-term risks for the company.Fortunately for Autodesk investors, the company has much to look forward to over the long run. As a certain degree of social distancing will likely become the norm in the workforce, demand for its services should grow over time. In fact, the pandemic could be a catalyst for companies to adopt more virtual solutions. The virtual and digital nature of Autodesk's product are perfect for the new normal facing the global workforce.Autodesk could see growth in demand as new norms develop in the workplace.Source: GrenslerThe advancements in machine learning, AI, and advanced computing is allowing for software to simulate reality to greater degrees of accuracy. The amount of money saved from designing, modeling, and rendering using software will likely only grow moving forward. Most advanced technology, construction, and manufacturing industries are already starting to rely heavily on virtual software technologies.Autodesk still has more upside even at its current market capitalization of $51 billion and forward P/E ratio of 61. Current societal and technological trends all point to more virtualized and digitized work solutions. As a leader in the virtual software space, Autodesk is well-positioned to capitalize on these emerging trends."
4351765,105306,2020-06-03T13:36:58-04:00,"Autodesk's gradual shift to a predominantly subscription business model improved the resilience of the company.Structural tailwinds, such as the digitalization in the AEC segment and the adoption of cloud-based applications to the manufacturing field, should drive growth in the years ahead.Current valuation multiples are a little stretched, as an attractive upside would be only justified after assuming a strong top line growth that may be challenging in the near term.","It was admittedly a solid quarter to Autodesk (ADSK), as the software design and engineering provider beat estimates and renewal rates held up well. While underlying fundamentals remain constructive, Autodesk's current valuation appears to reflect a strong recovery in construction and manufacturing that may fail to materialize in the short term. Therefore, investors should consider buying shares of Autodesk only as a long-term investment before we have more clarity about the shape of the economic recovery.The fiscal quarter ended on April 30th highlighted the resilience of Autodesk's business model, as subscription revenue increased on a sequential basis, following a strong Q4, and led total revenue to rise 20% year-over-year at $885.7 million, beating estimations by 2%, despite a drop in maintenance revenue during that period.This steady revenue performance amid pandemic-related shutdowns should be credited to Autodesk's gradual shift to a predominantly subscription business model, as subscription currently represents nearly 90% of total revenue, as opposed to 62% two years ago.Positive subscription revenue results were driven by renewal rates, which were relatively stable in the quarter, including partial renewals. On the other hand, there was a modest decrease in multi-year deals and a slowdown in new business in the second part of the quarter, affected by the peak of the pandemic and economic restrictions in that period.That said, revenue breakdown by product showed strong growth across the board, driven by AEC (Architecture, Engineering and Construction) with growth of 26% over a year ago to $382.7 million, while AutoCAD and AutoCAD LT family rose 23% to $262.2 million. Meanwhile, MFG (Manufacturing) grew 9% to $182.9 million and M&E (Media and Entertainment) increased 16% to $52.6 million.Moving to the P&L, non-GAAP operating margin remained stable at 15% on a sequential basis, but increased sharply from 3% a year ago, driven by revenue growth and contained total spend, which increased only 6% year-over-year. As a result, diluted non-GAAP net income per share was $0.85, surpassing estimations of $0.79 and nearly doubling from $0.45 a year ago.Meanwhile, the disruption in the normal working environment caused by COVID-19 boosted the usage of Autodesk's cloud collaboration applications, such as BIM 360 in construction segment and Fusion 360 in manufacturing.Autodesk expects that it will be not a temporary trend, as many companies will realize the benefits of the cloud-based offerings and will not go back to the previous operating environment in the future. This will be a very positive development for Autodesk, as the company has increasingly focused on cloud and digitalization to boost growth going forward.On the other hand, another strategic front for Autodesk, the conversion of non-compliant users, has been impacted by the current economic scenario. Meanwhile, Autodesk remains focused on building a pipeline of new opportunities, looking to conclude potential deals in a more appropriate moment in the future.Overall, in spite of some challenges, the management team remains confident in its fiscal 2023 plan, as structural tailwinds, such as the digitalization in the AEC segment and the adoption of cloud-based applications to the manufacturing field, should accelerate and drive growth in the years ahead.With regards to fiscal FY 2021 outlook, Autodesk is forecasting revenue growth in the range of 12% to 15%, assuming net revenue retention remaining between 100% to 110% and a partial recovery in fiscal Q2, despite the impact in the new business volume. In addition, operating margins are expected to expand by 200 to 400 basis points, as gross profit margins should remain stable and expenses contained at $60 million.In order to assess Autodesk's profitability on a relative basis, I will compare the company with a close peer like Adobe (NASDAQ:ADBE) as well as the software peer group, using as reference the group of software companies that constitute the XLK - Technology Select Sector SPDR ETF.As we can see below, over the past 5 years, Autodesk's operating margin has increased at a faster pace compared to the software segment, although it is currently below the average yet. In addition, revenue growth has accelerated somehow in the recent 3 years, surpassing software peers. Of note, Autodesk has lagged Adobe in most metrics here evaluated.Turning to the valuation analysis, Autodesk is trading at higher P/E, EV/EBITDA and EV/Revenue Forward multiples compared to the software segment, with premium ranging from 14% to 28%.Source: Data from Finbox, consolidated by the authorAlthough shares of Autodesk look overvalued on a relative basis, it does not mean that there is no upside left. Instead, it reflects the strong growth expected in the future. As we can see below, analysts covering the company are forecasting top-line growth in the mid-teens over the coming years, even after recent downgrades.Source: Seeking AlphaAssuming that Autodesk can actually deliver revenue growth in the 15% range over the coming years, we can estimate the influence on company earnings and use the 5-year DCF model to project the fair value of the company.In addition to the revenue growth of 15%, the following assumptions will be considered: 1) Operating margins will increase by 200 basis points this year, as forecast by the management team, along with incremental increases of 200 basis points each year over the next years and 2) Terminal EV/EBITDA multiple of 53x, which is the average of the software segment of XLK ETF.Thus, after applying these inputs to the DCF model, the projected fair value of Autodesk would be $270.00, implying nearly 28% upside over the current price level.I see two main considerations regarding this model that it is worth sharing. Firstly, valuation multiples of the software industry are admittedly high, given strong growth forecasts. In case we see peers missing estimations at some point in the future, the whole software industry may be subject to multiples compression, including Autodesk.The second point is related to the Autodesk's top line growth potential. While it looks attainable, given the vast potential for digitalization in the AEC field and also virtualization / cloudification in the aftermath of the pandemic, we cannot rule out potential headwinds in case of a slower economic recovery, as it would moderate manufacturing activity and keep investments in construction subdued.While Autodesk's subscription revenues offer extra resilience to the company's business, structural tailwinds such as cloud and digitalization should help drive growth over the coming years.However, I see current valuation multiples a little stretched at the moment, as an upside nearing 25% to 30% would be only justified after assuming a strong top line growth that may be challenging for the company, especially in the near term, given the uncertainties related to the economic recovery."
4355661,104744,2020-06-25T13:19:48-04:00,"ADSK is an industry leader with double-digit revenue growth prospects and surfeit FCF.However, the growth has decelerated this year due to the macro headwinds.The share price has surged, as the market has priced in a too-quick recovery.I will be better to stay on the sidelines until the correction.","Autodesk, Inc. (NASDAQ:ADSK), a company that offers software of choice for architects and engineers, has seen its stock price rallying to the all-time high since a deep dive in March when it plunged together with the S&P 500 amid the market hysteria sparked by the coronavirus pandemic. Among the catalysts were the Q1 EPS and revenue beat, which signalized that the end-market demand had not sunk as deep as analysts expected, and, despite its exposure to cyclical industries, the company had been relatively immune to the softness in the economy. At the same time, bearish voices were mostly ignored. With ~63.9% price return since March 29, the stock had easily trounced Microsoft (MSFT), Adobe (ADBE), Salesforce.com (CRM), and, sure, the S&P 500 (SPY).Data by YChartsI would not say that the recent rally was potentiated by the fundamentals only (there are types of investors who have never read a Form 10-K, focusing solely on the news headlines). However, Autodesk is still a free cash flow machine, and investor perception of its solid financial performance had definitely somewhat contributed to the rally. Nevertheless, I would like to highlight a few issues that bullish investors should keep in mind before going long now. In a nutshell, I acknowledge the unquestionable merits, but building a position after the stock touched an all-time high is reckless. It is far better to wait until a buying opportunity emerges.First and foremost, ADSK is a relatively rapidly growing FCF positive company with a leading position in the industry. Since 2018, after a thorough strategic overhaul, it has been converting nearly all its cash flow from operations into FCF, and, due to minuscule capital intensity, it will likely continue delivering resilient cash surpluses going forward.Data by YChartsAnalysts are predicting consistent double-digit revenue growth in the medium term, and I reckon it will likely be assisted by simultaneous increases in net income and cash flow. These merits alone make ADSK a perfect investment and a long-term shareholder value-generating engine.Source: UnsplashHowever, we need more context here. First, the robust Q1 FY21 results instilled confidence and somewhat eased fears that softness in the construction industry amid the economic downswing can ruin Autodesk's top line. Despite lockdowns and disrupted supply chains, its segments demonstrated astounding growth, while Architecture, Engineering, and Construction, the flagship segment regarding revenue, outperformed others, delivering around 26% sales growth rate. The AutoCAD and AutoCAD LT segment was up 23%. Moreover, double-digit growth was achieved across all regions. Though APAC is not its principal market regarding sales, the regional revenue is expanding at a faster pace if compared to the Americas and Europe, the Middle East, and Africa. The only division that posted a single-digit improvement was Manufacturing, which offers such products as CAM Solutions, Fusion 360, Inventor, and Vault.Yes, it's overall great. However, as a reminder, earlier this year, the analyst community expected the Q1 revenue to surpass $912 million, while ADSK disappointed Wall Street and lowered its first-quarter revenue expectations to between $880 million and $895 million. The Q1 total reported revenue amounted to $886 million. It also anticipated FY21 (ending January 2021) revenue to rose by 20%-22% (see slide 8). Since then, the growth outlook has drifted materially lower, as, according to the changed guidance, Autodesk expects to increase the top line by 12% to 15% (see slide 8). Most importantly, though, in February, ADSK anticipated FY21 billings to increase 11%-13%, in May, it acknowledged that double digit-growth is unachievable and 3% contraction is possible in the worst-case scenario.At the same time, the share price has touched an all-time high. So, it appears the market is irrationally pushing equity value higher rewarding the company for much weaker future growth than previously anticipated. Of course, this cannot continue ad infinitum.Though ADSK posted strong results in the April quarter, it does not mean the rest of the year will also be that stellar. Among the financial industry, there are a few bearish voices who have highlighted the significant risks associated with Autodesk's end users stemming from the macro headwinds. To have a grasp of what is happening in ADSK's end markets, for instance, inside the construction industry, we can assess a few indicators like the Architecture Billings Index, the one I highlighted in my article on Carlisle Companies (CSL). The ABI touched a historic low in March, which points to the fact that architectural firms are in dire straits because of cratered demand for design services. The data published recently demonstrated that the sentiment recuperated only marginally. The ABI score for May was 32 vs. 29.5 in April and 33.3 in March; any figure lower than 50 signalizes a decline in billings. For a broader context, in January, the score was 52.2. Hence, since orders plummeted, most firms have neither reasons nor cash to hire new employees and, hence, renew/extend AutoCAD subscriptions. There is no coincidence ADSK significantly downgraded its FY21 growth outlook.I believe my dear readers have likely noticed that Autodesk has a somewhat puzzling financial position. Though it has been consistently generating cash surpluses, its book value is sub-zero, while Debt/Equity equals 1,176%. So, we simply have no denominator (shareholder equity) to assess Return on Equity or go a bit deeper and scrutinize CROE or even FCF ROE.Data by YChartsThe principal culprit is deferred revenue, which the company recognizes as both long-term and short-term liability. E.g., in Q1, current deferred revenue was $2.16 billion. Another culprit is notes with different interest rates that were issued in 2012, 2015, 2017, and 2020 (see page 57 of the annual report). Sure, sizable total borrowings do not pose significant risks, as, after deduction of cash & cash equivalents, the net debt stands at just $169 million, a tiny fraction of its enterprise value of ~$51.3 billion. Obviously, hefty cash pile and copious FCF instill confidence ADSK will have no issues with the repayment of the principal.Though growth stocks are quite often valued on a P/E basis, I believe we cannot ignore Autodesk's immense debt, so, it is better to tap its valuation using Enterprise Value-based multiples. These ratios signalize the stock is significantly overvalued both compared to the sector and 5-year averages. Moreover, as EV/Sales illustrates, the company is almost 1.5x more expensive than MSFT and close to 2x more expensive than CRM. At the same time, bulls may riposte that Adobe, a software company akin to ADSK, is even more expensive with EV/Sales of ~17.3x. But ADBE is less exposed to the macro headwinds because of its much lower dependence on the cyclical industries. To sum up, at these levels, it is better to avoid ADSK.Autodesk's revenue growth had not been linear in the past. In the second half of the 2010s, when the company has initiated an inevitable but long and challenging transition towards a more profitable recurring revenue model, it experienced tough times. Its revenue contracted, thus adding pressure on margins. Because of lackluster sales, its net profit together with cash from operations and FCF dived to sub-zero levels. However, the company successfully turned around and embarked on a path of robust top-line and cash flow expansion.ADSK can be a lucrative investment. However, given valuation and the short-term challenges, it is worth staying on the sidelines."
