article_id,author_id,publish_on,summary,content
4384036,105567,2020-11-02T11:11:26-05:00,"Akamai has a strong balance sheet, secure revenues, and a positive growth outlook.Cybersecurity has become a big issue in the past year. Through its latest acquisition, Akamai continues to establish its dominance in the space.While the company seems fully priced, it is a business we are happy to buy and hold for the long term.","Akamai Technologies Inc. (AKAM) provides CDN and cloud services. It has been around for over 20 years and is a leader in cybersecurity and edge computing. While the stock is fully priced, we believe that it is still a good company to add to your portfolio. Akamai has “utility-like” characteristics that make its revenues reliable and secure. Furthermore, the company will enjoy continued growth thanks to cybersecurity and its pioneering Edge Platform.Source: wbur.orgAkamai Technologies provides CDN and cloud services for delivering content around the internet. It provides the necessary infrastructure to companies around the world to deliver data in a fast and secure way. The company has been around since the days of the tech bubble and has a long track record of growth and profitability. The latest quarterly numbers are no different, and we can gain some insight into the direction the market and business is going:Source: Investor RelationsYoY, revenues are up 11% after accounting for foreign exchange. The company operates in two main segments; Web Division, and Media and Carrier Division. The service provided is essentially the same, but the profile of the clients and specific needs are different. Web Division serves data to “traditional” HTML websites, such as Airbnb Inc. (AIRB). Meanwhile, Media and Carrier provide services to clients like the NBA and Riot Games. Revenues are split quite evenly between these two segments at $418M and $375M, respectively, in the latest quarter. However, the Media and Carrier grew at 16%, more than twice as fast as the Web.Perhaps though, a more interesting breakdown of revenues would be by service and geography. Akamai has established itself as a leader in the cybersecurity space. Cloud Security Solutions brought in $266M and grew 23% YoY. Geographically, U.S. revenue was $437 million, up 6% year over year, while international revenue came in at $355 million, an 18% increase.In terms of revenue growth, the company has achieved a very reasonable 12% CAGR over the last 10 years. The appeal of the steady double-digit growth, though, is at least matched, if not outweighed, by that of the balance sheet.Source: Investor RelationsWith $742M in cash, over $2 billion in short-term assets, and only $3.4 billion in total liabilities, Akamai has an above-average balance sheet. The question for investors is whether the company can maintain the last few years' levels of growth in the future. The area is getting incredibly competitive, but the company enjoys some significant advantages and also new growth opportunities.The strength of the balance sheet, as mentioned above, is a big plus. The other thing we love about Akamai is its distribution of revenues, giving investors good exposure to the international market. But what surely separates Akamai from its peers are two things; its vast and established network and its leadership in cybersecurity and edge computing.Akamai has over 300,000 servers around the world. This level of infrastructure is unrivaled and is what allows the company to deliver data so fast. The final iteration of this infrastructure comes in the form of Akamai’s Edge Platform. Edge computing is a “decentralized” way of delivering information. It connects devices directly, rather than having to go through servers, and Akamai is unparalleled in this area.Source: Company WebsiteThe company has been a pioneer in edge computing for the last 10 years, but edge computing represents the future even more than the past. The decentralized nature of edge computing is what will enable future technologies such as AI, IoT, and 5G. The growth prospects are unquantifiable.The other area where the company is thriving is cybersecurity, a segment that is poised to grow at a 10% CAGR from 2020-2027. Cybersecurity has become a very significant issue for companies scaling their digitalization. A recent survey by Asavie shows that this has become an even bigger issue following the COVID-19 pandemic:As we can see, scaling endpoint security was the top concern for large companies. Furthermore, over 44% of companies cited receiving cyberattacks during the COVID-19 months.Cybersecurity represents a growth opportunity which we believe could far exceed 10% CAGR. Akamai’s security services already grew at over 20% in the last quarter, and the company continues to assert its leadership with the recent acquisition of Asavie. Asavie’s technology focuses on creating secure networks for mobile applications. The key driver behind the acquisition was the scalability of Asavie’s technology. With this new integration, Akamai can reinforce its cybersecurity offerings and capture further growth from 5G.On a final note, regarding this section, we’d like to point out the fact that the revenues are incredibly steady and secure. Akamai offers a service that is the backbone of the internet. It is part of the infrastructure that allows the internet to work, and as such, it is protected to a certain extent from demand headwinds, as many of its services are “necessities”. Furthermore, the company displays a moat-like quality thanks to its unparalleled infrastructure and superior technology.As far as weaknesses and threats, there are at least two significant issues that the company could face in the next few years:First and foremost, the biggest issue that the company faces is competition. Not competition from its competitors, but rather from its clients. When it comes to the CDN market, we have seen a tendency for the “Big boys” to develop in-house solutions for their specific networks. This is something we saw with Netflix Inc. (NFLX), which used to be a client of Akamai’s.The other problem is that Akamai may lose out to some of the other players in the space as CDN becomes “commoditized”. Despite Akamai’s superior offerings, companies like Amazon.com (AMZN) and Microsoft, Inc. (MSFT) can offer cheaper and more “standardized” solutions. This would take market share from Akamai, or at the very least, could put heavy downward pressure on profitability. Having said this, what we see as a much more real possibility, is that Akamai could one day be absorbed by one of these key players.The valuation method is based on our estimates of potential unlevered free cash flow to common shareholders. To do this, we analyze some key ratios regarding investment, revenue, and operating expenses. If you'd like to learn more about our valuation method, you can read about it here.Akamai has a strong growth prospect for 2020 and further years to come, but we did adjust investment spending, which has increased so far in 2020, with net asset turnover decreasing slightly. Profitability is set to remain solid and consistent, and the balance sheet looks healthy, as the debt burden is more than compensated with short- and long-term financial investments, with net interest expense minimal.Overall, we expect an approximate long-term cash return of 6.43% for common stock at the current price ($106.72, October 28). You can see a summary of our forecasted financial data below:Source: Author’s workGiven what we believe to be very reasonable growth expectations, the return for Akamai does look, on the surface, rather underwhelming. However, we are still bullish on the company given the strengths and resilience of its revenues. We invite you to think about Akamai as a utility company, as much as it is a technology company. It provides infrastructure which is essential to the workings of the internet. Akamai serves around 30% of all internet traffic today and that is something that can’t disappear overnight. A look at the stock price chart shows that the company has followed a steady appreciation over the years. Given the fact that revenues are reliable, there are significant growth opportunities, and the incredible strength of the balance sheet, AKAM is a stock we are happy to buy and hold."
4377967,21702,2020-10-07T08:20:50-04:00,"The company's cybersecurity segment is now growing faster than its content delivery networks (""CDN"") business.For 2020, cybersecurity related revenue could approach $1 billion.As a result of continued growth in cybersecurity and a strong comeback in CDN, Q2 results were very strong.While the transition from the stagnating CDN segment to faster-growing cybersecurity seems rational, it opens the door to competition.","Akamai (AKAM) had a blowout Q2 as its content delivery network (""CDN"") segment made a comeback and its cybersecurity business continued to rapidly expand. However, the CDN business that Akamai has dominated for years is stagnant at best and declining at worst while network security - whether accomplished in the cloud, in hardware, or both - is a highly competitive market. So far, management has been able to exploit its existing edge network to rapidly advance its cybersecurity business. Going forward, AKAM will have to wall off its existing network security business from competitors while working hard to gain new customers.Akamai's Q2 EPS report was a blowout and soundly beat expectations on both the top and bottom lines. Revenue of $795 million was up 13% yoy and cost controls helped push EBITDA margin up to 32.7% vs. 31.1% in Q1. As a result, EPS of $0.98/share was up 42% from Q2 of 2019. It was a great quarter but the stock actually closed down a tad the day of the report.As the graphic below shows, AKAM's cloud security business grew 27% in Q2 - continuing a trend that stretches back more than a year. What was surprising in Q2 was an uptick in what had been a rather stagnate CDN business (revenue up 7% yoy), likely due to customers scrambling to provide solutions to handle a massive surge in internet traffic due to the global pandemic:Source: Q2 EPS ReportNote from the above graphic that AKAM's Cloud Security Solutions segment has grown to be ~1/3 of total revenue. But that means CDN is still responsible for ~2/3 or revenue. And that's the problem.AKAM was a pioneer in CDN and really the first company to build a widely dispersed CDN. Akamai's CDN is still one of the largest, if not the largest, in the world:As a result, Akamai has an advantage today because of the scale and resiliency of its existing network (more than 240,000 servers in over 130 countries) and its existing customer base:Source: AkamaiHowever, as shown in the graphic above, prior to Q2, CDN revenue was relatively flat - or even declining - in 2019. That's because the big cloud providers - notably Amazon (AMZN), Microsoft (MSFT), and Alphabet (GOOG) - operate CDNs of their own and already serve some of Akamai's customers. That puts them in an ideal position to steal business away from Akamai should they choose to do so. That is, Akamai doesn't have a wide moat to keep CDN competition at bay.As a result, the company's full-year 2020 guidance does not appear to build on the strength of Q2, which looks to be a temporary uptick:Source: 2020 Full-Year GuidanceThe midpoint of Q3 revenue guidance ($772.5 million) is significantly below the $794 million posted in Q2. That may be why the stock traded slightly lower after the Q2 results were released. Yet the $772.5 million midpoint in Q3 revenue guidance would still be +8.8% as compared to the $709.9 million in revenue for Q3 of 2019. And the midpoint of full-year 2020 non-GAAP net income ($5.07/share) compares well to full-year 2019's $4.49 per diluted share. So in the near term, Akamai looks to be performing well and benefiting from the COVID-19 tailwinds that have resulted in more internet usage and traffic.However, going forward and considering the big players that could erode AKAM's CDN business, the company's network security business - which has been growing at a near 30% clip - appear to be the catalyst and investment thesis. Akamai's primary initiative to leverage its existing dispersed network business into its cybersecurity solutions, as well as gain new customers, is what it calls the Akamai Intelligent Edge Platform - which it describes as a ""defensive shield that can surround and protect everything — sites, users, devices, data centers, clouds. It is the technology that eliminates friction and enables immersion."" The company is getting high marks with its security products while increased video streaming and cyber attacks on video gaming provide excellent opportunities for the company to expand its market position.The big question seems to be whether or not Akamai's security solutions can keep growing at a rate that will make up for the potential loss of revenue in CDNs going forward. That is uncertain and hard to ascertain given the COVID-19 juiced Q2 results.Akamai currently trades at a P/E=32.9 TTM earnings. The stock closed Friday at $108.61, which at the midpoint of guided (non-GAAP) 2020 earnings of $5.07 implies a forward P/E=21.4x. However, on a GAAP basis, according to Yahoo Finance, AKAM won't hit the ~$5.07 mark until full-year 2021:Source: Yahoo FinanceGiven the excellent Q2 EPS report and the company's full-year guidance, Akamai's stock looks reasonably valued. The company's cybersecurity related solutions are growing at a near 30% clip and looks to be the primary investment thesis going forward. However, that assumes the CDN business segment can maintain current revenue run-rates. And that is uncertain given the potential competition from big players like Amazon, Microsoft, and Google that could steal away a substantial slice of Akamai's CDN business. As a result, I advise investors to take a ""wait-and-see"" approach with AKAM and analyze coming earnings reports and management commentary before taking a position in the stock. For current shareholders, AKAM is a Hold."
4378138,102785,2020-10-08T09:24:09-04:00,Akamai Technologies is one of the leaders in Internet infrastructure and cloud security.A low beta of 0.43 and relatively healthy profitability margins make it a stable long-term tech player.Akamai's management should watch the competition and monitor the company's debt.Our rating for Akamai is outperform.,"Trading at $17.8 billion in market cap, Akamai Technologies is one of the leaders in Internet infrastructure and cloud security. Its stock shows a low beta of 0.43 and relatively healthy profitability margins, making it a stable long-term tech player. One area to work on for Akamai's management is to watch the competition and monitor the company's debt. Our rating for Akamai is outperform.The plumbers of the InternetAkamai owns and operates networks of hundreds of thousands of server nodes that help the Internet run smoothly. The company can be considered as the plumber of the Internet because of its role facilitating the flow of data across the world.Akamai's servers help clients (usually other companies with a strong online presence) bring traffic faster and safer to consumers.The use of its infrastructure is reported by Akamai separated by two types of clients as per the Q2 2020 earnings report:A global network of 300,000+ serversThe goal of Akamai's content delivery network is to reduce the delay between submitting a request for online content (being this a website, a video stream, or any other type of digital media) and the content fully loading on the consumer's device. For example, if a US consumer tries to access a website based in Australia, the data would need to cross the Pacific Ocean and the user will experience long loading times. To combat this, Akamai stores a cached version of the website in as many as possible geographical locations around the world. The company is currently offering ""a single network hop"" to 85% of the world's internet users (source: corporate website on 10/8/2020).Figure 1 - Approximate location of Akamai Content Delivery Network serversFounded by academicsAkamai Technologies was incubated in MIT in the late 1990s by a team of professors and researchers. One of them, Tom Leighton, still holds the role of CEO at the company. Another of the co-founders, Daniel Lewin, was tragically murdered in the September 11 terrorist attacks when he was reportedly stabbed aboard the AA11 flight after he attempted to foil the hijacking.A survivor of the Dot-com eraAkamai was founded in 1998 and saw its business boom in the mid-2000s with the advent of video platforms like YouTube (NASDAQ:GOOG) (NASDAQ:GOOGL) and streaming providers such as Netflix (NASDAQ:NFLX).Headquartered in the Bay StateAs opposed to other tech giants that make Silicon Valley their home, Akamai Technologies has its base in Cambridge, Massachusetts, honoring its MIT beginnings.In terms of clients, 56% are US based while 44% are international. Non-US clients provide the most attractive growth rate being up 24% YoY.Does Akamai have a moat?The largest revenue growth area (+27% YoY) for Akamai is its security solutions against Distributed Denial-of-Service (DDoS) cyberattacks. DDoS is a tactic cybercriminals use to ""overwhelm"" the servers of a company, with the purpose of making their internet connection collapse. How do the perpetrators achieve this? Usually, with thousands or even millions of ""zombie"" infected computers that simultaneously (and in a coordinated fashion) initiate connection requests to the victim's server. The victim's infrastructure becomes ""clogged"" with too much traffic and its service goes offline.Figure 2 - DDoS diagram (source: Alibaba)A famous example of this cyberattack was the March 12, 2012, ""Six Banks DDoS Attack"" in which Bank of America (NYSE:BAC), JPMorgan Chase (NYSE:JPM), US Bank, Citibank (NYSE:C), Wells Fargo (NYSE:WFC), and PNC Bank (NYSE:PNC) went offline after being the target of a hacker network. These attacks represent substantial losses, both monetary and in consumer confidence.The protection that Akamai offers can be explained in simple terms as a ""shield"" of thousands of nodes that protect the connectivity of their client's end server in case of a DDoS attack. The attackers hit Akamai servers, while the client's servers remain online allowing legitimate connections.Akamai is getting stiffer competition. However, the nature of Akamai's business gives the company a major advantage: economies of scale. Being the largest CDN and cloud security provider out there gives Akamai a moat, although entrants will keep expanding in niche areas. If the management of Akamai doesn't sleep in their laurels, the company will continue enjoying relatively stable profits.Figure 3 - Akamai's stock price chartWhat we like about AkamaiWe see Akamai Technologies almost as a utility company of the Information Age and the stock shows some peculiarly conservative characteristics for a tech company of this size:Table 1 - Profitability ratios of AkamaiOptions markets display optimism about the next earnings releaseOn October 27th, Akamai is expected to release its earnings report for Q3 2020. The Oct 30th expiration implied volatility smile points to a positive sentiment towards earnings release: higher strikes show higher prices in terms of implied volatility vs. farther expiration dates, making us think investors are betting on a potential earnings surprise.In the chart below, it can be observed how lower strikes' volatility runs almost parallel to future expirations, while higher strikes are way steeper in the nearest expiration to earnings date:Figure 4 - Volatility smile of Oct 30th (orange) vs. Nov (orange-yellow) vs. Jan (red)Akamai's debt is the darker spot in the company profileAkamai's long-term debt for the quarter ending June 30, 2020, was $1.873 billion. Although it has a somewhat worse debt position compared to its peers, half of that debt was issued in 2019 in what we believe was a move to take advantage of low interest rates, which at that time their CFO might have considered rock bottom. Now, in 2020, we know that the Fed rate went even lower, but that's another story for another day.Analysts are upgrading their ratings on AkamaiOnce the COVID19 crisis started in March, a variety of analysts shifted focus to Akamai as a potentially safer bet during uncertain times, especially considering the expected surge in Internet traffic from homestayers that would surely benefit the company. Cowen, Raymond James, and Robert W. Baird went from Neutral to Outperform. Goldman Sachs, which was more pessimistic previously with a Sell rating, upgraded to Neutral. Evercore initiated coverage with Outperform.Akamai Technologies is an interesting company for a diversified portfolio. Being one of the leaders of Internet infrastructure and security, we foresee continued use of its services and solutions in the future. Akamai enjoys economies of scale which gives the company a competitive advantage against smaller competitors; however, management needs to be focused on two areas of the competitive landscape: a) larger players that want to vertically integrate their service and b) smaller startups that focus on fast growth niches. Finally, in the company's financials, we wish to see thinner debt in the future. Our overall rating is outperform."
