article_id,author_id,publish_on,summary,content
299478,24802,2011-10-13T16:52:36-04:00,,"One of the fundamental rules in investing is that sometimes a company's stock price must drop significantly before it becomes a worthwhile investment opportunity. We have found such a company in Akamai (NASDAQ:AKAM).Akamai is the world's leading CDN, or content delivery network, using its vast server farms all across the world to speed up the Internet worldwide. The issue with this business model is that Akamai is facing competition in the CDN space from the likes of Limelight (NASDAQ:LLNW) and Level 3 (NASDAQ:LVLT). But Akamai stock has fallen over 46% in the past year due to these concerns, and we think the worst case scenario is more than priced in.Click to enlarge  We bought Akamai recently because we believe that the stock has found a bottom, especially as investors price in these growth fears, which have not been as dire as the stock chart would suggest. Revenue at Akamai has grown at an average of 29.3% over the past five years, and the company is expected to post record GAAP EPS this quarter. But then, why has the stock tumbled so much?In short, Akamai committed the sin many high-multiple, high-growth stocks commit. Growth slowed down just a tad. The company missed analyst's expectations for revenue by $0.8 million in the last quarter, and as a result, the stock dropped over 13%. (click here)Going forward, we expect Akamai stock to outperform, for the following reasons.Note that we did not specify a buyout as a reason to invest in Akamai. We never buy a stock on the basis of its appeal as a takeover target. If it is rumored to be one, so much the better. But we think it is foolish to buy a stock solely based on takeover speculation. Akamai has had more takeover speculation surrounding it than any other company in the S&P 500. The latest rumor is that Google (NASDAQ:GOOG) is looking to buy the company. While it would certainly be nice to have a buyout, we think at this level Akamai can outperform going forward as a standalone company.We stress that Akamai at $24-$25 is a much different company than at $50. Expectations have come down dramatically, as has the P/E ratio. Akamai now has a P/E ratio of just over 23 and a forward P/E of about 14. Akamai trades at a price-to-book ratio of 2.5, a huge discount to the sector average. At levels of $50, Akamai's stock was pricing in far too rosy prospects. At $25, the stock is pricing in doom. The Reuters average price target is $31.39, representing upside of nearly 30% from current levels.The first half of this year was a record for Akamai in terms of revenue, cash flow and profits. The long-term trends supporting the business have not abated. Internet traffic is growing exponentially, as is enterprise cloud computing and e-commerce. Akamai stands to benefit from all these trends, which is why we have bought the stock at these levels. Akamai's stock is pricing in a disaster for the company, yet the company's financial results do not support this. Expectations have come down to realistic levels, and while Akamai does have competition, it will not decimate earnings. The value-added services segment is seeing strong growth, and will support the company going forward.We think Akamai is a long-term bet on the explosive growth of the Internet. Akamai continues to be a leader in the industry, and at this price, in our opinion, the stock is too cheap to pass up given the growth profile. Akamai means intelligent in Hawaiian, and to us, Akamai stock is a very Akamai investment.Disclosure: I am long AKAM."
296708,20875,2011-09-29T14:39:00-04:00,,"Over the course of the past ten years, Akamai has seen various competitors  come to the market, typically looking to compete on CDN services. Most  of these competitors didn't last long or in the case of someone like  Speedera, Akamai acquired them, thereby re-affirming their leadership  position in the industry. While Akamai's CDN business has taken a hit  over the last few years, revenue from their value add services business  has been growing and has really helped diversify the company's revenue.But over the past 3-4 quarters, Akamai's business is, for the first  time, being impacted on multiple levels. Their CDN business, value add  services business and their network technology is all feeling  competitive pressure and Akamai has been slow to react to changing  market dynamics. While it use to be easy for them to say that new  entrants were just competing on price, that's no longer the case.  Competitors are competing on performance and in many cases, winning  deals based on that alone. Content owners know that Akamai is not the  only option in the market and we've all learned that there is more than  one way to deliver content with great performance. Level 3 and Limelight  combined will have north of $200M in CDN revenue this year. Clearly,  Akamai's not the only game in town anymore and performance is about much  more than the number or servers a CDN has or what kind of network  architecture they have.While it's very clear to see the impact that Level 3, Limelight (and  soon Amazon and Verizon) are having on Akamai's CDN business, many have  felt that Akamai built a moat around their value add services business,  thereby keeping others from truly competing. What we have seen is that  Cotendo and others are in fact winning business from Akamai based on  performance and price for these services and this trend will only  continue. I've been hearing from a lot more customers lately who have  left Akamai for Cotendo for things like app acceleration or DSA and  these customers say that on average, Cotendo is 20% faster and 30%  cheaper than Akamai.Of course this is not always the case for every product and every  customer, but Cotendo is enough of a threat that Akamai feels the best  way to try and stop them is to sue them for patent infringement.  Akamai knows that Cotendo and others are only going to continue to put  the pressure on the value add services portion of their business and  drive the price for these services down over time. Based on Akamai's  recent earnings and guidance, we are already starting to see this  happen.While Akamai's CDN and value add services business is now under  attack, changes in the market also mean that Akamai's position inside  the last mile is also facing trouble. As more telcos, carriers, ISPs and  MSOs start to build and deploy their own CDNs, Akamai's value inside  many of these networks is diminishing. While Akamai won't come out and  say there is a problem, the whole reason Akamai is now trying to create a licensed CDN (LCDN) product is to try and stay inside the last mile and provide more value to the carriers.While it has been clear for some time that the CDN market is  evolving, Akamai has been very slow to respond to these market changes.  Two weeks ago, EdgeCast announced  that their carrier grade CDN solution, which has been on the market for  two years, has now been licensed by Pacnet, the tenth carrier to sign  up with EdgeCast. Meanwhile, Akamai does not have any carrier product  out in the market and is still searching for senior people to work in  the LCDN group. These open positions list job functions including, ""responsible  for defining strategy, target markets, product requirements,  pricing  and financial models, managing product launches, and providing   management updates on their product.""The future of the CDN business lies with the carriers and telcos and  while Akamai is still developing a carrier CDN solution in-house to  bring to market, with no ETA as to when it will be ready, Akamai  continues to get beaten by the smaller and more nimble EdgeCast, a  company that is doing only 5% of Akamai's total revenue. Why Akamai is  trying to build everything in-house I don't know, but if I was them, I  would acquire EdgeCast and then acquire a transparent caching provider,  ideally PeerApp, which would then give Akamai an instant carrier grade  CDN and transparent caching solution for telcos.Such a product would be a very strong offering in the market and with  Akamai's reach and marketing exposure, competitors would have a hard  time selling against it. Especially since Akamai could also offer  off-net CDN services in addition to the on-net software. Such a platform  would solve all three of the delivery needs for telcos, carriers and  ISPs. It would be a true carrier grade CDN and transparent caching  solution, all in one platform. And if anyone wonders if this is the way  the market is headed, last week, EdgeCast and PeerApp both announced  they were working to create one platform for both their services, based  on demand from their telco customers. The carrier market is telling the  market what they want in the way of solutions, but Akamai has yet to  deliver.With EdgeCast doing north of $50M in revenue this year, it would be a  simple acquisition for Akamai and one they could easily afford. Some  might say that Akamai has tried these types of acquisitions in the past  and not fared well, which is true. In 2006 Akamai spent $160M, or nine  times revenue to acquire Nine Systems and then stopping selling the  StreamOS platform about two years later. By all accounts, that  acquisition was a failure. But unlike Nine Systems which changed their  business model and focus quite a bit before they were acquired, EdgeCast  has been focused on the licensed carrier CDN model from day one. And  with ten telcos and carriers already relying on EdgeCast's technology  including AT&T, Telus, Deutsche Telekom, Global Crossing and Dogan Telecom,  you know it works and works well. Not to mention, EdgeCast has a nice  list of non-carrier customers including Yahoo!, ESPN, JetBlue,  Wordpress, LinkedIn, Kellogg's, IMAX and Lifetime Networks.Aside from getting beaten by EdgeCast on the carrier side, Akamai is  also getting beaten by Cotendo on the mobile acceleration front. While  Akamai announced in February a ""strategic alliance"" with Ericsson to  develop some kind of mobile acceleration product, to date, no real  details have been released of when the product will come out or what it  will look like. Akamai has a very generic and high-level marketing video  on their website, but there is no real product info. Meanwhile, Cotendo launched their mobile acceleration suite three months ago,  have given out very detailed information of how it works, and announced  customers who are already paying to use it. Once again, Akamai is  getting beaten by the little guy with a new product in the market.While competitors like EdgeCast and Cotendo are smaller than Akamai,  they are more nimble and have been faster at rolling out new products  and platforms. One of the things I have found very strange is that over  the past fifteen months, Akamai has been super slow in rolling out new  products and services. If you take a look  at all of their press releases over the past year and half, you'll find  very few announcements of new products and platforms. I find only three  releases talking to new services, which pertain to their Edge  Tokenization service, Electronic Software Delivery for Gaming and  Edgeview. While Akamai has announced a bunch of ""alliances"" (Brightcove,   Rackspace, IBM, Riverbed), these haven't been new products or  platforms. At Akamai's customer conference last year, Akamai said they  would soon have a new version of their DSA product on the market, but a  year later, I have yet to see them announce it.At a time when Akamai's business is clearly being impacted by  competitors, big and small, as well as fundamental changes taking place  in the market, Akamai's management has been very quiet. They aren't  saying what they are working on, what their product road map looks like  and haven't outlined what they plan to do to get their business growing  again. They aren't telling Wall Street any story, aren't opening up to  customers and are simply conducting business as usual. Why Akamai isn't  making key strategic acquisitions in the market I don't know, but unless  they make some serious changes in how they do business, Akamai's going  to continue to have tough times going forward.Simply put, Akamai needs to evolve. The market has changed and Akamai  is not changing with it. They need to change their message, they need  to open up to customers, they need to respond to RFPs faster and they  have to stop operating their business with the attitude that no one can  possibly compete with Akamai's network technology. I was hoping that  once Akamai felt that Cotendo might seriously compete with them, Akamai  would change their way of thinking and simply roll out a better platform  than Cotendo and compete on the merits of the product. Instead, they  fell back to their usual way of thinking and instead of innovating,  simply filed a  patent infringement suit against Cotendo.While I know Akamai won't agree with me, their arrogance is at the  heart of the problem. Even customers whom I speak to that like Akamai's  products and services, say the company is arrogant. And while I'm sure  some will want to argue with me on that point, people know it's true and  it can't be debated. To Akamai, they are never wrong, no one can do  what they do, everyone else's technology is outdated and no one can  truly compete with them. Until management changes the culture of the  company and changes their current message to the market, and by that I  mean customers and Wall Street, Akamai is going to have a had time  growing their business at the rate they use to.Disclosure: No positions."
287040,24279,2011-08-12T11:28:46-04:00,,"Akamai Technologies (NASDAQ:AKAM) went down in a blaze this past year falling from its 52- week high of $54.70 to its current price of $22. Investors seemed to have wised up to its lofty P/E Ratio of 63 back in late 2010, and have taken it down to a much more reasonable valuation at a price/earnings multiple of 15 based on Yahoo Finance consensus earnings estimates for 2011. Although Akamai appears to be trading at a discount, this once marquee security may not be ready for the scrap heap, but, also may not be suitable for conservative portfolios with the volatile markets trading in uncharted waters. Let's take a look under the hood and see what you think.Akamai distributes Internet content to desktops, laptops, tablets and smartphones: ""...on its 90,000 servers which serve roughly 30% of all Web traffic at the edges of the Internet around the globe,"" according to J. Bosnia in a May 11, 2011, article Riverbed and Akamai Team for Hybrid Clouds in Investor's Business Daily. The company selectively collocates its servers in prime real estate locales around the global networks that make up the Internet. This enables Web content such as text, video, graphics and applications to load quicker with less latency.On July 27, the stock traded at $29.48, then Akamai reported an earnings miss and it ran off the rails closing at $23.84 the next day. As CEO Paul Sagan stated in the Q2 2011 Earnings Call Transcript: ""We've seen our top line growth slow down, driven primarily by the pricing and traffic dynamics in our media and software delivery business, and we've encountered a general slowdown in a few of the more mature markets outside of the U.S. where we operate due primarily to the tougher macro economic headwinds in those markets."" Translated into English, what CEO Sagan is saying is that the company had to reduce prices due to commoditization in the broadband delivery industry and European sales are slowing down due to sovereign debt problems.Sagan went on to say that prospects going forward still remain attractive and they are building the business around four main drivers: ""The first one of these is the emergence of cloud computing in the enterprise, followed by the need for better IT security. Then there's the dramatic increase of connected devices, a phenomenon that is driving new applications and new demand for rapid and reliable delivery of data, especially in mobile networks. And finally, more and more rich media, especially long form video, is being consumed online..."".Some of this online streaming demand is from customers such as MTV, Independent Film Channel, CBS Sports and the National Football League. Other clients include Apple (NASDAQ:AAPL), Microsoft (NASDAQ:MSFT) and Best Buy (NYSE:BBY), just to name a few, and, various government agencies like the U.S Air Force, the Defense Department and the Census Bureau. A very impressive customer base. However, there is competition from the likes of Limelight (NASDAQ:LLNW), Amazon (NASDAQ:AMZN) and Level 3 Communications (NASDAQ:LVLT).To bolster its cloud computing presence, CEO Sagan discusses some of Akamai's initiatives in the 2011 Q1 Earnings Call Transcripts: ""This month, IBM announced its WebSphere Application Accelerator for Public Networks and Hybrid Networks. These products integrate Akamai's application acceleration capability with IBM's WebSphere technologies."" WebSphere is a brand of enterprise software products that has been available for over ten years in the sector of Application and Integration Middleware. Akamai has also partnered with Rackspace Hosting (NYSE:RAX) and Riverbed Technologies (NASDAQ:RVBD) to help take marketshare.In that same conference call, CEO Sagan goes on to say: ""In the area of Internet security, which is a top priority of CIOs everywhere, we announced our new suite of cloud defense solutions. The Akamai DDoS defense architecture is designed to help customers therefore monitor and mitigate the impact of distributed denial service of attacks. The distributed computing platform was designed to protect our customer sites from malicious threats by absorbing large-scale attacks at the edges of the Internet, not at the backdoor of a client's data center.""If you're trawling for equities in the cloud computing space, Akamai Technologies is a great organization to keep your eye on, but there's no immediate rush to jump into it post haste. After all, consensus earnings estimates as reported on Yahoo Finance are reported to be $1.45 for 2011 and only $1.63 for 2012. That's a nice gain, but nowhere near the projected 15% five-year CAGR or the heavy duty 36% it grew on an annual basis in the previous half decade. This decrease in business is one of the main reasons the stock got torpedoed and investors were left in the lurch.A p/e ratio of 15 and a five-year CAGR of 15% gives it a PEG ratio of one, which isn't very rich, but Akamai's strong suit isn't proprietary technology. Yes, it is making inroads into the cloud, but it is still primarily a content distribution company without a large moat around the business. Any entity with deep pockets can set up server farms. That's exactly what Amazon is doing right now. According to the analysts opinions on Yahoo Finance, six have it as a strong buy, four say it's a buy and thirteen want you to hold the security. I tend to take the more pessimistic side of the market these days and believe we are heading lower, so I am going to bite the bullet and wait and see if it goes lower. Disclosure: I am short the market with inverse ETFs"
282339,21445,2011-07-27T15:41:59-04:00,,"Akamai Technologies (NASDAQ:AKAM) is expected to report Q2 earnings after the market close on Wednesday, July 27, with a conference call scheduled for 4:30 pm ET. The consensus estimate is 36c for EPS and $277.98M for revenue, according to First Call. Many analysts lowered estimates and ratings on Akamai shares after its Q1 results back in April. The firms cited a slowdown in Media and Entertainment revenue growth. The company's publicly stated outlook for Q2 called for $270M-$280M in revenue and 34c-37c in EPS. SunTrust's Robinson Humphrey is forecasting Q2 results of $278.0M in revenue and 37c in normalized EPS, basically in-line with consensus. SunTrust's key focus will be the growth rate of the Enterprise industry segment, which it believes is a reasonably accurate gauge of the continued uptake of higher margin value added services. With the positive figures reported out of the wireless data segment, SunTrust expects a positive update on wireless demand, and would expect some indication of the progress of the Ericsson (NASDAQ:ERIC) partnership. SunTrust believes that a re-acceleration of the volume-driven business in 2H11 is possible -- pulled through by increases in wireless demand and in overseas markets, quite possibly with the Netflix (NASDAQ:NFLX) expansion into Latin America as one modest catalyst. The firm feels that Akamai's Q4 of 2010 re-price of its largest Media and Entertainment customers likely will keep upside to margins restrained, but it believes that the company's outlook and the Street mean are conservative enough to anticipate an in-line to slightly better quarterly print, in the upper half of guidance. On the call, investors/analyst will be closely watching for comments on what pricing pressures Akamai faces from competitors like Limelight Networks (NASDAQ:LLNW), InterNAP Network Services (NASDAQ:INAP) and Level 3 (NASDAQ:LVLT) for its content delivery network service. They will also look for any signs of a slowdown in customer additions as telecom providers like AT&T (NYSE:T) have started to venture into providing their own CDN services. Consensus for Q3/FY11: 38c/$1.57 on $288.75M/$1.17B in revenue."
265819,20568,2011-04-27T11:47:49-04:00,,"Akamai Technologies Inc. (NASDAQ:AKAM)  is scheduled to announce its first quarter 2011 results today, after  the market closes. We do not see any movement in analysts’ estimates in  the run up to the earnings report.Prior Quarter HighlightsAkamai reported fourth quarter 2010 earnings per share (EPS) of 30  cents, beating the Zacks Consensus Estimate by 2 cents. Akamai achieved  its top-line guidance of more than $1.0 billion in fiscal 2010.Revenues in the quarter escalated 19.5% year over year and 12.3%  sequentially to $284.7 million, surpassing the Zacks Consensus Estimate  of $283.0 million. The year-over-year growth was attributed to strong  performance across all key verticals.Operating income on a non-GAAP basis was $76.6 million, up 15.4% year  over year versus $66.4 million in the prior-year quarter. Operating  margin declined 90 basis points (bps) to 26.9% in the quarter compared  with 27.8% in the prior-year quarter.We believe a significant increase in costs negatively affected margins  in the quarter. Total costs and operating expenses increased 20.6% year  over year to $212.3 million. As a percentage of revenue, total costs and  operating expenses increased 70 bps to 74.6% from 73.9% in the  comparable prior-year quarter.Current Quarter ExpectationsAkamai expects normal seasonality in the first quarter of 2011. Akamai  forecasts sequential decrease in revenue in the Commerce and Advertising  vertical for the first quarter of 2011. Akamai projects revenue in the  range of $265.0 million to $275.0 million, up 10.0% to 15.0% from the  first quarter of 2010. However, on a sequential basis, revenue is  expected to dip 5.2% in the quarter. The current Zacks Consensus  Estimate is pegged at $274.0 million, at the high end of the company’s  guided range.Akamai estimates earnings of 35 cents to 37 cents per share for the  first quarter of 2011. Currently, the Zacks Consensus Estimate is pegged  at 27 cents for the first quarter.Akamai expects gross margin in the range of 80.0% to 81.0% for the  first quarter of 2011. Further, the company expects operating expense to  decline sequentially and adjusted EBITDA margin to be in the 45.0% to  46.0% range, roughly flat with the prior quarter.Akamai expects capital expenditure of $50.0 million for the first  quarter. On a long-term basis, the company expects capital expenditure  to be at the upper end or slightly above the long-term revenue model of  13% to 16%. Akamai continues to maintain its objective of more than  15.0% growth for fiscal 2011.Estimate Revision TrendOut of the eighteen analysts providing estimates for the upcoming  quarter, none made any changes in their estimates in the last thirty  days.Similarly, for fiscal 2011, none of the analysts covering the stock  revised their estimates in the last thirty days. Thus the EPS estimate  for fiscal 2011 remained at $1.20.ConclusionIncreased penetration in broadband and the momentum gained in online  media and entertainment fueled growth at Akamai and we believe this  trend will continue going forward.We believe that the growing popularity of   High Definition (NYSE:HD)  quality video over the Internet should help drive bandwidth requirements  going forward, thereby enhancing demand for Akamai’s services. We  expect HD video to emerge as a new growth driver for Akamai in the  coming years.Akamai’s broad services offerings and collaboration with large vendors such as Microsoft Corp. (NASDAQ:MSFT), Apple Inc. (NASDAQ:AAPL), Netflix Inc. (NASDAQ:NFLX), Hulu and Adobe Inc. (NASDAQ:ADBE) to provide HD quality experience, will help the company capitalize on  the growth in HD content and media in the near term.Akamai is a leader in content delivery networks with over 60% market  share and currently delivers 15.0% to 30.0% of all Internet traffic  worldwide with the largest web content delivery and acceleration  platform in the world.However, the company is facing stiff competition and pricing pressure, as new competitors including AT&T Inc. (NYSE:T) and Level 3 Communications Inc. (NASDAQ:LVLT) enter the market, joining traditional players like Limelight Networks Inc. (NASDAQ:LLNW) and Packeteer.We maintain our Neutral recommendation on a long-term basis (6-12  months). Currently, Akamai has a Zacks #3 Rank, which implies a Hold  rating on a short-term basis."
