article_id,author_id,publish_on,summary,content
4368723,103480,2020-08-14T10:24:08-04:00,"Shares of Arista dropped a precipitous ~20% after the company's second-quarter earnings release.
        Investors are fearing that enterprise spend on Arista's hardware will be depressed for longer than the near term.
        Revenue guidance of $570-$590 million for Q3 is still pointing to revenue declines vs. last year's $654.4 million.
        Thankfully, and on the bright side, Arista's hard-won gross margins did not peel back.","Prior to the coronavirus overtaking the global economy, Arista Networks (ANET) was one of the hottest stocks in the IT sector. In contrast to many SaaS stocks, Arista Networks wowed the investment community due to the fact that despite being a hardware company, it clung to extremely high gross margins and critically, was profitable and generating tremendous earnings growth, which peaked when the Trump tax cuts settled in. Arista was billed as a ""Cisco (CSCO) killer"" and a long-term winner that would benefit as companies continued to invest in infrastructure that allowed them to adopt cloud-friendly infrastructures.Here's the problem: since the coronavirus began, companies have scaled back on spending. Not only have they slashed hiring and headcount, but they've scrapped capex budgets as well - and that includes IT spending on things like Arista products. Amid that backdrop, and due to the fact that unlike many other tech companies Arista doesn't have a recurring revenue base that protects it from volatility, Arista has been dealing with jarring revenue declines. After reporting a disappointing second quarter and guiding to an even more disappointing third quarter, shares of Arista have dropped ~20%:Now, here's the good news: these problems aren't Arista-specific. Arista's principal competitor Cisco (CSCO) tanked ~12% after earnings, due to disappointing results stemming from soft enterprise spending from its own customers. What this means is that, at the very least, Arista isn't losing pace with the rest of its industry. Looking longer term, I'm favorably dispositioned toward Arista. The company has earned a ""best in breed"" reputation as a networking product that was specifically designed with the cloud in mind, whereas Cisco has the negative connotation of an older legacy product. The cloud isn't going away - businesses aren't investing into infrastructure in the near term, but they will have to as our computing demands continue to increase. At the same time, there continue to be no near-term catalysts that can lift Arista higher. Arista's latest management commentary doesn't provide any hint of respite from the current demand environment (in contrast to many other enterprise companies, particularly in the software sector, that have signaled strong bouncebacks in June and July). Based on this, I think the best move is to continue to wait and watch. Considering that even after this stock price correction, Arista already trades at a ~23x forward P/E based on FY21 EPS consensus of $9.67 (+12% to FY20 consensus, but only flat to FY19; data from Yahoo Finance), I'd say there isn't much of a safety net on the valuation front either. We can now dive into the specifics of Arista's second-quarter print. Take a look at the results in the table below:Figure 1. Arista Q2 earnings resultsSource: Arista Q2 earnings press releaseArista's revenue declined -11% y/y to $421.4 million, which is certainly better than Wall Street's consensus of $530.6 million (-13% y/y) but still a disappointing continuation of the -12% y/y growth trend that we saw last quarter. With a weak macro environment, companies are focused on conserving cash and aren't lining up to replace infrastructure products, which are delayable expenses in most cases.Here is the bright news, however. It's possible that Arista's underlying Q2 demand could have been stronger than the -11% y/y decline that it generated, due to the fact that it was supply-constrained and had to push out fulfillment of some orders. Here's some important commentary from CFO Ita Brennan on the Q2 earnings call. This isn't exactly a whole lot of information to go off of, but we feel reasonably confident in estimating that ""somewhat constrained shipments"" means at least a few points of growth were pushed out from Q2 into Q3 when the orders are filled. Arista's guidance - which calls for the same -11% y/y growth in Q3 - may have some points of opportunity by that logic, assuming of course that the company is finally able to catch up to its backlog by the end of the quarter. And while Arista's CEO Jayshree Ullal did offer the unsurprising commentary that many of its large customers (and cloud titans) are pushing out spending decisions to future quarters, ""Arista experienced a cloud titan recovery and enterprise strength in Q2 offset by extended sales cycles in the campus sector."" In other words, there are some mixed signals - and while Arista remains uncertain about the overall demand picture, it's not all unidirectionally bad news.The other piece of good news is that Arista was able to hang on to its hard-won margins in the quarter. Arista's pro forma gross margins remained flat at 64.7%, which is incredibly high for a company that primarily sells hardware. Similarly, pro forma operating margins held roughly constant at 38.1%. Figure 2. Arista margin trendsSource: Arista Q2 earnings press releaseWe also remain encouraged by Arista's fortress balance sheet. As of the end of the June quarter, Arista held a whopping $2.78 billion of cash and marketable securities on its books, worth roughly 17% of its market cap and also just over a year's worth of revenue. This cash also comes free and clear of debt. This liquidity gives Arista plenty of flexibility to manage through the current crisis and re-invest in growth, and also take advantage of a lower share price to continue repurchasing shares, on which it has a ~$0.5 billion authorization left to go on its existing $1 billion share buyback approval. Arista is far from doomed forever. As the leading provider of cloud-friendly networking infrastructure, Arista is closely tethered to the trends that are driving the modern tech and computing landscape. Its problems are thankfully not self-isolated, and we've seen similar cautious commentary around Cisco, Arista's biggest rival. The fact that Arista was supply-gated and couldn't fulfill all its shipments in Q2 also suggests that underlying demand may be stronger than its current financials are showing. Stay cautious for now, but keep on the lookout for a buying opportunity if shares drift meaningfully lower."
4335603,101501,2020-04-02T07:35:09-04:00,Arista Networks network equipment is supplied to Cloud Titans like Facebook and Microsoft who are experiencing a massive surge in demand.Despite revenue levelling over the last 12 months we believe the surge in Internet usage will drive growth even after the virus recedes.At a PE of 19 and with ~$2.7 billion in cash on the balance sheet and a surge in demand we believe ANET is a buy below $225.,"During the current uncertainty where almost all earnings forecasts seem in doubt, we thought it would be useful to identify a technology company that might actually benefit from the virus. The benefit is easy to explain. Arista Networks (ANET) sells switching equipment to expand the capacity of the Internet. Suddenly all of us are using the Internet far more intensively, using videoconferencing like Skype or Zoom (ZM), or simply self quarantining with Netflix or Disney+.Growth was in doubt prior to the virus. Will the surge last?ANET is a holding of ours from years past. In the last 18 months however we have traded in and out. Increasing our holdings after a poor guidance plunge and reducing our position once the market price recovers. But ultimately, despite its great historical track record, should ANET have an asterisk over its growth future? Does the virus change things?We profile ANET as part of our Global Technology Growth Star investment strategy. In this strategy we focus on strongly growing technology companies with a market capitalization in the range of 1-100 billion USD, not just in the United States, but from around the world.We look at our standard testsBut first, what does ANET do?Arista Networks makes high speed switching equipment for networks and data centers, thus making it the biggest challenger to Cisco System's (CSCO) market dominance. Major clients are cloud giants like Microsoft (MSFT) and Facebook (FB), but also large corporates, universities and governments.Arista Networks has undoubtedly been a growth star in the past growing at a strong consistent rate. That is, until growth slowed in 2019.Source: CGP Asset ManagementQ4 of 2019 in particular was a bad quarter, falling below both the previous quarter but also Q4 2018. This is not a seasonal effect either as previous 4th quarters have usually risen.The US/America's also remains the vast bulk of company revenue.Source: Arista Networks Investor PresentationDuring the Q4 conference call, CFO Ita Brennan put two ""cloud titan"" customers at above 10% of revenue. These were:In the call, a lack of visibility from cloud titans was also cited as a reason for the lack of full year guidance for 2020. The virus might have changed that.We think after the initial surge passes, we will also be left with an ongoing change behavior that will increase in Internet demand going forward. Here are just two examples.How much of the demand will be affected remains hard to guess. But once the surge fades, the change in consumer demand will likely drive internet growth for several years to come. ANET is likely to see a surge in sales given their reliance on cloud titans who are trying to respond to a massive surge in demand. Even better, Cloud titans have plenty of cash to pour into network infrastructure investment.ANEET has a long track record of growing profitability ever since its 2014 IPO (and even before).Source: Arista Networks Investor PresentationOperating margins have been maintained at strong levels in the 35-40% range for quite some time. These are very good levels for a company involved in technology hardware.Source: Arista Networks Investor PresentationHigh and stable margins are a key test for investors like Warren Buffett when he looks at stocks. Arista Networks meets this test.Competitors - Cisco Systems and the othersArista Networks has grown from a niche player in switching to become one of the main competitors to the dominance of Cisco Systems. Network management systems built for the specifically for the purpose of managing cloud systems has helped.Source: Arista Networks Investor PresentationStill, Cisco Systems is far and away the leader of market segments like 10GbE and Higher - Excludes blade switches, that are represented in the diagrams above. Arista Networks isn't the only competitor to Cisco Systems although the ability of Huawei to take market share in the current political environment, at least in the United States, is likely to be inhibited for the foreseeable future.Source: Arista Networks Investor Presentation.Bottom-line: Market share growth and margins give signs of a moat but recent lagging growth a concern.Internet and Data will keep growingThe simple answer is ""Yes, the TAM is big enough and growing fast enough.""Should you have any doubt, these trends are increasing network traffic include:There are many sub-sectors that require switching. A main focus for Arista Networks is Data Centers with campus ethernet a focus for future. This forecast is below, although this forecast was released in January 2020. The coronavirus might mean this is quite likely to beaten. Arista Networks with around $2.4 billion in total annual revenue, which includes other segments and service revenues, still has plenty of room to grow.Source: Arista NetworksWe usually like to consider several different management decisions and history to get a sense a management style. But in the current crisis times, capital management is far more important, so we will just focus on that.But here is a quick summary.$2.4 B in cashSource: Arista Networks Investor Presentation.Overall ANET is well prepared for any cash crunch with cash levels far in excess of requirements plus further unused borrowing capacity given the lack of any long term debt.Like many growth companies Arista Networks has regularly traded at PE multiples in the 30-plus range. Even now after sell-offs due to growth concerns, the historical PE ratio of ANET is around 18 at the time of writing.Data by YChartsGiven current volatility levels it makes sense to consider a range of stock price levels. A ""strong buy"" last week, could yet see the stock reach sale price next week on internet demand confidence. The flattening of sales in 2019 leaves us unconvinced of a long term growth profile.From this we produced these guidelines, for ANET at present. Interestingly they also do support recent trading history where the stock traded in a range of $200-300 with brief excursions outside this range.For us, here is how we are looking at ANET at the moment.Source: CGP Asset ManagementNibble at stocks, but keep some powder dry.We feel it is likely that the market may yet retest lows as the virus emergency spreads from New York to Louisiana, Florida and eventually most states. An 08/09 sized recession seems almost certain given the likely ongoing economic impact of ""shelter-in-place"", despite the unprecedented stimulus provided. So although ANET is at a buy price, just nibble at current prices. Keep some powder dry, because we could yet see further falls if the economic gloom darkens.Bottom line: ANET is a buy below $225.Arista Networks is undervalued compared to the boost in growth it will receive, which should substantially improve profits. We believe however that this is a trading opportunity to exit at around $290 over the coming weeks or months. We have sufficient doubts over long term growth that ANET does not qualify as a buy-and-hold stock for a multi-year hold."
4324794,25120,2020-02-17T18:02:38-05:00,"Arista Networks has long been a darling yet growth has not just come to a standstill, but in fact has reversed.The long-term promise looks good, and the question is if the company is just losing a few accounts or faces more prolonged competitive headwinds.Expectations have come down quite a great deal as value seems imminent, provided that revenues stabilize and start growing again.Shares deserve a prominent spot on the watch list, as I look to buy on dips, looking with eager to show clues about growth later in 2020.","Arista Networks (ANET) seems to have lost its mojo. Since the company went public in 2015, it has proven to be a worthy challenger to Cisco Systems (CSCO) and the likes. Shares traded in their sixties in 2015/2016, yet thereafter started a huge momentum run to levels above the $300 mark in spring of 2019. Over the past years shares have fallen quite a bit to current levels of $223, despite the market at large setting fresh highs.My last take on the business was February of 2018. That article followed the initial review at the time of the IPO at $55 in 2015. When the company went public, shares traded at 9 times sales. While this is on the high side, growth was quite impressive and very profitable, yet I was somewhat scared of the overhang caused by litigation risks.Early 2018 I noted that shares had essentially increased a factor of 5 times in a period of just about three years. The company reported $1.65 billion in sales in 2017 on which it earned $5.35 per share, while holding $20 per share in net cash as well, implying that operating assets traded at an elevated 40 times earnings. That high valuation prevented me from jumping aboard at the time.The potential for Arista is huge as the company is all about EOS offerings supporting virtualization and cloud solutions for all the major cloud players involved. EOS addresses these scale issues related to placing data in the cloud, as Arista operates in secular growth markets, which has been driving its growth trajectory in the recent years.When I last looked at the shares in February of 2018, when shares traded at $250 per share, I noted that a 40 times earnings multiple looked very rich, a bit too rich for me. Assuming 25% earnings growth in 2018, that suggests earnings of $6.70 per share. In 2018 I concluded that I would be willing to apply a 25 times multiple to that, and including $25-$30 per share in net cash, I would be happy to become a buyer around the $200 mark.Shares actually fell a bit during 2018 and fell below the $200 mark during the market sell-off late in 2018, yet that fierce and short sell-off created opportunities across the board of course.Fast forwarding to February of 2019 Arista reported its 2018 results. Those results were actually quite solid with full year sales up 31% to $2.15 billion, as momentum towards the end of the year was solid with fourth quarter revenues up 27% year-over-year.The company reported net earnings of $328 million, or $4.06 per share which actually marks a fall in earnings. While these are still very nice margins, note that the company took a huge $405 million settlement charge with Cisco, exactly the thing I worried about at the time of the IPO. Adjusted earnings came in at $7.96 per share, or $643 million. That number is not really fair, as it excluded a $91 million stock-based compensation expense, which after tax amounts to nearly a dollar per share. Adjusted for that, realistic earnings number came in around $8 per share.With net cash balances having increased towards $2 billion, net cash has increased to $25 per share. That actually meant that at $200 per share early 2019, valuation multiples had compressed a great deal. After backing out net cash, earnings multiples compressed to 25 times earnings, in line with my entry target as opportunities elsewhere made that I allocated by funds in other investments at the time.That was quite a shame as these solid results and a market recovery made that shares recovered from $200 at the start of 2019 to $320 in April, with shares showing 60% gains in the time frame of just a few months.From that moment on, growth has slowed. First quarter sales grew 26% year-over-year. At the start of August it became apparent that growth slowed down to just 17% in the second quarter, as this growth slowdown triggered a sell-off to levels in the low $200s. Shares plunged to $190 in October as third quarter results revealed that growth remained low at 16%. Note that despite the slower pace of growth, the company was still in essence generating earnings at close to $10 per share, as net cash balances had increased to roughly $30 per share. That implied that operating assets were merely trading at a market multiple, despite very strong balance sheet and actual still double digit growth.This appeal actually triggered a recovery to $240 earlier this year, yet shares now trade at $223 following weak fourth quarter results, with sales actually down 7% year-over-year. This is actually a bit on the contrary to the dip seen in the datacenter market results reported by Intel (INTC) and Nvidia (NVDA) and therefore suggests some operational weakness, not just market dynamics. Industry talks seem to suggest that the growth slowdown is attributable to Facebook (FB) hitting the breaks, although it does not seem very credible that one company is responsible for the fall in sales.For the first quarter of 2020, Arista sees revenues at a midpoint of $527 million and non-GAAP operating margins of 34%. At the midpoint of the guidance, sales are seen down 11-12% year-over-year, as the fall in margins makes that earnings could drop about 20%. If this is the new normal for 2020, earnings could easily fall back to $8 per share, yet investors are mostly worried about what is causing this weakness, as it seems that competitors are eating Arista's lunch for a change.Trading in the low $220s, and recognizing that net cash balances have risen to more than $30 per share, that implies a 24 times earnings multiple applied to the operating assets, assuming this weakness is prolonged throughout 2020. Given the complete lack of momentum and uncertainty about the competitiveness, this is probably a fair approach until more becomes clear.Despite some current woes, the long-term promise of the business look good as I would not rule out M&A interest over time as well, making that I am now truly willing to buy some further dips at $200 per share.While a short-term recovery might not seem very realistic, I recognize that shares ripped higher from $200 to $320 in a time window of four months this time last year. Recognizing that the $300 call by early 2021 is on sale for just $8, as a similar $120 move higher from here could make you 5 times your money, or even more in case such a similar recovery might occur in a shorter period of time, although I do prefer the risk-reward on the stock for now."
