article_id,author_id,publish_on,summary,content
4169751,103480,2018-05-04T06:55:54-04:00,"Arista crashed 8% after Q1 earnings on soft gross margin guidance.Just like in Q4, Arista's selloff follows an extremely strong quarter in which the company beat expectations on both the top and bottom line.Revenues grew 42% y/y while pro forma EPS grew 83% y/y, making Arista one of the fastest-growing companies in the hardware sector.Arista continues its sector leadership over incumbents like Cisco, and a few points of gross margin shift are not a long-term indicator of slipping fundamentals.","Like many Arista Networks (ANET) investors, I continue to be frustrated by the market's lack of appreciation for what I believe to be one of the technology hardware sector's highest-quality names. The networking hardware vendor - which bills itself as sort of a new-age Cisco (CSCO) whose products are built for the cloud era - continues its dominance and growth in a staid corner of the technology industry that is more or less flat year-over-year. Yet Arista - led by a woman who was once a top lieutenant of Cisco's John Chambers - shows that new players with superior technology can turn a boring industry upside down on its head.Stocks that crash 10% after earnings tend to see much worse-than-expected results or terrifying forward guidance. In Arista's case - both this quarter and last quarter - it was neither.Let's recall what caused Arista to topple ~20% after Q4 earnings last quarter. The company had guided to $450-468 million in revenues for Q1, implying 38% y/y growth at the midpoint. Analysts had then expected $459 million, making the guidance in line, but investors weren't impressed and dumped the stock.What actually happened in Q1, which we now know, is that Arista ended up posting $472.5 million in revenues, or 42% y/y growth - ahead of the high end of the guidance range, and ahead of Wall Street's expectations both at the end of Q4 and now. Don't punish a company with a history of conservatism - Arista always beats itself and the market every quarter without fail. See below the company's earnings history, provided by Seeking Alpha:Source: Seeking AlphaThere is no cause for the post-earnings selloff that took Arista yet again below $250 (it had closed near $270 prior to reporting earnings, as shown below). Arista's P/E in the mid-30s certainly isn't cheap, but in the context of nearly doubling EPS on a y/y basis each quarter, this is certainly one of the best-valued growth stocks in the market. For me, every dip is a buying opportunity. I'm holding my breath and adding more.ANET data by YChartsHere's a look at Arista's results for the quarter:Figure 1. Arista Q1 resultsSource: Arista investor relationsAs previously noted, Arista achieved stellar 42% y/y revenue growth to $472.5 million, squarely beating its prior guidance range of $459-468 million in revenues as well as analysts' consensus target of $463.4 million (39% y/y), a target that had already moved upward during the quarter. Arista's long stretch of >40% growth (last year, for the full FY17, Arista had generated 46% y/y growth - an incredible number for a company exiting the year at a nearly $2 billion revenue run rate).It seems that Arista investors really didn't care much about the growth this quarter however (really strange because most of the Arista crowd are hardcore growth investors). What dominated the earnings reaction was Arista's gross margin.As seen above, Arista's gross profit of $302.9 million represented a GAAP gross margin of 64.1% - a hair lighter (just 10bps) than 1Q17 gross margin of 64.2%. There's no need to make a federal case out of this (as Elon Musk said in response to a gross margin question during Tesla (TSLA) earnings) - a 10bps shift in gross margin can easily rectify in the future, and can be driven by a lot of non-permanent factors.Investors, of course, also zoomed into Arista's gross margin guidance (on a pro forma basis) of 62% to 64% for Q2. Analysts had wanted to see 64.2%. Yes, it's true that a shortfall of as much as two points in gross margin for next quarter is a much bigger issue than a 10bps slide this quarter, but we have to remember that Arista is famed for its conservative guidance principles. It wouldn't be surprising at all to see Arista hit the high end or even exceed its gross margin range entirely in Q2. It has, after all, held its gross margin in the 64-65% range for the past several quarters, and a two-point shift would indicate some seismic event that is no more than mere conjecture.And in any case, Arista's continuous recognition by Gartner as a leader in the networking space, as well as the general flood of positive reviews from customers, continues to enshrine it as a top competitor in the space. Gross margin pressures are not, as Citron Research would have it, an indication that the industry is suddenly moving more toward ""white-box"" solutions. While certainly cost-conscious IT buyers exist out there, most IT decision-makers are spending their company's money, and they want the best that money can buy. It's these customers who generate the largest enterprise billings for the least customer maintenance expenses, and this is Arista's focus anyway. Gross margin moves are just one part of the story - it must also be read in context with Arista's incredible growth and tailwinds in the competition versus Cisco. The chart below taken from Arista's earnings deck showcases its share growth against the legacy giant:Figure 2. Arista market share gainsSource: Arista investor relationsGiven that Cisco still holds about half of the market (but is consistently losing share), Arista still has plenty of room for penetration.And gross margin aside, Arista clearly still has plenty of room to boost its earnings expansion regardless. Arista showed extreme expense discipline in growing its R&D and sales and marketing expenses by less than its revenue growth, indicating significant operating leverage as the company continues to scale. And the company also managed to take its general and administrative spending down.This has resulted in an operating margin of 35.3% this quarter, up an impressive 510bps from 30.2% in 1Q17. It's exceedingly evident that the company can make up for any gross margin losses by continuing to gain operating leverage.GAAP net income grew 74% y/y in the quarter to $144.5 million. Arista's earnings growth has outpaced the ~30% growth seen across the broader technology industry this quarter. EPS of $1.66 also grew 78% y/y and showed 10% upside to analyst expectations of $1.51.With a three-point beat to revenue expectations and 10% surprise upside on the EPS figure, it's unclear why investors would react with an 8% selloff to Arista shares. The company is still obviously on remarkably strong footing, with huge revenue growth and operating leverage improvements leading to a near doubling of profits.Disappointed as I am that my Arista position still hasn't recovered to pre-Q4 highs above $300, the silver lining is that this misguided Q1 selloff has presented an opportunity to load up on more undervalued Arista shares and dollar-cost average down. Few companies in the enterprise technology sector, much less the hardware sector, have generated as much goodwill from customers as Arista, and it shows in the company's hyper-growth results.Gross margin worries will recede. Twilio (TWLO), a CPaaS software company, went through a similar dilemma two quarters ago, where a dip in gross margins caused investors to panic that the business was becoming commoditized. Fast forward less than half a year later, and Twilio is notching new highs for 2018, with a new product launch and growth-driven results accelerating enthusiasm for the stock. Gross margin hasn't yet fully corrected to prior levels, but investors seem to care much less.Arista will undergo a similar phasing with its recovery. At the moment, too much doom-and-gloom surrounds the stock, but eventually, the market will give Arista credit for its revenue and earnings growth again. Be patient with this stock and continue to buy the dips."
4148067,25120,2018-02-19T06:47:54-05:00,"Arista Network has defied all doubters in recent years, having delivered on impressive growth and expanding margins.The company continues to undercut Cisco, which has again resulted in a very strong momentum run in 2017.Even after a 20% pullback, shares trade with gains for 2018, although continued growth makes that shares look interesting if they come under further pressure.","Arista Networks (NYSE:ANET) has continued to amaze me. Around the time of the IPO back in the summer of 2014, I looked at the prospects for the shares, but decided that levels around $55 on the opening day left shares too risky for me.Trading at 9 times sales, although sales were growing quickly, left me cautious, although the real reasons for caution were the competitive environment and, even more so, the risk of litigation in which the company has been involved.Initially, my reservations looked reasonable. After all, shares were trading at similar levels in the summer of 2016, as investors have seen no returns over this period of two years. Unfortunately, I have not kept up with the growth development of Arista ever since, as valuation multiple compression, thanks to growth in 2015 and 2016, made that $55 was a great entry point in 2016 (with the benefit of hindsight). Continued advancements made that shares hit a high of +$300 in recent weeks.While a pullback to $250 looks meaningful, shares have still five-folded in about two years' time, as the setback provides a great time to review the situation.Arista is all about its EOS offering, which supports virtualisation and cloud solutions from most major players. The benefits of the cloud over traditional networks are well documented, as Arista's EOS solution addresses the scale of data which needs to be put on the cloud. The solutions are very much in demand with data centers and large customers which have their own dedicated centers.The growth trajectory over the past few years has been nothing short of amazing. Arista reported revenues of $361.2 million in 2013, the last year before the company went public. Revenues were up 62% in 2014 and rose another 43% to $837.6 million in 2015.Earnings were on the increase as well, although operating margins equal to 18% of sales in 2015 were actually similar in terms of percentages compared to 2013. The company reported earnings of $120 million in 2015, or $1.67 per diluted share. Including $645 million in net cash, the company operated with $9 per share net in cash.As shares were trading in the low $70s in early 2016, that implied that operating assets were trading around $60, for a 35 times trailing earnings multiple. That looked a lot more reasonable than the valuations at the time of the IPO, certainly as sales growth still came in at 40% per year.The company grew sales by 35% in 2016 to $1.13 billion, while it managed to grow operating margins to +21%. The +50% increase in net earnings attracted a lot of investors, as shares had risen to the $100 mark by the end of 2016.Last year was a crazy one for Arista, most noteworthy in its valuation. First-quarter revenues were up 38%. Growth accelerated to 50% in the second quarter, 51% in the third quarter and remained very steady at 43% in the final quarter.These results are astonishing, as growth is only accelerating on a percentage base, while the company already surpassed the billion mark in revenue in 2016. Full-year sales were up 46% to $1.65 billion, yet the real impressive performance was seen in the margins, as operating profits nearly doubled in absolute terms and rose to more than 28% of sales.The company earned $5.35 per share, which is more than double the earnings reported in 2016, as the net cash position of $1.5 billion comes in at nearly $20 per share as well. These achievements made that shares rose from $100 at the start of 2017 to $235 by the end of the year. After backing out net cash, earning multiples have risen from the mid-30s to 40 times earnings, following a doubling of earnings in 2017 and acceleration of growth.Very strong momentum pushed shares up to a high of $311 per share just ahead of the fourth-quarter earnings release, and despite a 19% pullback in response to the earnings report to $250 per share, these shares are still trading with gains of 6% so far this year.Alongside the fourth-quarter release, Arista provided its first-quarter outlook for 2018, as it traditionally only looks forward one quarter at a time. Revenues are seen between $450 million and $468 million, with non-GAAP margins at around 32%.Based on the midpoint of the revenue guidance, sales growth is at 37% in the first quarter, marking a slightly lower pace of growth than investors had gotten used to in 2017. It should be said that actual revenues have recently come in far ahead of the initial guidance provided, although the degree by which Arista has beaten its own guidance has come down a bit. In the fourth quarter, the company beat its own midpoint by $11 million, as a similar result would imply growth rates of 40% in Q1 of 2018 on an annual basis.What is clear is that Arista has built up a very impressive track record in a short period of time after it has gone public, by combining very steady and impressive revenue growth with real margin expansion. While the latest 20% pullback looks appealing, it has come in reaction to a great momentum run, as shares are still up for 2018 and have still more than doubled compared to this time last year.If we assume a more modest 25% earnings growth in 2018, driven by 25% sales growth and flattish margins (as the growth rates have recently been indicated by management), earnings might come in around $6.70 per share, as cash holdings could easily grow to $25-30 by the end of the year. The improved earnings potential, growing cash holdings and correction makes that multiples are coming down rapidly.Given the track record and still-impressive current growth rates, I would be happy to buy around a 25 times forward multiple, translating at $168 per share. Including cash holdings, that would make me a buyer at levels just below the $200 mark, as I would be looking to start initiating a small position at those levels, given the company has certainly pushed out the doubts which I had at the time of the IPO.After all, Arista has grown sales by >40% for years in a row now, taking huge market share from Cisco in the high-speed data center switching market. As insiders continue to hold large stakes in the business, the company gains market share by undercutting Cisco, and its target markets continue to grow at a nice clip, I am happy to pick up a few shares below the $200 mark."
4149350,103358,2018-02-22T09:05:56-05:00,Arista Networks experienced a sharp up/down trend over the last few days.Such movements are usual for ANET and happened a handful number of times since its IPO.ANET is undervalued based on my fundamental analysis.Low Guidance for Q1 is business as usual for ANET.,"I started covering Arista Networks, Inc. (ANET) back in September 2017 with a buy rating at $180 with a target price of $215 (Arista Networks: A Buy For Long-Term Investors). Since then, the company outperformed S&P 500, PHLX Semiconductor Sector (SOX), S&P North American Technology Sector Index (SPGSTI), Dow Jones U.S. Semiconductors Index (DJUSSC) and even its main competitor, by a large margin.ANETYChartsHowever, after the recent earnings report on February 15, 2018, the stock tanked severely by about 18% in two preceding sessions.ANETYChartsProbably you think ANET posted a decline in growth, a significant charge or notified stockholders about a management turmoil or at least some bad news.Surprise! It's entirely the opposite.Cisco (NASDAQ:CSCO) filed several patent infringement cases against Arista Networks and it is fighting in courts for years. Last week, Federal Circuit Appeals Court ruled in favor of Arista Networks. Andrew Nowinski of Piper Jaffray believes ""this increases the probability of victory for Arista in the 945 case and potentially the '43 case.""During the conference call on fourth-quarter earnings, Jayshree Ullal, CEO and President of Arista Networks, mentioned that the company now has more than 15 million cloud networking ports and lead the market in 100 Gigabit Ethernet switching.To understand the significance of this event, I urge you to take a look at the graph I used in my previous article.Source: As Networks Speed Up, Arista Gains Ground On Giant CiscoLeading the 100-gigabit market is a critical success for Arista Networks. Based on the expected market demand for different speeds, 100 Gigabit will replace the older 10 Gigabit by 2021.Source: Arista Networks 2017 - Q4 Earnings call slidesCEO also mentioned that Arista Networks would enter the 400 Gbps market next year. It is worth mentioning that industry-wide standard for 400 Gbps Ethernet passed by IEEE just a few days before the end of 2017 (Source: http://www.ieee802.org/3/400GSG/email/msg01519.html).Facebook (FB) and Google (GOOG) are among the major supporter of these super fast Ethernet ports.The growth of cloud computing, high bandwidth applications such as video streaming, and the need for low latency intra-server communication in data centers pushed the providers to come up with intuitive solutions. Arista Networks is leading the way here by offering an independent hardware system for managing and optimizing routers.EOS (Extensible Operating System) is the hearth of Arista Networks offering. Unlike legacy solutions, a client can benefit from this highly customizable operating system without committing to buy any specific hardware from Arista Networks. This proprietary operating system is based on Linux, and Arista Networks modified it to run on different cloud platforms such as Google, Azure (Microsoft), Amazon, or even Oracle.Source: Arista Networks 2017 - Q4 Earnings call slidesThis approach is extremely beneficial from an economic standpoint, allowing the cloud providers to cut their costs to 1/30. Arista Networks claims that a 100 GB port which costs over $100,000 using a traditional router, costs only $3,000 using its technology.Source: Arista Networks 2017 - Q4 Earnings call slidesThe continuous double-digit growth rate in its revenue and quick penetration in a business to business market may be considered as a proof of its claim.It's still a perplexing question to me. The earnings surprise is not as big as it used to be and the guideline for next quarter is not as promising as before, but the growth rate is still far beyond competitors, its market acceptance is growing fast and its profitability ratios improved.To base our investment decisions on a solid foundation, I updated my previous DCF model using the results of past two quarters.The first step in estimating the intrinsic value of the equity is to form a reasonable hypothesis about the future profitability and revenue growth. Arista Networks grew rapidly over the past five years and posted higher revenue for each quarter compared to the previous one (except one quarter).Source: Quarterly earnings reports, graph prepared by the authorFor the last five years, revenue had positive growth except in one quarter (2016 Q1 vs. 2015 Q4), with the average of 12.1%. If we use annual revenue, the growth rate is between 34.8% and 86.8% with the average of 51.8%.To be on the conservative side, I used 45% as the expected growth rate for 2018 compared to 2017 with 4% annual decline.A legitimate debate over my assumption for annual revenue growth can be the guidance provided by the company during the latest earnings conference call.ANET provided a lower than expected guidance for its 2018 Q1 revenue and many believe that this is the reason for the recent sell-off. To defend my assumptions for annual revenue growth, I prepared a table consisting of previous revenue guidance since the fourth quarter of 2015.Source: Quarterly earnings conference call, table prepared by the authorThe lowest percentage changes in guidance compared to previous quarter happened to be on guidance for Q1. For 2016, 2017, and 2018, it was -1.67%, 3.17%, and 0.44%, whereas the average value for all quarters was 7.61%!I believe this strategy is a conservative move by ANET to manage expectations over the next quarter, not an indicator of declining revenue growth.ANET effective tax rate was 17.06%, 23.96%, and 10.86% for 2015, 2016, and 2017 respectively. Again, to keep my conservative approach, I set it at 21%.Arista Networks has no long-term debt, and the total effect of interest income and other financial expenses was immaterial compared to EBITDA. It doesn't have any plan to add debt for the foreseeable future, and considering the amount of cash on the balance sheet, I believe it's reasonable to omit this item from our model.Change in non-cash working capital is assumed to be 3% of revenue and Capex set to 1.3% of revenue.For other value drivers, I used the average of the recent years.Source: Data from quarterly and annual reports, model prepared by the authorEven with conservative assumptions, this stock is undervalued by a large margin.Arista Networks targeted a niche market in the high-end networking infrastructure used for cloud computing and proved to have an edge in its technology. Cloud computing just started its growth cycle, with abundant of new investments from major corporations to catch up with the demand. My fundamental analysis shows that even with conservative assumptions on revenue growth and tax cut implication, this stock is still undervalued by the market."
