article_id,author_id,publish_on,summary,content
4241903,102764,2019-02-18T13:52:55-05:00,"Arista Networks has produced outstanding growth in revenue and earnings over the long term.Fundamental momentum is exceptional, and the company has delivered numbers above expectations in each and every quarter since 2014.Moving forward, the company has massive opportunities in 400-gigabit products.The stock is priced for growth, but valuation is still reasonable for such a vigorous business.If the company keeps playing its cards well, Arista Networks offers attractive upside potential going forward.","Arista Networks (NYSE:ANET) is a market leader in software-driven cloud networking solutions for large datacenter and cloud computing companies. The company offers a wide variety of Gigabit Ethernet switches that significantly improve the price and performance equation of datacenter networks.Source: Investor PresentationDemand for cloud connectivity is booming, and Arista is doing a sound job in terms of translating its growth opportunities into growing sales and earnings for investors. In the past five years alone, the company has increased revenue by more than 400%, with both operating income and earnings per share increasing well above 700%.Data by YChartsArista reported earnings for the fourth quarter of 2018 on February 14, and performance was quite solid across the board. Market's reaction to the earnings announcement was clearly strong, with the stock jumping by 9.6% after the news hit the wires.Revenue during the full-year 2018 amounted to $2.15 billion, an increase of 30.7% versus 2017. Adjusted earnings per share reached $7.96 during the period, a vigorous increase of 35% year over year. Both revenue and earnings surpassed expectations in the fourth quarter, and this is a major positive for investors in Arista Networks.The company tends to consistently deliver financial performance above expectations, which can be a powerful upside fuel for the stock. Successful investing is not just about investing in companies that are doing well, but those companies that are doing better than expected can be the most profitable ideas in the market.In other words, current market prices are reflecting a particular set of expectations for a company. When the company delivers earnings numbers above expectations, chances are that the stock price will tend to rise in order to reflect the upward adjustment in expectations going forward.Source: Seeking AlphaArista has a spectacular trajectory over the long term. The company has delivered both revenue and earnings numbers above Wall Street's expectations in each and every quarter since the second quarter of 2014. This level of consistency in fundamental momentum is quite exceptional.If the company performs better than expected, this generally means that Wall Street analysts are running from behind and increasing earnings forecasts for it in the future. Unsurprisingly, stock prices and earnings expectations tend to move in the same direction over time.The chart below shows how earnings forecasts for Arista Networks in both the current year and next fiscal year have evolved over time. An image is worth a thousand words, and Arista Networks has an outstanding track record in terms of outperforming expectations and driving increased expectations about future performance.Data by YChartsMoving forward, Arista is launching its 400-gigabit fixed switches named the 7060X4 Series with game-changing improvements in terms of routing and buffering in the middle term. This market looks like a huge opportunity for Arista in 2019 and beyond.Source: Arista NetworksThe market is expecting vigorous growth from Arista in the years ahead, and these expectations are incorporated into valuation levels to a good degree. But the stock is not overvalued at all, especially if the company keeps crushing expectations in the future.Wall Street analysts are on average expecting Arista to make $8.89 and $10.31 in earnings per share for 2019 and 2020 respectively. If the company meets those numbers, then the stock would be trading at a forward PE ratio of 29.7 for the current year and 25.6 for next year.These valuation levels are clearly demanding, but not excessive at all for a company that is delivering revenue growth well above 25% year over year and expanding profitability.Besides, valuation is a dynamic as opposed to a static concept. Arista has an exceptional track record in terms of delivering earnings numbers above expectations over the long term. If the company continues exceeding expectations in the future, this would make the stock much cheaper than what current numbers are showing.The PowerFactors system is a quantitative algorithm available to members in my research service, ""The Data-Driven Investor."" This algorithm ranks companies in the market according to a combination of quantitative factors that include: financial quality, valuation, fundamental momentum, and relative strength.In simple terms, the PowerFactors system is looking to buy good businesses (quality) for a reasonable price (valuation) when the company is doing well (fundamental momentum) and the stock is outperforming (relative strength).The algorithm has delivered market-beating performance over the long term. The chart below shows backtested performance numbers for companies in 5 different PowerFactors buckets over the years.Data from S&P Global via Portfolio123Companies with higher rankings tend to produce superior returns, and stocks in the strongest bucket materially outperform the market in the long term.Arista is currently in the top decile, with a PowerFactors ranking of 97.78. The company has solid numbers across the four quantitative drivers: quality (99.39), value (85.57), fundamental momentum (98.9), and relative strength (60.65). This means that the big picture in Arista Networks looks clearly attractive from a quantitative perspective.Only because the numbers look strong, this does not guarantee that Arista will outperform the market going forward. On average, companies with strong quantitative metrics tend to outperform the market more often than not. However, this does not tell us much about how a single stock will perform over a particular year.Arista needs to continue reinvesting for growth in order to sustain its technological advantage, and the company is facing tough competition from bigger players with deep pockets such as Cisco (NASDAQ:CSCO). If the company fails to continue gaining market share versus the competition, this could be quite problematic for the stock.That risk being acknowledged, it's good to know that Arista Networks is still offering attractive upside potential from current price levels, if the company plays its cards well in the years ahead."
4218025,103480,2018-11-04T13:18:49-05:00,"Shares of Arista Networks bounced back sharply to the tune of ~15% after announcing strong Q3 results.Previously, the stock had hovered in the low $200s for most of October, getting hit hard with the rest of the hardware sector.Revenue growth accelerated one point to 29% as the company also held strong gross margins, erasing concerns that Arista's products are becoming commoditized.Arista is an earnings powerhouse that is well positioned for long-term stock appreciation.","When Arista Networks (ANET) is down, it's never down for long. The networking hardware company has had a challenging summer, dropping from highs above $300 back into the low $200s, but after the company's Q3 earnings release, a ~15% share price pop positions the company for a near-term rebound. Faith in Arista had been evaporating for most of the year - especially when rumors surfaced that Amazon (AMZN) would be entering into the enterprise switch market at low-cost, white-box prices. These rumors were later dispelled, but that did little to remove the worries that Arista was facing commoditization of its core hardware products and that its gross margins would eventually tumble down.ANET data by YChartsArista's most recent results - and in fact, its earnings trends all year long - have shown only a company that is leading innovation in cloud-enabled networking hardware and is constantly winning market share against Cisco (CSCO), the decades-old giant of the space. In spite of fears that Arista would suffer from both sharp revenue deceleration and gross margin deterioration, its results have proven that it's currently not at risk of either.It's worth noting as well that Arista Networks joined the S&P 500 in August, a key psychological milestone that confirms Arista's critical position in both the IT landscape and in U.S. enterprise. It's also a consistent winner of awards - from lists of fastest-growing companies, to technical awards from Gartner. In a nutshell - Arista is incredibly appealing from both a raw fundamentals perspective as well as from a narrative and momentum front. Obviously, this caliber of quality doesn't come cheap - Arista is trading at a 36x forward P/E ratio, but considering the company's earnings growth power - in the year-to-date, Arista has grown its pro forma EPS by a massive 46% y/y - it's not too ridiculous of a price to pay for a company with a stable long-term growth trajectory.There are several risks, of course, to this thesis. The most obvious risk is competition - Cisco is a much older and better-funded company than Arista, and though it has slackened on the innovation front in recent years, its recent crisis of survival may force the networking giant to step up its competitive game against Arista. Cisco has upped its software offerings lately - something which Arista lacks. In addition, though the Amazon scare has mostly died down, there's no telling when a white-box competitor can come in and push prices and margins down in the sector.That said, however, Arista has maintained its leadership position for a reason: it has earned a solid reputation as ""best-of-breed"" in the networking space. In my view, investors should stick to Arista as a multi-year, long-term hold.Here's a look at Arista's most recent quarterly results:Figure 1. Arista 3Q18 resultsSource: Arista investor relationsRevenues grew 29% y/y to $563.3 million, actually accelerating one point over last quarter's growth rate of 28% y/y. This is a fairly wide beat over Wall Street's expectations of $548.7 million, or +25% y/y. Evidently, the consensus opinion held that Arista would decelerate growth - not the other way around.During the third quarter, Arita launched 400 gigabit platforms - offerings which support 400G ethernet, which Arista claims delivers four times the throughput and double the power efficiency of its prior 100G products. This is a cloud-native offering that is well suited to complex, demanding applications - introduced in response to customer needs. This is an example of the type of growth-driving innovation that Arista has consistently engaged in.It's also worth noting that Arista managed to eke up its gross margins in the quarter as well. The company achieved gross margins of 64.2% on a GAAP basis this quarter, up 10 bps relative to 64.1% in the year-ago quarter. Last quarter, too, Arista had managed a 10 bps gross margin increase. Though this is only a small bump, earlier in the year Arista was up against widespread fears that margins would fall as competition kicked into higher gear. Arista has, to the contrary, maintained its wide margin premium against Cisco - which, despite the inclusion of higher-margin software offerings, still carries a ~3-point margin deficit to Arista:CSCO Gross Profit Margin (Quarterly) data by YChartsOn a pro forma basis, Arista hit 64.6% gross margins, up 20 bps from the year-ago quarter. With a pro forma margin guidance of 63-65% for the fourth quarter, the company is also signaling that it continues to expect margins to come in at current elevated levels.The only disappointing note in the quarter was that operating margins declined - largely due to a 48% y/y increase in R&D spending to $117.6 million, consuming 21% of Arista's revenues versus 18% in the year-ago quarter. Innovation has been key to Arista's continued market share gains, however, so investors should be patient with Arista as it continues to scale and gain operating efficiencies. On the plus side, general and administrative costs - the ""least productive"" component of operating spend - declined -21% y/y to $15.3 million. Arista still managed to grow GAAP operating income by 28% y/y to $180.8 million, but on a pro forma basis, operating margins dipped 150 bps to 37.1%, versus 38.6% in the year-ago quarter. Still, however, we must stress that Arista carries a premium margin profile relative to most hardware companies - and certainly one that connotes a value-added, non-commodity product offering.Arista also generated $2.11 of pro forma EPS in the quarter, smashing Wall Street's expectations of $1.85 with 15% upside. Year-to-date, that takes Arista's earnings growth to 46% y/y. During these nine months, Arista has also more than doubled its operating cash flows, as shown in the table below:Figure 2. Arista OCFSource: Arista investor relationsArista's third-quarter results serve as a breath of relief to investors who had expected to see Arista begin to decelerate on the top-line and possibly see some near-term margin contraction. The long-term growth thesis for Arista is still very much intact: Arista is continuing a healthy pace of innovation and maintaining its premium positioning in a market that is seeing robust end-customer demand for datacenter and IT hardware.Though investors will have to keep a close eye as competitors encroach on its space, Arista's moat seems well-defined for the near future. Even after this quarter's gains, Arista still remains ~15% off highs that it reached in the late summer. Hold on to this stock for the long term."
4231532,104537,2019-01-04T16:38:24-05:00,"The stock price dropped by 35% from its highs.The growth and profits are exceptional thanks to the low sales and marketing expenses.While I expect the sales and marketing expenses to rise over the long-term, the company will still grow while generating healthy profits.Despite important net margins differences between Arista and other fast-growing IT companies, the market values these companies at a similar EV/sales ratio.","Arista's (ANET) stock price fell by more than 35% off its high. But the fundamentals of the company didn't change. Management even reported results above expectations during the last earnings. And the revenue is still expected to grow above 20% for the next quarters.The stock price dropped below my estimation of fair value of $212. I'm still not buying as I require a margin of safety. But this drop is an opportunity to verify the validity of a key aspect of Arista's success.Revenue has been growing at a CAGR above 20% while net income margins gravitate at about 20%. A key factor to this performance is the low sales and marketing expense. But is it a sustainable advantage? Before answering this question, let's see why Arista is unique from this perspective.Image source: NeuPaddy via PixabayIn the tech industry, the performance of Arista is exceptional. Companies that achieve a similar growth rate usually report a low - or negative - GAAP net margin.The graph below compares the revenue growth of Arista with other network and security vendors. Cisco (CSCO) and Juniper (JNPR) are obvious references. I have chosen to include security vendors as there is no network vendor with Arista's growth profile. And the security and network businesses are similar. They both sell hardware and software to build IT infrastructures.ANET Revenue (Quarterly) data by YChartsOver the last 4 years, Arista has been growing revenue at a higher rate than the other companies listed above. The growth is comparable with Palo Alto (PANW), Proofpoint (PFPT), and - to a lesser extent - Fortinet (FTNT), though.The next graph compares the profits margins. I exclude Cisco and Juniper as their revenue don't match Arista's growth. ANET Profit Margin (Annual) data by YChartsWhile Arista has been generating net margins of about 20%, the other fast-growing IT companies delivered GAAP net margins between approximately -40% et +2%. Besides the quality of the respective solutions the companies propose, there is one explanation for Arista's exceptional performance. Sales and marketing expenses are way below what the other fast-growing tech companies spend as a percentage of revenue. And this advantage is not due to scale as all these companies generate annual sales in the range of $1 to $2.5 billion.The 35%+ sales and marketing margin advantage for Arista is huge. The question of the health and the sustainability of such low expenses is legitimate.There are many reasons for Arista to spend less on sales and marketing. But over the long-term, and considering Arista's strategy, I expect the sales and marketing expenses (as a percentage of sales) to increase.Let's see why Arista can afford lower sales and marketing expenses and why this competitive advantage will diminish over time.Arista started its business selling network switches and software to the cloud providers. Arista also addressed other verticals starting with big customers in a niche (banks with high-frequency trading activities). The limited number of these customers and their scale favor low sales and marketing expenses. Acquiring one customer in the web-scale area can yield great results. As an illustration, management recently confirmed Microsoft (MSFT) still represented way more than 10% of sales at Q3 2018.By turning to enterprises and smaller businesses, Arista will face a new challenge. The number of potential customers is more important than web-scale providers. But the sales potential per customer is much lower. Arista will need a more versatile and denser sales force. The company will also have to adapt its sales strategy. Solutions will become more complex with the integration of the campus infrastructure. Sales teams will have to speak to different corporate levels instead of dealing with web-scale engineers. Check Point (CHKP) is currently following this path to address the weaknesses of its sales processes. In the Q3 conference call, Check Point mentioned the importance of reaching higher level management. The goal is to pitch sales of solutions and architectures at management level instead of speaking to engineers to sell a product.The growth overseas will also increase the costs. Currently, U.S. sales still represented more than 72% of revenue during Q3 2018. And the three big web-scale providers (Amazon (AMZN), Alphabet (GOOG, GOOGL), and Microsoft) are American companies. So, the development overseas will not generate as much web-scale business as in the U.S.Thus, the low sales and marketing expenses are not sustainable. But it's not that bad for three reasons:For the next quarters, I will check the sales and marketing expenses and the costs of revenue progress in opposite directions. If that's the case, there's no reason to worry about the higher sales and marketing expenses.I highlighted in my last article about Proofpoint the recent convergence of the valuations for the fast-growing IT security companies. Despite its unique combination of revenue growth and high net margins, Arista is no exception to this valuation trend. The market values the company at an EV/Revenue (Forward) ratio of 5.ANET EV to Revenues (Forward) data by YChartsThat doesn't mean the market is offering a bargain as I estimate the other high-growth IT company overvalued. But at least, Arista is a bargain relative to these peers.As there is no change to the fundamentals of the company and considering the sustainability of the margins, I keep my estimation of the fair value at $212 per share. The company reported last earnings above expectations. The fundamentals didn't change. Yet, the stock price dropped by more than 35% off its highs about 6 months ago.Due to the nature of its business with web-scalers, Arista has been growing at a fast rate while generating high net margins. Even if sales and marketing expenses will not stay so low over the long-term, the company will still generate high margins and growth for the foreseeable future.Yet, the market values the company at the same EV/Sales ratio as other fast-growing IT companies that generate GAAP losses. Considering the fundamentals are still solid, I keep my estimation of fair value at $212 per share."
