article_id,author_id,publish_on,summary,content
4379204,35401,2020-10-15T10:00:00-04:00,"AppFolio faces slowing growth in an increasingly saturated market.
        Yardi and RealPage are now focusing on this segment.
        Aggressive accounting of capitalized software has led to an overstatement of historical earnings.","AppFolio (APPF) is priced for perfection despite facing 1) increasing levels of saturation in its core market, 2) growing competition, and 3) aggressive accounting practices that should, taken together, bring its valuation to far lower levels as these variables exacerbate.According to the company’s 10-K:Its software provides features such as handling maintenance requests, marketing, rental applications, tenant screening, accounting and reporting, online payments, etc.With AppFolio and other vendors’ historical success, the small and mid-sized market has become increasingly penetrated over the years. This can be seen even in AppFolio’s own disclosed data shown below.Property manager customer growth has slowed over time as has property unit growth. AppFolio’s pricing is based on the number of units each client manages. As total growth equals property unit growth plus same customer sales growth, this bodes ill for future growth sustainability.Our discussions with AppFolio customers support this thesis of saturation in the market. Even die-hard customers say that all of their peers have some sort of property management solution and are not just doing things on Excel spreadsheets. With its extreme valuation, I believe the market is not pricing in a saturation scenario for the company.In addition to increasing penetration, new competitors are beginning to enter the small and medium sized customer segment. Yardi, a traditional high-end competitor, is now beginning to increase its focus on the smaller end of the customer universe with its Yardi Breeze product. Saturation at the high end is causing Yardi to look elsewhere for growth and it is now targeting AppFolio’s sweet spot in the market. Similarly modern in its look and feel to AppFolio’s product, Breeze is poised to take market share in the smaller end of the marketplace. Furthermore, RealPage, through its Buildium subsidiary purchased in 2019, is doubling down on this customer segment as well.On its last conference call, RealPage CEO Stephen Winn said:You can see from Buildium’s disclosed numbers that it is growing faster than AppFolio and thus, taking market share. As competition from Breeze and Buildium increases in an increasingly saturated market, we believe growth will slow at AppFolio and the company’s heady valuation will decline.In addition to its top line challenges, we believe that AppFolio’s earnings are overstated due to an aggressive capitalized software policy. The company’s software capitalization has exceeded its amortization for the past five years resulting in a capitalized software asset on its balance sheet of $35.2 million, as you can see here and in the company's latest 10-Q.This accumulation of capitalized software was gradual in 2018, but then accelerated in 2019 and 2020. This high capitalization rate is rare amongst its SaaS software peers, which usually expense the vast majority of their R&D expenses. Examples of SaaS peers with zero software capitalization include Appian (APPN), Anaplan (PLAN), and SmartSheet (SMAR). If AppFolio had expensed its R&D instead of capitalizing it since its inception, earnings would be reduced by $35.2 million, basically wiping out the majority of its stated historical earnings stream. I emailed the company to discuss its capitalized software policy but received no response.Finally, the company’s accounts receivable balance popped up in Q2, from $9.6 million in Q1 to $12.7 million in Q2, a 32% increase. While the company has not explained the phenomenon explicitly, it could be that some customers are not paying due to the financial stress the pandemic is imposing on their businesses. This issue bears watching in future quarters.AppFolio currently trades at an enterprise value to revenue ratio of 18x 2020E revenue. This makes it one of the most expensive stocks in the small-cap universe. On an earnings basis, it trades at a 220x P/E ratio on 2020E earnings. While the company has shown good revenue growth historically, I do not think it has been scrutinized by investors as much as other SaaS companies have been. APPF trades 130,000 shares a day, far fewer than most of its peers. We believe this lack of scrutiny has created an opportunity to short a company whose growth should slow going forward and whose aggressive accounting may be not be given a pass by investors when held up to the light.We believe a fair value for the company should be at 8x 2020E revenue, trimmed from current levels for slowing growth, which would translate to a share price of $70 or 58% downside from current levels."
4338665,35181,2020-04-20T19:20:58-04:00,"AppFolio has strong historical fundamentals, including 35% annual revenue growth and 12% free cash flow margin.The government-mandated shutdown is causing many renters to move in with family or friends because they can't afford rent.While historical performance is strong, I expect that AppFolio's property management platform will take a hit during the pandemic and expected global recession.","AppFolio Inc. (NASDAQ:APPF) has been one of my favorite stock picks this past year. In fact, I gave the company a bullish rating back in early January. The stock price has held up as well as could be expected since then, losing 11% versus the 13% for the S&P 500 in the extremely turbulent market conditions.(Source: Seeking Alpha)AppFolio provides a SaaS platform that primarily focuses on real estate property management. I have been bullish on this company as a result of its great performance, with strong annual revenue growth of 35% and a positive free cash flow margin of 12%. These are factors that would be quite desirable in a strong market.But the pandemic changed everything in a heartbeat. The macroeconomy has shifted dramatically and is undoubtedly putting tremendous pressure on real estate and the housing market. More than 20 million Americans have lost their jobs and the government has not been particularly clear on landlord/renter strategies other than that they should work together:Across the country, only three-fourths of renters would be able to cover one month of their housing expenses with the $1,200 one-time payment by the government. One has to wonder what will happen when the pandemic-driven economic slowdown stretches to six months, one year and beyond.In one survey, a little over 80 percent of respondents have stayed put, while the remainder has moved in with family, a partner or a roommate since the start of COVID-19.(Source: realtor.com)It is also unlikely that very many rental units will be filled during the government-mandated shutdown. Under the current circumstances, it is difficult for prospective tenants to view rental units, and they prefer to see a rental home in person. In all likelihood, many rental units will be empty during the government-mandated shutdown portion of the pandemic.So, despite the recurring revenue business model, I expect that AppFolio will not be immune to the pressures seen by property managers and tenants. Property managers (AppFolio's clients) will most certainly be asking for concessions from AppFolio. Additional pressure on AppFolio's revenue stream may result from usage-based fees from some of the Value+ services.There is one bright side, and that is the company's electronic payment services for rent collection which may become very popular as a result of social distancing.There are numerous techniques for valuing stocks. Some analysts use fundamental ratios such as P/E, P/S, EV/P, or EV/S. I believe that one should not employ a simple ratio, and the reason is simple. Higher growth stocks are valued more than lower growth stocks and rightly so. Growth is a significant parameter in discounted cash flow valuation.Therefore, I employ a technique that uses a scatter plot to determine relative valuation for the stock of interest versus the remaining 152 stocks in my digital transformation stock universe. The Y-axis represents the enterprise value/forward sales, while the X-axis is the estimated forward Y-o-Y sales growth.The plot below illustrates how AppFolio stacks up against the other stocks on a relative basis.(Source: Portfolio123/private software)A best-fit line is drawn in red and represents an average valuation based on next year's sales growth. The higher the anticipated revenue growth, the higher the valuation. In this instance, AppFolio is situated slightly above the best-fit line. This suggests that AppFolio is modestly overvalued on a relative basis. However, the overvaluation is so minor that I wouldn't reject investment in AppFolio based on this factor alone.One industry metric that is often used for software companies is the Rule of 40. The metric sidesteps the valuation dilemma for high-growth companies that generally don't show profits. The Rule of 40 allows for both revenue growth and profitability (expressed as a margin) in combination such that they must add up to at least 40%. Analysts use various figures for profitability. I use the free cash flow margin.The rationale for the Rule of 40 is as follows. If a company grows by more than 40% annually, then you can turn a blind eye to negative free cash flow to some extent. On the other hand, if a company grows by less than 40%, then the company should have a positive free cash flow to make up for the less than ideal growth.This rule accommodates both young high-growth companies as well as mature moderate growth companies. Young companies tend to have high revenue growth but are burning cash. Mature companies have lower revenue growth, but they make up in terms of free cash flow. The 40% threshold is somewhat arbitrary but typically divides the digital transformation stock universe in half, separating the best stocks from the so-so.For a further description of the rule and calculation, please refer to one of my previous articles.(Source: Portfolio123/MS Paint)In AppFolio's case:Revenue Growth + FCF margin = 35% + 12% = 47%AppFolio scores above the 40% needed to fulfill the Rule of 40. Exceeding the Rule of 40 signifies that AppFolio has a healthy balance between growth and profitability.According to the Q4 2019 earnings call transcript, the company management indicated that expenses have risen faster than revenue:The timing for the increased headcount was unfortunate, given the expected economic downturn that will likely affect future results.AppFolio provides software for the real estate market that is designed to meet the operational and business needs of property management companies. This company has great fundamentals, including 35% annual revenue growth, 12% free cash flow margin and handily meets the Rule of 40. But these figures are historical, and it is quite likely that AppFolio will be subjected to the same heartaches as the rest of the real estate market during the pandemic and likely recession to follow. The high unemployment rate is causing renters to have difficulty with rent payments with the end result that many are moving in with family or friends. It is unlikely that many empty rental units will be filled during social distancing. It is unlikely that AppFolio will be completely insulated from the economic damage. Therefore, I am giving AppFolio a neutral rating."
4316100,35181,2020-01-09T23:06:34-05:00,AppFolio is a SaaS provider that primarily focuses on real estate.Sales growth of 30+% is being bolstered by new and expanded features.The stock price is staging a breakout to all-time highs.,"I am a strong believer in market action. When a stock is making a move higher and pushing 52-week or all-time highs, it's best to take notice. AppFolio Inc. (APPF) is one of those stocks.2020 has started out with a bang for SaaS companies. I am like a kid in a candy shop, and I am actually having a difficult time prioritizing which stocks to write about. But AppFolio got my attention simply due to the pretty chart, with today's price jump of almost 3% emphasizing where this stock is headed.Back in July, I had some concerns with AppFolio. I expressed them in this article: ""AppFolio: Every Dog Is Allowed One Bite"". I must confess that some of these concerns still persist, but the stock breakout, coupled with new product features, a great economy, no chance of interest rate hikes, and an impending presidential election which is usually bullish for the stock market, lead me to believe that it is best to embrace this stock while the going is good.For the above reasons, I am adjusting my rating for AppFolio from Neutral to Bullish.As I have explained in recent articles, high-growth companies generally don't measure up based on traditional value metrics. In fact, they often confound analysts, with the result being a lost investment opportunity. In place of traditional value factors, I generally focus on other measures, such as revenue growth, free cash flow margin, and the software company ""Rule of 40%"".AppFolio had an excellent year with trailing twelve-month (TTM) revenue growth of 33%. The company's 5-year annual growth rate of 48% is also extremely good.(Source: Portfolio123)AppFolio’s free cash flow margin TTM has been positive since the Spring of 2017 and is currently sitting at a very healthy 12.8% of revenues.(Source: Portfolio123)The recent slight decline in free cash flow margin is the result of an increase in headcount due to the new product features that I will discuss a little later in this article.One industry metric that is often used for software companies is the Rule of 40%. It is an industry rule of thumb that attempts to help software companies ascertain how to balance growth and profitability. There are different ways of calculating the Rule of 40: some analysts use EBITDA and others use the free cash flow margin. I use the free cash flow margin TTM.The Rule of 40% is interpreted as follows: If a company's growth rate plus free cash flow margin adds up to 40% or more, then the SaaS company has growth and cash flow in balance and is considered financially healthy. In AppFolio’s case:Revenue Growth + FCF margin = 34.6% + 12.8% = 47.4%Since the calculation comes out at 47.4%, I conclude that the company is in good shape financially.The thrust of the bull case rides on the investments that AppFolio has made in several areas that are expected to impact long-term growth. These include:I determine stock valuation on a relative basis by comparing sales multiples and sales growth to the company's peers. I believe that high-growth companies should be more highly valued than slow-growth companies. After all, growth is a prime factor in valuation models such as DCF. Higher future growth results in higher valuation and, therefore, higher EV/sales multiple.To illustrate this point, I created a scatter plot of enterprise value/forward sales versus estimated YoY sales growth for the 152 stocks in my digital transformation stock universe.(Source: Portfolio123/private software)The sales multiple in the vertical direction is calculated using the EV and ""next year's sales estimate"" mean value based on all analysts from the Portfolio123 database. The estimated YoY sales growth is calculated using ""current year's sales estimate"" and ""next year's sales estimate"", also provided by Portfolio123.As can be seen from this scatter plot, AppFolio is over the best-fit line, suggesting that its forward sales multiple is higher than its peers', given its estimated future revenue growth rate. My interpretation is that AppFolio is moderately relative to the average stock in my digital transformation universe.However, a similar evaluation based on next year's earnings estimate / EV suggests that the company is fairly valued.(Source: Portfolio123/private software)Considering the two evaluations, I believe that AppFolio is overvalued based on its EV/forward sales multiple but fairly valued considering the expected earnings looking forward.While I believe that now is the time to initiate a position in AppFolio, the investment comes with significant risks, as summarized below.While software stock valuations have come down in recent months, they are still high on a historical basis. I would not dismiss the possibility of a dot-com-like crash in the future.There are other uncertainties, such as the rising tension in the Middle East, trade disputes, and President Trump's impeachment, which could cause a market downturn. Software stocks tend to get hit hard during any market turbulence.The new product initiatives described in the previous section may not prove to be as fruitful as company management expects, and this would result in lowered margins and profitability.The Total Addressable Market (TAM) appears to be limited, and future growth will depend upon expansion into Europe, entering new verticals, and increased sales to larger customers. Failure to do so effectively will likely result in stagnation in revenue growth.AppFolio has a history of negative earnings surprises as shown below.(Source: Portfolio123)Negative surprises tend to have an impact on the stock price.AppFolio is a SaaS provider that focuses primarily on real estate (90%), with a minor interest in legal markets (10%). It has a strong YoY revenue growth of 34% and will likely have similar growth during the coming year.The company has a good free cash flow margin, and, combined with good sales growth, scores well on the software Rule of 40%.Several new product features have been introduced, and company management believes that these initiatives will fuel future revenue growth. The company stock price is responding with an apparent breakout to all-time highs. I am a firm believer in embracing positive market action, and I believe that now is the time to turn positive or risk losing the opportunity. For this reason, I am changing my AppFolio rating from Neutral to Bullish.I do have some concerns, including moderate overvaluation and limited TAM. Future success is dependent on how well customers respond to AppFolio's product initiatives and the company's expansion into new markets. This investment should be kept on a short leash."
4344945,104952,2020-05-08T14:54:43-04:00,"AppFolio builds a SaaS offering for only one market, which is the real estate. It has simple pricing, business model, and go-to-market.The simplicity of the business potentially drives the outperformance.Since the IPO in 2015, revenue and shares price have increased by over 3x and 10x, respectively.","AppFolio (NASDAQ:APPF) is an interesting investment opportunity in the SaaS real estate space. Revenue growth and OCF/Operating Cash Flows have been solid, while the business is profitable. Furthermore, the net profit margin has been in steady expansion as share price more than doubled over the last two years. The share price continued to trend upwards in 2020. It had a ~32% run-up to its YTD-high in February, right before the broader COVID-19 selloff. The stock has fallen by ~20% since then, which creates an attractive entry point to pick it up at a bargain.In a nutshell, AppFolio makes money by selling an all-in-one cloud property management/PM software. To a much lesser extent, it also has a presence in the legal industry as it sells a similar software to the small law firm customers. This business is less successful and only makes up less than 10% of AppFolio's revenue. On the other hand, AppFolio's business as a whole has been exceptionally strong. Since the IPO in 2015, revenue has more than tripled, while share price has increased tenfold.(Source: AppFolio.com/pricing)We believe that the key to AppFolio's outperformance is the overall simplicity of the business. Given its focus on cloud-based PM software, AppFolio only needs to focus on one niche market, which is the real estate. The per unit/month pricing scheme is also straightforward and scalable for the customers. Moreover, simplicity would reduce the chance of making major execution mistakes. Consequently, the company's execution has been very solid. While top-line growth already decelerated to +36% towards the end of 2017 from +57% in 2015, the company has maintained growth in and around the +30% level as of the end of 2019.The property management industry also provides an attractive upside, given the inherent digital transformation opportunity existing in any of the companies in the market. AppFolio's focus in this market has allowed it to broaden its offering to include tenant debt collection, renter's insurance marketplace, analytics, and AI through both organic and acquisitions over the last five years. All these solutions target the stakeholders across the property management ecosystem such as the tenants, owners, and property managers.(Source: stockrow)Over time, these activities have resulted in strong market positioning and economic moat. The business turned net profitable at the end of 2017, and since then, the net margin has expanded by over 750 bps. Moreover, shareholder value has also improved exponentially as ROE/Return on Equity grew by over 1,900 bps within the same period.As per the Q1 earnings call, the outlook remains unclear, given the COVID-19 situation. While revenue still grew at 27% YoY, driven by the 18% increase in units under management in Q1, an overexposure to one sector can also amplify the risk. Over 90% of AppFolio's revenue is derived from its real estate PM business. Major property construction delays due to the continuation of COVID-19-related restrictions on business activities, for instance, will create a systemic contraction in demand for AppFolio's products.The stock seems expensive from the P/E perspective. It currently trades at 121x P/E, which implies that a growth expectation of ~120% is required to reach a fair value. At the moment, growth is still relatively very strong at +30% YoY. Moreover, the company's strong bottom-line, ROE, and cash flow generation easily explain the premium. Given the strong growth, it is also more relevant to look at AppFolio from the P/S perspective.(APPF vs PAYC vs HUBS vs FIVN vs BL. Source: stockrow)Among the other cloud software stocks with a relatively similar business model, growth, and size, AppFolio stands out. It is the fastest-growing and the only player aside from Paycom (NYSE:PAYC) with a positive net margin. It is rare to find a profitable company growing at +34% that trades at ~14x P/S.Furthermore, profitability and cash flow generation are also in upward trends as they improve every year. AppFolio is relatively in a flexible position as it plans its corporate strategy going forward to improve the already strong ~32% ROE. It can pay dividends, buybacks, or engage in more M&A deals. Having been down ~20% from its YTD-high where it reached ~18x P/S, the stock is a bargain at 14x P/S today."
