article_id,author_id,publish_on,summary,content
3293735,25120,2015-07-01T11:02:16-04:00,"AppFolio saw a nice opening day gain after the demand for the IPO has been relatively modest.The company's SaaS solutions are translating into real revenue growth as relative losses are coming down.While growth is high, growth rates are trending down as the company has focused on a small niche in a very competitive marketplace.While I recognize the potential opportunities going forward, I am cautious amidst elevated valuation multiples and many emerging risks.","AppFolio (APPF) jumped 17% on its first day as a publicly traded business last week. The SaaS provider saw modest opening day gains after shares have been priced at the lower end of the preliminary offer range.While I like the strong pace of growth and positive trends in terms of margin improvements, there are plenty of risks in this offering besides the premium valuation alone. Given these concerns, I have a cautious stance on the prospects for the shares. To become enthusiastic I look for confirmation of growth trends and margin improvements going forward before potentially initiating a position.The BusinessAppFolio provides cloud-based software solutions for small to medium sized companies. The company focuses to provide these applications to the property management industry, yet its applications are used by legal firms as well. Further development and refinement of the software create opportunities in other ""verticals"" as well.The company has developed ""AppFolio Property Manager"" for the real estate industry and acquired software company MyCase in order to target the legal industry. In the case of the Property Manager solution, AppFolio's software allows for tracking and posting of tenant vacancies, administration of maintenance and repair works, and accounting, among others.AppFolio recognizes that many small to medium sized businesses cannot afford the development costs of complex tailored IT solutions, which create inefficient workflows. These workflows only divert the attention away from the end customers.The OfferingAppFolio and the underwriting syndicate priced the IPO of the company at $12, the lower end of the $12-$14 preliminary price range. While the pricing has been somewhat disappointing, shares did see a nice opening day gain as they closed just above the $14 mark.The company sold 6.2 million shares in the offering, which has been sufficient to generate gross proceeds of $75 million. With 32.3 million shares outstanding after the IPO, AppFolio is now valued at roughly $455 million.Potential And Recent PerformanceAppFolio deliberately targets small and medium sized businesses as these organizations are generally time and resource constrained while they work with legacy or underperforming software solutions. These businesses often do not have the resources to invest large sums in state-of-the-art software packages while a SaaS software solution requires fewer cash outlays, which are furthermore spread over time.AppFolio itself believes that its solutions for small and medium sized businesses for property management alone represents a $5 billion market opportunity. If it counts larger companies as potential clients as well, this opportunity is even larger.This means that the company has ample growth opportunities as revenues for the year of 2014 came in at $47.7 million, equivalent to just 1% of the addressable target market. These revenues have grown at a rate of nearly 80% over the past year.AppFolio posted an operating loss of $8.6 million in 2014, which marks a modest increase compared to the year before. These losses have been coming down on a relative basis. Operating losses were equivalent to 18.0% of sales, which marks a more than 10 percent point improvement compared to the year before.The start to 2015 has been somewhat mixed. While revenue growth has slowed down to 61%, this is still an appealing growth number as revenues totaled $15.8 million in absolute amounts. It has been disappointing to see an increase in operating losses. AppFolio posted a $3.5 million operating loss, which it attributes to higher general and administrative costs, partially the result of the preparations for the IPO.Ahead of the offering, AppFolio held $12 million in cash while the offering will raise these cash holdings to roughly $75 million. With no debt outstanding, the enterprise valuation comes in around $380 million. This values the business at roughly 8 times the sales being reported for 2014, although these multiples are still falling fast.A Look At The RisksExcept for the current losses and the steep valuation multiples, there are other risks to consider as well. AppFolio is still a relatively small company in a very competitive field. Fortunately, the company focuses on niche segments, as the property management solutions are generating roughly 90% of total revenues. While niche market positions make it easier to compete and to differentiate solutions from mainstream software packages, it does create concentration risks as well.The company offers subscription services, which is liked by the investment community as they do allow for potential predictable revenue streams. The only issue is that most subscriptions are less than a year, thereby not creating real long-term visibility in terms of expected future revenues.Pricing might be another concern. The company claims that it has nearly 6,500 property customers at the end of the first quarter. The company posted revenues of $47.7 million in 2014, of which 90% has been generated by the property management solutions. This implies that its solutions are sold at an average of $6-7k per year per customer, which is quite a substantial amount for a small-size property management firm. The relative high price of the software is an often heard complaint on review websites.ConclusionI am neutral on the prospects for this offering. I appreciate the strong growth rates and the substantial improvements being achieved in terms of margins. These developments as well as a strong balance sheet are key attractions of the business from an investor point of view.The most relevant risks about which I worry are the steep valuation multiples and the relative larger slowdown in the annual pace of revenue growth, although growth rates remain very healthy. The question is how effective these solutions can withstand intensifying competition with many companies investing billions into cloud-based solutions. With the absolute valuations being complicated by the losses, there is little imminent appeal based on relative sales multiples.I am largely neutral after putting all my observations together. I will keep an eye on the business going forward. If sales trends continue to be healthy and margin improvement continues, I do potentially see upside potential. At this stage in the growth cycle, it is hard to judge whether AppFolio's solutions will still be used in a significant way in the medium term. To play it safe, I will stay on the sidelines but add the stock to my investment radar."
3333535,21136,2015-07-18T09:14:53-04:00,"The 25-day quiet period on underwriter analyses for APPF ends July 21, allowing the firm's IPO underwriters (Credit Suisse, Morgan Stanley, Pacific Crest, and William Blair) to finally release information.
        A flood of positive reports could boost APPF's stock price; we've found above-market returns of approximately 3% for IPOs at this point.
        Price increases often correlate with numerous and reputable underwriters.
        With solid fundamentals, we see the time period prior to APPF's IPO quiet period expiration as a chance to buy into this promising firm.","AppFolio Incorporated (NASDAQ: APPF) - Buy Recommendation - $17.80 PTThe 25-day quiet period on underwriter analyses that began with the June 26, 2015 IPO of AppFolio will come to an end on July 21, allowing the firm's IPO underwriters to publish reports, recommendations, and analyses of the company on July 22.AppFolio is a provider of cloud-based software solutions for small and medium-sized businesses in the property management and legal industries.See our IPO preview of APPF here. We previewed this and the IPO quiet period event for our premium subscribers. You can sign up for this service at the bottom of the article.AppFolio 's share price will likely see a temporary increase as a result of the release of underwriter reports.Early Market Performance: Upward TrajectoryAppFolio was priced at $12, at the low end of its expected price range of $12 to $14. The stock opened at $12.22 and closed at $14.08 on its first day of trading. It reached a low of $13.70 on June 29 and a high of $16.69 on July 13. Currently, APPF trades at $17.10.(Nasdaq.com)Business Overview: Provider of Cloud-based Software for SMEs in the Property Management and Legal IndustriesAppFolio provides cloud-based software solutions for small and medium-sized businesses in the property management and legal industries. It offers AppFolio Property Manager, a solution for the operational requirements of small and medium-sized property managers, including activities, such as posting and tracking tenant vacancies, handling the entire leasing process electronically, administering maintenance and repairs with their vendor networks, and managing accounting and reporting to property owners. In addition, the company offers MyCase, a practice and case management solution for practitioners and small law firms, providing time tracking, billing and payments, client communication, coordination with other lawyers and support staff, legal document management and assembly, and general office administration services. Other products and services include Value+, which offers website and electronic payment services, as well as industry-specific services comprising resident screening for property manager customers.Management Team HighlightsCEO and President Brian Donahoo has been in his position since 2007. Mr. Donahoo served as a Senior Vice President of Products and Services at Expertcity/Citrix Online Inc. from 1999 to 1997, and he built and managed call centers at Viacom/Blockbuster and Stream International. Mr. Donahoo received a B.S. in Psychology from Colorado State University.Founder and Chief Technology Officer Jon Walker has served the company in his position since 2006. He previously served as the Chief Technology Officer and Vice President of Engineering for Miramar Systems Inc. His other previous experience includes positions at Nortel Networks, Xing Technology. He is also a Contributing Editor to LinuxWorld Magazine. Mr. Walker received a B.S. in Business and Economics from Westmont College.Competitors: Thompson-Reuters, LexisNexis, Clio, RealPage and YardiCloud-based management software is a growing industry, and in property management competitors include RealPage (NASDAQ:RP), Yardi, Remote Landlord, Capterra and Re-leased. In the legal industry, competitors include large enterprises such as LexisNexis and Thompson-Reuters (NYSE:TRI) as well as newer market entrants such as Clio.Financial Snapshot: Increasing Revenues, Losses StableAppFolio provided the following financial data:For the three months ended March 31, 2015:Conclusion: Buy APPF Ahead of the Quiet Period ExpirationInvestors who wish to buy into AppFolio may wish to take advantage of the strong buying opportunity presented by the upcoming quiet period expiration, and the fact of it being backed by very powerful underwriters.These include: Credit Suisse Securities, Morgan Stanley, Pacific Crest Securities, and William Blair and Co.The stock continues upward; combined with a total 23.3% return from IPO, APPF has clearly proved its popularity among investors.While we were less optimistic on the firm IPO, we see the window prior to the quiet period expiration as an excellent chance to get in on a promising firm. This is backed by our firm's research."
3274855,21136,2015-06-23T12:42:31-04:00,"APPF is a California-based company, offering online management software applications to small and medium-sized property management and legal companies.IPO underwriters include Credit Suisse, Morgan Stanley, William Blair and Pacific Crest Securities; APPF is set to begin trading 6.26.2015 on NASDAQ.We suggest caution, given lack of profitability and APPF could be overshadowed by the other offerings this week.A positive point is that the software solutions market for small-to-medium sized businesses is set to double to $125 billion by 2013-2016.","AppFolio (NASDAQ:APPF) is a California-based company offering online management software applications to property management and legal companies. AppFolio targets small-to-medium sized companies with their cloud-based software solutions.AppFolio filed with the SEC on Monday, May 18, 2015, to offer shares of publicly traded stock. The current status of the IPO remains as filed. The company hopes to raise between $71.4 and $82.6 million, by offering 6,200,000 shares of Class A common stock, with a price target of $12-$14 per share.IPO underwriters include Credit Suisse, Morgan Stanley, William Blair and Pacific Crest Securities.According to the company prospectus, the software solutions market for small-to-medium sized businesses will double to $125 billion by 2013-2016. The research firm Parallels reports the increase in market demand.The company plans to use the proceeds to increase financial flexibility, hire more employees and expand its research and development departments. The company will use a portion of the proceeds to enhance operational support systems and improve its technology infrastructure.Business Summary: Cloud-Based Software Solutions for Property Management CompaniesAppFolio provides industry specific cloud-based software for SMBs (small-to-medium sized businesses). The primary industries the company serves are property management and legal companies. AppFolio states its software provides a user-friendly interface across multiple devices, and the platform allows users to work from anywhere at any time. The company claims the interface offers property management companies the ability to manage properties quickly and effectively from a single, integrated environment.We previewed the APPF IPO, along with twelve other IPOs for this coming week, for our premium subscribers. You can sign up for this exclusive service below the article.Overview of Top Level ManagementBrian Donahoo is the President and Chief Executive Officer of AppFolio. He continues to serve as a board director, a position he has held since 2007. Mr. Donahoo was the Senior Vice-President of Products and Services for Expertcity from 1999 to 2007. Prior to Expertcity, he was the Site Director for Stream International from 1995 to 1999.Klaus Schauser helped co-found AppFolio in 2006. He has served as a director and Chief Strategist since 2007. From 1999-2005, Mr. Schauser served as the Chief Technology Officer of Expertcity, a company he helped co-found. Expertcity was acquired by Citrix Systems (NASDAQ:CTXS) in 2004. Mr. Schauser attended the University of California Berkeley where he received a Ph.D. in Computer Science.Largest Competitors: Thomson Reuters and LexisNexisCloud-based software solutions are a global market, and the rapid change in technology offers opportunities for other companies to enter the property management software industry. As of 2015, AppFolio's largest competitors include Thomson Reuters (NYSE:TRI) and LexisNexis. However, Clio is a new market entrant providing cloud-based solutions for companies throughout several industries, including property management software solutions, according to AppFolio's SEC filing.AppFolio Financials: Quarter Ending March 31, 2015Gross Revenues - $15,848,000 (up from $9,834,000 for Q1 2014 - a 61 percent increase year over year) Net Income - (-$3,618,000) (down slightly from a loss of $1,245,000 in Q1 2014) Total Assets - $36,014,000 Total Liabilities - $27,701,000 Total Stockholders' Equity - (-$54,853,000)Recommendation: Hold OffThe APPF IPO has many risks because of its limited operating history and history of losses (noted above) and the dangers of security breaches.We suggest caution, given lack of profitability and relatively small syndicate; APPF could be overshadowed by the other offerings this week."
3285985,80646,2015-06-26T09:21:14-04:00,Appfolio creates a comprehensive digital solution for law firms and property management companies.The company's core product has done very well in their focused niche with strong sales and market penetration.Long-term investors are banking the potential for Appfolio to succeed at selling to other industries.,"OverviewAppfolio (NASDAQ:APPF) is preparing to make its initial public offering and raise between $70 and $80 million in net proceeds. The company focuses on selling a wide-range of digital-based solutions for a few niche industries. The company has built a strong brand amongst small business as their core target market. IPO proceeds may be able to enable the company to expand their horizons and market potential. The company's IPO pricing represents an aggressive valuation, but investors could flock for exciting future prospects.Value PropositionAppfolio's value proposition is the completeness of their solution. The company has chosen to develop a very comprehensive system for a few niche industries that manage a large amount of documentation and workflows. The solution targets law firms and property management companies and provides a large range of functionality and services. Within the core industries the solution has been well received and quickly growing. The future challenge for Appfolio is to continue to penetrate their niches as well as expand their technologies to new markets.Source: Appfolio S-1FinancesAppfolio has posted strong revenue growth trends. The company has averaged over 90% annual growth over the past two years, and based on first quarter 2015 results is on track to post similar results this year. In order to fuel this growth the company has had to invest heavily in sales and marketing. As a result, the company has continually posted an operating loss. Long-term profitability will depend on the company to reach a critical mass and recognize economies of scale.Source: Appfolio S-1Appfolio's current balance sheet shows about $12 million in cash, which is about the annualized operating loss for 2015. The company needs additional capital to continue to fund growth. IPO proceeds are earmarked to help boost the company's cash and working capital positions.ValuationAppfolio's current IPO price would result in a $430 million market valuation. At that valuation, Appfolio would trade at a 9.1x price-to-sales multiple. Most competitors and comparable peers trade at much lower multiples. The peer group is also mostly profitable, and they boast a broader range of clients. The valuation is aggressive, but some investors may justify the price based on potential. A comprehensive solution can become very popular across a wide-range of industries. Source: Google FinanceRisksAppfolio's biggest risk is the narrow markets in which they currently operate. The limited size of the market threatens top-end growth. Future success depends upon the company's ability to venture into new industries. Appfolio has not proven it can be successful in a broad portfolio of industries. The challenges and costs associated with standing up operating outside of their core market may be substantial.SummaryAppfolio has a great product, but a very narrow market and customer base. In order to succeed, Appfolio has to be able to expand their focus to new industries. However, the company's ability to expand is unproven and comes with a large amount of risk. The current valuation leaves very little upside, but investors might flock to the potential upside. Those who decide to invest should closely watch early trading activity."
