article_id,author_id,publish_on,summary,content
4317594,105545,2020-01-17T11:26:20-05:00,"Altisource saw revenues drop -18% yoy in the first 9 months of 2019 and we expect top-line to remain challenged in the medium term.Current foreclosure trends will make it difficult to grow revenues from new clients aggressively while New Residential is likely to remain focused on shifting more subservicing internally over time.The competitive landscape has changed with several servicers expanding into segments where Altisource is active (Mr. Cooper, New Residential).Valuation is not expensive with an EV/EBITDA 2020 of 8.5x on our numbers but many uncertainties remain.The real upside will only come once the foreclosure cycle turns. With this turn not imminent, there is sufficient time to assess the company's transformation before becoming much more bullish.","Altisource (NASDAQ:ASPS) reported total revenues of US$508M in the first 9 months of 2019, a drop of -18% yoy. Revenues in Q3 were down -31% to US$141M. The majority of the revenue decline in Q3 will be permanent and was driven by the drop in other service revenue following the sale of the Financial Services business, the discontinuation of the BRS business and the termination of information technology infrastructure management services following Ocwen’s (NYSE:OCN) transition to another servicing platform. As a result, other services revenue dropped from an average of around US$41M per quarter in the first 9 months of last year to just US$3.8M in Q3 this year. This will also lead to a large yoy drop in revenues in Q4. Early Stage Business revenues will also drop to close to zero as Altisource is winding down the Owners.com business which generated revenues of US$5.9M in the first 9 months of 2019.Field Services and Mortgage and Real Estate Solutions showed declines of respectively -9% and -11% in Q3 (-6% and -15% 9m19). The decline was driven by a reduction in the size of the Ocwen services portfolio and number of delinquent loans. The trend in average number of delinquent loans serviced by Ocwen has been downwards, although stabilized somewhat in recent quarters. Hubzu inventory has also been on a downward trend.One factor that temporarily affected revenues was the impact of Ocwen’s transition to another servicing system on default related referral volume and REO inventory conversion rates. The Company estimates that revenue was approximately US$7.8M lower in the third quarter of 2019 because of lower REO inventory conversion rates related to Ocwen’s transition to a new servicing system. We expect Marketplace revenues to pick up again by US$8M vs. Q3 as the impact of Ocwen’s transition to another servicing system fades. Assuming flat qoq numbers for Field Services and Mortgage and Real Estate Solutions would result in a total revenue for Q4 in line with Q3 and total revenues for 2019 of US$649M of which US$622M in service revenues. This would be in line with lower end of the company’s potential 2019 scenarios.Sales breakdown by segmentSource: Altisource Form 10-Q September 30, 2019Average number of delinquent loans serviced by Ocwen ('000)Source: Altisource Third Quarter 2019 Supplementary InformationNumber of homes sold on HubzuSource: Altisource Third Quarter 2019 Supplementary Information Hubzu inventorySource: Altisource Third Quarter 2019 Supplementary Information2019 Potential ScenariosSource: Altisource Third Quarter 2019 Supplementary InformationFinancial Services, the BRS business and information technology infrastructure management services still generated revenues in the first half of 2019 and this will drop out in first half of 2020. However, revenues from the remaining core businesses are likely to struggle as well.While New Residential (NYSE:NRZ) will remain an important client of Ocwen in the coming years, we expect the company to continue to gradually shift subservicing internally over time (on new business). As a result, Altisource will need to significantly increase its revenues from other parties if it wants to become less dependent on Ocwen. While non-Ocwen/New Residential/Front Yard Residential Corp. (NYSE:RESI) business is growing, it remains unclear whether this will suffice to offset declining business elsewhere in the current environment. Thus, the most recent data from Black Knight shows November 2019 foreclosure numbers marked a 26% yoy decline. The 33,500 foreclosure number was the lowest monthly number since Black Knight began recording the metric in 2000. The total US loan delinquency rate amounted to 3.53%. The number of properties that are 90 or more days past due but not in foreclosure amounted to 439,000, a decline by 71,000 yoy. It takes a certain period to convert properties past due into actual foreclosures, suggesting a pick up might take time. In its January 2020 US Consumer Finance Outlook, Barclays noted peak delinquency rates on post crisis vintages are trending significantly lower than normalized levels. Historically, a normalized delinquency curve peaks in years 3-5 at between 4 and 6% of total loans written during the vintage years. On business written post crisis, delinquency curves seem to peak at significantly lower rates. A similar observation was made by Auction.com.Core business service revenue from customers other than Ocwen, NRZ and RESI growing Source: Altisource Third Quarter 2019 Supplementary InformationSeveral servicers have expanded into segments where Altisource is active. Mr. Cooper (NASDAQ:COOP) acquired Assurant Mortgage Services in 2018 which is now part of their Xome segment (press release). Xome provides a variety of real estate services to mortgage originators, mortgage and real estate investors, and mortgage servicers, including valuation, title, and field services, and operates an exchange which facilitates the sale of foreclosed properties. Approximately 53% of Xome revenues were generated from third parties in the first 9 months of 2019. Xome recorded total growth of 42% over that period. Third-party generated revenues more than doubled to US$168M. This compares to US$63M in service revenue for Altisource’s core business from customers other than Ocwen, NRZ and RESI. Xome sold 2,453 properties on their Exchange platform in Q3 vs. 2,695 sold on Hubzu. Year to date, Xome sold 7,519 properties compared to 9,673 for Altisource. Similarly as for Hubzu, the number of properties sold declined year on year, which is in line with the trend in foreclosed properties discussed earlier.Source: Mr. Cooper Form 10-Q September 30, 2019 Source: Mr Cooper Form 10-Q September 30, 2019 New Residential Investment Corp. acquired Guardian Asset Management in August 2019 (press release). Guardian Asset Management is a provider of field services and property management to government agencies, financial institutions and asset management firms. The company commented at the time: “The addition of Guardian, coupled with our existing investment in Covius, would allow New Residential to take another step forward in our strategy of building a full suite of ancillary services and growing revenues and earnings for our shareholders.” Covius is a provider of mortgage tech related services. New Residential does not break out these services as Mr. Cooper does but it makes sense for the company to shift internal field services orders to Guardian.Another peer is Auction.com. Its website states it has over 30,000 discounted residential bank-owned and foreclosure home deals which makes it substantially larger than Altisource's Hubzu inventory.Field services is a local market and players like New Residential and Mr. Cooper will still need to use third parties for certain states where they are not active. In an environment of increased foreclosures, capacity constraints will also come into play even in states where they are active.Despite the challenging top-line profile, the company’s valuation is not demanding. The company reported EBITDA/adjusted EBITDA of US$53M/US$55M for the first 9 months or a 10.4%/10.9% margin. The company confirmed it targets cost savings of US$8-10M from moving to the cloud. It also closed Owners.com and moved Pointillist to a separate entity for which it plans to raise outside equity in 2020. These 2 businesses generated a combined US$19M in losses during the first 3 quarters of 2019, according to the company's Form 10-Q filing. While Altisource will still need to take restructuring charges of US$12-15M as disclosed in its most recent 10-Q, we expect the company to be able to achieve an adjusted EBITDA of US$60M next year. Based on our estimates, the company is trading at a 8.5x EV/EBITDA multiple.The company has a share repurchase program for 4.3 million shares of which 2.7 million remain available. The program is valid until 2022. This represents 17% of shares outstanding. During the first 9m of 2019, the company bought 0.6 million shares or close to 4% of outstanding shares. With solid cash generation, the company should be able to continue buying back stock. Moreover, at 1.9 million shares, short interest remains high considering on average 79k shares traded a day in the last 12 months.Given the many uncertainties, we see this as a fair valuation. The real upside for Altisource will come from a turn in the delinquency and foreclosure cycle which is not imminent. Therefore, we do believe there is plenty of time to assess the company’s progress.We expect Altisource’s top-line to continue to decline over 2020. There does not seem to be an imminent rise in foreclosures as delinquencies remain low. While the upside for the industry could be high if and when foreclosures and delinquencies start rising again, we do not expect this to happen soon and thus believe there is sufficient time to wait to see Altisource deliver on the growth of non-Ocwen/New Residential/RESI revenues as well as see the impact on costs and margins from recent restructuring actions."
4357120,105577,2020-07-06T11:53:31-04:00,"Altisource is an asset-light, counter-cyclical business model.The CARES Act will delay foreclosures until 2021, meaning that financial results in 2020 should be down by 40%.Wait until Q4 to see signs of an inflection point. Once the default cycle turns, ASPS could be a multi-bagger.","One of the big winners of the mortgage crisis of 2008 was Altisource Portfolio Solutions (NASDAQ:ASPS). The stock rose from $5.60 to over $150 share in less than five years as mortgage delinquencies skyrocketed. Due to the pandemic, mortgage delinquencies are on the rise again. However, the Coronavirus Aid, Relief, and Economic Security (CARES) Act has put a halt to foreclosures. Subsequently, Altisource has yet to see an uptick in its business, and the inflection point will most likely be in Q1 of next year.Source: Yahoo FinanceIn May, it was reported that the number of borrowers more than 30 days late swelled to 4.3 million, up 723,000 from the previous month. More than 8% of all U.S. mortgages were past due or in foreclosure.Source: BloombergSource: Black KnightThe current surge in delinquencies is even greater than 2009. The five-year period where mortgage delinquencies rose from 1.5% to 5% resulted in a 30X move in the stock price of ASPS. The question is whether this is the beginning of a multi-year cycle for whether the economy will quickly regain its footing in the second half of 2020.Thus far, ASPS has not seen any benefit from the rise in mortgage delinquencies due to the CARES Act. At the height of the pandemic, a temporary halt to foreclosures until August 31, 2020, was enacted. In addition, mortgagees have the option to apply for loan forbearance if they experienced financial hardship due to the pandemic. The loan forbearance can be up to 360 days in length.On the most recent conference call, CEO Bill Shepro noted that there would not be an uptick in business until maybe Q1 of next year.It should also be noted that it takes time for a default to be passed along to ASPS for processing. After the mortgage is in default for 15 days, ASPS sends the first mailing. However, it can take 180 days after a foreclosure for the company to book any revenue from the operation. Thus, there is a long lag time that is further complicated by the CARES Act.ASPS has a market cap of $227 million and an enterprise value of $422 million.I am currently modeling a 40% decline in revenues for 2020. This would result in revenues of $360 million. The company will most likely lose almost $1/share in 2020.The balance sheet is far from pristine. The company has $304 million of debt. Operating cash flow was negative $1.6 million in Q1. With $120 million of cash, ASPS should be able to weather a difficult 2020.If you believe that mortgage delinquency has started a multi-year cycle, ASPS could be a big winner. With a small uptick in mortgage delinquencies, the company could earn $100 million of cash flow in 2021. If you put a 10X P/CF multiple, you come up with a stock that could quadruple. However, ASPS is a company that you want to revisit later in the year to see some signs that the business is at an inflection point. To put things into perspective, the company earned over $1 billion in CF during the 2009 crisis. The upside is enormous for a company with only a $227 million market cap.The prudent move is to wait for signs of inflection before buying shares of ASPS. Despite the fact that mortgage delinquencies are surging, it will take several months for ASPS to see an uptick in the business."
4070621,103084,2017-05-08T11:35:00-04:00,"Language in the ASPS - OCN Services Agreement does not protect ASPS from NRZ directing downstream services.We believe ASPS will lose significant high-margin revenue from OCN.OCN shareholders, and not to mention bond holders, who do not own shares of ASPS should be rightfully concerned about the conflicts of interest between OCN and ASPS.","It has been pointed out that Altisource Portfolio Solutions (NASDAQ:ASPS) has contracts with Ocwen Financial (NYSE:OCN) that some believe are ""very solid."" These ASPS bulls incorrectly assume that ASPS will be protected from a potential shift of service fee revenue that we believe will occur after New Residential Investment (NYSE:NRZ) acquires $117 billion of UPB in mortgage servicing rights (""MSRs"") from OCN as proposed on May 1, 2017, in a joint press release from NRZ and OCN (the ""MSRs Transaction""). We believe that the language in the ASPS, OCN Services Agreement (dated August 10, 2009) and two subsequent amendments (dated October 1, 2012, and March 29, 2013, respectively), does not protect ASPS from NRZ directing ""downstream services"" after it owns and controls the $117 billion in UPB of MSR, causing the loss of a significant high-margin revenue stream for ASPS.We would expect that as the new owner in control of the MSRs, if the MSRs Transaction is completed, NRZ will direct how services are provided. First, and as described publicly by NRZ and OCN, we anticipate that NRZ would enter into a ""standard"" sub-servicing contract with OCN. We expect that under that contract, OCN would provide all services EXCEPT ""downstream"" services. This would be consistent with what NRZ's CEO said on their Q1 2017 earnings call: ""NRZ will also fully control all of the downstream services associated with this portfolio."" Furthermore, we expect that as part of this sub-servicing agreement, NRZ would require OCN to send all copies of loan files that require ""downstream"" services to either Nationstar Mortgage (NYSE:NSM) or NRZ, which could then refer/pass on the files to NSM.ASPS bulls likely rely on non-compete language in the Services Agreement and its two amendments to defend their position that ASPS is protected from loss of the significant high-margin service fee revenue stream referred by OCN. For purposes of this write-up, we will refer to the Second Amendment to the Services Agreement, which includes the latest language on the non-compete, filed in an 8-K March 29, 2013. Exhibit 10.1, page two of section 3. Standard of Performance; Marketing and Promotion; and Noncompete and in the sub-section (C) Noncompete, (emphasis added):A few points to consider: First, it is important to note that the Services Agreement is between OCN and ASPS, not NRZ and ASPS. Any breach of this non-compete would arise in a claim by ASPS against OCN, not NRZ. Second, as part of the MSRs Transaction, OCN would have a relationship with NRZ which simply owns the MSRs and doesn't engage in a line of fee-based businesses similar to those provided by ASPS. NRZ would be referring the REO auction and other services to NSM, which has no relationship with OCN. Third, even if somehow OCN could be seen as having violated the non-compete, the Services Agreement provides that in no event shall damages for a breach of contract exceed fees for the most recent six-month period (page 16 of Services Agreement). We estimate such fees would be less than half of what OCN would receive from NRZ in the MSRs Transaction, and since ASPS would have to rely on ambiguity rather than a violation, at best, ASPS could hope to settle for a lesser amount. In any event, we think the point is moot. We believe the Services Agreement and its two Amendments actually contemplate a scenario in which OCN can sell the MSRs to NRZ and provide sub-servicing while NRZ directs ""downstream"" services without violating the non-compete.From page two of the Second Amendment, same section 3., but from sub-section (B) Marketing and Promotion (emphasis added):We believe that following completion of the MSRs Transaction, NRZ would be the outright owner of the MSRs it acquires from OCN and, as such, will have control over the selection of the service provider of Services. We further believe that OCN will not be in a position to ""direct"" nor will it ""have control over the selection of the service provider of Services."" Moreover, we expect that NRZ will be considered a ""third party relationship"" for OCN.OCN can ""encourage"" NRZ all it wants to use Providing Party ASPS for ""downstream"" services. However, we think the smart business decision for NRZ and NRZ's likely choice will be to engage NSM for the ""downstream"" services. We also believe that regulators may prefer the selection of NSM given the issues that the 25 states, CFPB, and SEC have raised with respect to OCN's problems with its REALServicing technology platform and REO auction fees, among other issues, for which ASPS is partially responsible.Finally, we note a large overlap of shareholders exists between OCN and ASPS. OCN shareholders, and not to mention bond holders, who do not own shares of ASPS should be rightfully concerned about the conflicts of interest between the two companies. OCN has referred billions of dollars of fee revenue to ASPS over many years. Meanwhile, ASPS's technology platform appears to be at the root of OCN's problems with regulators, as evidenced by the claims in recent litigation and cease-and-desist orders filed by 25 states. Regulatory fines and monitor expenses have cost OCN hundreds of millions of dollars. And yet, OCN continues to refer revenues to ASPS. One must wonder why OCN has never turned to ASPS to share some of the burden, as it appears that ASPS bears much responsibility for the root problems. The inaction could be explained by certain large shareholders of OCN having a relative larger investment in ASPS and, therefore, a greater economic interest in protecting that larger investment. We suggest that OCN shareholders who do not own ASPS should be aware of the potential conflicts of interest which could also come into play in the pending NRZ-OCN MSRs Transaction. A potential activist investor in OCN, or plaintiff's attorney, might find it interesting to explore these conflicts of interest further.We once again suggest that long investors in ASPS should sell what we believe are overvalued shares which face significant downside risks."
