article_id,author_id,publish_on,summary,content
4246279,22201,2019-03-04T17:42:51-05:00,"Despite being a $11 billion market cap firm that has clobbered the market, most investors aren't aware of Broadridge.That's even despite you using its services as an investor.The stock is surprisingly cheap compared to its closest peers.The recent 25% pullback creates a significant buying opportunity.Broadridge is a compelling dividend growth stock with a 19% 10-year CAGR dividend growth rate and a 33% hike this past year.","Looking for a backdoor Dividend Aristocrat that has put up 4x the returns of the S&P 500 over the past decade and which has a remarkably stable low-risk business? Meet Broadridge Financial Solutions (BR).Broadridge has been an operating entity for more than 50 years, as it started processing brokerage transactions in 1962. Over the years, it grew as a financial services division within Automatic Data Processing (ADP). ADP spun off Broadridge in 2007, setting up what's been a tremendous opportunity for investors:Data by YChartsIn the 1980s, Broadridge started with its proxy services - that is, helping shareholders participate in corporate democracy. This would become its primary line of business over time.In 1994, the company launched its ProxyEdge digital service for this category. By 1999, Broadridge had established a 90% market share within the field of proxy services. That number has only continued to grow over the years, as it now has 95% share and a 98% client retention rate:Source: Corporate WebsiteLooking past just the proxy business, Broadridge keeps expanding its business by picking up more and more back-office business for brokerage firms. As one Forbes columnist put it:This is a great sort of business to be in, as it is mission-critical but not a major cost center. Compared to the amount of revenues that brokerages generate, these sorts of clerical functions constitute a small part of overall expense but are vital to get right. This is a category of business where you can establish a large moat. Changing to a different service provider is unlikely to save enough money to offset the risk of reputation-damaging errors if these back-office functions stop working seamlessly.Notably, more broadly outside of just the proxy market, most investment banks still handle much of these operations on their own. While Broadridge is the industry leader among third-party service providers, most of the market is still left to be taken as banks are still shifting away from handling these operations themselves.Data by YChartsIn recent years, Broadridge stock has traded steadily higher. However, 2018 finally represented a break in the trading pattern, with the stock losing a quarter of its value from peak to trough in the fall of last year. Some of that was due to market volatility, to be sure. However, BR stock hasn't bounced back strongly with the rest of the market so far in 2019; shares dipped again in February following the company's most recent earnings report.That is a mistake, however. Just read what CEO Tim Gokey had to say in discussing the most recent quarter on the latest conference call:This is a classic example of looking at headline numbers versus details. The headline numbers for this most recent quarter seem bad at first glance. Revenues dropped more than 5% year-over-year along with EPS missing analyst expectations. However, this sort of thing can happen with a growth stock that has an unusually good quarter or year. In Broadridge's case, there was unusually strong proxy activity related to a few high-profile corporate activism battles in the prior year.Analysts tend to model out that unusually strong growth as though it will continue for a time, the stock experiences an exponential spike - see Broadridge's 40% run in the first half of 2018 - and then there is a letdown when the company returns to its more standard long-term growth rate.Once you get past the event-driven revenues from 2018, you see record new recurring sales and a healthy 7% growth rate along with 2019 guidance being maintained despite the apparent earnings miss. It's noteworthy that 2019 guidance was established in late 2017, and the company is sticking with it. The whole rally and then big correction in Broadridge stock last year occurred while the business' fundamentals remained the same. Thus, for anyone that looked at the stock last year and wanted to buy into its compelling story, the time to actually make your investment would be now.It'd be tempting to suggest that Broadridge will not deliver compelling returns going forward, even though it (and its corporate parent ADP) has consistently topped the market. After all, how much further room is there for growth in proxy services? The company already owns virtually all of the U.S. market and most of the overseas ones within its leading niche. Growth is unlikely to be particularly fast, especially as the number of listed public companies (in the U.S. at least) is shrinking.However, there are two issues with that line of thinking. For one, the business will be stable, and likely to at least match the inflation rate. That, for a capital-light business, is still fine. The company doesn't have to invest much to keep its proxy business humming along, thus it throws off a ton of free cash flow for buybacks, dividends, and acquisitions. Companies will still need to have shareholder votes, and as long as Broadridge essentially has a monopoly there, there will be plenty of free cash flow for shareholders.Additionally, Broadridge is acquiring other financial service providers at a rapid clip. This is allowing it to move into more SaaS applications in various fields related to back office, mutual fund disclosures, and software solutions for wealth management among other applications. Arguably, the most exciting of this is Broadridge's efforts to make a software solution to automate much of the clerical work within the brokerage industry. The CEO described this on the latest conference call:At this point, it's hard to handicap how much of the market Broadridge will end up controlling. However, UBS is a highly credible client, and Broadridge is making acquisitions left and right to shore up its capacities in this area. This line of product offerings, if even moderately successful, can create many years of aggressive revenue growth.The most important risk, at least as a long-term investor, is whether this business can be disrupted or not. There are always threats, from the technological end (remember blockchain enthusiasm?) through to the mundane, such as the SEC changing the amount of fees that Broadridge is allowed to charge for some of its services.However, within the core proxy market, Broadridge seems to face a low level of business disruption risk anytime soon. Its service is indispensable to clients, doesn't have much direct cost to any particular customer, and there is little in the way of meaningful competition. On the wealth management side, there is clearly more competition, but Broadridge is a much smaller piece of the overall market, offering more upside as well. Additionally, Broadridge's ability to make numerous value-adding acquisitions over the years speaks well of its capacity to build this business out successfully.To be clear, there is the risk that the company makes bad acquisitions and/or runs out of things to buy. Since 2014, according to the 10-K, the company has made at least 17 different deals to bring in new operating firms or assets from other companies. This is a high rate of deal-making. It must be said that most of these acquisitions are not particularly large in comparison with the core Broadridge proxy business. However, the usual disclaimer that comes with roll-up businesses having more operating and accounting risk should probably apply here as well.One thing you don't have to worry about with this, unlikely most financials stocks, is a deep recession. Part of what makes Broadridge compelling is that it was close to immune to the Great Financial Crisis. In 2009, it reported revenues which declined just 3% while earnings only fell 5%. Even when times are tough, companies still have to communicate with their shareholders and effectively manage their back-office needs. This spending is difficult to cut, even during a depression within the financial services industry.Thus, when looking at Broadridge stock, realize that you're getting the upside of financial services companies without the jarring downside risk if the stock market collapses again. Since the company's results aren't closely linked to returns, AUM, or other market-sensitive metrics, it is one of the most defensive options you can find that still gives you significant exposure to the growing lucrative FinTech market.The problem with BR stock, at least for a lot of people, is that it always looks expensive. Even with the drop from $130 to $90 late last year, the stock only gave back a year's worth of gains. It is selling just under 20x forward earnings now, assuming the company earns $5.10 in 2019.That said, I see 20 as a completely reasonable, if not slightly cheap P/E ratio for this sort of business. As Intrinsic Investing noted, businesses in this field tend to trade at a high 20s P/E ratio:You are unlikely to find many tech businesses that sell for less than 20x earnings which generate huge free cash flow, and that are more than 90% recurring revenue-based with nearly no customer losses on a year-to-year basis.The company's capital allocation is also compelling. It sets, as a threshold, a 20% return on its capital from new acquisitions, running far ahead of what we investors can obtain on our money in most other places. It generously shares the rest of the capital it doesn't reinvest in the business back with us.To start with, while the share buyback is substantially slower than in the financial crisis days, it is ongoing. Since 2012, Broadridge has shrunk its share count more than 5%, and continues buying back around 1% of the float each year. That's not a huge value driver, but it does incrementally help with earnings.The more attractive capital return lever is the dividend. Now Broadridge is not a Dividend Aristocrat, as it was spun off in 2007, thus giving it just 12 years as a standalone operation. However, the company that spun it off, ADP, has been a long-standing Dividend Aristocrat with 44 years in a row of dividend hikes. Broadridge, for what it's worth, has also increased its dividend every year in a row since its public debut. Thus, I'd consider Broadridge to essentially be a Dividend Aristocrat, as it was birthed by one, and has carried on with the same consistency as its previous operator.Broadridge's dividend has quintupled since the financial crisis. In 2018 alone, the company hiked its dividend by 33%. Combine that with the recent share price decline, and BR stock's yield is up from the low 1% range to 1.9% now. Of course, a 1.9% dividend yield today isn't going to be a huge income source - but it is quite nice coming from a company with a consistent history of double-digit EPS growth and dividend increases. As a long-term growth and income play, Broadridge is a solid pick at present prices.Just 12% annualized earnings growth - well below the company's 17% pace over the past five years - gets us to $10 in earnings in 2025, or a 10x P/E ratio at today's price. Figure the company doubles the dividend again in conjunction with earnings to maintain a steady payout ratio, and you have a 4% yield on cost as well.While there could certainly be a cheaper price ahead for Broadridge stock in the near term, over the long haul, it's hard to see much risk of permanent capital impairment. The company's core proxy business isn't going anywhere anytime soon. And given the attractive cash flow it throws off, there will be plenty of money for more dividends and buybacks going forward. Even in 2009, a most terrible year for Wall Street, Broadridge's results were nearly flat.And on the upside, the wealth management operation and other new services represent significant drivers of further growth going forward. I don't have a firm forecast on how much additional value Broadridge will be able to create here. But with the core business so healthy, this represents a significant further option that could supercharge returns. With double-digit earnings growth ahead, starting at a 20x forward PE ratio, it's easy to see a path to sustained 12-15% total annual compounded returns on the stock as well."
4087276,101421,2017-07-12T13:05:40-04:00,Broadridge Financial has acquired Spence Johnson Limited for an undisclosed sum.Spence Johnson has developed an institutional asset management data and research consultancy.The deal represents a widening scope of services that Broadridge wants to offer its clients as it moves up the value chain in the investment management services industry.,"Quick TakeFinancial technology company Broadridge Financial Solutions (BR) has announced the acquisition of data provider Spence Johnson Limited for an undisclosed amount.Spence Johnson provides data, analytics, and consulting services to the financial asset management industry in Europe, the United States and Asia.With the acquisition, Broadridge is broadening its offerings to provide asset managers with global market insights and fund flows and appears to be a step by management to ‘move up the value chain’ in the asset management services market.Target CompanyLondon-based Spence Johnson was founded in 2008 as a data consultancy focused on the institutional asset management business.Management is headed by CEO Magnus Spence, who co-founded the firm, was previously Director of European Research at Financial Research Corporation.Below is a brief interview of the CEO on the subject of Defined Contribution investment changes:(Source: PensionsInsight)The company’s most visible product is called Money in Motion and provides asset managers with analytics on new asset flows, addressable assets, and revenues. It is delivered for 12 institutional market sectors.Spence Johnson’s clients are a veritable ‘who’s who’ of asset management firms and include the following:(Source: Spence Johnson)Acquisition Terms and RationaleNeither company provided details on the acquisition price or terms, and Broadridge did not file an 8-K or indicate any change in financial guidance or effect on its financial condition, so the acquisition amount appears to be not material to its financial condition.Broadridge has acquired Spence Johnson as part of an initiative to expand its capabilities in research and consultancy as an adjunct to its historical focus on investor communications and securities transaction processing for the asset management industry.While Spence Johnson is a relatively small firm in terms of size, it has an impressive client base. Many of its top tier clients are no doubt clients of the much larger Broadridge, but there will be cross-selling opportunities.The deal represents Broadridge’s effort to provide its clients with a more ‘holistic global market view enabling identification and analysis of growth opportunities.’As Broadridge stated in the deal announcement,As data becomes more central to the investing and allocation functions of asset management firms, the move by Broadridge to further develop its expertise and offerings in the area of data analysis is critical to accessing the more valuable parts of the relationship with asset managers.Processing transactions and investor communications are certainly the bread and butter of BR’s business, but management is smart to begin moving ‘up the value chain’ to offer more value-add services such as analytics and consultancy.I view the deal as a definite positive for Broadridge as it seeks to provide a deeper set of capabilities to prospects and its existing customer base.I write about M&A deals, public companies that invest in technology startups and IPOs. Click the Follow button next to my name at the top or bottom of this article if you want to receive future articles automatically."
4073028,102551,2017-05-14T02:51:09-04:00,"Broadridge Financial continues to grow its business and the NACC acquisition made in mid 2016 is already making significant contributions.Adjusted net earnings increased 11% to $0.174B of the current FY compared to $0.156B for the prior year period (9 months).Diluted EPS increased 2% to $1.15 compared to $1.13 for the prior year period (9 months).Adjusted EPS increased 12% to $1.43 from $1.28 for the prior year period (9 months).Trends in Capital Markets, Wealth Management, Asset Management, and Corporate Issuers present significant long-term growth opportunities for BR.","IntroductionThis is a follow up to my February 9, 2017 Broadridge Financial (NYSE: BR) post. At the time I wrote that post, BR was trading at $68.18. This price was very similar to the price I had paid in August 2016 to acquire additional BR shares; BR is currently trading at $71.07.Should you be unfamiliar with BR, I suggest you review BR's March 14, 2017 presentation made at Barclays Emerging Payments Forum.In my February 9, 2017 post I indicated BR had acquired the North American Customer Communications (""NACC"") business of DST Systems, Inc. (NSYE: DST). Upon acquiring this business, BR renamed the NACC business ""Broadridge Customer Communications"" and integrated it into BR's Investor Communication Solutions segment. By doing so, BR created North America's premier customer communications technology platform for print and digital solutions to banks, broker-dealers, mutual funds and corporate issuers.At the time of my February post, Google Finance reflected a PE of 26.89. Generally I would hesitate to recommend a stock valued at this level but based on my analysis I concluded BR had a forward PE of sub 22 and that growth prospects supported a slightly elevated PE.BR recently released its Q3 results. I, therefore, thought it would be an opportune to revisit BR.Q3 2017 Results and Outlook for Remainder of Fiscal 2017BR released its Q3 2017 and YTD results and its forecast for the remainder of the current fiscal year on May 10, 2017; its Earnings Release can be found here.I enclose the following images from BR's Q3 2017 Earnings call with analysts since they are currently only accessible if you view the webcast and you do not have the time to do so.I also encourage you to listen to the webcast which can currently be accessed at:http://www.broadridge-ir.com/While it is 55 minutes in length, it is well worth listening to.On several occasions during the conference call, management stressed how successful the NACC acquisition has been to date. This is borne out in the dramatic growth in YTD revenue.BR continues to ""fire on all cylinders"" and is seeing strong demand for its solutions and services. There have been no new ""significant wins"" but rather ""a bunch of singles"". Furthermore, BR is not dependent on any single product for its growth. In essence, growth is well balanced.BR likes ""spin-offs"" and IPOs because this increases the size of the pool of companies requiring its services; BR has witnessed an increase in both these areas as well as dramatic growth in the number of individual investors. In essence conditions have, and continue to be, favorable for BR's growth.One thing I truly like about BR is that customer satisfaction is a key performance related metric in that all associates are tied to measurable customer satisfaction levels. In addition, over 50% of all BR associates can only earn a bonus if customer satisfaction levels increase.BR continues to focus on offering more services to clients in an industry which is extremely focused on driving costs out of the process. This puts BR in a strong position for future growth.Rather than develop products and services to dramatically help its clients drive out costs, BR is focused on ""bite sized"" enhancements to its product/service offering. Once again, I strongly encourage readers to listen to the webcast where Richard Daly (President and CEO) explains the reasoning for this approach. Should you not have time to listen to the entire webcast, you may wish to start listening at the 35 minute mark which is when the Q&A period with analysts begins.As far as BR's acquisition strategy goes, BR is presented with roughly 10 acquisition opportunities per year. Only 1 or 2, however, may meet BR's stringent acquisition criteria:BR's long-term debt has increased dramatically in the last few years as a result of its string of acquisitions and repurchase of its shares.As at its fiscal YE 2102 (page 25 of 100), LTD was $524MM, Treasury Shares was $580MM, and Goodwill and Intangible Assets was $923MM.As at March 31, 2017, LTD was $1.142B, Treasury Shares was $1.292B, and Goodwill and Intangible Assets was $1.645B.While BR's risk profile has changed within the last few years as a result of this additional debt, it continues to meet all conditions under its credit facilities. In addition, interest rates on the new debt taken on in recent years have actually come down from debt incurred within the first few years of being a stand-alone entity.I also note that FCF levels in 2012 - 2016 were $0.244B, $0.22B, $0.334B, $0.365B, and $0.362B. For the 9 months ending March 31 st 2016 and 2017, FCF amounted to $0.093B and $0.105B. BR's FCF guidance for the full FY2017 is $0.35B - $0.4B. On May 10, 2017, BR reiterated that this target remains unchanged.Given the above, I am comfortable with BR's current debt levels.ValuationAs previously noted, BR closed today at $71.07. Google Finance reflects a PE of 27.77 which implies an EPS level of $2.56. FY2016's Diluted EPS was $2.53 and management has forecast 2 - 7% growth giving us a range of $2.58 - $2.71. If we use the mid-point of this range ($2.645) then we get a PE closer to 26.9.From an Adjusted Diluted EPS perspective, BR achieved $2.73 in FY2016. Management has reiterated that it expects this metric to grow 12 - 17% in FY2017 giving us a range of $3.06 - $3.19 or a mid-point of $3.125. This is slightly lower than the mean estimate of $3.14 from 6 brokers.Source: TD WebBrokerIf I use today's closing price of $71.07 and an Adjusted Diluted EPS of $3.125 I get a 22.74 forward PE. This is slightly higher than the forward PE of 21.85 I calculated in my February 9 th post. Having said this, I do not view this new level as entirely excessive based on BR's growth potential.DividendsThe following reflects BR's dividend history for the past few years.Source: TD WebBrokerWhile the $1.32 annualized dividend works out to a sub 2% dividend yield based on the current price of $71.07, BR has the wherewithal to steadily and conservatively grow its dividend.It is not for me to tell others how to manage their investments but I notice an increasingly greater number of investors who are chasing yield. One recent post I read provided a lengthy list of US listed companies with dividend yields in excess of 5%; several companies had dividend yields in the double digits.I performed a quick review of the financial statements for at least a dozen of the companies on this list. In my opinion, investors in these companies are taking undue risk of dividend cuts or a permanent impairment to their capital.Personally, I would much rather invest in a low dividend yield company like BR where I have some level of confidence that the dividend is sustainable and there is a strong possibility of future increases on at least an annual basis.Before you completely rule out BR because of its low dividend yield you may want to read my Low or No Dividend Yield Companies Belong in Your Portfolio post.Final ThoughtsWhile definitely not ""on sale"", I continue to view BR as a ""buy"". My reasons for this recommendation are that it:In BR's May 10, 2017 conference call, the President and CEO stated that while it is imperative the business be managed with short-term objectives in mind, the company is very clearly focused on the long-term. In this regard, I suggest investors conduct their own due diligence and decide whether this is a company worthy of being held in a portfolio for several years.I have owned BR shares (not in the FFJ Portfolio) from the time BR was spun-off from ADP in 2007. I have no intention of parting ways with these shares and, at the moment, intend to acquire more shares within the next 30 days. I would also make a much larger purchase should we experience a market correction and BR gets caught in the downdraft.As at the time of writing this post I am long a few hundred shares of NYSE: BR. This holding represents ~0.4% of our overall holdings and not just the FFJ Portfolio."
