article_id,author_id,publish_on,summary,content
4356294,102170,2020-06-30T01:46:11-04:00,"Broadridge has outlined and executed on its growth and margin expansion plans.It has the opportunity to improve its earnings due to macro tailwinds and operational leverage, which makes it a favorable company.Despite the negative impact of COVID-19, Broadridge continues to hit its goals.","Broadridge (BR) has provided expectations for near-term goals but has experienced hiccups given the impact of COVID-19 on certain lines of business. BR has not returned to pre-COVID levels due to investors' concerns of meeting expectations. This has been exasperated by management's cadence in the latest earnings conference call. Historically, management has been a good steward of capital and has expanding operating margins. There may be upside if the near-term headwinds abate and if management provides an improved tone during the next earnings presentation. Broadridge does provide steady performance with a decent capital return to shareholders. There may be some near-term turbulence, but this is balanced by macro tailwinds, capital returns and margin expansion.Broadridge provides products and services aimed for investor relations and back office operations for the financial industry. The company has two operating segments: Investor Communications and Global Technology & Operations.Investor CommunicationsGlobal Technology and OperationsFrom a high-level view, BR's revenue was largely flat between FY18 and FY19 and may be considered unremarkable after having strong growth of 4.5% and 43% in FY 18 and FY17, respectively. While it may appear that growth stalled recently (it sort of did), the previous years were supported by acquisitions. If we peel back the revenue growth in FY19, we can see positive trends that include solid recurring revenue growth in both segments which carry wider margins. Recurring revenue growth outpaced declining growth in other business lines within the Investor Communications Solutions (ICS) segment.Both total revenue and recurring fee revenue are expected to grow 3-6% and 8-10%, respectively, in FY21. These ranges were originally outlined last year in the 4Q19 earnings presentation and remained unchanged, but management provided cadence in the Raymond James presentation where performance may end up in the guidance range provided. Now, total revenue is expected to be at the lower end of the range, as BR is unfavorably impacted by lower event-driven revenues due to lower proxy and equity contests. Fund companies do what they can to put off these events during high-stress periods due to uncertainty in the reception a change may bring. This is important because even though the company was impacted by COVID-19, revenue remains relatively stable due to the importance of its services with its customers. On a long-term basis, BR should be able to ride the tailwinds of mutualization, digitization, and data & analytics trends. Broadridge sees opportunity in digitization and data & analytic needs with the Governance business. Regulatory documentation and communications will largely shift to digital from paper-based. Long-term growth is further supported by recent acquisitions RPM (wealth management), Rockall (back-office), Shadow and ClearStructure. The Investor Communications segment is expected to have a steady low-single digit growth, whereas Global Technology and Operations (GTO) is expected to have mid-teens growth.Broadridge has strong expectations for margin expansion and laid out its plans in the March 2018 Investor Presentation for Adjusted Operating Income margin expansion of ~50bps/year.Not only did the company hit that goal in FY19, it doubled it from 13.8% to 15%. Operating income improved due to integrating recent acquisitions and an increase in higher-margin recurring revenue.Source: 4Q19 Earnings PresentationI mentioned the updated guidance earlier from the 3Q20 earnings presentation, and the table is below.Both GAAP OPM and Adjusted OPM remained unchanged. BR has been aiming for these targets and shows management is capable of managing the business to hit these goals even in the current environment. The pain comes from a double whammy - lowering guidance of both diluted EPS and adjusted EPS growth due to lower event-driven revenue.There may be near-term pain for EPS expansion, as there could be potential client onboarding delays, impact of lower assets under administration and interest rates on mutual fund processing and transfer agent business. These headwinds are mitigated by a strong $330 million backlog, strong GTO growth potential and a 97% client revenue retention rate.The third quarter had its ups and downs when compared to the linked prior-year quarter.Source: 3Q20 Earnings PresentationOverall, revenue growth was positive and supported by recurring fee revenues, but event-driven revenues was down 43%. Operating margin declined 100bps due to the negative impact of unfavorable revenue mix (lower event-driven) and higher acquisition expenses.It is important to mention the liquidity and resilience of the balance sheet. During times of peril, BR can fall back on its balance sheet. Liquidity is solid and consists of $402 million in cash and borrowing capacity of $1.5 billion. Additionally, the company is solidly investment grade. This strength should provide comfort for current and potential investors.Source: 3Q20 Earnings PresentationThere is no other publicly traded company similar to Broadridge. Of course, there are companies that offer some of the competitive services, including State Street (STT) and Bank of Mellon NY (BK). Furthermore, there are mom-and-pop shops that handle Investor Relations activities for their customers, but those are largely regional in nature. There are some other competitors - Fidelity National Information Services (FIS), SS&C Technologies Holdings (SSNC) and MaketAxess Holdings (MKTX) - that somewhat compete with Broadridge. No other company provides the full 360 degree-style products and services like Broadridge, which presents a unique advantage. Some of the competitors will be outlined in the valuation section.Data by YChartsBroadridge has had its ups and downs in 2020 due to the COVID-19 pandemic. Currently, the forward P/E is largely within historical range, albeit at the lower end. This might be reasonable given the downward modification in total revenue and EPS expectations. Similarly, the stock price is lower than the 2019 trading range for the same reasons. Given the strength in its recurring revenues and GTO segment, and the long-term tailwinds, this may be a buying opportunity. If event-driven revenue perks up, this may provide a near-term pop in the stock price.First of all, I would like to apologize for the huge table. The metrics enclosed are important for analyzing and investment. On a high-level analysis, BR is largely overvalued compared to its peers when comparing on a forward P/E basis. However, when the EV/EBITDA metric is used for comparison, BR looks to be fairly valued. Its forward revenue and EBITDA growth rate are on the low-end when compared to its peers. This appears reasonable given the lower revenue expectations in the current environment.There may be some near-term headwinds, but thus far, the company has been resilient. I believe there is pent-up demand within the financial markets to make some moves that could be a near-term pop for Broadridge. That is without regard to the long-term trends the company is striving to capture.Based on 3% year-over-growth rate and 130bps EBITDA margin improvement over the next five years, I come up with a stock price of $131 per share. This is about 5% higher than the current stock price. The 3% growth rate is slightly higher than expectations, but the EBITDA growth rate is at a 4% CAGR. Based on the DCF model, the stock is fairly valued.By applying the TTM EV/EBITDA to projected FY21 EBITDA, the stock price is $163 per share. The potential 1-year price target is somewhere in the middle, around $150 per share.Management clearly laid out risks to near-term price appreciation. The stock price may be fairly valued if event-driven revenues do not pick up, customers pull back on spending on digitizing information and margins continue to compress. If trends seen in the latest quarter continue, management may need to rein in guidance once again. Right now, the stock is priced for these events to occur, but investors may overreact if these trends continue. I believe there is safety within the company's balance sheet and the importance of Broadridge to the financial industry.Broadridge has laid out plans and expectations for near-term growth and has capable management, as evidenced by operating margin expansion. Management has been a good steward of capital, but investors might be wary given the lowering of EPS growth expectations. Broadridge has grown through acquisitions and now has runway to grow organically. The COVID-19 pandemic has negatively impacted the company in the near term. Management was conservative in the cadence of its latest conference call that has spooked investors. Based on the DCF model, the stock is fairly valued. But based on the projected EV/EBITDA multiple, there is room for price appreciation. There may be upside if the near-term headwinds abate and if management paints a more colorful picture of future expectations. Broadridge does provide steady performance with decent capital return to shareholders. Overall, this is a good company with a low near-term growth outlook. Investors might be interested in its capital deployment and margin expansion story. Broadridge may provide a solid return for investors willing to ride out the soggy weather."
4368933,102170,2020-08-14T19:49:39-04:00,"Despite softness in Q3, financial performance improved from the prior year.Company hit almost all of its long-term goals.FY21 guidance remains solid against macro headwinds.","Broadridge Financial Solutions (NYSE:BR) really nailed the 4Q20 after a soft third quarter. This is important to investors because it shows the resiliency of the business model, and the spending on acquisitions and technology has paid off. BR has guided for solid financial performance for 2021 despite management feeling conservative, given an expected weaker global environment for their next fiscal year. Given the FY20 financial performance, FY21 guidance and management cadence, I believe there is more upside for stock appreciation.There is a lot of good stuff here. Actual performance vs. guidance is within range and shows investors that management has the pulse of the company. The sad part is that there may be no upside surprises.Jim Young, the outgoing CFO, speaks about some more good stuff during the FY20 conference call.Investors were rewarded with a 1-year stock appreciation of ~12% along with dividends and share repurchases. On top of that, the dividend is raised six percent! Perhaps, more importantly, BR has strong liquidity and a balance sheet that has low to moderate leverage. The income statement is good, and the balance sheet is solid. This is a sight for sore eyes.Total revenue growth was solid in the 4Q that led to overall strong results despite challenges in Q3, especially with lower event-driven transactions (down 26% yoy). In total, GTO grew 18% to $1,174MM due to strong organic growth. Organic in 1H20 was 3% and 10% in 2H20. The organic growth in GTO may be one time in nature due to the increase in trading volumes as a result of market volatility.Source: FY20 Earnings PresentationEvent-driven transactions are near historically low levels and were soft in the first three quarters before picking up in the fourth quarter.Source: FY20 Earnings PresentationGAAP operating profit declined slightly yoy, but adjusted operating profit improved. Adjusted operating profit growth was driven by higher recurring revenue. This demonstrates why recurring revenue growth is a key metric for management and one to be monitored by investors.Source: FY20 Earnings PresentationAt first look, one would expect the guidance to be higher. Management notes that their guidance is conservative, and the ranges are higher than normal due to what they expect to be a soft fiscal year. Given the perceived challenges, performance still looks good. Jim Young explains during the conference call:Source: FY20 Earnings PresentationAlthough it is not noted in the commentary above, event-driven revenue is expected to remain at levels that were experienced this year. This is a positive if it stabilizes as it will not be a drag on revenue in FY21.I was curious to find out if BR noted an increase in customers focusing on digitalization. Some other companies I follow had a surge in revenue growth as their customers increased their technology spend as a result of the pandemic. BR has noted a pull forward in spending as described by Tim Gokey CEO during the conference call.I am going to quote myself from my last article to provide context on the projected stock price.I believe the guidance provided is conservative, especially with revenue growth. BR should continue to benefit from the pull forward in technology spend, and the markets should continue to be volatile. Both of which will contribute to organic growth. Management is expected to tighten their operating expenses and rationalize their real estate footprint through leases not being renewed. The increase in recurring revenue/total revenue and margin improvement sets up a good case for stock appreciation.My model has been updated to reflect a slightly higher growth rate than previous, and margins have been expanded to account for tighter controls and lower lease payments. This has led to a price of $148 per share. Based on the EV/EBITDA multiple, the projected price is $171. Once again, the stock price is probably somewhere in the middle, let's say $155-$160.Despite earlier challenges related to the pandemic, BR has executed on their plans and has improved financial performance. Management believes that there are macro headwinds that could slow growth and margin expansion when compared to a normal operating environment. There are tailwinds to support growth included guiding their customers through bank governance and the digitalization of the financial industry. Investors can hold steady in this stock with a modest dividend and share repurchase plan, solid liquidity and a moderately levered balance sheet. The share price could appreciate to the $155-$160 range."
4304283,102551,2019-11-08T08:52:14-05:00,"Broadridge reported weaker Q1 results than in Q1 2019, but this is because it benefited from a proxy campaign at a significant mutual fund complex in Q1 2019.BR continues to increase the extent to which recurring revenue is generated.Tuck-in acquisitions continue to be made with $0.179B in tuck-in M&A investments made YTD across governance, capital markets, and wealth management.","Broadridge Financial Solutions, Inc. (BR) is a company in which 504 shares are currently held within a 'Side Account' in the FFJ Portfolio and additional shares are held in an account for which I do not disclose details.In my August 7th article at Financial Freedom is a Journey, I indicated 'I would be looking to increase my position if BR drops to $115 (or lower)' but indicated this is not a hard and fast dollar value.Well… with the recent pullback in BR's share price following the November 6th release of Q1 2019 results, I added to my existing position in the account which currently holds BR shares for which I do not disclose details.If BR is a company with which you are unfamiliar, I highly encourage you to read the Business and Risk Factors components of BR's FY2019 10-K to obtain a good overview of BR's business, strategy, clients, competition, etc.BR's Q1 results can be found in its November 6th Earnings Release, Earnings Presentation, and in the Q1 2020 10-Q.BR reported record Q1 sales and it completed tuck-in acquisitions across each of its franchises so as to strengthen the company and to drive long-term growth.While some investment articles in cyberspace indicate that BR missed earnings and revenue estimates, they may have neglected to reflect that Q1 is typically the weakest quarter. In fact, BR typically generates only 12-14% of its full year adjusted EPS in Q1 and this is right where BR ended this past quarter.In addition, in Q1 2020, BR did not benefit from event-driven activity and corresponding revenue as it did in Q1 2019; event-driven revenues declined significantly because, in 2019, BR benefited from a proxy campaign at a significant mutual fund complex. It is important to remember that event-driven fee revenues carry significant levels of incremental profitability as they leverage an existing cost infrastructure.In addition to organic growth, it is important that investors take note that BR continues to make headway in increasing the degree of recurring fee revenue. While Q1 has historically been weakest quarter, look at page 7 of the Earnings Presentation. Here, we see the extent to which recurring revenue relative to total revenue increased relative to Q1 2019. Naturally, the greater the degree of recurring (auto-pilot) revenue, the better management can deploy its resources toward generating incremental business.Slide 6 of the Earnings Presentation reflects how active BR has been on the tuck-in acquisition front. In fact, acquisitions are an integral part of BR's capital stewardship and investment strategy and are tightly aligned with the franchise strategy.On the governance side of BR's business, the strategy is to build the next generation of governance communications and to expand services across the governance network. BR has, in fact, invested more than $0.3B in the past 24 months to help accelerate this strategy. It significantly extended the data-driven solutions business with the relatively recent Fi360 acquisition and the purchase of TD Ameritrade assets.BR has also added to its issuer product suite, broadened its regulatory communications footprint, and strengthened its digital capabilities.On the wealth side of the business, BR is creating the open architecture solution of the future for investors, advisers, and operations with its largest acquisition being that of RPM Technologies. This acquisition strengthened BR's wealth business in Canada and extends its capabilities to integrate banking into wealth management. BR has also acquired new capabilities around securities-based lending, and most recently, adviser compensation.Growth in the capital markets segment of the business has been mostly organic but in October, BR acquired Shadow Financial Systems so as to broaden its presence into new asset classes, including exchange-traded derivatives and cryptocurrencies.In a nutshell, strategic acquisitions will continue to be a normal course of BR's business. The expectations are that acquisitions will continue to deepen BR's relationships with key clients, allow it to acquire talent, and bring new capabilities that it can use to generate additional business. In fact, on the Q1 2020 call with analysts, BR indicated these investments should contribute ~$0.175B of FY2020 recurring revenue.I pay particularly close attention to a company's Free Cash Flow as this provides management with flexibility. While BR generated $0.1067B of negative Free Cash Flow in Q1, this quarter is typically a negative Free Cash Flow quarter; looking at slide 15 of the Q1 Earnings Presentation, we see that BR generated $0.111B in negative Free Cash Flow in the first 3 months of FY2019.On the leverage front, BR's leverage ratio using adjusted debt-to-EBITDAR at September 30 was 2.2x, and a slight uptick is anticipated in Q2, reflecting the $0.120B purchase price for Fi360. This temporary spike above the long-term target of 2.0x is a result of the seasonally negative Q1 free cash flow and the timing of M&A closings.There has been no change to BR's capital allocation strategy and leverage target and BR has historically benefitted from the seasonally stronger free cash flows in the second half of the year. BR is confident it will delever and generate additional flexibility to pursue attractive tuck-in M&A opportunities and/or repurchase shares while finishing the year in line with its 2.0x leverage target.NOTE: EBITDAR can be calculated as EBITDAR = Net Income + Interest + Taxes + Depreciation + Amortization + Rent/RestructuringIt is useful for companies undertaking restructuring efforts since restructuring charges are typically one-time or non-recurring expenses. Removing the restructuring costs shows a clearer picture of the operating performance of the company and perhaps might help with obtaining financing from a creditor.Looking at BR's Q1 2020 Balance Sheet, we see $0.399B appearing as a current portion of long-term debt. This is because BR has $0.4B in senior notes coming due in September 2020. BR has indicated it will consider opportunistically raising additional debt capital at some point over the next couple of quarters in order to appropriately manage upcoming maturities while keeping in mind plans to grow via acquisition.BR's FY2020 guidance is reflected below.Source: BR - Q1 2020 Earnings Presentation - November 6, 2019On the Q1 earnings call, management reiterated that BR remains on track to deliver another strong year of top and bottom line growth. Closed sales are expected to be strong and 8-10% recurring fee revenue growth and 8-12% adjusted EPS growth for the fiscal year are expected. With this outlook, it appears BR will deliver on the 3-year growth objectives shared with the investment community at its 2017 Investor Day.Management has indicated that ongoing industry trends have brought increasing evidence that the financial services industry is facing significant structural cost pressures. Examples of this include moves by online brokers to slash trading commissions and by global banks realigning their strategic focus.Regulatory change remains the constant with the SEC moving rapidly to implement Regulation Best Interest and the moves in Europe towards The Shareholder Rights Directive are a couple of the challenges helping drive BR's growth. Financial services firms must move rapidly to adapt their businesses and evolve how they serve their clients which is causing them to embrace industry solutions to mutualize critical non-differentiating functions, to tap into more and better data, and to raise the effectiveness of their communications.There has been no change to BR's credit ratings from Moody's and S&P Global subsequent to my last article and the credit ratings are not under review.Moody's continues to rate BR's long-term debt as Baa1 which is classified as lower medium grade. Standard & Poor's continues to rate the debt BBB+ which is also lower medium grade.These ratings are satisfactory for my purposes.BR's valuation at the time I wrote previous articles can be found in my August 7th article at Financial Freedom Is A Journey.We see from BR's August 1, 2019, Earnings Release that BR generated FY2019 diluted EPS of $4.06 and adjusted diluted EPS of $4.66. When I wrote my August 7th article, BR was trading at $123.60 thus giving us a forward diluted PE of ~30.44 and a forward adjusted diluted PE of ~26.52.With BR continuing to project FY2020 diluted EPS growth of 5 - 9% we arrive at a projected range of ~$4.26 - ~$4.43. Using the current $120.48 share price we get a forward diluted PE of ~27.2 - ~28.28.Using FY2020 adjusted EPS projections of 8 - 12% we get a range of ~$5.03 - ~$5.22 giving us a forward adjusted diluted PE range of ~23.08 - ~23.94.In my previous article I wrote:BR's share price dropped pretty close to this level which is why I acquired more shares.Despite the uptick in BR's share price on November 7th to $120.48, I think BR stands a good chance of being worth far more several years from now. Depending on your investment time horizon and other personal factors, I think acquiring BR shares for the long-term at the current level is not a bad decision.I am puzzled as to why BR does not keep the dividend history segment of its website current. The company's site reflects the most recent dividend as being $0.365 and having been paid July 3, 2018. As a long-time BR shareholder I know that BR's quarterly dividend has been increased twice subsequent to what the company's website reflects. A more accurate dividend history can be found here and below.Source: BR - FY2019 10-KSubsequent to BR's June 30th fiscal year end, it announced an increase to its quarterly dividend to $0.54/share. This provides investors with a ~1.8% dividend yield on the basis of the current $120.48 share price.Yield hungry investors will likely pass on BR given this low yield but as an investor desiring a well-balanced portfolio, I am prepared to invest in low dividend-yielding stocks if I have a reasonable degree of confidence that the company's share price will appreciate in value over the long-term.You will also note from the image above that the diluted weighted average number of shares outstanding is declining very gradually. Given that BR is in growth mode, I would not expect a significant reduction in the number of shares outstanding as a reduction in share count is not a strategic priority.I have been a BR shareholder since it became a publicly-traded entity in March 2007. Over this timeframe, I have had the opportunity to read several earnings call transcripts, 10-Qs, 10-Ks, and Earnings Presentations. Not once have I walked away wondering why the company is not executing on the strategy being communicated to the investment community.I fully intend to remain a long-term shareholder and my plan is to continue to periodically acquire shares as funds permit and depending on what other investment opportunities are presented.I wish you much success on your journey to financial freedom.Thanks for reading!"
