article_id,author_id,publish_on,summary,content
4279545,105281,2019-07-31T12:02:34-04:00,Data breach affected 100 million Americans.Capital One Financial demonstrated a strong and coordinated response to the incident and managed to capture the perpetrator.The vulnerability has been resolved and is unlikely to repeat.The extent of the damage pales in comparison to the breach experienced by Equifax Inc. whose stock price has since recovered.We believe that the intrinsic value of Capital One remains intact and that the price decline increased the margin of safety. We maintain our buy recommendation.,"Capital One Financial Corporation (COF) announced a data security incident affecting 100 million individuals in the United States and six million individuals in Canada. Consequently the market sold off on the stock for the day - resulting in a decline of almost 6%.(Source: COF Ticker page on Seeking Alpha)We think that the selling is overdone. This is especially easier to believe once we compare this data breach with that experienced by Equifax Inc. (EFX) back in 2017. As seen in the chart below - the short-term sell-off induced by their own announcement of a data breach has since recovered (several times, in fact).(Source: EFX Ticker page on Seeking Alpha)We'll talk you through the three big differences between the COF breach and the EFX one. Next we'll talk through the implications of the COF breach on the earnings ability of COF. Finally we'll connect the earnings implication with our valuation of COF.First, COF was very quick in determining the extent of the problem and in announcing it. Note that an external security researcher reported the vulnerability on 17 July 2019 and COF was able to discover the incident by 19 July 2019; by 30 July 2019 the company was able to announce the extent of the breach and its successful resolution of the vulnerability. In comparison EFX discovered the breach on 29 July 2017 and only reported it to the investing public on 7 September 2017. Second, COF was able to not only resolve the issue but also apprehend the alleged perpetrator of the breach. This allows COF and the Federal Bureau of Investigation (FBI) to extract relevant information from the alleged perpetrator and take necessary steps to minimize the potential damage of the breach. EFX was not able to identify any perpetrator linked to their data breach let alone capture anyone.Third and most important, the headline number of 100 million affected individuals in the United States for COF is somewhat misleading in comparison to the 143 million affected individuals in the case of EFX. The data breach for COF failed to intercept credit card numbers, log-in credentials, and social security numbers for over 99% of the individuals affected. In the case of EFX, the compromised information included: social security numbers, driver's license numbers, and credit card numbers.Consequently, we believe that COF will not be paying a meaningful amount of fees to the Federal Trade Commission unlike that of EFX (amounting to $425 million in settlement fees). COF was able to independently determine the existence of a vulnerability, to work quickly in closing the vulnerability, and to coordinate a response with investigators to apprehend the perpetrator. We believe that any penalty levied by the Federal Trade Commission or any other regulatory body will be a bad signal to the extent that COF has been a pro-active and good faith solver of the issue.This view aligns with management's own view. COF only expects to carve out $100-150 million in additional costs in relation to this incident. Said costs will revolve mainly around customer notifications, credit monitoring, technology costs, and legal support. Consequently the company is able to affirm its 2019 operating efficiency guidance (which is inclusive of these costs) despite the incremental and unexpected costs form this incident.We now estimate a fair value for COF based on the latest financial information from the second quarter earnings, facts related to the data breach incident, and our own views. In particular, we will be using a justified price to book valuation methodology. It is an approach we feel comfortable using for financial services companies. We used a similar valuation methodology in this article pertaining to DFS and in this article on SYF.Note that this approach was detailed in-depth in the Equities section of the Chartered Financial Analyst (""CFA"") Level II materials. The summarized version of this can be found in The CFA Glossary Blogspot. It is essentially an implication of the Dividend Discount Model as seen in the derivation below:(Source: CFA Glossary Blogspot)We prefer this valuation method as financial services companies are primarily constrained by capital. More capital retained by the entity will almost always result in more earnings. Thus, we prefer to use a book value-based valuation model rather than an earnings-based valuation model.We use the trailing twelve months average return on equity of 11% as the base case return on equity. We assumed a 2% risk-free rate based on the ten-year US treasury rate; a 6% implied equity risk premium based on the research of Professor Aswath Damodaran; and a market beta of 1.25, which we feel is appropriate for a financial services company concentrated in consumer lending (e.g., credit cards, auto, etc.). Cost of equity is the sum of the risk-free rate and the product of the implied equity risk premium and market beta.We adjusted the shareholders' equity of COF by the $150 million charge related to this incident. This is reflective of our believe that this incident will be a non-event in the long-term (therefore not affecting the run-rate return on equity). The recent decline also increases the margin of safety all things held constant. Since our calculated upside of 45% is greater than our buy recommendation threshold of 15% - we recommend that investors go long COF. Note that our upside estimate is even higher now than from our prior article.(Author)We think that the data breach is a non-event in the long-run. We continue to like COF fundamentals and recommend that investors maintain or add to their positions.The EFX data breach (which was far worse than COF) shows that investors can move on from these incidents as long as there is a clear resolution. COF has not only demonstrated that resolution (by apprehending the perpetrator) but also shown great pro-activeness in dealing with the issue (via third party vulnerability reporting processes) and by responding decisively in the face of risk.The recent price decline only enhances the margin of safety for patient investors. Long COF."
4240803,102937,2019-02-13T20:23:17-05:00,Capital One is moving away from home equity loans and mortgages which will grant it greater efficiency in the sectors in which it continues operating.Capital One has made several strategic acquisitions to boost its position as a leading credit card provider and consumer debt service.Capital One is seeing greater returns from its consumer and commercial banking segments.,"Image Source: Capitalone.comCapital One Financial Corporation (NYSE:COF) is a diversified financial services holding company with many subsidiaries. The company has three primary business segments: Commercial banking, consisting of providing financial services to businesses, consumer banking, geared towards providing banking services towards the general public, and credit cards, which provide small lines of credit to consumers. Capital One operates in a highly competitive industry, competing against other companies like Mastercard (NYSE:MA) and Discover (NYSE:DFS) for the credit card sector, and regional and national banks for banking services. In its most recent quarter, Capital One reported that 75% of its revenue came from its credit card business, 14% from consumer banking, and 11% from commercial banking. Until Capital One increases the proportion of banking services to credit card services, it should primarily be viewed as a credit card company when contemplating an investment. Nonetheless, each of its main business sectors should be treated accordingly to get a full picture of the company's overall financial health, as well as to get an idea as to where the company is heading in 2019. Capital One enjoys high profit margins from two of its three business cores: credit cards and consumer banking. Its commercial banking revenue lags behind somewhat, but this accounts for its smallest segment. Meanwhile, the company has adopted a corporate strategy that emphasizes its credit card business over the others, and its strategic developments in that arena present a new buying opportunity which should yield impressive returns going forward.Capital One's claim to fame is its credit cards, a convenient and easy way to make day-to-day purchases on a line of credit. Though competition in credit card issuance is fierce, Capital One remains one of the nation's top issuers, behind American Express and some of the big banks such as Bank of America and JP Morgan Chase. As its leading business segment and revenue generator, Capital One pays special attention to its credit card sector and its development. In September 2017, the company chose to shift resources away from its banking sector and into its credit card sector with its decision to cease originating new home mortgages and home equity loan products within the consumer banking branch. Capital One shifted its efforts on strategic acquisitions that would boost its credit card capabilities, such as the mass purchase of credit card loans from Synovus and Cabela's. In its most recent quarter, consumer trends have benefited Capital One, as overall purchases made with its cards are up 10% compared to this time last year, with credit card revenue up 2%, a healthy number for this line of business. Likewise, Capital One has enjoyed a decrease in credit loss, down roughly 11% from this time last year. Together, these statistical trends have granted the company a revenue margin of 16% on its cards. source: Capital One Q4 earnings presentationCapital One does cite some risks associated with its largest revenue producer. Credit card spending is subjected to seasonal volatility, as consumer spending fluctuates during the holidays. Furthermore, if payment patterns change, default rates and delinquencies could rise which would hurt their bottom line. Given the state of the domestic economy, though, with unemployment rates low and consumer confidence high, Capital One seems confident that these risks are worth citing for transparency, but will likely not be cause for concern in the immediate future. Instead, the big risks seem to come from the capital markets, as a rise in interest rates or increased costs associated with funding activities may affect operational profit long before the next recession might. Nonetheless, credit cards remain Capital One's anchor and can be relied on to continue producing hefty profits for the company in the coming years. Capital One is scaling back its lending in the consumer banking sector, particularly with home loans and mortgages. This is due to a shift in its strategic planning, which involves moving resources out of lower profit sectors and into higher profit ones. As a result, Capital One has stated that its booked loans are down 21% from the same period last year. Even though the company looks to move away from consumer bank lending, it still offers basic consumer banking products and services, and as such, has continued growing its deposits. According to its most recent fiscal quarterly results, consumer deposits have risen 7% year-over-year, which will provide the company with additional capital it can use to fund its other activities. source: Capital One Q4 earnings presentationThe commercial banking sector is Capital One's weak link, but fortunately is also its smallest component from an operations standpoint. Capital One has increased its lending activity to businesses and other commercial enterprises in an effort to boost its margins here, with loans being up 9% year-over-year, but revenue from the sector is down by roughly the same amount, as are its deposits. source: Capital One Q4 earnings presentationCapital One is a solid investment, as its credit card business segment will lead it to profitable times ahead. Through its credit card business and its initiatives that focus on expanding it, Capital One has been able to steadily grow its revenue and margins over the past several years. source: TD AmeritradeIn the financial sector, Capital One trades well below its peers in terms of P/E and P/B ratios, indicating that the company is currently trading at levels that could be considered to represent great value. source: TD AmeritradeAs Capital One expands its credit card business in 2019 through more strategic initiatives, it will see its margins expand and its bottom line swell. At current price levels, one cannot ignore this discounted stock, and it pays a nice dividend as well."
4234984,56142,2019-01-23T11:52:22-05:00,Capital One's loan charge-off level is set to rise materially as the economy slows.A weakening share price and relative strength performance trend vs. industry peers and the S&P 500 appeared in 2018.A significant recession in 2019-20 would lead to a sharply lower Capital One stock quote.,"The Capital One Financial (COF) business model is highly dependent on a growing U.S. economy, with a low level of consumer loan delinquencies and charge-offs. Luckily, investors in Capital One have witnessed relatively small/falling credit write-downs of around $7 billion in 2017 and an estimated $5.5-6 billion in 2018, using data from the first nine months as a proxy. In a worrisome development of late, the company has witnessed an uptick in delinquencies since September.My bearish argument revolves around the increasing odds of recession in 2019-20, with sharply increased charge-offs destroying earnings for Capital One. Given a severe recession like 2007-09, the company could be forced to raise additional capital or sell business units to cover losses and remain solvent, greatly diluting existing shareholder value vs. the start of 2019.Image Source: Capital One TV CommercialCapital One is part of a select group in terms of size and focus on the higher-risk consumer loan market, especially uncollateralized credit cards. The company holds $110 billion in credit card loans, and another $60 billion in consumer auto/mortgage/personal loans currently. We have all seen the ads with Jennifer Garner and others hocking quick and easy signature loans through mass media outlets. During good economic times, the company is able to earn strong levels of profitability as loan losses remain low.On the flip side of the coin, the 2007-09 recession nearly bankrupted the company, as credit losses jumped. You can review the chart and table below highlighting the correlation between credit card delinquencies and the Capital One stock drop from $84 a share in early 2007 to under $8 at the March 2009 bottom. The stock price “discounted” expanding write-off levels, trading well ahead of the news on the ground. Great Recession credit market problems reached their zenith at the end of 2009 and beginning of 2010, 6-9 months after the stock price bottomed.The above table of delinquency and charge-off rates for credit cards from 1989 to 2016 is from Wallethub using 2017 Federal Reserve data. By any measure, credit card delinquency rates have stayed at record low levels for a record length of time since 2013.All told, Capital One’s credit card delinquency rate of 4% today is roughly one-third the rate of the last recession and below the long-term 30-year industry average above 5%. What if the next recession is not a mild one, like Wall Street analysts are predicting for 2020 as a consensus view right now? What if record debts all over the world, including the U.S., lead to a large, or even bigger recession than 2007-09? If we get that as our reality soon, Capital One will have huge problems dealing with such a monster, in my estimation.Below are charts of the weakening performance of Capital One vs. peers in the banking business, especially the higher-risk consumer-focused companies of Discover Financial (DFS) and American Express (AXP). The major diversified banks in the U.S., including JPMorgan Chase (JPM), Citibank (C), Bank of America (BAC), and Wells Fargo (WFC) also began to fade vs. the S&P 500 return last year. Plus, the Financial Select Sector SPDR ETF (XLF) was an important laggard in 2018. Are delinquency problems coming for lenders?The price bounce higher in early 2019 looks like a good technical area to sell Capital One shares, or even consider shorting it. You can review the overhead price resistance area in the chart below. The $85-90 range looks like it will be a formidable supply obstacle to overcome. At the very least, a retest of the mid-$70s area, just above the December selloff low seems probable.Hints of the weak quality of the Capital One loan portfolio abound. Perhaps the biggest in my mind deals was the summer of 2017 Federal Reserve stress test snub. Every large U.S. bank passed, but Capital One had to refile and was the only banking company of 34 that did not raise its common dividend in June-July 2017. Again, after the summer 2018 stress test results, Capital One did not raise its $0.40 quarterly dividend payout, while other large banks did. The company has been “returning” capital to shareholders through equity buybacks at elevated prices the last few years. Nevertheless, the present 1.9% dividend yield is below the S&P 500 stock market average, the financial industry average, and well below the major bank average rate.According to the last available balance sheet from the September 2018 10-Q filing, the company has one of the largest credit card loan portfolios in the nation at $110 billion, and one of the highest consumer loan percentages of total assets at 50%. Compare Capital One's 50% asset exposure to U.S. consumer loans against 80% for Discover, 35% for American Express, 12% for Citibank, and less than 10% for JPMorgan Chase, Bank of America and Wells Fargo.The strong 2018 performance of Capital One’s operating income has been almost entirely a function of low and lower loan loss reserves taken, on top of Trump tax law changes. You can review the 3rd Quarter increase in profits below, as write-offs fell considerably.While mainstream analysts are counting on 2018’s peak earnings and margins as sustainable, the stock market pricing of Capital One is starting to look forward to the final stages of the credit cycle and an approaching downturn. When that happens, loan losses will rise substantially, and if past cycles are a guide, interest income will fall with declining interest rates. This double whammy typically produces a material drop in earnings during a recessionary period. It’s possible that all earnings will be wiped clean for a year or two, and the company will have to deal with charge-offs eroding underlying shareholder worth from the $35 billion tangible book value number today. The present $85 stock price is equal to a stock market capitalization of $40 billion.In 2010, at the end of the last recession, the company wrote off about 7% of ALL loan value. That’s well above today’s ultra-low 2% credit loss expense annualized in the September Quarter, reported on $240 billion in loan value. If we get a whopper recession again, Capital One could be writing an “extra” $10 or $15 billion off earnings yearly. Considering 2018 earnings may peak just shy of $6 billion, the downside to profitability and shareholder worth is gigantic, given another major recession. While the current 0.8x price to accounting book value looks cheap (1.2x tangible book value after subtracting $15 billion in goodwill and intangible assets), the 2009 low price was just 0.15x book value. To say that such a low valuation will never happen again is akin to someone saying at the depths of the financial panic ten years ago, the stock market will never recover or trade at record high valuations similar to 2007 or 2000. WRONG. “History doesn't repeat itself, but it often rhymes,” is the famous quote from Mark Twain.If you are looking to sell financials, Capital One should be near the top of your list of prospects to continue researching. My personal view is we are headed for a serious downturn, either in terms of damage to the economy or playing out over a prolonged length of time. Tightening credit conditions as evidenced by the nearly inverted Treasury yield curve in late 2018; the appearance of an actual trade war with China during the summer months; and a sharp decline in confidence and wealth caused by the 20% stock market swoon in the 4th Quarter just ended - all presage a slowing economy in the first half of 2019.Depending on events on the ground, a slowing economy could easily tip into recession. Then, the most overleveraged U.S. economy in history, including sovereign debt, business debt and consumer debt in aggregate vs. economic output, could turn into an economic fiasco quickly. Don’t say it cannot happen. From my 30 years of trading experience, whenever we get three or more significant issues dragging on wealth, output and confidence, we fall into recession. Holding too much leverage going into a recession is what turns a mild one into a deeper one.Seeking Alpha author Danielle DiMartino Booth wrote an interesting article this past week about late cycle credit card usage and how it relates to 2018 trends. It appears the November-December swoon in Capital One shares has plenty of fundamental logic to back the selling. We are long overdue for a recession, nearly 10 years into our current expansion. The clock is ticking.Please consult a registered financial advisor if you are contemplating a Capital One short position. The unique risks of short selling, including the potential for unlimited losses are different than holding a long-only position. Always short a diversified basket of stocks to reduce the risk of one equity creating oversized losses."
