article_id,author_id,publish_on,summary,content
4382618,104171,2020-10-29T13:00:24-04:00,"Capital One Q3 results showed a lower provision for losses, a lower charge-off & delinquency rate, and downtrend in the customer assistance program.This has reduced the loss to common shareholder to -$0.20 for the year so far.With things trending up for the bank, and a price-to-tangible book value of 0.88x, I am buying.","Capital One Financial (COF) has had a rough year due to the COVID-19 pandemic. In the first two quarters, the bank saw large bottom line deficits mostly attributable to higher provision for credit losses. But over these quarters, Capital One still was able to post quality credit metrics. In Q3, the bank finally posted some solid financial results. With the reserve built up in the first two quarters for expected poor results attributable to the pandemic, Capital One only posted a fraction of provision for losses in the third quarter. Again the bank showed quality metrics in Q3, and while a price-to-tangible book value of 0.88x, I am still adding to my long-term hold position. For the third quarter, Capital One posted net interest income of $5.555 billion, which was a decline of 3.17% compared to the prior year. This is due to the net interest margin contracting to 5.68% from 6.73% in Q3 of 2019. The net interest margin decreased in tandem with all other interest rates due to the pandemic and resulting monetary policy. On the other hand, total net revenue increased by 6.06% during the quarter to $7.381 billion. But, the big story for Capital One in Q3 was the provision for credit losses and net income. In Q1 and Q2, the provision for losses was massive and was the reason the bank posted losses. This was expected as Capital One was building the loss reserve, but it seems the bank either overestimated the downturn in business, handled it better than expected, or has revised the projections. In Q3, the provision for losses was only $331 million, a decrease of 92% from the Q2 level of $4.24 billion. This lower provision for credit losses resulted in a third-quarter net income of $2.406 billion, an 80.5% increase from last year. Overall, this quarter shows that the effect of the COVID-19 pandemic on financials seems to be winding down.Credit MetricsLooking at the net charge-off rate and 30+ day delinquency rate for the Q3 shows the same steady trend as seen in prior months. The net-charge off rate over the last quarter was 1.72%. This is surprisingly down from 2.38% and 2.72% in Q2 and Q1. For Q3, the 30+ day delinquency rate was 2.22%, down from 2.30% in Q2 and 3.16% in Q1.Source: Capital One Q3 Earnings Call PresentationFor the total nine months that have passed this year, Capital One has seen a consistent top-line and a troubled bottom-line. Net interest income for the year so far is $17.04 billion, which is only a decrease of 1.35%. Again, much of this is due to interest rate declines that have lowered decreased net interest margin to 6.06%. Total net revenue has been flat at $21.186 billion, while provision for credit losses increased by 126% to $10 billion. As can be seen in the above graphic, the large provision for losses posted over the past nine months has bolstered the allowance coverage ratios to very protective levels. But the downside is this has resulted in very low net income, at just $148 million. After the preferred dividends are paid, the common shareholder receives -$0.20 for 2020 so far.Credit MetricsFor the total nine months, the net charge-off rate was 2.28%, and the 30+ day delinquency rate was 2.22%. Again, this is down from last year's numbers. In the first nine months of 2019, the net charge-off rate was 2.50%, and the 30+ day delinquency rate was 3.51%. But, as I have mentioned before, we have to look into the pandemic assistance program Capital One has been running to see if there is potential for poorer credit metrics in the future. COVID-19 Assistance ProgramSource: Capital One Q3 Earnings Call PresentationLooking at the two graphs above shows the most important COVID-19 customer assistance programs. In the Domestic Card segment, weekly enrollments have been relatively flat since Q2. 91% of customers have been current upon a first-time enrollment, which shows a relatively healthy customer. The cumulative Domestic Card enrollments have seen a steady downward trend, and just 0.3% of accounts are currently enrolled. The Auto segment has seen the same general trends as Domestic Card. Weekly enrollments have been steady, with re-enrollments being the reason why. Only 74% of customers in Auto were current when first enrolling in the customer assistance program. Cumulative enrollments in the Auto segment have also trended downward, and just 2.6% of accounts are enrolled today, down from over 6% in April. Overall, the trend is clear, when the nation shutdown Capital One experienced a very high enrollment rate in the customer assistance program, which has tapered off as the economy has opened. What I like most about this is that the high rate of enrollments in March through May hasn't pushed the following month's charge-off or delinquency rates up. This gives me confidence that the bank can manage this current economic environment.Financial StabilityStarting with operational metrics, the bank had a decrease in the efficiency ratio from 53.49% last year to 52.14% this year. This shows that capital one is operating more efficiently than in 2019 when looking just at underlying costs. The financial strength of Capital One is still prominent. As of the most recent quarter, the bank had a liquidity coverage ratio of 147%, a tier 1 capital rate of 14.8%, and a CET1 rate of 13%. Altogether, these metrics show just how financially stable the bank is and can handle a large downturn in the economy or business. As of writing, Capital One is trading around a price of $74 per share. As of the most recent quarter, the book value and tangible book value per share have been $116.08 and $83.67. Therefore, the bank is trading at 0.64x P/BV and 0.88x P/TBV. I have been buying Capital One as a long-term hold position, and I do believe over the next few years that the bank can return to around the average past five year EPS of $8.06. If that is the case, then Capital One would be trading at 9.18x P/E during a normal period. Capital One has posted poor financial performance this year due to high provision for losses attributable to the COVID-19 pandemic. Over the past nine months, this provision for losses has totaled $10 billion and has resulted in a diluted EPS of -$0.20 for the common shareholder. But things are looking up, with the release of the Q3 results and a downward trend in the customer assistance program. In Q3, Capital One only had $331 million in provision for losses, which resulted in net income of $2.406 billion. On top of this, net-charge off and 30+ day delinquency rates have decreased this quarter and over the nine months when compared to 2019. The decrease in these rates is in part due to the customer assistance program, but enrollments in this program have peaked and are trending downward. This is a great sign, as credit metrics have remained stable. Overall, Capital One has not had the greatest year, but the bank is seeing headwinds subside, still has solid financial health, and is trading at a low valuation. As a long-term hold position, I am buying Capital One at $80 or under."
4377037,24361,2020-09-30T14:18:41-04:00,"Investors are concerned about the possibility of another cut to Capital One's dividend, but a pause in the dividend is likely to be fairly brief given healthy capital and reserving.Capital One has used a fairly conservative set of underlying assumptions for its reserving, and its reserve levels for cards look good relative to past loss experiences.Recent credit card and auto loan data has been better than expected, as government stimulus efforts are blunting the negative impact of COVID-19 on consumer credit.Capital One is not a typical bank and the value proposition is likewise a little different; priced between more conservatively-run (and better-loved) banks and riskier names, Capital One's return potential looks good, but not extraordinary.","If you doubt the impact of stimulus on the economy, at least in the short term, take a look at Capital One Financial’s (COF) August card data, wherein charge-offs and delinquencies for both credit cards and auto loans were lower than in the year-ago period… when there was no COVID-19 and the unemployment rate was around 3.7% (instead of the 8.4% in August). While the COVID-19 recession is by no means over, and there are still plenty of questions as to what future stimulus, if any, will look like, I would argue the odds are improving that these efforts will help “tide the consumer over” until the economy recovers, leading to lower overall loan loss rates than previously expected.Capital One remains an odd sort of bank, and really more of a bank-consumer finance hybrid. While it does make commercial and consumer loans, cards dominate the business. Likewise, while the bank does have a deposit-gathering franchise, including both branch-based banking and online operations, the overall cost of funds is still relatively high. Appreciated for what it is, I do believe that Capital One is undervalued today, but that’s the rule and not the exception these days in the banking sector, and I can see some near-term volatility risk from credit risk and capital returns.The short-term payouts from banks seem to have become something of an obsession for investors. Although Capital One’s capital position looks okay to me at this point, the Fed’s policy of basing dividend payouts on a running total of the prior four quarters’ net income could possibly lead to another cut and the risk of zero dividends in Q4 ’20 and Q1 ’21. To be clear this is not my base-case scenario, and with unemployment and credit trends tracking better than expected over the last quarter-and-a-half, I think it’s increasingly less likely, but it is still a risk that is in place for the next couple of quarters.A lot of what I say about Capital One’s near-term credit and capital position is going to carry the caveat of “for now”, as the business model is pretty sensitive to relatively small changes in assumptions. Along those lines, a lot of large industrial companies have been warning that the on-the-ground recovery isn’t looking as strong as the Street seems to be pricing in to stocks. So, if the economy is actually wobblier than believed, and particularly if there’s no additional stimulus, there could be some increased pressure in the near-term.That’s particularly true in consideration of the fact we’re still early in this credit cycle – in the past, it has taken anywhere from five to nine quarters after the start of a recession for bank credit losses to peak, so I don’t think we really know yet whether any bank’s reserves are truly adequate.What’s In the Cards?Specific to Capital One, the bank exited the second quarter with a 6.7% reserve position (reserves to loans), which is good for about 48% of the Fed’s severely-adverse loss estimate. Cards are reserved to 11.3%, with 13.5% in the Capital One-branded portfolios (private label business is protected in part by loss-sharing arrangements). That card reserve is at 53% of the Fed’s severely-adverse estimate, but also higher than the 9.15% charge-off ratio Capital One saw in 2009 (the highest one-year ratio) and the 10.3% ratio seen in the first quarter of 2010 (the highest single quarter).Looking at other card players, Capital One’s reserving looks appropriate. JPMorgan (JPM) has reserved a little more aggressively for card losses (12.6%), while Citigroup (C) is similar to COF at 11.5%. American Express’s (AXP) lower reserves (8.3%) make sense in the context of a lower-risk portfolio, though the lower reserving for Discover (DFS) (9.3%) is a little more puzzling to me. Among smaller players in cards, PNC (PNC) has been predictably conservative (15.3%), while U.S. Bancorp (USB) has not (10.1%).As I referenced in the open, recent trends have actually been pretty good as far as credit goes, with consumers supported in part by stimulus efforts. Card charge-offs in the month of August were 3.74% - down from 4.18% the year-ago and below the 4.5% average of the last 10 years and the 4.4% average of the last five years. Compared to peers, Capital One’s charge-offs are a little higher than Discover, but better than Synchrony (SYF) and this is pretty typical. Delinquencies, too, are holding up, with August down more than a point year over year to 2.23%.Corporate Still Has Some IssuesOutside of cards, commercial criticized loans have started to increase, with criticized C&I balances rising 75% qoq and CRE up 175%, for an overall increase of more than 91% qoq. At over 8% of loan balances, Capital One skews to the high side of criticized commercial loan balances, though Wells Fargo (WFC) and M&T (MTB) are higher still and the NPL/loan ratio is lower than average.Capital One has reserved about 2.7% of its commercial loans, which is a bit light relative to the Fed’s severely adverse scenario, but not troublingly so. As has been the case for many banks, Capital One’s exposure to oil/gas lending (around 4% of the portfolio) has driven elevated levels of criticized loans, non-performing loans, and loan reserves.Auto And A Little PerspectiveI think it’s also worth noting that auto loan trends have been pretty favorable too. Charge-offs fell to just 0.2% in the month of August (down 130bp year over year), while delinquencies fell almost three points to 3.6%. At the same time, loan balances rose 10% year over year, as Capital One remains a very willing lender in this category (including subprime auto) at a time when many have exited the market.I also want to talk briefly about Capital One’s underlying reserving assumptions. With economic assumptions that include 11.5% unemployment at year-end 2020 and 8.1% at year-end 2021, as well as no further government stimulus, I believe that Capital One’s underlying economic assumptions are among the most conservative/bearish on the Street. If readers are wondering about the other side of the coin, Citi and Regions (RF) are among the most bullish. In any case, with healthy reserves relative to past cycle losses and recent economic trends that look better than the underlying assumptions Capital One has based its reserves on, I’d say the bank is in good shape on credit.While Capital One runs an unconventional strategy for a bank, it works for them. Capital One has to pay more for its funds, right now it has among the highest-yielding 36-month CDs, along with offerings from Synchrony, Discover, and Signature (SBNY), but it also generates very large loan yields (9.15% in Q2) and net interest spreads (5.8% in Q2) on the back of its card and auto lending.Some analysts and investors are worried that management will look to accelerate marketing spending once it hits its “42 in 21” target (a 42% efficiency ratio in 2021), but I don’t believe management is suddenly going to lose spending discipline. I also find the concerns about increased tech spending to be misplaced – online services are a growth driver from Capital One (it has one of the top-rated apps) and I believe it’s more cost/capital-effective to invest in tech to drive growth than in physical branches.As I said, I do see some risk to the Capital One story, and I can’t/won’t ignore the risk of another cut to the divided, though if that should happen, I believe it would be restored by mid-2021. A lot now rides on how the economy develops; I believe Capital One has been prudent, if not conservative, in its decision-making but you don’t know if you’re assumptions are adequate until they’re tested in the real world… and we’re going to see that over the next three to six quarters, I believe.I expect Capital One to rebound after an ugly 2020, but I believe it will take four to five years to regain 2019 levels of profitability. I do believe Capital One can regain a low double-digit ROE over time, but certainly not in an environment of zero (or near-zero) rates. As is, I’m expecting a long-term core earnings growth rate of around 2%, with a high single-digit ROTCE next year and a double-digit number in 2022.Between discounted core earnings and ROTCE-driven P/TBV, I believe Capital One is undervalued. At the same time, though, almost all banks look undervalued, and Capital One slots in between higher-quality/lower-risk names like JPMorgan and PNC and higher-risk/higher-return ideas like Citi. If you’re relatively bullish on the economy, I think Capital One has more leverage to outperformance, but if you’re bearish, this may not be the name for you given the risk of higher loan losses and more pressure on pre-provision profits in 2021 and 2022."
4381426,92586,2020-10-26T15:25:31-04:00,"Capital One blew expectations out of the water in the third quarter. However, I remain concerned about the space in general.Key revenue drivers deteriorated YOY, particularly in credit card. But there was enough good news to trigger post-earnings bullishness.I would not dare approach the financial services sector unless I do it with top credit quality and business model diversification in mind.","Capital One (COF) has handily topped expectations in the third quarter. While analysts expected revenues to drop 3.5% YOY, the consumer bank delivered the widest top-line beat of the past five years, at least. Driven by higher revenues, especially on the non-interest side and a release of credit reserves, non-GAAP EPS of $5.05 also caught Wall Street by surprise.But the headline numbers, as good as they were, do not give me the necessary confidence to bet heavily on the consumer banking space. In my view, the combination of (1) lower spending and consumer leveraging, (2) a potential deterioration in credit driven by the COVID-19 crisis and lack of further government stimulus, and (3) unfavorable interest rate environment conspire against Capital One and its direct peers in the foreseeable future.Credit: Capital OneRegarding the top line and compared to the rest of the space, Capital One did very well in the third quarter. Sure, the key revenue drivers deteriorated YOY, particularly in the credit card segment (58% of total revenues). But what matters most, in this case, are the actual results delivered compared to de-risked expectations, which may explain why investors seemed pleased with the company's performance - as suggested by a stock that spiked 3% between the release of the earnings report and Friday's opening bell.Take credit card balances as an example. Capital One's 9% decline in ending loans did not look great on the surface and reflected the consumers' defensive stance in the face of macroeconomic uncertainty. However, the deterioration was less pronounced compared to the Big 4's comparable numbers (see graph below). Also, when it comes to purchase volume, Capital One's 1% decline was very modest when contrasted against American Express' (AXP) overall billed business decline of 20%.Source: DM Martins Research, data from multiple reportsCapital One also saw decent results further down the P&L. Lower marketing expenses justified by COVID-19 conservativeness, a very different approach to American Express' ""investment for the long term"", pushed non-interest expenses down sharply YOY. Capital One's tightening underwriting standards also helped to lower credit costs.These factors, coupled with two large unusual items associated with equity investment and asset disposition, helped to push Capital One's EPS to the highest levels that I have seen in years.Third quarter results aside, I continue to be highly concerned about the consumer banking space. The COVID-19 crisis is far from being resolved, and cases have been rising in the northern hemisphere. Rather than providing the fiscal stimulus needed to help offset the economic headwinds, the branches of the US government have reached an impasse. I expect the consequences to be a combination of deleveraging and rising delinquency, leading to lower loan balances and possibly higher credit costs.To be fair, Capital One seems to be navigating the choppy waters well. But, at the same time, the company is one of the most exposed to the consumer vertical at the lower end of the credit quality spectrum (see chart below). Should the industry fundamentals deteriorate, I expect Capital One to feel the pinch before any of its key competitors might.Source: DM Martins Research, data from Seeking AlphaCOF is a fairly cheap stock that trades at 9.3x next year's projected EPS and 6.9x the following year's earnings estimate. However, in the current environment, I would not dare approach the financial services sector unless I do it with top credit quality and business model diversification in mind. For this reason, I remain bullish AXP for the long run (despite short-term pain expectations) and bearish COF."
4371025,78115,2020-08-27T04:04:54-04:00,"Capital One reported losses for the second consecutive quarter, and cut dividends by 75%.COF's heavy credit card and auto tilt in loan book is a problem.Though trading below book, time is not ripe to buy COF yet.","Capital One Financial (COF) reported losses higher than USD 1bn for the second consecutive quarter, as it continues to build reserves. Given that more than 80% of revenues come from net interest income, of which 60% comes from the card business, the top line was hit really hard. Capital looks okay, but don’t hope for a dividend reinstatement in 2020-22.Let me drill down.Net interest income (NII) fell 9% QoQ (-5% YoY) as margins narrowed. COF’s net interest margin (NIM) contraction was the worst among large peers. Margins nosedived 100bps QoQ to 5.78% - the lowest in the past decade. But I believe that there is some upside to NIM from yield improvement as well as declines in deposit costs.More than 40% of COF’s loan book is in the credit card business, which was hit really hard in terms of growth rates, as consumers curtailed spending. Overall, loan book declined 4% QoQ.There is no hope of a significant near-term rebound in loan book. Customers have been paying down more of their credit card outstanding, while staying away from spending.Deposits continued rising, this time jumping 13% QoQ or USD 35bn:Capital One’s deposit franchise is weak, as denoted by the low proportion of noninterest-bearing deposits. Sure, such deposits bear no value in a zero-rate environment. But, in a rising rate environment (that won’t come until after 2022), they are valuable, and COF’s funding costs will rise more than peers in such a scenario.Unlike other banks, COF brings in only less than a fifth of its revenues in non-interest income.Non-interest income in 2Q fell 10% QoQ, led by interchange fees:Costs rose 1% QoQ (flat YoY) despite cutbacks in the credit card segment.Taken together, I’m not expecting positive operating leverage in 2020-21.COF had guided for achieving 42% “operating efficiency ratio” by 2021 (this probably means an unadjusted efficiency ratio of around 50%). While the management reiterated its commitment to save costs, it did not re-commit to the 2021 timeline to achieve the target ratio. The bank is on course to exit its use of data centers and complete its migration to the cloud this year, which is expected to bring in a lot of savings.Asset quality metrics are artificially low, thanks to government and Fed stimulus, as well as banks’ forbearance programs. Customers are deferring auto payments, but paying down their credit cards which is the main line of business at COF.Capital One’s CET1 ratio is quite strong at 12.4% - much higher than the internal target of 11% and the regulatory minimum of 10.1% (effective Oct’20). However, on an adjusted basis, I estimate that the ratio is around 11.1% - after removing the CECL transition benefits and exemptions from considering part of the 1Q reserve build.Given the new Fed rules on dividend payouts, COF reduced quarterly dividends to USD 0.10 per share from USD 0.40 earlier. It is highly likely that this dividend level will continue in the short term, as I expect the CET1 ratio to slide below the management target of 11% in 2022. So, 2023 might be a good time to expect a reinstatement of previous DPS levels.COF trades at 0.85x my estimate of one-year forward tangible book value per share (TBVPS). That’s two standard deviations below the historical average of 1.3x implying a 50% upside.I demand at least 12% returns from large diversified US banks. So, I use an even higher cost of equity (COE) to discount Capital One’s numbers, due to the increased riskiness and concentration of the loan portfolio, apart from a less-diversified revenue stream. Medium-term sustainable return on tangible equity (ROTE) might be closer to the COE and so I do not expect the stock to trade at a premium to TBVPS.At the current price of around USD 67, I don’t expect more than 5-10% annual return over the next 3-5 years. Don’t buy COF yet.My neutral view on COF can change if we start seeing hints of economic revival sooner, encouraging customers to step up their card usage and auto purchases. Together, these two constitute two-thirds of the loan book and three-fourths of the credit costs.Wells Fargo (WFC) is my top pick, followed by Bank of America (BAC).This article first appeared on TheBankingAnalyst.com"
