article_id,author_id,publish_on,summary,content
1951531,56112,2014-01-17T07:45:00-05:00,,"A few days ago, I lamented the fact that some commentators were throwing the baby out with the bathwater when it came to bank earnings. There are some institutions that I am certainly not enamored with. However, I believe a trifecta of circumstances creates the ""perfect storm"" in reverse for a few select financials. For these companies, I believe the following three points are key:Investors might be smart to take a look at institutions of this sort while their stock (both literally and metaphorically) is being held down by broader sector-level concerns.Wells Fargo (NYSE:WFC) is one of my favorites (read my recent article here). Capital One (NYSE:COF) is quickly becoming another. While you can read my full thoughts here, I'll summarize the salient points briefly:Capital One's fourth quarter results contained few surprises, demonstrating continued progress on several fronts. Earnings slightly missed expectations in a seasonally weak fourth quarter due to higher marketing expense and increased provisions; the management guided for higher marketing expense to continue through 2014 as they take advantage of opportunities in specific segments of the market. Planned runoff and the full-quarter impact of the divestiture of the Best Buy portfolio obscured growth in commercial and auto, as well as strong purchase volume (up 8% y/y) in general purpose credit cards. As expected, revenue growth in 2014 will be modest as planned runoff continues to offset growth.The Wells Fargo conference call earlier this week suggested an improving consumer and increasing potential for loan growth. Capital One CEO Richard Fairbank made similar comments during the conference call:Charge-offs will continue to increase over time off cyclical lows, but a continued focus on the upper end of the market will mitigate some of that impact.The charge-off rates were reasonable and don't really concern me. The one issue to keep an eye on is marketing spend; one analyst on the call (Moshe Orenbuch with Credit Suisse) asked the management how investors should think about the effectiveness of marketing, and what metrics to watch. The response was interesting:Definitely something to watch over time.Perhaps the most immediate thing investors should look for, however, is the regulatory decision on capital returns. Capital One requested authorization for share repurchases that would result in a total payout ratio ""well above"" the industry norm of 50%.For the sake of conservatism, we'll assume next year's earnings will come in at $6.75 on a GAAP basis. (This is well below the average analyst estimate for 2014 and well below my estimate as well.) The definition of ""significantly"" is up for debate, but let's just call it 60%. We already know Capital One will be paying out $1.20 per share in dividends, so that leaves $2.85 on a per-share basis for buybacks. That works out to nearly 4% of the shares outstanding, which will be immediately accretive given that shares continue to be undervalued.Given all of the above, Capital One shares continue to look attractive to me (and, for risk-tolerant investors, the warrants are even more so). Share price returns in 2014 may be more moderate than those of 2013, but management continues to execute on a sound strategy and the economic backdrop is favorable.Disclaimer: This is solely my opinion, not an investment recommendation or solicitation, and may not represent the views of my employer(s), associates, or other related parties. No guarantees made to accuracy or completeness. I am long the companies mentioned in the disclosure and may change my position at any time without notification. Please see the full disclaimer in my profile, and do your own due diligence before making any investment.Disclosure: I am long COF, WFC. I wrote this article myself, and it expresses my own opinions. I am not receiving compensation for it (other than from Seeking Alpha). I have no business relationship with any company whose stock is mentioned in this article.Additional disclosure: I am long both COF warrants and WFC warrants."
1276711,23762,2013-03-15T10:54:25-04:00,,"With the exception of Goldman Sachs (NYSE:GS) and Morgan Stanley (NYSE:MS), sentiment on the financials is improving on the back of the recently completed stress tests and the Fed's approval of various capital plans. Bank of America (NYSE:BAC) was a big winner here as it received permission to buy back $5 billion worth of stock and redeem $5.5 billion worth of preferred stock. This confirms why Warren Buffett and I have exposure (OK, he has a bit more exposure) to the stock as I recently highlighted.Another financial institution that did well in these tests and is also reporting improving metrics is Capital One (NYSE:COF). These cheap shares look like they are going to go higher in the next few months.Here are some recent positives for COF:Here are three additional reasons why COF provides good value at under $55 a share:Disclosure: I am long BAC. I wrote this article myself, and it expresses my own opinions. I am not receiving compensation for it (other than from Seeking Alpha). I have no business relationship with any company whose stock is mentioned in this article."
1351581,24051,2013-04-18T13:27:26-04:00,,"Capital One Financial (NYSE:COF) is expected to report fiscal first quarter earnings on Thursday, April 18th. The whisper number is $1.63, three cents ahead of the analysts' estimate. Whispers range from a low of $1.50 to a high of $1.82. COF has a 65% positive surprise history (having topped the whisper in 20 of the 31 earnings reports for which we have data).Earnings history:- Beat whisper: 20 qtrs- Met whisper: 0 qtrs- Missed whisper: 11 qtrsOur primary focus is on post earnings price movement. Knowing how likely a stock's price will move following an earnings report can help you determine the best action to take (long or short). In other words, we look at what happens when the company beats or misses the whisper number expectation.The table below indicates the average post earnings price movement within a one and thirty trading day timeframe:The strongest price movement of +1.5% comes within thirty trading days when the company reports earnings that beat the whisper number, and -3.1% within thirty trading days when the company reports earnings that miss the whisper number. The average price movement through thirty trading days when the company reports earnings is 'as expected' (beat the whisper see strength, miss and see weakness).The table below indicates the most recent earnings reports and short-term price reaction:In the comparable quarter last year, the company reported earnings eleven cents ahead of the whisper number. Following that report the stock realized a 1.6% gain in after hours trading, but gave back 1.7% in one trading day. Last quarter the company reported earnings twenty-four cents short of the whisper number. Following that report, the stock realized an 8.1% loss in after hours trading, and was only able to gain back 1.0% in one trading day. Overall historical data indicates the company to be (on average) an 'as expected' price reactor through thirty trading days when the company reports earnings.Enter your expectation and view more earnings information here, or let us know your expectation in the comments section below.**********************************Since 1998, WhisperNumber.com has been tracking and publishing ""crowd sourced estimates"" for earnings. We call these earnings expectations whisper numbers. Our whisper numbers are gained from individual investors and traders just like you that have registered with our site. While the whisper number itself is an important part of our analysis, a company's ""price reaction"" to beating or missing the whisper number expectation is the key. On average, companies that exceed the whisper are ""rewarded,"" while companies that miss are ""punished"" following an earnings report.Disclosure: I have no positions in any stocks mentioned, and no plans to initiate any positions within the next 72 hours. I wrote this article myself, and it expresses my own opinions. I am not receiving compensation for it (other than from Seeking Alpha). I have no business relationship with any company whose stock is mentioned in this article."
1136441,24627,2013-01-28T03:50:20-05:00,,"Capital One Financial Corp. (NYSE:COF) offers a variety of financial products and services which include credit cards, business loans, auto loans, as well as consumer and commercial banking services. Capital One shares were trending higher in early 2013, and just recently reached around $62. However, after the company announced earnings, the stock took a big hit and it now trades around $56 per share. This appears to be a solid buying opportunity for a number of reasons. First, let's take a look at the earnings report which caused a significant selloff in the stock.The company announced earnings of $1.41 per share for the fourth quarter. This was below consensus estimates of $1.58 per share. The quarter was impacted by higher loan loss provisions and higher operating expenses. These results were a short-term disappointment, but the pullback in the stock seems excessive, and it was exacerbated by some analysts cutting price targets. For example, analysts at Janney Capital cut the price target from $67 to $63 per share.One reason to consider buying the stock now is because it is trading at the low end of its recent trading range and near a key support level (as shown on the chart) which is around $56, right around the 200-day moving average. This appears to be an area where plenty of investors are willing to buy and that means the stock might not have much downside left.Capital One shares look undervalued when you consider that analysts expect the company to earn about $6.53 per share in 2013. That puts the price to earnings ratio near 8.5 times. This is a significant discount to the average stock in the S&P 500 Index (NYSEARCA:SPY), which now trades for about 15 times earnings. This stock also appears undervalued in terms of book value which is about $68.45 per share. Finally, Capital One looks cheap compared to other companies in this industry. For example, American Express (NYSE:AXP) is expected to earn $4.75 per share in 2013, (which is significantly less than estimates of $6.53 for Capital One) and it trades for over $59 per share.With many of the major market averages trading near record highs, it's getting tougher to find value in this market. That is another reason why it makes sense to buy stocks that drop over short-term disappointments like an earnings miss, especially when the company has a solid business model like Capital One. With the economy showing signs of strength in housing and some improvement in the job market, this could lead to increased consumer and business demand for Capital One's financial products in the future and it could also lead to lower loan losses.Here are some key points for COF:Current share price: $56.32The 52 week range is $44.30 to $62.92Earnings estimates for 2013: $6.53 per shareEarnings estimates for 2014: $6.92 per shareAnnual dividend: 20 cents per share which yields .4%Data is sourced from Yahoo Finance. No guarantees or representationsare made. Hawkinvest is not a registered investment advisor and doesnot provide specific investment advice. The information is forinformational purposes only. You should always consult a financialadvisor.Disclosure: I have no positions in any stocks mentioned, and no plans to initiate any positions within the next 72 hours. I wrote this article myself, and it expresses my own opinions. I am not receiving compensation for it (other than from Seeking Alpha). I have no business relationship with any company whose stock is mentioned in this article."
1107771,40861,2013-01-11T14:24:01-05:00,,"American Express (NYSE:AXP) was expected to report Q4-2012 earnings on January 17, but pre-reported yesterday. Revenue grew almost 5% year over year, which was in line with estimates. Card member spending grew 8% year-over-year and recognized a $400M restructuring charge. This charge will go to funding severance payments related to 5,400 layoffs, which is around 8.5% of its total workforce.The more spending-conscious consumers has helped the credit card company keep default rates at historically low levels in 2011 and 2012. Besides sustaining over 25% return on equity growth, American Express management expects to consistently invest 50% of its excess capital in the business while paying out the remaining 50% to the investors through dividends and share buybacks. Its re-engineering program is expected to be completed by the end of 2012, where management expects to generate annual cost savings of $70 million from 2012 onward.Even with the solid growth and prospects of American Express, it might be trading ahead of itself based on valuation, at 14x earnings and 3.5x book value. Other big credit card companies Discover Financial Services (NYSE:DFS), Visa Inc (NYSE:V) and Mastercard Inc (NYSE:MA) will be posting earnings several weeks away. Discover -- March 18, Visa -- February 6 and Mastercard -- January 31. Discover pays a relatively low dividend yielding 1.4%, albeit the highest among the credit card stocks. The two major debit card issuers Visa and Mastercard trade high on a book value and earnings per share basis. Visa is 50x earnings and 4x book value, whereas Mastercard is at 31x earnings and 10x book value.Capital One Financial Corp. (NYSE:COF) is expected to post earnings on January 17, which is expected to come in strong thanks to its credit card businesses. Quarterly earnings are expected to be up 80% year-over-year for the quarter. Last quarter, Capital One posted revenue up 14% and net interest income up 16% -- with net interest margin up to 7%. The credit card segment encompasses consumer and small business card lending and its consumer/commercial banking segments include lending and deposit gathering for retail and business consumers.With a competitive deposit market, Capital One was gearing up deposits nearly 66% year-over-year to $213 billion in the first nine months of 2012, driven by the addition of deposits from the ING Direct acquisition. Capital One has also shored up its credit card portfolio by acquiring HSBC's U.S. credit card business. From a dividend standpoint, Capital One has the most to grow, where the credit card company pays a dividend yielding only 0.4%. As of Q3-2012 Capital One was well capitalized with capital ratios coming in at Tier 1 capital of 12.7%, Tier 1 common ratio of 10.0% and leverage ratio of 9.9% -- well above the regulatory requirements.Based on the American Express' earnings release and the price performance, Capital One could be set up to outperform with its upcoming earnings announcement. The credit card company has the best debt-to-capital position at 50%, where American Express is at 75%, and Capital One also trades the lowest at 1x book value.Disclosure: I have no positions in any stocks mentioned, and no plans to initiate any positions within the next 72 hours. I wrote this article myself, and it expresses my own opinions. I am not receiving compensation for it (other than from Seeking Alpha). I have no business relationship with any company whose stock is mentioned in this article."
1030511,29161,2012-11-27T10:43:36-05:00,,"It seems everybody is getting into financial services these days or at least expanding their offerings in the sector. Wal-Mart (NYSE:WMT) and American Express (NYSE:AXP) are offering debit cards and checking accounts together. eBay (NASDAQ:EBAY) and Discover Financial Services (NYSE:DFS) are trying to combine PayPal and the Discover card into a new kind of financial service. Not to be outdone, Capital One Financial (NYSE:COF) has decided to start opening brick and mortar banks that will offer financial services and coffee.Is this headlong rush into new kinds of financial services good news for investors? The geniuses at the various companies involve hope all those new services will lead to increased cash flow and new revenues from fees. But are these hopes realistic? Will the expansion of retailers into finance and credit card companies into banking generate additional cash or not?The numbers from Capital One seems to indicate that they just might be onto something. Capital One's revenues have grown by a little over $6 billion in the past two years from $16.08 billion in September 2010 to $22.31 billion on September 31st, 2012. The revenue from Discover Financial Services has grown as well, but not as fast. Discover's revenue grew from $5.96 billion in November 2008 to $8.841 billion on August 31st, 2012.The amount of cash churning through the financial services companies is increasing, but is it translating into higher profits? The answer is yes. Capital One posted a gross quarterly profit margin of 90.49% on September 30th, and Discover posted a gross quarterly profit margin of 85.79% on August 31st. Basic financial services, such as credit and debit cards and payment processing, are paying off.Selling Financial Services to the UnbankedThe payoff will probably continue as the public seeks an alternative to traditional banks. Around 10 million Americans, or 8.2% of American households, now have no bank account of any kind, according to a survey by the FDIC. That number increased from 1% in the last similar survey by the same agency. The FDIC also reported that around 20.1% of American households are now underbanked. That means they have a bank account, but they use other methods of payment, such as payday loans or money orders. The number of the underbanked grew by around 2%, the FDIC reported.These numbers represent opportunities for the financial services industry, because all of those people still need to pay bills, cash paychecks, and buy groceries. Yet many of them don't trust banks or associate traditional banks with poor service and high fees. Wal-Mart and American Express's Bluebird card is one obvious attempt to serve such customers. It offers no fee and provides most of the services of a standard checking account, including electronic bill pay. A person can sign up for Bluebird without a credit score.Capital One's cafes are another attempt to reach this group. They are friendlier than a traditional bank, yet offer fewer services. Instead of tellers, a person who visits the café finds a coffee bar, a sandwich shop, a salad bar, flat screen TV to watch, wireless internet, and beanbags. There will be no safety box or cash services either, which will reduce the cost of operation. Instead, Capitol One employees on site will help visitors open accounts online or with smartphone apps. All of the banking will be electronic.This strategy can help Capital One from losing customers to eBay's PayPal, Google's (NASDAQ:GOOG) Google Wallet, and American Express's Bluebird, which provide a variety of banking services without a bank account. Capital One's strategy for competing with these services is to leverage the ING Direct Assets it purchased earlier this year. This will enable Capital One to go after middle and upper class customers that want more traditional banking services, but don't necessarily want a bank anymore.Capital One recognizes that people are moving away from traditional banks. In addition to alternatives such as debit cards, more people are taking advantage of online banking. Many people no longer think of a bank as a building; instead, they view it as a smartphone app or a website.It's a brave new world of financial services out there, and Capital One is in a good opportunity to take advantage of it. The company has figured out how to turn all of those new financial products into cash. It reported making $9.672 billion in cash from operations on September 30th. There seems to be no reason why Capital One can't continue with that.The new world of financial services is definitely an opportunity for value investors, and Capital One is one of the best values in it. It generates a lot of cash, and it is constantly looking for opportunities to generate more. More importantly, it looks like there are many such opportunities out there.Disclosure: I have no positions in any stocks mentioned, and no plans to initiate any positions within the next 72 hours. I wrote this article myself, and it expresses my own opinions. I am not receiving compensation for it (other than from Seeking Alpha). I have no business relationship with any company whose stock is mentioned in this article."
696711,24866,2012-07-02T10:54:16-04:00,,"Given the uncertainty in the macroeconomy, investors are justifiably weary about cyclical stocks. In my view, however, the global economy is stronger than what the market recognizes when it comes to consumer expenditures. Job figures may be disappointing, but they are heading in the right direction. Towards capitalizing on my bullish outlook, I recommend broadly investing in Amex (NYSE:AXP), Discover Financial (NYSE:DFS), Capital One (NYSE:COF), and Visa (NYSE:V) over time. These consumer financials are the ""infrastructure"" behind consumer spending and thus well positioned to outperform in the event of a quicker-than-expected recovery.Like investing in the S&P 500, I encourage investors to slowly increase any long position in the four stocks listed above. Don't put your eggs in one basket, since any signs of worsening debt crises abroad will limit the principal that allows for compounding. The idea is to not have your investment be disrupted by negative short-term events / news. Top value investors search for long-term growth, and card businesses have a strong brand image to warrant higher multiples.While the S&P 500 trades at 15.7x past earnings, Amex trades at only 13.9x past earnings. With a beta of 1.8, the firm is likely to recover lost shareholder value from the financial collapse quicker than the market overall. Discover is even cheaper at 8x past earnings; Capital One is cheaper still at 7.1x past earnings. The odd ball out in card business is Visa , which trades at a respective 28.9x and 17.5x past earnings. Part of the reason why Visa trades so high is due to the company's strong brand name and sustainability. Based on data from FINVIZ.com, all 4 of these consumer financials are rated a ""buy"" or better.Capital One is nevertheless preferred given how cheap it is. Assuming no growth, the firm raises more free cash flow than its market capitalization. Based on consensus 9.1% EPS growth expectations over the next 5 years, 2016 EPS will be around $9.74. At a 12x multiple, the future value of the company is worth $116.88 per share. Discounting backwards by an aggressive 12% discount rate yields a $66.32 price target, which is at a more than 20% premium to the current market value. With the firm trading 14% book value, I find that margin of safety is large enough to justify making an investment in a brand name firm that could more than double in value.Amex has stronger growth expectations going into its valuation with consensus forecasting 11.5% per annum EPS growth over the next 5 years. That means 2016 EPS of around $7.39. At a 12x multiple, the future value of the stock is $88.69. A discount rate of 12% would imply that the firm is roughly 15% overvalued. The Street's price target is nominally higher than the current market. Despite limited upside, I recommend backing the company since multiples nevertheless have room to expand. My 12x multiple is, after all, conservative in light of the current 13.9x multiple.Discover Financial has a PEG of 0.87, which implies that the market has failed to properly consider growth prospects in assigning a valuation. It also offers an industry-leading 1.2% dividend yield. By contrast, Visa has a PEG of 1.5 and a dividend yield of 0.7%. Brand name is critical in the consumer financial / card business, but the premium appears somewhat risky. Moreover, Visa has a low beta of 0.8, which indicates that it won't outperform broader indices from a macro recovery. The fundamentals are nevertheless solid against peers and reinforced by the absence of meaningful debt and 2.9 current ratio. For safety, go with Visa; for high reward, go with Capital One, Discover, and Amex.Disclosure: I have no positions in any stocks mentioned, and no plans to initiate any positions within the next 72 hours.Additional disclosure: We seek IR business from all of the firms in our coverage, but research covered in this note is independent and for prospective clients. The distributor of this research report, Gould Partners, manages Takeover Analyst and is not a licensed investment adviser or broker dealer. Investors are cautioned to perform their own due diligence."
