article_id,author_id,publish_on,summary,content
2623845,48411,2014-11-01T12:30:00-04:00,"CVT is the rare case of consistency, profitability, and execution.
        CVT's has slowly but sure grown its top-line each of the last 5 years while also growing market share in a very lucrative industry.
        CVT shares should continue higher and higher with little volatility. I like CVT to provide risk fragmentation and diversity to my portfolio.","I came across what turned out to be a great investment story the other day when running a screener that was looking for companies that were showing a net loss for full year 2013 but wouldn't have shown a loss if share based comp had been excluded. What I was looking for in particular was a company that might be undervalued based on algorithmic trading and based on surface level analysis of income statement results. One investment in particular, based on its prior history of operating at profitability, caught my eye - Cvent, Inc. (CVT).When I looked further into CVT I found a company with a great balance sheet including recent cash raises via an IPO and a secondary, a history of profitability inclusive of share based comp with obviously the full year 2013 results posting a net loss, improving cash flows, and that was serving a very needy market.This article will detail my analysis of CVT and make a recommendation for buying shares of the company. I think the company is fairly valued at this point but should continue to create value for shareholders with a mid to long-term time horizon. Shares should move steadily higher as results continue to reflect a healthy business and as the company can further entrench itself as the go to source for its industry.Cvent Planning and MarketingCVT is ""engaged in providing a cloud-based enterprise event management platform with solutions for both sides of the events and meetings value chain, event & meeting planners and hotels & venues (SOURCE: SA CVT Profile)"". CVT operates a cloud-based SAAS platform that acts as a watering hole for all parties involved in event planning, event executing, and event marketing. Imagine a quasi-social network but strictly for hotels/venues and event/meeting planners, a great place for the different parties to meet up, find out who's available, when they're available, and for how much. Believe it or not this is an incredibly valuable tool, and growing more valuable, that is filling a large gap in a big market. Prior to CVT's platform gaining traction in the size that it has the event planning and marketing life cycle was almost entirely handled with paper sources and paper based tools. What CVT's platform has done has made the overall life cycle more efficient, by way of that cheaper, and overall more effective.CVT's platform also allows the company to help market for both sides of the value chain and because of the method of delivery, SAAS/in-app/online delivery, the company can also provide analytics to customers on both sides. A huge amount of data can be captured as the event progresses through the life cycle stages because of the capabilities offered when executing the process via online sources thanks to advances in technology. Data in regards to engagement, overall satisfaction, delivery of goal, etc. can all be stored and studied in an effort to create larger returns on investments for customers. This positions CVT as a go to source for these type of needs and CVT's operations have reflected as much.OperationsWithout spending too much time on this you can see a few trends have been well established as the model has scaled up. What CVT has found out is that as its network has grown it has been able to control the variables surrounding investing into the network with greater clarity and effect. The actual model is really simple and at this stage can be explained pretty conveniently. CVT has found that the more inventory it can provide, the more ""shoppers"" it can attract - speaking here of the buy side or the demand side. As more demand has been attracted to the platform that has made the platform more attractive to the supply side. As both sides have grown this has created the need for a priority sorting mechanism, similar to paying a search engine for priority placement and search optimization, that has helped CVT sell premier ""memberships"" to its platform.Now, the growth in overall usage of the platform when combined with the capturing of the above noted data has helped CVT create more and more efficient and effective platforms that it auto updates for participants. As the platform has grown more effective, CVT notes this by pointing to its key metric growth which is outlined later in the article, so has the return on investment for both sides. How is CVT growing platform ROI? By having more and more participants be active on the platform. At this point CVT has a platform that is helping create its own organic growth (I can further evidence this later in the article by showing a reduction in operating expenses as a percentage of revenue as the platform is doing more with less), ""learning"" to be more efficient by collecting large amounts of data, showing verifiable, measurable increased levels of ROI for users, and allowing CVT to price premium memberships into the model. With the large amount of the total Event Planning and Marketing Ecosystem model remaining unchanged, outside of becoming more technologically based, the platform is growing more and more dialed in to the exact needs of the user base. All of this is contributing to the consistency of the financials that we'll discuss for the remainder of this article.The big takeaway from the model that is going to show to drive operations is that the model to this point is highly self-sustaining. With smaller and smaller amounts of spending, excluding share based comp, the company is able to drive substantially the same amount of revenue growth on a percentage basis but larger and larger amounts of absolute dollars Y/Y. Until this relationship changes you're going to want to own this.Quickly, I think it's worth taking a look at the operations that triggered my scanner:Revenue has progressively grown and recently crossed the $100 million mark. Traditionally CVT has scaled up expenses behind its modeled revenue growth in an effort to manage its accumulated deficit which sits just north of $20 million. This has done well to help the company avoid debt and has allowed its income statements to perform without pressure from financing vehicles. I think this is one of the most overlooked positives in finance. I'm almost always OK with debt being used to drive a scale-up but the ability to accomplish this without leverage pays huge dividends in the long run from an operational flexibility standpoint and from a profitability acceleration standpoint. Now with that in mind you'll see that every year since 2009 CVT has posted a positive operating income figure. What caused the ~$10 million drop from FY12-FY13? Small contributions from natural growth of expenses for scale-up but mostly share based comp. Share based comp has nothing to do with underlying operations by the way. It's also because of this share based comp, with a little help from the tax man, that CVT posted a net loss in 2013 which triggered my scanner. I mean just take a look at those net income figures and add back share based comp. What you see is a company that ex. share based comp would have ~$6 million in accumulated deficit and net margins that would have The Street considering this a diamond in the rough. I'm not saying that CVT hasn't received any of the attention that it's due because it does have a nice valuation and as I said in the introduction I think the past performances have been baked into the current share price but this is exactly the scenario I was looking for when running the scan in the first place only I wasn't expecting to find such a solid set of operations and such a consistent industry.Moving to more current data we see more of the same as it's been business as usual for CVT:Every single trend remains in place and growing like clockwork. This type of consistency is really hard to find in any industry which could lead to aggressive multiples being used to value the shares in the future. If this happens clearly this would be good for the share price.Revenue has continued to grow on the 1H and is on pace for yet another record year. You can see that with a ~33% drop in share based comp Y/Y for the 1H that operating expenses have come down to levels that more closely reflect the actual scale up expenses (which drive revenues, meaning that when share based comp skews the overall expense line too far the revenues which aren't driven by share based comp have a hard time of making of the extra expense gap) and that has led to a ~$3 million positive Y/Y swing in operating income. Again, the scanner did its job in finding an income statement that was artificially pressed down one year prior. Finally, CVT was able to post a ~$4.6 million positive swing in net income Y/Y which I think CVT should post ~$4 million in FY net income which would have it in trend with its best years since 2009.Should I be concerned that net income has fallen in the range of ~$4 million in the years that CVT has had a net income regardless of the overall top-line (indicating falling net margins)? I think the answer is no because I see the net income falling in a predictable print rage being more a factor of CVT's being able to manage the bottom line (ex. increases in share based comp) with predictability than anything else. As CVT has scaled up, prior to seeing the historical income statement, the best I could have asked for would have been to see the bottom line managed to breakeven. That's usually what I would consider a best case scenario for a growth stage company. Luckily for those who have been long CVT this company's ""breakeven"" happens to be ~$4 million. What this also shows investors is that as huge line items like G&A and S&M begin to slow as the line items reach full economies of scale (meaning shrink as a percentage of revenue) assuming share based comp isn't on the moon the net income line modeling for full years should start at ~$4 million. I really like the idea that CVT will be able to grow profitability in size and with speed if it decides to grow into any number of the next stages of growth rather than just plowing ahead to the next scale.Contributing to this expectation and furthering the idea of stability and consistency with CVT are the revenue segment breakouts provided by the company, overall metric performance as a percentage of revenue, and consistency in key metric growth:Revenue when broken down by segments has grown at exactly the same paces per segment Y/Y for each comparable period, this goes a long way into being able to model growth with accuracy and being able to meet guidance given. I think this has contributed to management's ability to manage the income statement to CVT's ""breakeven"" of ~$4 million. It's also important to note that the actual dollar growth of the segments from a percentage standpoint has been within 100 basis points of each over during the first two quarters of the year for both comparable periods.The one line item I don't like to see on this graphic is that gross profit has fallen 200 basis points Y/Y for the 1H as a percentage of revenue. Management has guided that this downtick is short term in nature and was caused by a one-time uptick in technology maintenance expense that was expensed as incurred to the cost of revenues line. Without this expense recurring the gross profit line should be back at 74% of revenue going forward. Even with the downtick in gross profit with a 700 basis point reduction in total operating expenses as a percentage of revenue, most of it coming from a reduction of G&A expenses - this is a clear example of what I noted above about growing into the current level of scale up and allowing economies of scale to take place, both the operating and net income lines made positive advances. To be clear I'm not saying CVT needs to take a break at this level of scale up and allow itself to close out the accumulated deficit in its entirely, mostly because the company has no debt worth mentioning, but that it could. That's the general bull thesis with CVT, that its history of operating excellence has allowed it flexibility and with flexibility comes variable control. I like to own both of those in my portfolio.Unfortunately CVT only updates key metrics in its 10-K's but as of full year 2013 key metric growth is excellent across the board and indicative of the health of the underlying business. Specifically, take a look at the tight range of Y/Y revenue percentage increase. What a marvelous display of control of operations by management.Cash FlowsFinally, and I just wanted to leave the graphic for viewing because I think the key metric graphic does a good job at showing the historic trend line, but the cash flow statement for the 1H is showing increased operational cash flow that's on pace for a record year. Even if you were to back out the cash flows provided by a reduction in Prepaid Expenses and Other Assets the 1H would have still shown an operating cash flow increase. I guess what I'm saying is that the build isn't coming from any padded line items or short term manipulations. This is a really impressive development:Where's the trade?CVT adds a level of diversity to my portfolio that I don't currently own. I own some hotels, my largest position is in La Quinta, but no event planning/marketing. I really like the CVT model, management's execution, the consistency of operations, and the fact that I think I can buy shares and never look at them again. Those are the types of diversity providers you want to own.One of the core principles that I operate my book by is Risk Fragmentation. I'm always looking for ways to fragment risk via diversification and via downward pressure on volatility. I mean the ideal portfolio would be one that goes up every day by the exact same amount of percentage points, right? We know this isn't possible but this should always be the goal. I like the idea that CVT can add to both for me and I'm longing shares into the weekend for an indefinite hold.I look forward to providing continuing coverage in the future. Good luck to all."
3293815,48411,2015-06-30T11:25:14-04:00,"Cvent is out with news of a new lead scoring mechanism as a tool within its broader Hospitality Cloud.The new mechanism is aptly called Lead Scoring.Cvent now has a tool that will silo leads in its Hospitality Cloud into a scoring system which will give the hotelier a defined, measurable benchmark for prioritizing leads.The Lead Scoring system will take into account several moving, real-time variables that will slide the leads score in real-time as information changes.Tracking the leads let alone scoring them is an endeavor that requires constant attention and, with that, constant overhead.","Cvent (NYSE:CVT), a leading cloud-based platform for meetings and group business and a company I've been hot on since its overlooked IPO, just keeps grinding for me. Cvent is out with news of a new lead scoring mechanism as a tool within its broader Hospitality Cloud - a platform I recently called a blend between a social network and a CRM. The new mechanism is aptly called Lead Scoring.Obviously bottom funnel focus has been a priority for any SMB or enterprise involved in any part of the sales ecosystem but this focus has come under an even more granular microscope as the combination of increased technology and slow GDP have magnified the importance of every customer win. With Cvent looking to establish itself as the Goliath, best of breed provider for its space - the event management space, if you will - of course this is an area it would like to have an effective and unique offering for. It appears with its Lead Scoring system it will have just that.Cvent now has a tool that will silo leads in its Hospitality Cloud into a scoring system that will give the hotelier a defined, measurable benchmark for prioritizing leads. The Lead Scoring system will take into account several moving, real-time variables that will slide the leads score in real-time as information changes. This is an incredibly defensive, retention driving announcment by Cvent and I believe an immediate reason to buy. I'll explain why.According to Cvent (and other third party data is readily available for this industry) hoteliers manage up to 15 million inbound lead per year. Lead management can become an extreme burden, and a costly one, because of the above noted constantly shifting variables on both the lead side and the hotel inventory side - things like meeting room availability, food and beverage spend, etc. Tracking the leads let alone scoring them is an endeavor that requires constant attention and with that constant overhead. Still, this tracking and spend doesn't guarantee success or accurate scoring.Cvent's system, however, will automate this process based on parameters set by the hotelier and it will provide a data trail that can be audited, analyzed for improvements, and used in general BI. This will allow the hotelier to migrate overhead and increase lead conversion. Obviously, that's good for the hotelier's bottom line.What's maybe most bullish about this announcement is that it further underlines the need for the hotelier to use the Hospitality Cloud as the foundation platform for the entire sales lifecycle of each location. Now Cvent has a clearly defined value-prop for even micro layers within the general sales spectrum - Lead Scoring is only as effective as the data within the broader CRM arm of the Hospitality Cloud. Of course this means if you're using any other platform you can't score leads which creates the defensiveness alluded to above. I believe this creates a considerable switching cost when trying to exit the Cvent platform and should increase retention levels for the company.Also consider that as Cvent can further increase its overall social network presence, the quasi-marketplace it hosts for event planners and venues to meet and create transactions, AND increases the amount of data each hotelier feeds into its CRM platform the data gathered from both and the analysis potential that provides creates other barriers to exit. Should a hotelier switch platforms, largely Cvent is the only industry-built platform available, it would lose the ability to use data from periods past to measure real-time strategies being deployed.Again, I'm more than optimistic that Cvent trades much, much higher in time despite not currently being rewarded for my holding.I continue to recommend a long position in Cvent.Good luck everybody."
3288865,48411,2015-06-28T16:56:09-04:00,"Cvent has decided to take the salesforce.com model and apply it to a highly lucrative niche that has huge amounts of fragmentation and no market share aggregator.Up until now Cvent has been trying to be the central platform that attracts venues (largely hotel) and event planners – think a social network for the two.But now, it appears, Cvent is looking to simply be the platform to be used for pairing the two parties even if it isn’t the company doing the pairing itself.I guess the best analogy I could make would be if Facebook, instead of trying to be the central social media attraction, decided it was best to provide the tools.Cvent, by way of acting as a salesforce.com-like platform and not exclusively as a transactional company has now shortened its path to a much higher market cap.","Cvent (NYSE:CVT), the enterprise event management platform, has decided to take the salesforce.com (NYSE:CRM) model and apply it to a highly lucrative niche that has huge amounts of fragmentation and no market share aggregator - the hotel and venue space.So, I know that's a really broad based open to an article about a SMB/enterprise solution but that's really what Cvent is doing - keeping it broad based.Cvent has been moving toward this ""platform"" model for a while now, at least as long as I've been following the company (since its underfollowed IPO), and its recent Analyst Day finally made official what those following the name already knew. Still, this is a big deal and will be going forward.Up until now Cvent has been trying to be the central platform that attracts venues (largely hotel) and event planners - think a social network for the two. Pairing the two parties and collecting a ""toll"" on the transactional traffic has been lucrative as stated above. But now, it appears, Cvent is looking to simply be the platform to be used for pairing the two parties even if it isn't the company doing the pairing itself. This, in the opinion of this author, will be even more lucrative longer term and much more defensible.I guess the best analogy I could make would be if Facebook (NASDAQ:FB), instead of trying to be the central social media attraction, decided it was best to provide the tools to launch a social media platform - to manage the actual facilitation of social media rather than being the meeting place itself. If that makes any sense.Cvent has borrowed a bit from the Facebook model and borrowed from the salesforce.com model. Cvent currently runs a substantially similar model to salesforce.com in that it facilitates the lead nurturing and/or counter party management of the venue/meeting planner ecosystem. Think CRM but supremely dialed-in for this niche. We've already outlined that Cvent also has a ""toll"" model in which it leverages a ""social network"" to create supply and demand of inventory. Between the two Cvent has created a blended model that is entirely unique to the space. A space that it absolutely owns.I think that Cvent is now the absolute ideal platform for both sides of the enterprise event management transaction and has now started down the road of optimizing what should eventually be the salesforce.com of its space. As we learn more about the platform Cvent is deploying, it's set to be launched in ""early 2016"", I'll update readers to the more granular findings but in the early going and early analysis how can you not be bulled up Cvent?Cvent, by way of acting as a salesforce.com-like platform and not exclusively as a transactional company - although it will still run a stand-alone transactional business as well, has now shortened its path to a much higher market cap. This strategic shift will allow it to scale up much quicker, with much less risk (read: less M&A risk, integration risk, etc.), and will allow it to be an even more important fixture in the event management process for the space. Mission critical some would say.Cvent has shown the ability to consistently drive revenues higher (growing at roughly a 30% pace T36M) on attractive ~70% gross margins. It's also been able to grow cash generated from operations at a healthy clip consistently. All of its key metrics T36M have healthy growth slope lines as well.This is a name that if you can be patient with should continue to increase in fundamental health over time. How quickly its market cap increases is a matter of market awareness but this story won't stay hidden for too much longer if you're asking me.I continue to recommend a long position in Cvent. I've been long since late-October 2014 and have captured minimal gains for my efforts but I get the feeling that will soon change.Good luck everybody."
