article_id,author_id,publish_on,summary,content
4018904,40141,2016-11-03T13:16:50-04:00,The DoJ will probably block the Cvent deal.American Axle buys Metaldyne.Intelliquent and Lattice both get sold.,"Welcome to the Ominous issue of M&A DailyCventThe DoJ will probably sue to block the Vista acquisition of Cvent (NYSE:CVT) within the next three weeks. The buyers appeared unprepared to deal with the significant antitrust issues raised by their deal. If the DoJ sues, heightened concern about deal risk could blow out other spreads. Here is a shopping list of a half dozen deal targets to have ready:MetaldyneAmerican Axle (NYSE:AXL) is buying Metaldyne (NYSE:MPG) in a $1.5 billion cash and stock deal. MPG holders get $13.50 per share in cash and 0.5 AXL. The buyer is working with Greenhill (NYSE:GHL) and JPMorgan (NYSE:JPM); the target is working with Bank of America (NYSE:BAC).InteliquentGTCR is buying Inteliquent (NASDAQ:IQNT) in a $791 million cash deal. IQNT holders get $23 per share.LatticeCanyon Bridge is buying Lattice (NASDAQ:LSCC) in a $1.3 billion cash deal. LSCC holders get $8.30 per share. The buyer is working with Lazard (NYSE:LAZ); the target is working with Morgan Stanley (NYSE:MS).MicrosemiMicrosemi (NASDAQ:MSCC) is running a sales process in reaction to interest from Skyworks (NASDAQ:SWKS).SpectraSpectra (NYSE:SE) and Enbridge (NYSE:ENB) got a second request and a Supplementary Information Request from the Canadian Competition Bureau for their deal. The companies continue to expect the DEAL to close in the first quarter of 2017.du PontThe ACCC published its Statement of Issues on the Dow (NYSE:DOW) merger with du Pont (NYSE:DD).PotashAgrium (AGU) and Potash (POT) shareholders approved their deal.BrocadeThe definitive merger agreement was filed for the Broadcom (NASDAQ:AVGO) acquisition of Brocade (NASDAQ:BRCD).EverydayThe Offer to Purchase was filed for the j2 (NASDAQ:JCOM) acquisition of Everyday (NYSE:EVDY).Isle of CapriToday is the filing deadline for the preliminary S-4 in the Eldorado (NASDAQ:ERI) acquisition of Isle of Capri (NASDAQ:ISLE).DepomedMallinckrodt (NYSE:MNK) and Daiichi Sankyo (OTCPK:DSNKY) are two of the companies looking to bid on Depomed (DEPO). Shionogi (OTCPK:SGIOY) could be another of the bidders. More to come in future editions of M&A Daily…Elsewhere on Seeking AlphaBeyond Seeking AlphaSifting the WorldEditor's Note: This article discusses one or more securities that do not trade on a major U.S. exchange. Please be aware of the risks associated with these stocks."
4003372,102182,2016-08-31T12:32:21-04:00,Cvent shareholders have approved the merger.Going private at $36 per share.20-29% annualized rate of return.,"On July 22, Cvent's (NYSE:CVT) shareholders voted and agreed to an acquisition of the company by Vista Equity Partners in an all cash deal for $36 per share.Cvent is a software company specializing in the event planning/management space within the ""cloud."" Headquartered in Tysons Corner, Virginia, Cvent also has corporate offices in India, Canada and England. It employs 1,900 workers and generated $187 million in revenue in fiscal 2015.Acquiring PartyVista Equity Partners is a US-based private equity firm focused on investing in software and technology-enabled companies. It has a proven track record of successful acquisitions. Some of the recently closed deals include insurance technology provider Solera Holdings Inc. (NYSE:SLH) ($3.8 billion) and engagement marketing software company Marketo Inc. (NASDAQ:MKTO) ($1.8 billion). A list of Vista's portfolio can be seen at Vista's website.Purchase Price and FinancingBased on the $36 per share offer, the deal is valued at $1.65 billion. Given Vista's record with closing acquisitions having similar purchase value, I feel comfortable with Vista securing financing for Cvent.Closing HurdlesAs a friendly merger supported by management of Cvent, the deal was welcomed by its shareholders. As expressed in the recent 10-Q, the US DOJ has requested additional information and documenting material regarding the merger, commonly referred to as a ""second request."" Also stated in the recently 10-Q is the fact that both companies expect the merger to be completed in the third or fourth quarter of this year.Because of the small size of the deal, there is relatively minimal antitrust risk associated with the merger. Also, Cvent being a software company that does not deal with sensitive data, there should be little risk for the deal being rejected by the DOJ. Since Vista is a veteran in closing similar deals, I have strong belief that the deal should complete relatively smoothly.Spread and ReturnThe offer price of the merger is $36. Based on August 26's closing price of $32.7, the spread is a rich $3.30. If this deal were to close on Dec. 31, 2016, we can expect an annualized rate of return of:If we allow a two-month cushion for any potential delay (which I highly doubt), then the annualized return would be lowered to:Either scenario would provide a nice annualized return that beats a high interest savings account or CD.While it is unlikely, an unsuccessful close of the deal would mean the price could fall back to the price prior to the merger announcement.Since the stock has falter in the last couple months, this will be a good time to take advantage of the recent decline and add some Cvent shares to your portfolio.In the case that you have no previous experience buying stocks undergoing mergers: because there is no sell transaction, no SEC fees will be charged once the merger completes. Your broker should not charge a commission of the share delisting either. Although you still have to take your buy side commission into consideration.Institutional PurchasesEven though I do not generate my buy/sell conclusion solely on institutional purchases, it is always great to see some famous investors lining up on the same side of my trade:These are very tiny positions relative to the portfolios Mario Gabelli, Prem Watsa, and Joel Greenblatt manage. However, considering the size of this merger, any significant purchase could move the price of the stock and therefore narrow the spread.ConclusionCvent is a solid merger play that is relatively low risk, with a high probability of closing that offers a 20-29% annualized rate of return. We can take advantage of the recent weak price action to get in before the spread narrows."
4004522,96386,2016-09-07T02:15:40-04:00,"Event SaaS business is prepared for more growth.
        Shareholders have approved the merger.
        Vista equity partners has a successful track record in event tech acquisitions.
        Double digit annualized returns available to investors today.","Cvent inc. (NYSE:CVT) is a merger deal ready for new investors. Vista equity partners, a notable tech-focused PE firm, announced an all-cash deal for $1.65 billion or $36 per share for Cvent inc. earlier this year.Last week, Geoffrey W did a great job covering the details of the acquisition and the recent shareholder approval. My article will focus more on why Cvent inc. is a great business and that investors can feel safe putting money behind. The company has a very interesting story with a resilient CEO only focused on success and creating value for shareholders.Company BackgroundCvent is a leading cloud-based event management company for corporations, hotels and large venues. With 16,000 customers there is a good chance you have attended an event in the U.S. that was managed with Cvent's technology. Why? Because event management is a big business. Companies like TicketMaster and Eventbrite focus mostly on consumers ticketing transactions. This game is completely different for corporate business events. Cvent inc. can be viewed as the Priceline (PCLN) for corporate event management.The company offers a variety of services that assist event organizers run events seamlessly and connect attendees through mobile apps. The cloud software offers solutions for several challenges event planners face: expense management, venue sourcing, attendee registration and logistics. For large corporate buyers, events and tradeshows is equivalent to having a wedding and reception every quarter. Cvent solves these problems by automating logistical efforts and saving money when sourcing tasks. Below is a snapshot of Cvent's network; very similar to an online travel site with vertical and horizontal reach.Source: Cvent 2015 Q4 Investor presentationSince 2008 the company has increased group booking value from $50 million to $9.8 billion. In the chart below, you can see the company has quadrupled revenue in the last six years. While investors shouldn't expected +30% in growth forever, Cvent is certainly taking over market share in this competitive industry. The second chart has a list of the top customers and industries Cvent has been successful in servicing, a strong testament for the company's software solution.Strong revenue momentumSource: Cvent 2015 Q4 Investor presentationHigh quality customer baseSource: Cvent 2015 Q4 Investor presentationLike many other dot-com businesses, Cvent started in 1999 and was on the brink of bankruptcy shortly after the internet bubble burst. Co-founder and current CEO, Reggie Aggarwal, was a 31-year old former lawyer who had burned through most of the $17 million raised from notable investors. After downsizing his entire operation, Reggie and his team were forced to build great products instead of spending money on marketing.Buyout teamVista Equity Partners is one of the best tech-focused private equity firms. The company's primary focus is to buy and build tech-enabled and software businesses. Uncommon in the PE space, Vista keeps technology innovation on the top of its investment criteria list. Many reporters and industry experts have suggested that Vista will merge Cvent with one of its portfolio companies, Lanyon Solutions inc., another corporate event management business. If you want to read more about event tech space and Vista's plans for the future I would suggest reading this article about Vista's Marketo acquisition.Since Lanyon is a private company, it is difficult to calculate the value of synergies but we can be assured that the Vista team would find a favorable outcome post-deal close. It should be noted that Vista was successful in merging Active Network Business Solutions Group with Lanyon in 2014, increasing the likelihood Vista will create value with the Cvent deal. Vista was also able to close the $1 billion Active Network deal within two months of the announcement.Merger ArbitrageFor those unfamiliar, mergers arbitrage was the secret sauce for opportunistic investors like Warren Buffett. As a cash deal the likelihood of closing quickly increases. Buffett-like investors could purchase a great amount of Cvent stock in the short term to significantly enhance annualized returns. This was his favorite investment strategy which you can read more about in the Art of Stock Arbitrage, by Mary Buffett, Warren Buffett's former daughter-in-law.Below is a quick breakdown of what investors can expect from this acquisition. The deal is expected to close in the third or fourth quarter of this year. As of this writing, the stock trades at $32.5 and will close at $36. Investors will be given $36 in cash in exchange for owning CVT. A spread of $3.5 equates to a 10.7% return. If the stock was purchased today and the deal closed on December 31, 2016, this would produce an annualized return of ~32% (this is slightly higher than Geoffrey's return calculation because I have a lower buy-in price and shorter window).Given that this is a cash deal and Vista's exceptional track record, investors are given a high certainty that this deal will close in the near term. The probability of closing makes this scenario less risky than many speculative other stock buys."
3842376,56112,2016-01-29T08:50:36-05:00,"As a value investor, I usually find it hard to stomach stocks with sky-high valuations, but I think the value proposition at Cvent is pretty strong.If the company executes, they may be able to lock up the event vertical - on both the hospitality and demand side - and increase pricing over time.I can't call Cvent a buy even after the sell-off, but it's less of a stretch than most of its SaaS peers that I've looked at.I think this is a name that growth investors should do due diligence on.","High quality SaaS stories are rarely cheap in the absolute sense, but in many cases, valuations have come in pretty significantly since the froth of a few years ago, as investors' attention has turned to other categories. With many SaaS companies down significantly from IPO or post-IPO prices, I've been digging through the sector to figure out which, if any, may be worth a look.Despite trading at a valuation that is hardly ""cheap,"" event-management software vendor Cvent (NYSE:CVT) is one of the few SaaS stories that I think may be worth paying up for. The current valuation is steep, and to be clear, I'm not recommending a buy here - but the price I'd be willing to pay for Cvent is significantly higher than the price I'd be willing to pay for many SaaS peers. I'll explain why.Software With Network EffectsEveryone knows that marketplaces/network effects models are great, but more people claim to have them than actually do. As I discussed in my Opower (OTC:OPWR) write-up, for example, given the intensely local nature of electricity consumption, it's hard for me to see how having scale is particularly valuable in the utility-software market above and beyond the usual G&A efficiencies. In general, while there are lots of things to like about SaaS businesses, it doesn't get more valuable for user N when user N + 1000 joins the platform.Cvent, on the other hand, is unique in that it has clear network effects. The company does have some competitors. MeetMax, owned by The Wall Street Transcript, is used for a lot of investor conferences, and there are a number of companies like Regpack. Cvent seems to be a scale leader, and its reach spans both the ""Event Cloud"" (focusing on meeting planners) and the ""Hospitality Cloud"" (focusing on group and meeting business for hotels). The magic happens when these two intersect in the form of electronic RFPs; as CEO Reggie Aggarwal explains:Data from each side helps the other, similar to the interplay between data and listing sites at CoStar (NASDAQ:CSGP), an interesting company in its own right which I've discussed previously here. In the case of Cvent, hotels are better able to price (and pursue) group business when they have more visibility into various events. Meeting planners are able to spend more time on what matters rather than trying to find venues.Moreover, the value proposition is strong not just for planners, but also for corporate finance and compliance departments - Cvent is aiming to be the Concur (owned by SAP (NYSE:SAP)) of meetings. They believe event planning is one of the few remaining areas of uncontrolled corporate spend; in many instances, their clients weren't even shopping around for quotes, just going with the same venue year after year. This sounds surprising but really shouldn't be, and provides a pretty compelling value proposition for corporate adoption of the software - it not only enables time savings, but potentially significant monetary savings as well.TAM: While There Are Questions, It Should Be Big EnoughI've felt for a while that trying to figure out the size of a SaaS company's TAM is more art than science. While there's always some way to back into estimates - say, number of total potential seats times ARPU - there's a lot of wiggle room around potential additional applications on the upside, and potential ceilings from penetration and eventual ""good-enough"" competition on the downside. Cvent sees a $5 billion TAM on the event management side, with an additional $2 billion from the hospitality side, and potentially a billion more from mobile apps for events.One of the potential bearish arguments here deals with the frequency of events - in a world rapidly moving towards technology, do physical, face-to-face events have a long-term future? Let's take the investor relations world as an example: will investor conferences continue to exist in ten years the way they do today? It's an open question. Indeed, even once I'm not running my fund on a shoestring budget, I think I'd be hard pressed to spend money flying out to a conference when I could just watch the webcasts or read the transcripts online. That said, I find 1x1s quite valuable, and I do believe there is an additional element to face-to-face communication that WebEx meetings and the like leave behind.Moreover, at many conferences, you go less for the speakers and more for the networking (which is difficult to replicate online, at least for now). And even bleeding-edge technology companies host their own conferences that attract tons of people - Dreamforce comes to mind. While I do believe that the growth rate of events may moderate due to increasing utilization of technology - similar to how I would expect more and more corporate consulting to be done remotely, reducing wasteful T&E - I think this is more like a point or two off the future growth rather than an existential question. However you choose to size the market, Cvent seems to have a fairly long runway of growth.This is especially the case because I believe they're not pushing price nearly as hard as they could. As I'll cover in the next section, the company is focused on revenue growth rather than profitability right now - but the reason for this is because they believe they already have a significant lead, and they want to cement it by winning the market as fast as they can. In the words of Billy Newman, Cvent's VP of Financial Planning and Analysis, ""we want the volume from the planners to hotels to become so strong that we provide so much value that unlike the OTAs, they are afraid of creating another OTA.""The company is also going both up and downmarket to solidify its position. The new Cvent Express product requires minimal to no training and can be used by anyone - good for simple events, in other words. And on the other end, the company has added capabilities for ""complex events"" of up to 25,000 attendees.Proven History Of Profitability… And More Could ComeTo investors for whom companies are just blinking numbers on a Bloomberg terminal or Excel spreadsheet, the ""story"" may not matter much - but I always like digging into how companies got to be the way they are, as I think it says something about where they're going and why.Within that framework, Cvent's history - which they lay bare for anyone to see - is quite interesting. The company raised capital amidst the tech bubble and were encouraged to spend it all; when things imploded, they had to cut headcount by 80%. Most of the founding executives stayed, though - founder-CEO Reggie Aggarwal lived with his parents to conserve costs and personally signed the lease for the company's office despite the risk of bankruptcy permanently impairing his backup option (going back to practicing law).The company survived, though - and more than that, by focusing on customers, Cvent grew organically over time. What's more, they were actually profitable. Some lessons, you never forget.As I referenced, since the IPO, they are reinvesting heavily into sales and marketing, but they're still posting double-digit EBITDA margins despite posting >30% revenue growth. This is obviously an impressive combination. The company may also be able to push pricing over time once it's the dominant market leader - I wouldn't necessarily build this into my model, but it's a potential source of future upside.While there's a lot to like here, the problem is valuation. Even after the dramatic sell-off this month, though, it's hard to argue shares are cheap at over 5x trailing EV/revenues. Even if you ""grossed up"" EBITDA to the target model - i.e. what it would be if they were only growing at, say, 20%/yr - you'd still be trading at ~25x trailing adjusted EBITDA.If you believe in the long-term growth story, there could be room for upside here - Concur famously ended up being acquired for a nosebleed 11x revenues with a similar growth rate and lower gross margin. That said, betting on a higher public-markets multiple (or M&A) doesn't seem like a very good strategy, and I think an investment in Cvent at this price has to be based on the premise of future execution rather than multiple expansion.Wrapping It UpRelative to most value investors, I take a much more favorable view of software and ""growth"" companies. I'm just not willing to pay up the usual multiples for them. If Cvent's multiple got unreasonably clobbered on a few quarters of weak sales execution and I believed the long-term value proposition was still intact, I would find it to be an interesting proposition, but it's not right for me at this price.Relative to the rest of the small SaaS company landscape, though, Cvent seems to have fewer questions along with a clearer path to target profitability. I think that makes it one that's worth keeping on your radar - the current sell-off isn't deep enough to call it compelling, but at a turn or so lower on the multiple, I think it would be worth a look for risk-tolerant growth investors.Disclaimer: Investing is inherently subjective and this article expresses opinions. Any investment involves substantial risks, including the complete loss of capital. Any forecasts or estimates are for illustrative purpose only. Use of this opinion is at your own risk and proper due diligence should be done prior to making any investment decision. Positions in securities mentioned are disclosed; however, the author may continue to transact in any securities without further disclosure.This is not an offer to sell or a solicitation of an offer to buy any security. All expressions of opinion are subject to change without notice and the author does not undertake to update or supplement this piece or any of the information contained herein. All the information presented is presented ""as is,"" without warranty of any kind. The author makes no representation, express or implied, as to the accuracy, timeliness, or completeness of any such information or with regard to the results to be obtained from its use."
