article_id,author_id,publish_on,summary,content
1619582,24145,2013-08-08T14:35:00-04:00,,"Based in McLean, VA, Cvent (NYSE:CVT) scheduled an $101 million IPO with a market capitalization of $697 million at a price range mid-point of $18, for Friday, August 9, 2013.Nine other IPOs were scheduled for the week of August 5. The full IPO calendar can be found at IPOpremium.SummaryCVT is a leading cloud-based enterprise event management platform, providing solutions for both sides of the events and meetings value chain. Revenue Is mostly recurring, subscription-based.Year-over-year top line revenue increases have been in the range of 37%. CVT, however, lost money on Q1 '13 and estimates a bigger loss in Q2 '13, using the 'going IPO' excuse.ValuationGlossaryConclusionEven though recent financials are not that promising, investors want to buy subscription-based cloud companies on their IPO: buy CVT on the IPO.To put the conclusions and observations in context, the following is reorganized, edited, and summarized from the full S-1 referenced above:Q2 '13 lossThe net income decrease reflects an increase in general and administrative costs that were primarily related to increases in headcount for administrative operations necessary to prepare for an initial public offering and operate as a public company, depreciation and amortization, stock-based compensation, foreign currency losses and acquisition costs.CVT expects general and administrative costs to increase in absolute dollars and as a percentage of revenue as CVT continue to expand operations, hire additional personnel and transition from being a private company to a public company.BusinessCVT is a leading cloud-based enterprise event management platform, providing solutions for both sides of the events and meetings value chain: (i) event and meeting planners, and (ii) hotels and venues.Event and meeting planner customers include enterprises such as corporations, associations, not-for-profits, government agencies and universities.These customers enter into annual and multi-year subscription contracts to utilize part or all of CVT's cloud-based software solutions to plan, manage and execute enterprise events and meetings including external events, such as conferences, tradeshows, and customer events, as well as internal events, such as sales meetings, training seminars and team-building events.As of December 31, 2012, CVT had more than 6,200 event and meeting planner customers. CVT's event and meeting planner customers used event management solutions to execute more than 139,000 events and meetings and managed 7.3 million registrations during the year ended December 31, 2012. CVT's generally recognize revenue from these contracts ratably over the term of the contract.Hotels and venuesOn the other side of the event value chain, hotels and venues utilize CVT's online marketing solutions to generate more visibility with ready-to-transact event and meeting planners.CVT's online marketplace, the Cvent Supplier Network, or CSN, connects tens of thousands of event and meeting planners seeking the best venue for their event with more than 200,000 venues in CVT's proprietary database.CVT believes that its CSN contains the world's largest, most accurate and searchable database of detailed meeting venue information with listings of hotels, conference centers, convention centers, resorts, restaurants, museums, country clubs, wineries, castles and other special event venues in more than 175 countries.Hotels and venues enter into annual and multi-year advertising contracts with CVT for marketing solutions that increase the prominence of their properties in CVT's CSN; CVT recognizes the revenue from these marketing solutions over the term of the agreement based on the estimated selling prices of each solution.As of December 31, 2012, CVT had more than 30,000 active CSN event and meeting planner users. The CSN is available with the same functionality to users of the paid subscription event and meeting platform solutions as well as to event and meeting planners that simply visit the CSN site and establish a free user account.Competition• existing manual, paper and spreadsheet-based systems that corporate personnel employ to organize events by themselves in a fragmented manner. For example, a significant number of planners process registrations by asking attendees to fill out PDF forms and aggregate that information manually using various office tools. They also frequently lack the ability to process registration payments online. Venue searches and bookings are often processed either by phone or email, while tracking of budget and expense is done on an ad-hoc basis through spreadsheets;• event and meeting management firms such as The Active Network, primarily through its StarCite business that it acquired in 2012;• online event registration vendors focused primarily on consumer ticketing such as Eventbrite; and• small and large companies that offer point solutions that compete with some of the features present in our platform, such as registration management, travel management, venue bookings, web survey providers, email marketers and mobile app developer5% stockholders pre-IPO, non-managementEntities affiliated with Insight Venture Management, LLC, 26% Entities affiliated with New Enterprise Associates, Inc, 22%EmployeesAs of May 31, 2013, CVT had 1,300 employees between its operations in the United States and India.Use of proceedsCVT expects to net $91 million from its IPO.Proceeds area allocated to working capital and general corporate purposes.Disclaimer: This CVT IPO report is based on a reading and analysis of CVT's S-1 filing, which can be found here, and a separate, independent analysis by IPOdesktop.com. There are no unattributed direct quotes in this article.Disclosure: I have no positions in any stocks mentioned, and no plans to initiate any positions within the next 72 hours. I wrote this article myself, and it expresses my own opinions. I am not receiving compensation for it. I have no business relationship with any company whose stock is mentioned in this article."
2263043,66133,2014-06-12T06:12:25-04:00,"Cvent has created a business model around solving the problem companies didn't know they had: optimizing their events and meetings.Great financials, consistently strong revenue growth, margin expansion, and a big pile of cash.Cvent's $1 billion market capitalization is possibly a little overblown.","In business, one of the greatest coups a company can pull off is convincing the market it needs to solve a problem it didn't know it even had. Listerine convinced the world they had bad breath and needed to solve it in the 1920's. Apple (NASDAQ:AAPL) convinced us all that we needed a tablet to go with our laptop and smart phone in 2010. And right now, Cvent (NYSE:CVT) is convincing businesses that they need a meeting management platform, and customers are flocking in droves, generating Cvent's current market cap of just over $1 billion. However, this valuation is actually about 24% down from its IPO in August of 2013, and when one looks further under the hood, it becomes hard to even justify this value.Business overviewCvent's product is a cloud-based software platform used to plan, organize, and optimize all of your company's sizeable events and meetings. Not necessarily the ""let's go down into the conference room and discuss these pages quick"" meetings, but aimed more towards conferences, trade shows, and other emporiums. These meetings do have a sizeable cost impact on a business, as pointed out on the 4Q earnings call:The incumbent competitor to Cvent in this industry is a hodge-podge of word processors, emails and basic services a conference venue may offer, forcing the end-user to stitch several workstreams together, hoping the attendee does not notice the lack of cohesion. Cvent's business model also highlights the significant opportunity for the customer to focus more on its attendees, providing targeted analytics attendees to woo them into coming back next year, and maybe to a couple more events as well. It supplements this core offering with venue/event marketing services and ticketing capabilities, targeting smaller venues that TicketMaster passes over.FinancialsCvent booked $31.4M of revenue in 1Q 2014, good for 29% growth from prior year, accompanied by a gross margin of 70.7%, a good sign after a worrisome downward trend over the course of 2013 (explained as relating to increased customer service headcount).(Source: Cvent 2013 10K, 1Q 2014 10Q)Cvent bucks the trend of high-flying tech companies by actually demonstrating profitability, a milestone that many cloud-based firms have difficulty reaching without deep cost cuts that tamper with top-line growth.(Source: Cvent 2013 10K)The decrease in EBITDA margin from 2012 to 2013 of 11.8 points is attributed by management to a shift towards investing in sales & marketing hiring in the back half of 2013, with continued investment planned to continue through 2014. This is to be expected, as it comes on the heels of its August 2013 IPO. Cvent does not have any clear competitors in the meeting management domain, and has a huge runway for expansion of its product's audience. Management has a strong grasp on its cost footprint and is able to play with the operating expenses to a large degree due to a strong cash position, with $202M of cash and short term investments sitting in the coffers. CEO Reggie Aggarwal actively acknowledges this, as from the 1Q earnings:ValuationSo lots of cash on the books, no debt, profitable, no strong competitors and a lot of room to expand (Cvent booked 91% of its revenue in the U.S.! There's a whole world out there conducting meetings like cavemen!)… What's not to love?With all this comes a very pricey valuation. Cvent currently has a market capitalization of just over $1 billion, and an enterprise value of $800M. That EV is ~7x 2013's revenue, and 137x last year's EBITDA! That is a serious premium!One can see some operational levers Cvent can pull, as it has demonstrated an ability to run its business previously with EBITDA margins around 25%, and management is committed to be at that margin level, or greater, over the long term. Cvent also grew its customer base by 15% from 2012 to 2013, with revenue growing almost double that rate, up 29% year-over-year. This is due to its successful ""land and expand"" strategy of increasing revenue with its existing customer base, a good quality to exhibit. Really, Cvent shows great growth across the bevy of metrics it judges itself on:(Source: Cvent 2013 10K)An even better indicator of the business's health is when one focuses on dollars associated with each meeting that is managed, on a per-meeting basis. Cvent does not release hard customer numbers, but one can use ""events and meetings arranged"" as a high-level proxy for customer-related metrics, such as acquisition costs and lifetime value.(Source: Cvent 2013 10K)As one can see above, acquisition costs for a new meeting are falling over time, down 37% from 2012 to 2013, and are dwarfed by the revenue stream one can expect over the lifetime value of a meeting, expecting to receive almost 6 times as much value from a customer is acquires (this is assuming 70% of sales & marketing spend goes towards new customer acquisition, and uses an estimated 5% annual churn as gleamed from recent earnings calls). Lastly, Cvent has a great backlog of revenue already sitting on the balance sheet, with $70M in deferred revenue booked as of 1Q 2014, equaling to about 2/3rds of the expected 2014 revenue alone.However, taking all this into account, it is almost impossible to justify its billion dollar valuation. I arrive somewhere in the $825M range, about a $20 per-share price, down from the current value of $25.16 (as of June 10th), and I wouldn't even say my model is particularly conservative. To arrive at my current valuation, my assumptions are:Below is a snapshot of the output, modeled on my assumptions stated above. You can download my full model here.(Source: Cvent 2013 10K, 1Q 2014 10Q, model linked above - figures in millions except per/share counts)To get in the realm of its current market capitalization, Cvent will need to:Compared to those who are long-term holders on Cvent, I believe our key differences on the target share price center around Cvent's ability to sustain revenue growth greater than 25% over the long term. I chalk my revenue bearishness on my expectation for competition to enter in the near future, and expect it to be fierce. As a completely anecdotal data point, the pairing of ""offline data"" and ""online data"" has become a recent point of interest for marketers, and Cvent's product is a very logical offering for an enterprise-focused company to enter into, such as Google (NASDAQ:GOOGL) and Microsoft (NASDAQ:MSFT). The Wall Street shorts have also taken notice, with the ""short percentage of float"" at 13.3% (though, in Cvent's defense, this is not atypical to see with cloud-based companies currently, with many sitting in the double digits on this metric).The stock has already seen a strong pullback in its short-lived existence since its August IPO, down 24%. One can see the strong decline beginning in early March with its share price, where it diverged from the rest of its NASDAQ (NASDAQ:QQQ) brethren. I can't find a seminal event that may have instigated this sell-off, but investors may have grown weary of good-but-not-amazing revenue growth in a sector with a lot of room to run, and Cvent continuing to sit on a treasure chest of cash.(Source: Google Finance)ConclusionCvent has seemingly convinced the market that an event management service needs to be in every CMO's toolkit, and are reaping the rewards for ingenuity. Cvent appears to be a well-oiled machine with great operations, demonstrated profitability, a ton of cash and no debt, providing ample room to invest and acquire. However, a $1 billion market capitalization is tough to wrap one's head around with its current financials. I would advise to wait for an even deeper pullback and continued demonstration of growth and margin expansion, as there is a great deal more downside than upside with this firm.Disclosure: The author has no positions in any stocks mentioned, and no plans to initiate any positions within the next 72 hours. The author wrote this article themselves, and it expresses their own opinions. The author is not receiving compensation for it (other than from Seeking Alpha). The author has no business relationship with any company whose stock is mentioned in this article."
1628622,25120,2013-08-12T10:53:46-04:00,,"Cvent (NYSE:CVT) made its public debut on Friday, August the 9th. Shares of the cloud-based enterprise event management platform, ended their first day with gains of 56.8% at $32.92 per share.As investors in today's public offering market bid up shares of all companies which engage in ""cloud"" activities, the current valuation has become too expensive to me.The Public OfferingCvent has a mission to transform the events and meetings industry. With its cloud-based software platform it will disrupt the traditional planning system, creating more value for event planners. The cloud-based solutions address the entire lifecycle of the event, from agenda to venues. Event planners have access to a proprietary database of hotel and venue information, accessible online.Cvent sold 5.6 million shares for $21 apiece, thereby raising $118 million in gross proceeds. All shares will be sold by the company with no shares being offered by selling shareholders.The public offering values the equity of the firm at $813 million. The offering took place above the high end of the preliminary $17-$19 offer range.Some 14% of the total shares were offered in the public offering. At Friday's closing price of $32.92 per share, the firm is valued around $1.27 billion.The major banks that brought the company public were Morgan Stanley (NYSE:MS), Goldman Sachs (NYSE:GS), Stifel, Pacific Crest Securities and Needham & Company.ValuationWith it solutions, Cvent creates value for both event and meeting planners by making their lives a lot easier. Cvent makes it easier for hotels and other venues to advertise their capabilities to organize and host meetings or events.At the end of 2012, Cvent had some 6,200 event and meeting customers. In total some 7.3 million people subscribed for some 139,000 events through 2012 which were facilitated by the company.According to research company Frost & Sullivan, the events and meetings industry, totaled some $5.6 billion over the past year. This is according to a section within Cvent's S1-Filing. The traditional market for non-software event and meeting management was $22 billion, which Cvent hopes to make much more efficient with is proprietary platform.Key customers of Cvent include large companies like Visa (NYSE:V), Wal-Mart (NYSE:WMT) and Hyatt Hotels (NYSE:H), among others.For the year 2012, Cvent generated annual revenues of $83.5 million, up 37.2% on the year before. Net income totaled $4.3 million compared to a $0.2 million loss in 2011.First quarter revenues were up by 33.5% to $24.4 million. Net income fell from $0.9 million to $0.3 million.Cvent operates with $40.9 million in cash and equivalents. The company operates without the assumption of debt, or preferred stock investments. Factoring in the $118 million in gross proceeds from the public offering and the company will operate with a net cash position of almost $150 million.As such operating assets of the firm are valued around $1.12 billion. This values the operations of Cvent at 13.4 times annual revenues and an incredible 260 times annual earnings.Investment ThesisAs noted above, the offering of Cvent has been a huge success. Shares were offered above the high end of the preliminary offering range. On top of that came opening day returns of almost 57%. At Friday's close, shares are trading some 83% above the midpoint of the preliminary offering range.Cvent generates some 70% of its total revenues from its platform solutions, through licenses generated from planner customers. Some 30% of revenues are generated through marketing solutions, predominantly as hotels and other venues advertise to end up high on the search list of CVT's online market place. The market place hosts some 200,000 venues at the moment across 175 countries.The company, which has been founded back in 1999, has shown steady growth in recent yeas. Yet there are some risks to Cvent's operations. This includes the lack of current profitability, the vulnerability to a deterioration of general economic conditions, technological changes, and the fact that over half of its employees are based in India.I remain a bit skeptic. Cvent guides for second quarter revenues of $26.7-$26.9 million, implying revenues will be up 35-36% compared to last year. Net losses are expected to come in between $2.0 and $2.5 million as the company is preparing for its public offering. At this pace full year revenues of $110-$120 million are possible, while the company will most likely roughly break-even. After the successful debut, shares are way too expensive on sales multiples, even accounting for 35% growth in revenues.I remain on the sidelines.Disclosure: I have no positions in any stocks mentioned, and no plans to initiate any positions within the next 72 hours. I wrote this article myself, and it expresses my own opinions. I am not receiving compensation for it (other than from Seeking Alpha). I have no business relationship with any company whose stock is mentioned in this article."
1637202,20952,2013-08-15T04:44:54-04:00,,"Company: Cvent, Inc.Symbol: (NYSE:CVT)Source: IPO prospectus.Summary:The company is a leading provider of cloud-based event management solutions. The company provides solutions for both sides of the events and meetings value chain.Its solution addresses the entire event lifecycle by allowing event and meeting planners to organize, market and manage their meetings, conferences, tradeshows and other events.Its online marketplace connects event planners and venues through its proprietary database of detailed hotel and venue information. In 2012, its Fortune 1000 event and meeting planner customers managed an average of 630 events and meetings on its platform.Investment theme/thesis:The company has shown very strong financial performance in the past few years and is expected to continue its growth momentum in the future. Everything looks good for the company except the valuations. I will avoid the company just because of its valuations. At these valuations, all the positive (for the company as well for the industry) seems to be priced-in. So, for the time being, I will wait for some pullback in the prices before considering it as an investment opportunity.Solutions offered:Solutions for Event and Meeting Planners: Its cloud-based platform offers six major products:Solutions for Hotels and Venues: hotels and venues enter into annual and multi-year contracts with the company for marketing solutions that increase the prominence of their properties in its CSN.Cvent Supplier Network or CSNCvent Supplier Network, or CSN, connects tens of thousands of planners seeking the best venue for their events and meetings with more than 200,000 venues featured in its proprietary database. As per the company CSN contains the world's largest, most accurate database of detailed meeting venue information with listings of venues in more than 175 countries that can be searched and filtered. The number of event requests for proposal, or RFPs, submitted through its CSN has increased considerably from approximately 12,000 in 2008 to approximately 1.1 million in 2012.Customers:Event and Meeting Planner Customers: (as of December 31, 2012, the company had more than 6,200 event and meeting planner customers). Its customers under this segment includes: Visa (NYSE:V), Merck (NYSE:MRK), Walmart (NYSE:WMT), etc.Hotel and Venue Customers: (as of December 31, 2012, more than 4,700 hotels and venues have purchased marketing solutions from the company). Its customers under this segment includes: Hilton, Hyatt (NYSE:H), Fairmount, etc.Operational and financial metrics:The following table presents its operational and financial metrics:Financials:Source of revenue:The company generates revenue from:Platform Subscriptions: the company generates the majority of its revenue through subscriptions for its event management solutions platform, pricing for which is based on the features and functionality selected.Marketing Solutions: marketing solutions revenue is generated through the delivery of various forms of advertising sold through annual or multi-year contracts to marketers, principally hotels and venues.The following table presents its revenue by segment:Income statement analysis:Key points:Balance sheet analysis:Market Opportunity (very positive): (Source: IPO prospectus page 76)""Events and meetings reach across every industry vertical, from consumer products to energy to healthcare. A 2013 independent study conducted by Frost & Sullivan, which was commissioned by us, estimated that the global market for events and meetings management, including such costs as accommodations, transportation and other support, was approximately $565 billion in 2012. Of that amount, Frost & Sullivan estimated that the global event management software market was $5.6 billion in 2012, which we view as an immediately addressable opportunity. The same study estimated that the global market for non-software event and meeting management was $22 billion in 2012, which included the additional labor of planning, managing and executing events and meetings using manual processes that we believe can be made more efficient by our platform.""The table below shows the market size of the industry (events and meetings management):Growth StrategyThe company intends to grow its market by:Risks:Normal business risks like: Emergence of new competitors with the better products/services, any adverse change in the Govt. regulations, the economic slowdown etc.Positives:Valuations:At $33 per share, the company is available at PE of about 295x (FY 2012).Conclusion:The company operates in an industry which is vastly underpenetrated and expected to show huge growth in years to come. Due to its strong balance-sheet, product/service quality and proprietary database the company is all set to get most out of this opportunity. However, at these valuations all the positive (for the company as well for the industry) seems to be priced-in.Disclaimer: Investments in stock markets carry significant risk, stock prices can rise or fall without any understandable or fundamental reasons. Enter only if one has the appetite to take risk and heart to withstand the volatile nature of the stock markets.This article reflects the personal views of the author about the company and one must read offer prospectus and consult its financial adviser before making any decision.Disclosure: I have no positions in any stocks mentioned, and no plans to initiate any positions within the next 72 hours. I wrote this article myself, and it expresses my own opinions. I am not receiving compensation for it (other than from Seeking Alpha). I have no business relationship with any company whose stock is mentioned in this article."
