article_id,author_id,publish_on,summary,content
4163521,104119,2018-04-17T14:00:36-04:00,"Tolstoy wrote, ""happy families are all alike; every unhappy family is unhappy in its own way."" Can a similar thing be said about bad stocks? I'm beginning to think so.There is an SNL skit about a change bank whose business is making change. It makes money on ""volume."" Similarly, despite ENV's strong sales growth, earnings are in the red.This won't get easier. As the Law of Large Numbers suggests, the larger a company becomes, the harder it is to grow. When, then, can investors expect strong profitability?Another feature of bad companies, in my opinion, is dilution. And ENV has diluted its shares by over 22% over the last five years.Capital structures that are heavy in goodwill put investors at risk of earnings charges. These write-downs are becoming more common. With 50% of its capital structure composed of goodwill, ENV's capital structures puts investors at risk.","Tolstoy, in his novel Anna Karenina, suggests that happy families are all alike; every unhappy family is unhappy in its own way. Can a similar thing be said about stocks? Are bad companies bad in similar ways? I'm beginning to believe that to be the case, with a few oft-recurring features: non-existent earnings growth (often with earnings in the red in spite of revenue growth), share dilution, as well as a risky capital structure.This brings us to Envestnet (ENV). ENV provides ""intelligent systems for wealth management and financial wellness,"" as it states in its 10-K. Its ""unified technology enhances advisor productivity and strengthens the wealth management process"" as well as ""empower[ing] enterprises and advisors to more fully understand their clients and deliver better outcomes.""It also has several of those features I mentioned above. Negative earnings, dilution, and a capital structure more than half of which is comprised of goodwill - for an earnings yield that doesn't beat the risk-free rate. Let's begin.There is a classic SNL skit about a change bank whose business is - quite literally - making change. If a customer comes into First Citiwide Change Bank with a twenty-dollar bill, for example, it will give him the change he wants - two tens, four fives, 20 ones, etc. - basically, the works. Jim Downey describes how First Citiwide Change Bank profits from this strategy:Of course, with this strategy, we know that First Citiwide Change Bank will make a lot of sales. If the demand for change is strong, its topline growth will be through the roof! As word spreads and demand grows, it will have great revenue increases every quarter.And no earnings.With that being said, let's look at ENV's revenue growth and see if, unlike First Citiwide Change Bank, ENV has been able to eke out a profit.ENV Revenue (TTM) data by YChartsAs we can see, despite nearly 800% TTM revenue growth over the period shown, earnings are worse than they were back in 2010, with the company failing to turn a profit. In fact, an increase in revenue has hindered its bottom line, causing COGS and SG&A to increase even more rapidly - not unlike our friends at the change bank.This raises the question: if 800% revenue growth hasn't improved its bottom line over nearly 10 years, what will it take? Growth is easier, mathematically, from smaller numbers; as revenues get bigger, and its sales take up more and more of the market, growth will be harder, and more operational cuts will be required. It is the law of large numbers:To me, this means that if ENV hasn't been able to translate sales growth into earnings growth already, it will only become harder in the future. And investors, in my opinion, shouldn't stick around to find out if ENV can eke out a profit.The next feature of bad companies seems to be - in my opinion - dilution. When a company issues additional shares, an existing investor's proportional ownership in that company is reduced. Indeed, a company's choice of capital structure may convey management's (negative) expectations about the company's prospects. While higher debt ratios are binding constraints that may signal positive management expectations concerning future cash flows; in contrast, share issues may be a negative signal about management's expectations.And as we can see, ENV has diluted shares over 22% over the last five years.ENV Average Diluted Shares Outstanding (Annual) data by YChartsTo demonstrate why dilution is so bad for shareholder value (and no, acquisitions funded with shares are not an exception; they tend to fare worse for shareholders than those funded with cash), let's use the following assumptions in a though experiment:1. Let's assume that the next five years resemble the last five years and ENV increases its share count by 22.6%.2. Let's assume that ENV manages to double its revenue in that same period.3. Let's assume we buy 100 shares at its current price of ~$54.75.Source: Author's WorkEven in that very charitable situation, because it diluted its shares, shareholders will find their return muted, as we can see:Source: Author's WorkTo break it down:Now, this revenue growth assumption is charitable; I don't believe ENV will double its revenue in five years (there's that law of large numbers again!). So, the point is this. A revenue increase doesn't equal a share increase. We're rewarded on a per share basis. And management's decision to dilute shares will impact your return negatively. Thus, I believe investors should avoid dilutive companies like ENV.The third feature a lot of bad companies have - in my opinion - is a capital structure largely comprised of goodwill. It is a problem because:Hence, investors should be wary of ENV's capital structure, which is made up of more than 50% goodwill alone.Source: YCharts Quarterly Numbers & Author's CompilationAs described above, this puts investors at risk of earnings impairment charges - something that would be bad for investors' bottom line. With ENV already struggling to turn a profit, this would be very bad news for investors.Product Quality Is Built Into Its PriceLet's not forget that, no matter how amazing a company's products are, the positive sentiment regarding its products is already built into its price. This public information is not news to the market. Consider the behavioral finance research into attribution bias:Source: Advances in Behavioral Finance, edited by Richard H. Thaler, pg. 42.Here's what, in my opinion, this research means for us. When we read positive information about a company, like the positive reviews above, we need to be careful. If we were already bullish on a company like ENV, that positively-reinforcing ""news"" will asymmetrically increase our bullishness, while any negative information is discounted away.Investing shouldn't be about nice narratives. It should be about paying a good price for a company's future earnings. Narratives about products often get in the way of a true analysis of the company's profitability.As Tolstoy wrote in Anna Karenina, happy families are all alike; every unhappy family is unhappy in its own way. I'm beginning to believe that a similar picture can be painted of bad firms, with bad companies having a few oft-recurring features: non-existent earnings growth (often with earnings in the red in spite of high revenue growth), share dilution, as well as a risky capital structure.ENV is one such company. Not unlike our change bank, ENV makes a lot of sales and no earnings. Despite nearly 800% TTM revenue growth, earnings are worse than they were back in 2010 and its bottom-line is in the red. (Plus, now with a denominator 800% bigger, it has the additional problem that arises from the growth from larger numbers - that is, the law of large numbers.) Next, it has diluted its shares over 22% over the last five years alone. And half of its capital structure is composed of goodwill, which puts investors at risk of unexpected earnings charges.Taking a quick look at its earnings yield shows that it's -0.15%. If an equity can't beat the two-year risk-free rate - 2.37% - it is simply not worth the risk of its shares, and investors would be better off buying that T-bill. Avoid ENV; in my opinion, it's just not worth the risk."
4385421,105619,2020-11-05T14:49:02-05:00,"As the largest Turnkey Asset Management Platform by far (70% of the market by assets), Envestnet has a significant lead over peers in the space.The Pandemic should serve to accelerate the adoption of digital wealth management technologies as advisors seek to become more efficient and do more with less.We believe the stock trades at a slight discount to fair value, but that there is scope for the market to see greater potential in the near term.","Envestnet's leadership position puts it in the best position to capitalize on its sizable customer base at scale. As the leader in Turnkey Asset Management Platform provider to wealth managers, there is ample opportunity to upsell additional tools and services they need to better-advise and improve efficiency. The company's more recent investments into Fintech, particularly Open Banking, are helping to broaden out what Envestnet can offer customers as it continues to build out an ecosystem of services to consolidate banking, wealth management, credit, loans and mortgages. We see upside potential for Envestnet given Pandemic-related tailwinds and good progress being made with Open Banking. We are long-term bullish on Envestnet.Envestnet was founded after Jud Bergman left Nuveen where he was head of mutual funds as firm was not interested in backing the venture, so he set out to create software tools that would help financial advisers break away from big institutions and set up their own shops. Envestnet grew into a major Chicago fintech firm, acquiring other companies along the way as it built extensive performance-tracking, portfolio rebalancing, administrative and other software services for adviser clients and large institutions such as Fidelity.Source: 2019 Investor PresentationAcquisitions have allowed Envestnet to take greater share of the advisory market and put data at the center of its growth strategy. Notable ones include: Finance Logix (2015) put Envestnet's data into containers and made it more nimble. Yodlee (2015) data extraction platform with existing data they could use. Wheelhouse Analytics (2016), Yodlee is the extractor for the data, Wheelhouse is the refinery. FolioDynamix (2017), took out their largest competitor, effectively locking down the entire market and acquired another 3.2m accounts with data. Portfolio Center (2019), Tamarac is built on top of Portfolio Center and bought data on thousands more firms. MoneyGuide Pro (2019), 34 years of financial planning data and access to insurance sales tools.The company has successfully disrupted the wealth management sector and is ready to disrupt the broader financial services industry by using data to drive additional value-added services to their customers like insurance and credit.The business is comprised of 2 segments:Wealth Solutions: software and services to empower financial advisors at banks, broker-dealers and RIAs to deliver holistic wealth management to their clients. The tools and services cover: financial planning, risk assessment, investment strategies and solutions, asset allocation models, research, portfolio construction, proposal generation, paperwork preparation, model management, account rebalancing, monitoring, customized fee billing, overlay services (asset allocation, tax management and socially responsible investing), aggregated multi‑custodian performance reporting and communication tools, plus data analytics.Screenshots of Envestnet Taramac, source: Company WebsiteData & Analytics: Gathers, refines and aggregates a massive set of end-user permissioned transaction level data, and combines these with financial applications, reports, market research analysis, and APIs for customers. Includes the provision of data analytics, mobile sales solutions, and online educational tools to financial advisors, asset managers and enterprises.Envestnet runs an Enterprise SaaS, as it provides asset-based, subscription-based and professional services on a B2B2C basis to financial services clients, whereby customers offer solutions based on the platform to their end users. Asset-based recurring revenues consist of fees for providing customers access to platform services. The fee percentage varies based on the level and type of services the provided, as well as the asset values of customer accounts and is therefore sensitive to market fluctuations. Subscription based recurring revenues primarily consist of fees for providing customers access to the company's platform for wealth management and financial wellness. Subscription based fees include fixed fees and or usage-based fees and vary according to the scope of technology solutions and services used. Professional services revenue is generated from client onboarding, technology development and other project related work, which tends to be more variable than the rest of the business.Envestnet's Wealth Business is exposed to a $39bn TAM of which 25% is Turn-Key Asset Management Platform or 'TAMP' and the remainder spread across specific use-cases of their technology.Source: 2019 Investor PresentationTAM growth is driven by rising number of financial advisors adopting technology, more accounts per advisor and the relevance of the technology in more verticals e.g. not just RIAs, but banks, insurance companies, private banking and credit unions. Advised assets in the USA are expected to increase from $8.4 trillion in 2017 to $12.1 trillion in 2022 Cerulli Associates an 8% CAGR.The main competitors in the TAMP space are SEI (SEIC) and AssetMark (AMK), although there are many smaller tech firms offering some of their capabilities:Source: IBISWorld 2020 Financial Planning & Advice Industry in the US - Market Research ReportEuropean competitors include Bravura, FNZ, Novia, Nucleaus, Aviva, Fidelity, Standard Life, Tilney, St James Place among others.Envestnet is the largest US TAMP by assets under management, with 42% of the US advisory market's assets on its platform at $182bn. About one-third of US advisors use Envestnet's technology:Source: The WealthAdvisor American's Best TAMPS reportWe believe Envestnet has 3 distinct competitive advantages vs peers:We ran a 2-stage DCF model using the following base-case assumptions:Expected revenue growth for the next 2 years using consensus and trailed thereafter to achieve 10% p.a. over 10 years, 2% above 8% expected TAM growth of US advised assets, reflecting Envestnet taking additional market share and expanding internationally. We expect wealth managers to continue to turn to technology providers like Envestnet to generate efficiencies, comply with regulations and compete with Robo advisors. Terminal rate of 2.0% - above current 10-year yield which is depressed given extraordinary market conditions.We expect current Operating Margins of to reach 25% over 10 years, which is in line with more established SEI (28%). This reflects the business maintaining its market position as the leading TAMP for advisors and achieving scale benefits. We also assume some light take-up of vertical services via the platform including insurance, credit and advisory marketplaces.Source: Author's calculationsOur DCF indicates that a fair price for the stock is $87, although we can certainly see an upside case towards 15% revenue CAGR and 27% Operating Margins, which would see a fair value of $131. This Bullish scenario assumes Envestnet maintains its leadership position and takes half the US advisory market which would double its revenue, but also manages to scale its credit, insurance and advisor marketplace offerings which could add another $1.5bn in revenue, or compounding at 15% each year for the next 10 years.The company is due to report next on 5 November 2020, and we believe management will surprise to the upside given Pandemic-related tailwinds and good progress being made with Open Banking, where Envestnet has agreements with 5 of the top 10 US banks and is progressing with 25 in total - we're likely to get an announcement on additional progress. On their last earnings call management talked about the strong fintech momentum they were seeing with Yodlee - we expect a continuation of this given accelerated digital adoption.Envestnet is the largest provider of wealth management technology to financial advisors with over 103k financial advisors who oversee 12.3m accounts and $3.3t in assets administered via its technology. The company is focused on growing its market share and scaling its business to offer additional products and services to further enhance its market position and deliver profitability. As the largest TAMP by far (70% of the market by assets), Envestnet has a significant lead over peers in the space, and can work from this position of strength to build out additional capabilities and functionality into its platform, in addition to taking advantage of the large volumes of data it has visibility over. We believe the stock currently trades at a slight discount to fair value, and do not think a more optimistic upside scenario is unlikely given its position of strength, it is well-placed to execute. The Pandemic should serve to accelerate the adoption of digital wealth management technologies as advisors seek to become more efficient and do more with less."
4111207,87566,2017-10-02T20:54:44-04:00,"Envestnet is a financial services company that provides financial and wealth management technology to investors, advisors, and service providers.Positive forecasts come from analysts polled by Nasdaq, who suggest that the company will grow earnings at an annual rate of 15% over the next 5 years.The share price is up 41.7% in the year to date and 37.04% over the past twelve months, and currently trades at $49.95.","By Oisin Breen, ResearchEnvestnet (NYSE:ENV) is a financial services company that provides financial and wealth management technology to investors, advisors, and service providers. The company, through its fairly recently, acquired Yodlee platform also provides data aggregation and data analytics services. As an investment opportunity itself, the Chicago-based company has had a strong year. Its share price is up 41.7% in the year to date and 37.04% over the past twelve months, and currently trades at $49.95. ENV has a market capitalisation of $2.199 billion, and interestingly, it has just agreed to buy its close rival, FolioDynamix, for what seems like a cut-price $195 million from Actua Corporation (NASDAQ:ACTA).With this purchase, Envestnet, as Ed Swenson of Dynasty Financial Partners notes, becomes ""a true leader in the [fintech, analytics, and advice] space."" Indeed, not only does the deal seem somewhat of a steal, the 3.2 million extra accounts coming on board for Envestnet is excellent news and will certainly help to address fears that Envestnet is failing to market itself as much as it could to its addressable market. Furthermore, given that the company has yet to see its share price return to previous highs after the plunge that followed the Yodlee deal, there would seem to be growth potential left in the Chicagoan company. Indeed, analysts from Stifel Nicolaus and JMP Securities seem to agree, setting price targets of $52 (+4%) and $56 (+11%), respectively. Additionally, should markets react well to the FolioDynamix deal, these price targets may need to be revised upwards.Envestnet 1-Year Share Price(Source: Bloomberg)In terms of finances, the company has seen its expenditure occasionally rise, in part based on its M&A activity, which has been consistent and targeted. Since ENV's IPO in 2010, when it was priced at $9, it has acquired companies such as Tamarac, the aforementioned Yodlee, online investment platform Upside, Finance Logix, Wheelhouse Analytics, and most recently, has set up the deal for FolioDynamix. Envestnet's most recent earnings report was broadly positive, with second-quarter earnings up 38.10% year over year, whilst the company's average growth over the past four years is an excellent 34.85%.Envestnet Earnings History + Forecasts(Source: FT)Forward guidance for the company, taken from the latest earnings transcript, suggests that revenues ought to come in somewhere between the $667 million and $673 million mark, which is growth of upwards of 15% year over year, whilst EBITA guidance expects growth of up to 29% compared to 2016, in the range of $125-128 million. EPS guidance is also positive and expected to pull Envestnet out of the brief, albeit strong, drop it has suffered in EPS terms, with the figure analysts are suggesting being around the $0.35 mark. Further positive forecasts come from analysts polled by Nasdaq, who suggest that the company will grow earnings at annual rate of 15% over the next 5 years, with earnings expected to increase by up to 89.36% this year and 29.21% in 2018. It also looks clear that longer-term investors, in the form of institutions, are also banking on ENV's steady share price rise, with institutions owning 96% of the company's stock.Forecast Earnings Growth for ENV(Source: Nasdaq)The company's financial data is, however, not all positive. It has found it difficult, over the past few years, to fully integrate Yodlee, and suffered significant share price dilution as a result of the deal. That said, these bumps seem to be coming to an end, and synergies, most especially cross-selling, as the most recent earnings call makes clear, are now driving up earnings. Profit margins have suffered, it is true, yet it should be borne in mind that growth is always costly - and Envestnet is growing. Average three-year profit margins slumped to -1.5% owing to the last year's difficulties, although these figures are also showing signs of recovery.Gross, Operating, and Net Margins for ENV(Source: Macrotrends)The company's debt-to-equity levels, in the mid 50s, whilst high are not entirely unusual, and as long as Envestnet continues to pay down its debts, which it appears intent on, given its agreements with the Bank of Canada, as mentioned in the earnings report, its debt levels do not cause immediate alarm. Nevertheless, ENV will need to consolidate its acquisitions before embarking on much more spending.That said, the company is bullish about such considerations, inclusive of the new FolioDynamix deal. Indeed, as CEO Jud Bergman notes, Envestnet has been moving towards an open-architecture strategy called Open ENV, which Bergman believes gives his company a uniquely solid method for integrating companies like FolioDynamix into its own - meaning that, if Bergman is correct, short-term negatives owing to integrating the two companies ought to be minimized, whilst synergies ought to become evident quite quickly. With the FolioDynamix deal expected to close in Q1 2018, a net boost, which the company believes will impact EPS immediately, would certainly prove to be share price-positive. Furthermore, up to $20 million in cost synergies is expected within the first 36 months. So far, so good, though the Yodlee difficulties faced previously by Envestnet should not be forgotten.Envestnet CEO on the FolioDynamix acquisition(Source: Business Wire)The fact that earnings have been on the up, much like the company's share price, that they rose by $0.15 in the last quarter and are expected to rise by a further $0.45 this quarter, does suggest that Envestnet is back on the right track, as long as the FolioDynamix deal goes as planned. Indeed, as Jefferies Group analysts note, ENV's ""fundamentals more-or-less look intact longer-term, [and] [a]ny potential stock weakness [can be seen] as a buying opportunity."" Furthermore, should Envestnet break levels of resistance, which it has been testing, of around $50.05, the stock can be expected to post steady gains in the short-to-medium term. In the longer term, with the company growing its portfolio, establishing itself as a market leader, increasing its client base, and seemingly well into the process of addressing the difficulties it has faced for the past two years, ENV may well be a stock that is worth considering for your portfolio.Envestnet Revenues and Forecasts(Source: FT)Income Statement(Source: FT)Lastly, although it is true that the company has faced difficulties, it is certainly arguable that the large drop in the share price that occurred in 2016 was an overreaction to the dilutive purchase of Yodlee. Ultimately, with this acquisition, Envestnet increased its business, gained access to noteworthy clients, including Citigroup, HSBC, and JPMorgan Chase, and it also provided the company with a strong analytics platform that in the long run will serve it, its shareholders, and its customers well. As per the earnings call, the company's subscription and licensing revenue is set to continue to grow. It increased 27% year over year to record highs, and is expected to climb a further 20%. ENV's technology sales beat $33 billion, and with 6.5 million investor accounts on board and plenty of new clients in 2017, from Quantas to India's Kotak Bank and Axis Bank, to American Century Investments and lender Sierra Pacific, and increasing demand for services from banks, including Synovus, Hancock, and First Citizens, it's easy to see the positives in a long-term investment in ENV.Envestnet Income Statement(Source: FT)"
