article_id,author_id,publish_on,summary,content
3675506,87996,2015-11-11T09:01:45-05:00,"McKesson is among the stocks selected by Morgan Stanley as best bets for the next 12 months.McKesson has strong cash flow and balance sheet.Importantly, current market valuation seems to be rather conservative.","McKesson Corporation (NYSE:MCK) reported fiscal 2016 second quarter results on October 29. The revenues were USD 48.8 billion (up 10% compared to USD 44.2 billion a year ago). On a constant currency basis, revenues increased 14% over the prior year. Importantly, for the first half of the fiscal year, McKesson generated cash from operations of USD 1.3 billion, and ended the quarter with cash and cash equivalents of USD 5.4 billion. The Board of Directors authorized a new USD 2 billion share repurchase program.McKesson is among the stocks selected by Morgan Stanley as best bets for the next 12 months. In my previous article, I have focused on another stock from Morgan Stanley list - Ingersoll-Rand. I was slightly disappointed after analyzing its fundamentals, though. Ingersoll-Rand is in very good shape from business and financial perspective, its valuation seems to be quite stretched to me (see this). Is McKesson a different story?Empowering cash generationMcKesson is focused on healthcare services and information technology and it offers solutions that include pharmaceutical and medical-surgical supply management, and business and clinical services. Its stock went through remarkable rally in 2011 - 2014 period, gaining almost 30 % in 2012 and 2014, and more than 60 % in 2013. Nevertheless, the stock took approximately 10 % dive in 2015.McKesson grew revenues 30.32% from USD 137.39 billion to USD 179.05 billion in fiscal year 2015. Its net income rose by 16.86% from USD 1.26 billion to USD 1.48 billion. We can should note high return on equity: ROE reached 21.8 % in fiscal year 2015. The Company had more than USD 5 billion of cash and its interest bearing debt reached approximately USD 10 billion. EBITDA reached USD 3.3 billion in fiscal year 2015, and the ratio of net debt to EBITDA is therefore rather low. During current fiscal year the balance sheet got even stronger.I do not believe Morgan Stanley would recommend a company with weak cash flow, and McKesson is certainly not a negative surprise. Its cash flow from operations was stable at USD 3.1 billion in 2014 - 2015 period. As indicated above, McKesson generated cash from operations of USD 1.3 billion in H1 2016. As you can see from the first table below, it represents significant y-o-y improvement, and the same holds for cash flow after CapEx. Note that The Company generated USD 2.7 billion after CapEx in 2015, and USD 2.6 billion in fiscal year 2014 (see second table below).We can see the dividends and buybacks reached USD 530 million in fiscal year 2015, which is significantly below free cash flow to equity (i.e., cash flow after CapEx/total investments). As mentioned above, the directors have authorized a new USD 2 billion share repurchase program. This means the total payout to the shareholder will increase, but it will not harm the financial stability of the Company due to high free cash flow relative to the dividends and planned buybacks.Valuation thoughtsMcKesson trades with market cap of USD 42.5 billion. As indicated, fiscal 2016 cash flow after CapEx should be above 2015 level. Nevertheless, let`s be conservative and assume short term free cash flow standard is at USD 2.7 billion level reached in 2015. Stock`s beta is at 0.9, which means the required rate of return should be close to 7.1 % (using standard CAPM model).If we assume the cash flow will be stable in the future, its present value is equal to USD 35.8 billion. It is somewhat below current market cap and this means the market is somewhat more optimistic regarding the long term cash flow growth. It must reach 1.4 % for the present value of the cash flow to be equal to the current market cap. In other words, if the short term cash flow standard is similar to cash flow in fiscal year 2015, and long term cash flow growth reaches 1.4 %, the stock is valued fairly*.The 1.4 % hurdle seems to me rather conservative from macro, industry and company-specific point of view. Long term nominal growth of the US and other developed economies will almost certainly be higher than 1.4 %, and the same holds for the health care sector. We could argue the Company was not able to grow its free cash flow in 2015, but 2016 indicates this was an exception. And there does not seem to be an obvious reason, why the Company should not be able to grow at least as much as the overall economy. In other words, this may be one of the few remaining undervalued stocks in the US.*Please note this estimate assumes future acquisitions will be value neutral. I mention this mainly because in September 2015, the Company entered into an agreement to acquire the pharmaceutical distribution business of UDG Healthcare Plc based in Ireland for Euro 408 million in cash. In July 2015, the Company announced plans to acquire the pharmacy business of J Sainsbury Plc based in the U.K. for £ 125 million in cash. Under the terms of the transaction, we will acquire 281 pharmacies in the U.K. including 277 in-store pharmacies and four located in hospitals. In August 2015, The Company sold ZEE Medical business for a total purchase price of USD 134 million.Disclaimer: I encourage you to do your own research and analysis. I use information obtained from sources I believe to be reliable, but its accuracy and completeness are not guaranteed. Any examples shown here are for demonstrational purposes only. My articles are in no way a recommendation to buy or sell any asset. They are my personal opinion, I am happy if they can help you make your own."
3985564,101959,2016-06-30T14:25:11-04:00,"McKesson operates in an oligopoly with Cardinal Health and AmeriSourceBergen.Recent drug pricing fears have offered an entry point into all three.The comparison between the three shows the Aristocrat is the best, but all three make good long term investments.","I have recently done articles on Cardinal Health (NYSE: CAH) and AmeriSourceBergen (NYSE: ABC). They are two of the three companies who control the vast majority of the market share in the medical supply and pharmaceutical distribution space. I have been interested in this space mainly because of its high barriers to entry, and the share price declines all three of the companies have faced. Health care is also one of my favorite defensive sectors to overweight in my portfolio. The company I want to analyze today is McKesson (NYSE: MCK). I encourage anyone to go back and read the detailed analysis of Cardinal Health and AmeriSourceBergen and I will add a quantitative comparison of all three at the end.Source: McKesson FY2016 Annual ReportMcKesson is a pharmaceutical and medical supply distribution company operating with both distribution and technology solutions segments. However, distribution accounts for 98% of revenue, and that will be the majority of what is discussed.Source: McKesson 2015 10-KThis graphic will help illustrate their scale:Source: McKesson FY2016 Annual ReportMany of the qualitative factors working for and against McKesson will be macro ones, which affect their 2 primary competitors, as well. For that reason, I won't rehash them here, and will just talk about the company-specific opportunities and their recent acquisitions. I urge you to go back and read one of my other two articles on this sector which will discuss these.Many of McKesson's recent acquisitions in Europe could be cause for concern with investors due to the upcoming Brexit. American companies operating in the EU and UK will face uncertainty. However, if there were a sector to be confident in, it would be healthcare. McKesson should be able to weather any issues due to the recession resistant nature of its business, but it's still something to keep your eye on, and something that could sway a decision between McKesson, CAH, and ABC.Continued synergies from 2-year-old Celesio acquisition in Europe:In 2014, McKesson acquired German-based Celesio for $5.4 billion. This expanded their generic pharmaceutical business in Europe, and its synergies are still being realized. Management has guided for $275-$325 million in synergies. This added 132 wholesale branches supplying 65,000 pharmacies and hospitals in 14 European countries. On their most recent earnings call, management updated shareholders:John H. Hammergren - Chairman, President & Chief Executive OfficerAcquisition of UDG Healthcare in Ireland:Last year, McKesson acquired UDG Healthcare, which operates in both Irelands, for $466 million. They also acquired 281 pharmacies in the UK under the Sainsbury's brand. Both of these are part of a larger strategy for them to increase their European presence. Like I mentioned above, the recent Brexit may give the more conservative investor pause. In my personal opinion, I believe that businesses with strong balance sheets and cash generation capabilities should not have a problem.Additionally, McKesson has acquired 2 companies in America this year for $1.2 billion. Vantage Oncology and Biologics expand their oncology business and will be accretive to earnings in 2017. Integration is underway and we should get more status on the synergies provided on their Q1 2017 report. Investors should make sure to pay attention to their next earnings call, to verify that management is meeting their goals with regards to both acquisitions.With all of these purchases, their debt has been increasing. Management discussed this during their most recent earnings call:James Beer (EVP and CFO)This is something for investors to keep their eye on. Every acquisition carries risks of overpaying and underestimations of what will be required in terms of assimilation and integration. Additionally, companies can overextend themselves right before an economic downturn causing issues with liquidity. I don't think that this is an issue for them now, however, due to their stable cash flows and the low rate environment.Quantitative Analysis:McKesson is a dividend challenger, having raised their for 8 consecutive years. However, nobody would call them a high-yielder. At the current price of $176.31, it yields about .64%. It isn't a surprise, then, that their payout ratio is only 11%. I generally like to see one that is higher than that. This pretty much precludes investment for those interested in current income, but it shouldn't for those interested in total return. Let's look at its 1/3/5/10 year dividend growth rates:Source: David Fish's CCC ListThese are not bad growth rates if this were a higher yielding company, but compared to that of ABC and CAH, it seems very small. This isn't something that changes whether or not to invest in a company, since it's possible that they have better uses for their capital in other projects that will spur growth. As stated above, they have definitely been acquisitive, and if done right, that will reward shareholders with increased earnings.Through FY2016, they repurchased $1.5 billion worth of shares, and allocated $4 billion to acquisitions as well as paying down $1.5 billion in long term debt. Trust in the company's management that capital is better allocated on acquisitions than returning it to shareholders in the form of higher dividends or more buybacks is an important thing for an investor to decide before investing in a company.Their Return on Equity has been excellent: (numbers courtesy of MorningStar)The graph below illustrates their ROIC-WACC spread. This shows the creation of shareholder value as they grow, and that their capital allocation has been in their best interest. (numbers courtesy of GuruFocus)Their FCF yield is about 7.7%, which is average. Their free cash flow generation of $3 billion for 2015 versus ~$6 billion in long term debt shows that it is serviceable. However, it is something to keep an eye on.They have compounded their earnings at an 18% rate over the last 5 years, which is an outstanding level. They have guided for ~9.5% for the next 5, which is definitely enough to make investors happy. Their ttm P/E is 17.58 and forward is 11.89, which is comparable with others in their industry.I will discuss their net margin in the comparison of all three companies below, since I believe that it can be used to measure the companies against each other in terms of their efficiency.Before we get into the comparisons between the three companies, let's just do a final look into McKesson's valuation using one of Chuck Carnevale's FAST Graphs:Source: FAST GraphsIndustry Comparison:Here is a table of some key metrics compared by company, and then all three of their net profit margin graphs, showing their efficiency in creating profits over time in an industry with razor-thin margins.Source: MorningstarLooking at these metrics side by side, I believe that all three companies are strong and their biggest differences are in ABC's debt load, FCF generation, and dividend yield. These metrics can definitely separate investors based on what they value most. My last comparison I would like to make is on their net margins. These companies being in almost the exact same business, a side by side comparison of margins can be a good demonstrator of operational efficiencies.MCK's consistency is commendable. Both MCK and CAH ended 2015 with the exact same net margin, and ABC was only off by a fraction of a percentage point. These companies, operating on such thin margins, must stay efficient and keep their costs down to maintain profitability. It looks like they have all done a good job of that, MCK being the best and ABC the worst.I think a discussion of which areas outside of America the 3 companies are expanding into can make a difference, as well.Conclusion:It's hard to come to an easy, one sentence conclusion from the data I have outlined above. I believe that all 3 companies offer different things to different investors, and they are all good defensive companies trading near or beneath fair value. I am personally long CAH and ABC, and am mostly swayed by the fact that MCK offers a lower yield without beating out the other two in earnings growth or FCF yield. Because of that, and the fact that Cardinal Health is a Dividend Aristocrat, I find them to be the most compelling, followed by AmeriSourceBergen and then McKesson. I hope you found this article helpful, and if you are interested in strong value companies like this, hit the follow button up next to my picture.Financial statistics were sourced from FinViz, unless otherwise stated. This article is for informational purposes only and is not a formal recommendation to buy or sell any stock. Please do your own due diligence and/or consult a financial professional prior to making investment decisions."
3962675,86786,2016-04-02T11:30:56-04:00,"I run a dividend analysis on McKesson.McKesson's buyback program was successful in reducing outstanding shares, but was not a wise use of their cash.McKesson's use of cash shows they care more about management than they do investors (and employees).","I recently received a reader request to look into McKesson (NYSE:MCK):MCK is an interesting stock because of its high price but relatively low yield. I've found, through digging around in forums and comments on the stock, that many hold MCK because of its strong fundamentals, its consistent dividend growth, and its buyback program. Truth be told, an analysis of these three aspects shows the company to be weaker than its peers.Allow me to run through this analysis as if I were running a dividend analysis, as all my points are contained within.MCK Dividend AnalysisThe dividend increases have been sporadic at best:It's as if the management has no plan for the dividend but plays things by ears (or by balance sheet). Still, we've only seen increases, and no cuts to this point. This shows strength in dividend increases but no real reliability for dividend growth investors.As for dividend growth versus stock growth, we see dividend growth outpacing stock growth in terms of sporadic bursts:I have no doubt that MCK and its dividend trend have become uncoupled. Unfortunately, this removes one predicative tool from our arsenal. Using the dividend to predict stock growth speed will fail.Notably, the stock has taken a tumble, bursting along with the biotech bubble. The tumble might not have been justified - that depends on how much artificial price inflation you attribute to the bubble and how much growth you attribute to the fundamentals. In addition, we have buybacks, which have certainly raised the price of the stock to artificial levels - buybacks do not add any value to the company but simply reclaim shares.This buyback program was particularly successful:In October, MCK authorized a new $2B buyback program. I feel this money could have been better spent. In essence, the buyback program does nothing but raise the price of the stock with the side benefit of reducing dividend payouts.However, as you will see, dividend payouts are not a problem:This yield is so absurdly low that no dividend investor would ever take a second look. But if not pay a healthy dividend, what is MCK's plan. Are they positioning themselves as a growth stock, using the buybacks to inflate the price?Or perhaps they want to become a value stock without a dividend - a stock with a healthy balance sheet that does nothing but slowly grow? Few investors would be interested in such a stock, so taking this route is awkward. But the fundamentals certainly are looking well; revenue is back on the incline:The fundamental aspect I mentioned in the intro relates to income, which is steadily rising. The income has covered the dividend for a long time:This leads us to ask why the dividend has been kept so low? If the dividend only occupies 15% of MCK's income, why doesn't the company raise its dividend? This is a strange stock indeed:EPS has grown considerably, but the stock has reversed and the dividend has barely moved. Free cash flow has had its hard times but not so in recent times:A running average of the free cash flow gives a better estimate for the cash on hand and therefore MCK's ability to pay the growing dividend:Again, we see no problems here. MCK seems cash rich, yet they are seemingly unwilling to spend their free cash on anything but buybacks. Why not dividend increases?Closing ThoughtsIf not raise the dividend, just what has MCK done with its money? Considering they are firing nearly 2,000 employees, they certainly aren't using that cash to encourage their workforce. But they have recently acquired Rexall Health, a Canadian drug store.Whether Rexall was a good acquisition remains moot. The fact remains: MCK is attempting to expand with its acquisitions, including two oncology companies. The company's money is funneled into acquisitions and buybacks but not dividend hikes.The company could easily double the dividend twice without needing to raise debt. The question is why they've set their growth at such a low rate. It seems as though they care less about the investors than they do the insiders. When you look at the money funneled to management, you begin to see the bigger picture.MCK's CEO is the second-highest paid CEO. In light of the firing of 2,000 employees, this shows a possible distain for ""the little people,"" including you, the average investor. If you cannot afford to pay your employees, you probably cannot afford to pay your shareholders, either.Clearly, the buybacks were mostly at a premium, as the stock has dropped considerably even after the buyback program. MCK seems to be wasting its mountains of money on management, artificial stock inflation (possibly to help those in management with stock options), and on so-so acquisitions. Eventually this must come to an end, for better or for worse.Until that time, stay out of MCK… unless you're really hankering for a 0.7 % yield.Learn More about EarningsMy Exploiting Earnings premium subscription is now live, here on Seeking Alpha. In this newsletter, we will be employing both fundamental and pattern analyses to predict price movements of specific companies after specific earnings. I will also be offering specific strategies for playing those earnings reports.Our last newsletter looked at the upcoming earnings for ConAgra Foods (NYSE:CAG).Request an ArticleBecause my articles occasionally get 500+ comments, if you have a request for an analysis on a specific stock, ETF, or commodity, please use @damon in the comments section below to leave your request."
