article_id,author_id,publish_on,summary,content
4145833,102404,2018-02-12T16:37:58-05:00,"McKesson is - according to the price-to-earnings ratio - the seventh cheapest stock in the S&P 500 with a P/E of 7.45, and also according to DCF analysis severely undervalued.McKesson is not just superior to its closest rivals, AmerisourceBergen and Cardinal Health, but the distribution system is also creating a wide moat.The announcement of Amazon, Berkshire Hathaway and JPMorgan forming their own insurance company shouldn’t pose a threat to McKesson’s business.It might, however, combined with a possible overall stock market decline, lead to very attractive price levels for the company and a potential revisit of the $120 low.","In a list with the “cheapest” stocks in the S&P 500 right now, McKesson (NYSE: MCK) is on the seventh place with a P/E of 7.54 at the time of writing (and with current volatility, this might be already incorrect again). This alone should be reason enough to examine the stock and check out if we have a bargain at our hands or if there are good reasons for the stock being so cheap and beaten down.MCK data by YChartsIn the following article, we first try to understand the business model and examine a little closely how McKesson is making money. After that, we will look at the company’s valuation a little closely and provide an intrinsic value calculation. In a third and fourth chapter, we look at the growth potential of the sector and the competitive advantage of the company. Finally, we analyze a few different risk factors.To examine and analyze any company, it is important to understand how it generates revenue and profit. McKesson is a global leader in healthcare supply chain management solutions, retail pharmacy, community oncology and specialty care, and healthcare information technology. In the company’s own words, the business is quite simple:Basically, McKesson is divided in two business segments: distribution solutions (pharmaceutical distribution and services) and technology solutions (products and services). The technology solutions segment provides clinical, financial and supply chain management solutions to healthcare organizations. As the segment generated only $2.6 billion in revenue (about 1.3% of the overall revenue of $198.5 billion), it can be neglected at least as long as we are talking about the company’s revenue. However, when focusing on operating profit and operating margin, the segment is contributing about one-eighth of the company’s operating profit due to higher margins.The distribution segment generated about $195.9 billion in revenue in the last year. We have to point out that although the distribution segment is generating almost all of McKesson’s revenue, it has an operating margin of only 1.7%, while the technology solutions segment has an operating margin of 12-13%. The distribution solutions segment distributes branded and generic pharmaceutical drugs and other healthcare-related products internationally and provides practice management, technology, clinical support and business solutions to community-based oncology and other specialty practices.McKesson is the largest pharmaceutical distributor in the United States with more than 40,000 customers. The business supplies branded, specialty and generic pharmaceuticals and other healthcare-related products to customers like retail national accounts, independent retail pharmacies and institutional healthcare providers such as hospitals and health systems. The company is also one of the largest pharmaceutical distributors in Canada. Aside from North America, McKesson also provides distribution and services to the pharmaceutical and healthcare sector in 13 countries in Europe. Its wholesale network delivers daily to 50,000 pharmacies in Europe. The retail pharmacy business serves patients and consumers in European countries directly through over 2,400 of its own pharmacies and over 5,500 participant pharmacies operating under brand partnership agreements.We already mentioned that McKesson has a P/E below 8 right now, but the number is misleading. The company reported $23.28 GAAP EPS for the full year 2017, but we have to point out that in the fourth quarter, it reported additional $3,947 million as “gain on net asset exchange, net” which led to earnings per share of $16.79 for the quarter. Much more realistic are the adjusted earnings per share of $11.61 for the full year and $3.39 for the fourth quarter (on a non-GAAP basis). Using these numbers, we get a realistic P/E of 14, which is still very cheap. For the fiscal year 2018, the company expects adjusted earnings per share between $11.80 and $12.50.It seems important to point out that GAAP earnings per diluted share from continuing operations are “only” expected to be between $4.80 and $6.90 for 2018. And while EPS on a GAAP basis as well as the adjusted earnings per share both have shortcomings, we should be careful not just to take that number best suited for the point we are trying to make (in this case, that McKesson is undervalued). And if we take the lower end of GAAP guidance, the forward P/E ratio would be 33.3, and therefore, rather high.For a more accurate intrinsic value calculation, we will not use simple valuation methods like the P/E ratio, but apply a discount cash flow analysis. In the Investor Day Presentation (slide 14), McKesson claims it is on the path to double-digit adjusted EPS growth - meaning the company expects at least 10% EPS growth. If we take McKesson’s free cash flow of the last years (not 2017, as the free cash flow was exceptionally high), we can use about $2,173 million free cash flow as the basis for our calculation (free cash flow of the past four quarters) and also assume the company will grow 10% for the next decade. As usually, we use a 10% discount rate, and for perpetuity, we assume 3% growth (very conservative for a wide-moat company). All these parameters lead to an intrinsic value of $254.59 for McKesson, making the company extremely undervalued. It would have to grow about 4% for the next decade and 3% for perpetuity to be fairly valued right now. The important question right now is if the company will be able to grow at least 4% annually for the next 10 years and then 3% for eternity.In order to ensure above-average growth rates, a company usually needs some form of competitive advantage, because otherwise competitors will enter those segments of the market that pledge high growth rates and increasing revenue. McKesson has built a distribution network, especially in North America, that is hard to match for new competitors. The top three distributors - McKesson, AmerisourceBergen (NYSE: ABC) and Cardinal Health (NYSE: CAH) - have a market share of 90%, and even McKesson, with its distribution system already in place, has extremely low net income margins. Over the last years, McKesson’s net income margin has fluctuated about 1%.These factors show us how difficult it is for new competitors to enter the market, as gross and operating margins for new competitors would be terrible. With very little revenue and extremely high costs of revenue at the beginning, it is almost impossible for new competitors to match McKesson’s prices and profitability. While the company has to spend about 25% of each year’s net income as capital expenditures, the costs for new competitors to build a similar distribution network would be much higher.(Source: Own work based on data from Morningstar)We learned above, that McKesson (as well as AmerisourceBergen and Cardinal Health) doesn’t have to worry much about new competitors entering the market because of the competitive advantage and the wide moat the company has. McKesson mostly has to worry about its two competitors, but if we look at four different metrics - return on assets, return on invested capital, net income margin and gross margin - McKesson seems to be superior to its closest rivals. Gross margin was the highest in the last ten years, and net income margin also was in most years higher than the margins of Cardinal Health and especially the margins of AmerisourceBergen. On average, the net income margin over the last decade was 1.17% (Cardinal Health had a net income margin of only 1.01% and ABC only 0.55%).But not just margins are better, the return on assets and return on invested capital are also higher. Return on assets for McKesson was 4.29% on average during the last decade (compared to 4.03% for Cardinal Health and 2.91% for AmerisourceBergen). Return on invested capital for the company is on average 14.62%, compared to 13.52% for AmerisourceBergen and 10.44% for Cardinal Health. I think it is safe to say that McKesson doesn’t have to fear its closest two competitors, at least not based on the different presented metrics.A wide moat is certainly one of the most important “assets” a company can have, as it protects the business and keeps competitors at a healthy distance. But a moat is only helpful if the overall business is increasing. A moat is pointless if revenue for all companies operating in a certain sector is declining as the overall demand is fading (it might help the company to survive a little longer, but can’t stop the decline forever). Therefore, it is also important to look at the sector the company operates in and analyze if the sector as a whole is promising increasing revenue for the companies.(Source: 2017 Investor Day Presentation)The spending on pharmaceuticals and the market is expected to grow in the high single digits in the next years, not just in the United States, but also in Europe and globally. Especially the aging society in developed countries will maximize the demand for pharmaceuticals and healthcare solutions. But the demand in emerging countries is also rising. The increasing demand for pharmaceuticals and drugs will lead to more and more products that need to be distributed and leads to increased revenue for McKesson. But not just the demand for drugs will expand in the years to come, the demand for medical-surgical supply will also increase as the demand for surgery and operations will rise.In case of McKesson, not just the distribution segment, but also the technology solutions segment will profit from these mega-trends that will continue over the next years and decades. Combined with the competitive advantage, I think it is not only reasonable, but also extremely conservative, to assume at least 4% growth for the next decade.We already wrote above, that it is very hard for new competitors to enter the markets due to the high costs and extremely thin margins. It would take some big corporations, that have massive capital resources and can spend millions or even billions of dollars upfront and can stand being not profitable for quite some time. A few days ago, Berkshire Hathaway (NYSE:BRK.B), JPMorgan Chase & Co (NYSE: JPM) and Amazon (NASDAQ:AMZN) announced forming their own insurance company. The project aims to improve healthcare for the employees of the three companies (about 1.3 million people) and wants to provide affordable healthcare coverage for the U.S. employees. The company should be free from profit-making incentives.Although we know very little about the new project right now, it had the power to disturb the markets quite a bit. Companies like Walgreens Boots Alliance (NASDAQ:WBA), CVS Health Corp. (NYSE:CVS) or Express Scripts (NASDAQ:ESRX) took dramatic hits that day. Considering how little we know about the project, the sell-off seems like an overreaction. However, it wouldn’t be the first time that Amazon made other stocks tank after some announcement. Target (NYSE:TGT) or Kroger (NYSE:KR) are examples from 2017 and two stocks that declined quite a bit as the market panicked. But after a few months, both stocks have recovered nicely so far (about 50% gains), as market participants seemed to realize they overreacted. A similar development could also be the case for McKesson.For long-term investors, it is however more important to analyze if these sell-offs are justified as we have a real threat at our hands or if they create a great entry point. The three companies (Amazon, Berkshire and JPMorgan) certainly have the power and financial resources to build a similar distribution network as McKesson. Nevertheless, I don’t think McKesson has to fear the newly formed insurance company. But it doesn’t really matter if the new company will hurt revenue and profits in the long term - what really drive the stock markets are expectations. And right now, market participants assume that Amazon, Berkshire and JPMorgan will hurt McKesson, and this might lead to cheap stock prices.Additionally, there are two other risks I like to point out. One is the dependency on CVS Health Corp., which is McKesson’s largest customer and accounted for about 20% of total revenue last year. If the company would lose CVS as customer, the effect on revenue as well as profitability would be quite dramatic. We are also facing the risk of being too optimistic about revenue growth for the entire healthcare sector. Most analysts expect growth rates in the high single digits, and therefore, much higher than GDP growth.Although McKesson was even cheaper a few months ago, and it looks like we have missed out on our chance to buy the company at a very attractive price, investors should not panic. First of all, the company is still very attractively valued, and McKesson is still a buy. Additionally, as already mentioned above, the rumors about Amazon, Berkshire Hathaway and JPMorgan forming a new company might lead to a further declining stock price. Finally, we are confronted with an US stock market at one of the most overvalued states it has been during the last century. If the stock market should enter a corrective phase or even a bear market - and it will at some point in time (No, the first signs of panic in the last few days are not what I mean) - many individual stocks will be drawn down with the overall market even if the companies are already cheap. In my opinion, we can stay patient and probably will see price levels of $140 or even $120 again.Thanks for staying with me till the end. If you enjoyed reading the article, please share it with your friends and followers. If you like to be informed about future research and analysis on McKesson or other companies as soon as the articles are published then I encourage you to follow me by clicking the big orange “Follow” button at the top of this page next to my name and choose the “Get email alerts” option."
4107746,21652,2017-09-18T15:26:55-04:00,McKesson remains out-of-favor.Long-term results suggest today’s price is a bargain.Analysts think an EPS revival is on tap starting in 2018.MCK could just be the best value available in the entire healthcare industry.,"The broad averages hit a series of new records last week. Finding bargain-priced shares is a tough job. Most stocks which are down in this environment have obvious flaws.Can stocks with ""warts"" still hold amazing upside potential? Absolutely. The ""efficient market theory"", which says every stock sells for exactly what it is actually worth, gets disproven regularly.McKesson (MCK) is a prime example of a company offering big potential gains due to public perception that its business model is in jeopardy. Traders who disagree can snag great value.MCK is on pace to post more than $200 billion in FY 2017 revenues, more than ever before (fiscal year ends Mar. 31, 2018). The shares carved out a peak north of $234 back in 2015. They rallied to more than $197 last year. McKesson closed on Friday, Sep. 15, 2017, at just $149.88.EPS are expected to dip slightly this year, from $12.88 to about $12.07. That downer may have obscured the company's superior longer-term track record. McKesson's share price has done well but it fails to reflect anywhere near the past decade's true growth in fundamentals.The market remains skeptical but analysts see FY 2017 as nothing more than a small speed bump. Consensus views for FY 2018 now project EPS of $12.89. Value Line thinks earnings could reach more than $20 per share by 2022.MCK's current valuation looks remarkably similar to its previous best entry points (green-starred below). McKesson was expensive when it peaked in 2015. The P/E was 23.8x then versus a 2010 - 2016 average level of 15.7x. The yield was sub-par, too.A simple regression to the mean valuation on next year's estimate suggests $203 as a reasonable 12 to 18-month target price. That's far from an upper limit as MCK broached $214 in both 2014 and 2015 when fundamentals were less favorable than they are today.Don't just take my word on this.Standard and Poor's research seconds the idea that MCK can see profits rebound next year. They call present day fair value as $220.30 while conservatively seeking a share price of $172 over the coming 12-months. McKesson falls into S&P's top 2% in terms of ""investability"", a measure of quality.Independent analysis from Morningstar goes further. They label MCK a 4-star (out of 5) BUY and would upgrade to their very top rating should the shares dip below $147. Its view of McKesson's fair value runs $210.The firm's higher than typical current yield and wide moat serve as added plus factors.Value Line assigns MCK their highest possible financial strength rating. You can now own this long-term winner at a discount price. Why not buy when it's on sale?Option savvy traders might consider selling some MCK Jan. 2019, expiration date puts. With the stock just below $150 you could snare $15.40 for the at the money strike, greater than $20 on the $160s or about $26.80 for standing ready to buy, if exercised later, at the more aggressive $170 level.Break-evens drop to very attractive levels of between $134.60 and $144.90.Maximum profit on these, or any other option sales, would be keeping 100% of all premium received up front. The worst-case scenario on these would be forced purchase at the net prices indicated in the table above.Outright ownership of the shares offers unlimited upside but without any extra margin of safety should things out less well than expected.McKesson is a blue-chip company at a decidedly white-chip valuation right now.Buy MCK shares, sell some puts or consider doing both.Disclosure: Long MCK shares. Short MCK options."
4122849,101421,2017-11-09T13:00:38-05:00,McKesson said it will acquire RxCrossroads from parent company CVS.RxCrossroads provides a range of specialty pharmacy services to biopharma firms and patients.MCK believes the specialty pharma business is a strong growth driver over the next several years and appears to be opportunistically acquiring that growth potential from CVS.,"McKesson (MCK) has entered into a definitive agreement to acquire RxCrossroads from parent company CVS (CVS) for $635 million net of the present value of incremental cash tax benefits.RxCrossroads provides a range of specialty support, dispensing and logistics services to biopharma manufacturers.McKesson is acquiring RxCrossroads because it believes the U.S. specialty pharma market is going to grow substantially over the next several years.Louisville, Kentucky,-based RxCrossroads was founded in 1986 as Medical Distribution to provide ""specialty distribution, pharmacy and patient support"" to biopharmaceutical firms.Management is headed by Vice President and General Manager Rob Brown, who has been with the firm since March 2016 and was previously Vice President Business Development at Omnicare.RxCrossroads provides five offerings to life science firms and the patients they serve:The firm was acquired in 2005 by Omnicare and then acquired by CVS Health in 2015. In the context of an expected offer of CVS for Aetna, the firm appears to be exiting non-core holdings perhaps to minimize transaction review risk as well as raise cash for a potential bid for Aetna.According to a 2014 report by UnitedHealth Center for Health Reform and Modernization, the specialty pharmacy market size regarding drug spending alone in 2012 was $87 billion and was forecasted to rise to $400 billion by 2020.The main drivers for this expected growth include unit price growth and utilization growth for the primary conditions of cancer, rheumatoid arthritis and multiple sclerosis.As biopharma firms develop ""orphan"" drugs in greater numbers due to the rise of new technologies such as gene editing, the number of drugs delivered in a specialty environment could increase dramatically.McKesson believes that by 2018, ""50% of all drugs sold in the United States are expected to be specialty pharmaceuticals, compared with 30% today."" It projects the specialty market will grow over 25% per year and ‘that five of the largest specialty drug manufacturers will control 75% of the market.With that kind of concentrated market power, it isn’t difficult to see why McKesson needs to be a big player on the other side of it.McKesson intends to pay $635 million net of the present value of incremental cash tax benefits and says it will fund the deal with cash on hand.As of September 30, 2017, MCK had $2.56 billion in cash and $51 billion in total liabilities. So while the firm has significant liabilities, it can do the deal with cash on hand without undue financial hardship.The deal will be ""approximately 20 cents accretive to adjusted earnings per diluted share by the third year following the close of the transaction."" That is Non-GAAP guidance, which is usually more favorable to management, and it says the firm won’t benefit financially for more than two years after transaction close.MCK appears to be acquiring RxCrossroads as an opportunistic deal due to CVS having bigger issues on its corporate horizon.As McKesson stated in the deal announcement,In a report on TheStreet, Leerink Partners analyst David Larsen stated of the deal, ""We view (it) as a smart strategic move to help position the company for the continued importance and growth of specialty pharma products.""Investors seem to agree, as MCK stock rose on the news which was announced November 6""(Source: Seeking Alpha)So, although it will take some time for MCK to close the deal and absorb RxCrossroads into its operations, the deal appears to be perceived as a positive development and assuming smooth integration should be accretive to MCK in the medium term.I write about IPOs, M&A deals, and public company investments in technology startups. Click the Follow button next to my name at the top or bottom of this article if you want to receive future articles automatically."
