article_id,author_id,publish_on,summary,content
4371751,67113,2020-08-31T14:11:25-04:00,The company posted a $2.77 earnings beat in Q1 on the back of a strong showing in June.Momentum is expected to continue in Q2 and Q3.Bullish crossover of the long-term moving averages. More upside needs to confirm the buying signal.,"In June of this year, McKesson's (MCK) 10-month moving average crossed above its 50-month moving average. As we can see from the chart, this buying signal has been pretty trustworthy in past times. An additional bullish sign would be a visible upturn of the 50-month moving average.We have been long this stock from time to time but are at present without a position. Our stance may change now as a result of the opioid settlement which brings transparency to the situation with respect to settlement payments. Why? Well, considering the inflation which will undoubtedly occur in drug prices going forward along with McKesson's robust cash flows, the drug distributor should easily be able to absorb these payments which will be spanned out over a number of years.McKesson finished its fiscal first quarter at the end of June this year and results were announced on the 3rd of August last. Although the top- and bottom-line were down in Q1 this year compared to the quarter of twelve months prior, one just has to look at Q2 (EPS of $3.81) projections to see momentum is definitely with McKesson at present. If the distributor can hit this number, it would be a $0.21 beat over Q2 last year. The $3.81 projection incidentally has increased by around $0.60 per share over the last 30 days alone (Clear momentum).CEO, Brain Tyler stated on the latest earnings call that because of this growing momentum which began in the latter part of June, guidance would be raised for the year to the $14.70 to $15.50 range. McKesson's delivery prowess along with the clear demand for its products was clearly seen in the first quarter especially in the pharmaceutical & specialty solutions in the US.Trading at close to the $154 mark, McKesson's valuation especially its earnings, sales, and cash flow multiples remain attractive. The forward non-GAAP earnings multiple came in at 10.15, the forward cash flow multiple at 10.05 whereas the forward sales multiple came in at 0.10.Firstly, with respect to sales, McKesson's 5-year average multiple for this metric is 0.15 meaning its sales are 33% cheaper at present than the average over this time frame. Despite operating through the teeth of the pandemic, McKesson is expected to report a 3.3%+ increase in top-line sales this fiscal year followed by 5% the following year.Why is this significant given the firm's present valuation? Well, apart from expecting a reversion to the mean type event which will price the shares higher, cash flow should increase meaningfully. Over the past four quarters, for example, MCK generated $3.36 billion of operating cash flow and only $580 million was used for investing purposes. In fact, the lion's share of this cash flow was given back to shareholders in the form of buybacks ($1.277 billion) and dividends ($293 million). Yet, still, there was a surplus of cash ($917 million) to add on to the balance sheet.What does this mean going forward? Projected earnings and sales growth are going to increase the net worth of the firm due to McKesson not being a capital-intensive firm. In fact, future acquisitions should be able to be paid from the company's strong cash flows which again stacks the odds in favour of the long-term investor (increasing assets). This demonstrates the leverage of the firm spinning off $3-4 billion of operating cash flow with no significant outgoings other than shareholder commitments.In our opinion, considering the big three distributors in this industry control almost all the market, we do not see disruption in this space any time soon. Furthermore, in the latest quarter, McKesson reported a debt to equity ratio of 1.47 and an interest coverage ratio of 5.62 and operating income still is 10+ times the net interest expense on the balance sheet. Therefore, even if the firm were to encounter adverse trading conditions over the near term, we believe there is plenty of buffer here in the financials to be able to weather any potential downturn.Therefore, to sum up, a solid buying signal for us would be to see that 50-month moving average turn up. We may have to wait for this though due to stocks definitely overdue for a trip down into an intermediate cycle low. Let's see what the second quarter brings."
4351230,105703,2020-06-01T07:32:56-04:00,"McKesson is the largest of the 3 drug distributors and has entrenched relationships with healthcare providers.During the pandemic, its recession-resistant business model provides investors with safety and comfort.McKesson is poised for strong risk-adjusted returns with strong forecasted growth in healthcare spend and active share buybacks.","McKesson (MCK) operates a mission critical healthcare distribution business that can survive and thrive regardless of difficult macroeconomic conditions. McKesson shares have bounced back from its COVID-induced low of $112 back in March but are still currently undervalued. With a market-leading position and continued strong revenue growth coupled with a low valuation, MCK is poised to reward shareholders with low double-digit annual returns in the coming years.McKesson (MCK) is a 187 year-old healthcare company based in Irving, Texas, and is the biggest of the ‘Big 3’ pharmaceutical distributors, with the other two being AmerisourceBergen (ABC) and Cardinal Health (CAH). Perhaps one overlooked fact is that it is ranked #7 on the Fortune 500 list due to its massive revenues through being a leader in healthcare supply chain management, retail pharmacy, healthcare technology, community oncology and specialty care.Its 80,000 employees enable McKesson reach one-third of all US pharmacies and a significant number of health systems. McKesson also has 275,000+ SKUs of branded and private label medical surgical supplies. If you have family or friends who work in hospital, there is no doubt they interact with McKesson products on a daily basis.Source: Company WebsiteI like the fact that McKesson is well-positioned to ride the wave of expanding healthcare spend for at least the next decade. According to CMS, national healthcare spend is projected to grow at an average rate of 5.5% per year through 2027, and reach an astounding $6.0 trillion by 2027. This puts healthcare spend on pace to grow 0.8 percentage point faster than the US GDP, with health share of GDP expected to reach 19.4% by 2027.In other words, whether we like it or not, within a decade, 1 out of 5 dollars in the economy will flow to the healthcare industry that McKesson operates in, and I believe dominant firms such as McKesson will leverage their economies of scale to capture a disproportionate share of that growth.Healthcare has been one of the most resilient sectors during the COVID pandemic. While banks, hospitality, restaurants, and airlines have taken a beating and have yet to recover, the healthcare sector has bounced back faster than the market. As seen below, the Fidelity MSCI Health Care Index ETF (FHLC) has outperformed the S&P 500 by nearly 8% over the past 6 months.Source: Yahoo FinanceMcKesson’s business showed strong resilience and even benefited from a surge in pre-pandemic demand with strong Q4 revenues growing 12% YoY. Full-year 2020 revenues were not bad either, growing 8% YoY. However, profitability did not grow at the same pace, with operating income growing just 1% YoY for Q4, and 2% YoY for the full year.Source: Q4’20 Investor PresentationThe wide gap between Q4 revenue growth of 12% and operating income growth of just 1% was due to COVID, which resulted in a higher mix of lower margin PPE gear, a pronounced decline in higher margin specialty provider volumes primarily in the non-oncology markets, and one-time costs to support front-line workers and employees during the pandemic. This one-time cost appears to be a smart and necessary move by management, and it’s good to see that the company took active measure to support employees and front-line workers as they navigated through these challenging times, as the CEO Brian Tyler noted during the conference call:What’s encouraging is that demand for high margin oncology products remained stable despite a drop in doctor’s office visits, reflecting a continuation of critical patient treatments during the pandemic. In addition, the company is starting to see early signs of stabilization in its key business lines as CFO Britt Vitalone remarked on the conference call that volumes have begun to stabilize in the pharmaceutical and retail businesses.Besides solid revenue growth, what I like most about McKesson is its active share repurchase program. In FY 2020, the company repurchased $1.9 billion worth of shares, enabling it to retire 9% of its share count, with $1.5 billion of remaining authorization. Including dividends, the company returned a total $2.2 billion to shareholders that was safely covered by $3.9 billion in free cash flow.At the current PE of just 10.8, every dollar that goes towards share repurchase contributes a 9.3% earnings yield. Coupled with a low but growing dividend yield, McKesson’s recession-resistant business offers at least low double-digit annual returns.A key risk that comes to mind when evaluating the drug distributors is the cost of opioid litigation. Full-year opioid-related costs were $232M, including $150 million in litigation costs and $82 million in settlement costs. While future settlements are uncertain, the company has more than sufficient free cash flow to cover these costs with mid-point 2021 guidance of $2.5 billion in FCF.Another risk factor is intense competitive pressures in the drug distribution business, as evidenced by the low margins. However, the big 3 players have well-entrenched relationships with hospitals and pharmacies, and I believe low margins actually serve as a defensive moat by helping to deter new entrants from entering the market due to the massive economies of scale required to make the business profitable.McKesson operates a recession-resistant business that has survived and thrived during SARS, H1N1, and the Great Recession. The company’s latest results reinforced this belief with strong revenue growth and profitability. I believe that shares are undervalued at the current price of $156.86 with a PE of just 10.8.I estimate the company is worth at least $174 per share, putting it at a PE of 12. This would make it in line with its smaller competitor AmerisourceBergen, and equates a one-year 12% total return including dividends with compelling risk-adjusted potential for low double-digit annual returns thereafter."
4337215,102404,2020-04-13T08:07:41-04:00,McKesson's revenue probably won't be affected neither by COVID-19 nor by the upcoming recession.The company's debt levels are a little high and the company is still facing opioid charges with potential high fines.But McKesson is undervalued right now - even if we assume high fines due to opioid charges - but might drop lower in this market.,"Last week we covered three different companies so far and tried to analyze what effect COVID-19 as well as the upcoming recession might have on the business model. While McDonald’s (MCD) might probably be hit more severe (despite its takeaway and drive thru business), the other two companies – the retailer Target (TGT) as well as the supermarket chain Kroger (KR) – will probably see at least stable revenue. Both companies probably won’t be affected much by the negative consequences of COVID-19 as well as the global recession.This week, we continue our series with a company from the healthcare sector, the pharmaceutical distribution company McKesson (MCK), which we also covered in the past – lastly in August 2018, when I asked Mr. Market why he punished McKesson. And to forestall the conclusion of this article already: like many other companies from the healthcare sector, McKesson probably won’t see huge negative impacts from neither COVID-19 nor the recession.(Source: Pixabay)All these articles will follow the same structure and focus on four different aspects that seem to be very important right now:(Source: Author’s own work)McKesson is a pharmaceutical distribution company and is also providing health information technology, medical supplies and care management tools. About 1/3 of all pharmaceuticals used each day in North America is delivered by McKesson and it is also the 4th largest pharmacy chain with more than 5,000 retail pharmacies. Additionally, McKesson is the number one distributor in oncology and key specialties.Not only are pharmaceuticals but also medical equipment are necessary all the time despite the current state of the economy. Considering the hoarding tendencies for pharmaceutical products and the increased demand hospital and other healthcare facilities might have right now, McKesson could even see increased revenue in the next few months. Almost all the products and services McKesson is offering are essential for people – especially in this crisis.While many other companies either offered an updated guidance (and in most cases a lower guidance) or withdrew the guidance (as they are not able to make reasonable assumptions about the business in the next few quarters), McKesson hasn’t provided any update so far due to COVID-19. The company only updated its guidance on March 17, 2020 due to the completion of the Change Healthcare split-off. McKesson is now expecting adjusted earnings per share for 2020 to be between $14.67 and $14.87 (even a few cents higher than before).When looking at Seeking Alpha Earnings Revision, the consensus for revenue stayed more or less the same during the last few months. At the end of January, analysts were expecting earnings per share of $14.57 and now they are expecting even $14.80 for the full fiscal year. Analysts are not always right and often too optimistic (and for most companies, the expectations – despite downward revisions – are still not reflecting the negative effects of COVID-19 in my opinion), but for McKesson we can be pretty confident that the company won’t be affected much by COVID-19 and the consequences that come with lockdowns and social distancing.While social distancing and the closing of stores or restaurants will not really affect the business of McKesson, we also have to look at the upcoming recession and how this will affect the business of McKesson. Overall, McKesson can be described as recession-proof – similar to many other companies operating in the healthcare sector.When looking at the last two recessions and McKesson’s performance, we see pretty stable numbers. During the last recession – the Financial Crisis in 2008 – McKesson could increase its revenue every single year and even in 2010. The worst year for McKesson in that time – revenue still increased 1.9%. Net income fluctuated a little more. In 2009, net income declined 16.9% and in 2011 – two years after the recession – net income declined 4.8%. Due to the aggressive share buybacks of McKesson, earnings per share declined only 11.1% in 2009, and in 2011, EPS declined only 1.1%.And the picture is pretty similar when looking at the next-to-last recession (during the Dotcom Bubble). During this recession, McKesson could also increase its revenue every single year with impressive growth rates. In the years between 2000 and 2004, revenue increased in every single year with a CAGR in the double digits. The picture for net income is a little different. In 2000, net income was $724 million and one year later, McKesson lost $48 million and it took until 2006 before McKesson could reach the net income from 2000 again.When looking at past numbers, we can be pretty sure that McKesson’s revenue will be stable or even increasing as McKesson’s business is pretty recession-proof and the company will see a high demand for its services even during economic downturns. However, we can’t rule out the possibility of net income decline or EPS decline in a recession as past numbers are indicating such a scenario.Although McKesson will probably see stable (or even growing) revenue despite COVID-19 and the upcoming recession, the financial health is still an important aspect we should pay attention to. On December 31, 2019, McKesson had $2,065 million in cash and cash equivalents on its balance sheet, which seems to be enough for McKesson to provide liquidity – assuming that revenue will not really take a hit from COVID-19 or a recession.When looking at solvency, we have to focus on the debt and borrowings the company has. McKesson has $2,109 million in short-term borrowings and $1,007 million in short-term debt. Additionally, McKesson has $6,734 million in long-term debt. When comparing the total debt and borrowings to the total equity of $6,385 million, we get a D/E ratio of 1.54 for McKesson, which is quite high. We can also compare the total debt of McKesson to the operating income, which was $3.3 billion in 2019 and $2.8 billion in the last four quarters. When using the operating income, it would take about 3 years for McKesson to repay the outstanding debt, which is acceptable. As long as revenue will stay stable, we should not really be concerned about McKesson’s financial health.But in case of McKesson, we have to look at another important point, which might have a big influence on the balance sheet and financial health of the company: the pending lawsuits regarding the opioid crisis and the probably high fines McKesson and many other companies are facing. The pending lawsuits have taken a back seat as COVID-19 is dominating all news, but McKesson will have to pay several billions in fines in the next few years and we have to take that into account. In February 2020, it was reported, that twenty-one states rejected an offer from McKesson, Cardinal Health (CAH) and AmerisourceBergen (ABC) to pay $18 billion over 18 years. For McKesson, this would mean $6 billion in settlement payments (and $333 million to pay annually). Obviously, some states want the settlement to be between $22 billion and $32 billion, which would mean $10.66 billion for McKesson in the worst case. Alternatively, the states want the money paid faster than over 18 years.In my worst-case scenario, I would assume that McKesson has to pay a higher amount in a shorter time frame. We assume that McKesson has to pay a total amount of $10 billion stretched over 10 years.In a next step, we are trying to calculate an intrinsic value for McKesson. For 2020, management is expecting a free cash flow to be between $2.8 billion and $3.0 billion. The free cash flow of the last twelve months was $3,125 million. As basis for our calculation, we use the midpoint of the company’s own guidance ($2.9 billion in free cash flow) for 2020.For the years going forward, I assume only 3% growth for free cash flow from 2021 till perpetuity, which is a very moderate calculation. When we are looking at past numbers, McKesson increased revenue 7.23% annually over the past ten years, and when looking at revenue since 1980, it grew even with a CAGR of 11.00%. Over the last few years, the GAAP EPS fluctuated quite heavily and it is difficult to calculate an average growth rate. But until 2016, net income increased with a CAGR of 10.7%.Additionally – as mentioned above – we have to include the fines McKesson will have to pay in the foreseeable future and have to subtract $1 billion every year for the next 10 years. Using these numbers (and a 10% discount rate) leads to an intrinsic value of $165.42. As in all the other articles, we calculate with a margin of safety of 20% and this leads to an entry point of $132.34 for McKesson.Although McKesson seems to be undervalued right now – even when considering high fines as result from the opioid charges and slow growth rates in the future – the stock declined similar to the overall market.Data by YChartsThis is especially surprising as McKesson should perform pretty stable in the next few quarters despite COVID-19 and the upcoming recession. While it is possible that net income might decline, revenue should stay at least stable or even increase. In my opinion, the company’s debt levels as well as the high levels of uncertainty about COVID-19, the economy in general and how high the fines will be, are pushing the stock down. And this is creating a great buying opportunity – although I think the stock could drop a little lower and reach its lows of December 2018 around $100.(Source: Author's own work)Stay safe, stay healthy, don’t panic!"
4332162,67113,2020-03-16T09:49:47-04:00,We liquidated in early February.Q3 momentum flowing into Q4 will increase earnings here meaningfully.Long-term fundamentals remain very solid here.,"We exited the vast majority of our equity positions at the beginning of last month. One of those stocks was McKesson Corporation (MCK). The primary reason why we exited our positions was because stocks have become far too stretched above their respective moving averages and technical divergences were beginning to appear. Our decision was purely valuation-based and not fundamental in nature. In fact. McKesson's third quarter numbers again exemplified a strong company once more.The question now is where this stock will bottom going forward. What we do know at present in practically every market (due to the coronavirus outbreak) is that every company involved in the supply chain of healthcare is under major pressure at present. McKesson being an international player will do very well due to how market conditions have changed over the past few weeks. We believe we will see this demand come through in the company's fourth quarter numbers as well as guidance for the following fiscal year (2021).Guidance for this year (2020) was already increased back in January to approximately $14.70 per share. We now believe this number will be beaten as Q3 momentum will now continue in spades into the fourth quarter.Considering where this stock has come from in recent years, the main metric we are looking for in quarterly earnings reports is sustained top line growth. Why? Because shares, for example, topped out at well over $200 a share back in 2015 as we can see in the long-term chart below. McKesson's current share price comes in at a mere $132 a share. However, revenues, for example, are up approximately 9% on average per year over the past five years. Yes, margins have slipped substantially over this time period but gross margins, for example, have stabilized somewhat over the past 24 months.Consolidated revenues grew in the third quarter by 5% over the same period of 12 months prior. This growth led to gross profit increasing by 4% as US Pharma & Speciality Solutions drove sales forward. Operating expenses were up 3% in the quarter but McKesson continues to work hard in bringing down its costs. Over a sustained period, savings on operating costs will be aimed to be reinvested back into the business (grow sales) or drop to the bottom line. The recent deal with Walgreens (NASDAQ:WBA) to service customers in the German market is an example of how McKesson wants to drive investment going forward. This should be good news for long-term investors.We remain laser-focused on McKesson's sales multiple which comes in at a very attractive 0.11 at present. Remember its five-year average is 0.17. McKesson will probably grow sales by another $12 to $15 billion next year. We expect the sales multiple to rise accordingly over time.With respect to our long-term view of McKesson, nothing has changed. McKesson essentially operates in a monopoly with the other two major distributors and we do not see this changing any time soon. They control 90%+ of the market between them. Therefore, straight off the bat, we see stability in this market as all three of the firms due to their similar size should be able to control their margins (small as they are) in a manageable way.Furthermore, due to the sizable free cash flow McKesson generates ($3.12 billion) over the past four quarters alone, we find it difficult to see how sustained mid single-digit top-line growth cannot be achieved over the long term. Remember, by March of next year, management expects to deliver annual pre-tax savings of up to $500 million. Trends like these will do wonders for cash flow and investment over the long term.Therefore, to sum up, it will be interesting to see where McKesson shares finally bottom over the next while. So many quality companies are going to be on sale if elevated volatility in equity markets continue. Besides the volatility though, there are a lot of moving parts going on at McKesson at present such as the opioid trial as well as the split-off of SpinCo. Both though are minor issues. We remain focused on the big picture in MCK and intend to add in due course."
