article_id,author_id,publish_on,summary,content
4293824,104952,2019-09-26T19:02:38-04:00,"New Relic announced a downgrade of its Q2 revenue guidance in its Q1 earnings call, though its full-year revenue guidance of $600 million to $607 million remains unchanged.Over a month, post-Q1 earnings call, New Relic revealed a management shakeup. The company revised its FY 2020 revenue guidance to be in between $586 million and $593 million.Trading at 30% lower than its pre-Q1 price/share due to its recent headwinds, we believe that New Relic is fairly priced.We maintain our neutral position pending the progress of Relic One's adoption and resolution of the recent issues by the management over the next two quarters.","New Relic (NEWR) shares dropped by 30% to its 1-year low around $64 per share, following its Q1 earnings call, despite beating its guidance, much due to what the CEO claimed to be internal sales execution and hiring issues. Q1 saw the company beat its non-GAAP EPS by $0.11 and its revenue guidance by $1.27 million. The Q1 revenue was $141 million, which represents a 30% YoY growth. The only downside outlook here was the Q2 revenue guidance of $143-145 million, which was below the consensus of $146 million.Unfortunately, just recently, it appears that the internal issues the CEO blamed for the weaker Q2 guidance turned out to be much more severe than what we anticipated. Just a little over a month after the Q1 earnings call, its Technology Chief and Chief Revenue Officer (CRO) have resigned, which forced the company to cut its FY 2020 revenue forecast further. As a result, we are staying neutral on the stock at least until new appointments are made to replace the leaving CRO and Technology Chief.Earlier last month, during the Q1 earnings call, the CEO, Lew Cirne, broke the news that the company could not achieve its internal sales target despite beating its guidance:(Source: Seeking Alpha)In the last two years, we have always known the management to underpromise and overdeliver on its revenue guidance. On that note, we brushed aside the latest minor adjustment on the Q2 guidance. Besides, the FY 2020 revenue guidance remains unchanged.However, taking into account the CEO’s relatively blunt statement and the management’s reputation on underpromising and overdelivering, in hindsight, we probably should have guessed that there was a greater issue. Unsurprisingly, the news broke out about a month later that New Relic needed to cut its FY 2020 revenue guidance following the resignation of its two key chief executives, one of them being the one heavily involved in sales execution.The underperformance issue in Q1 seems to be a delayed management shakeup. The company also revised its FY 2020 revenue guidance to be in between $586 million and $593 million, instead of the previous $600-607 million. After the news came out on September 16, New Relic shares dropped to a new 6-month low of $51 per share, before trading back up to the same level post-Q1 earnings call a few days later. Though the previous shares drop post-Q1 earnings call might seem like a little overreaction from the crowd, we now have an impression that much of the recent headwinds are already priced in by the crowd.In APM (Application Performance Management) space, New Relic competes head-to-head with the recently IPOed Datadog (NASDAQ:DDOG), Cisco AppDynamics (CSCO), and privately held Dynatrace (NYSE:DT). Though New Relic is mostly in the business of APM, its recent M&A activity and initiative to launch a programmable monitoring platform, Relic One, indicate that it is ready to enter the broader data analytics market. Some of the sub-segments of the broader market New Relic enters are AIOps (AI Operations) and Log Management, where it competes directly with Splunk (NASDAQ:SPLK).(Source: G2crowd)Interestingly, data analytics is the space where we tend to see a good number of pure-play competitors. As a result, it is relatively straightforward to value New Relic. Furthermore, we also believe that data analytics is the space where companies need to push for innovation to differentiate. With companies playing around with a lot of advanced technologies such as AI, big data, and orchestration, we like the fact that investors are getting exposure to these technologies through the stocks. The only question we have for New Relic at this point is whether its recently-launched Relic One product can be competitive enough as a niche offering in the increasingly saturated APM market. From a high-level standpoint, two of the Relic One's main value propositions, which are ""programmability"" and ""extensibility"", are nothing new. For context, Datadog also offers similar functionalities where it allows developers to build a custom dashboard for extensive data visualization and to get access to over 350 integrations to third-party data sources across systems, apps, and services. In the space, there is a new competitor by the name of Datadog, whose recent IPO has drawn a reasonable level of enthusiasm from the market lately. Datadog went public at $27 per share and soon reached $40 per share before trading at ~$38 per share currently. In terms of growth, Datadog is faster than New Relic. Datadog grew its revenue almost twice as much from $100.8 million in FY 2017 to $198.1 million in FY 2018. The revenue also further grew from $85.4 million in the first half of FY 2018 to $153.3 million in the first half of FY 2019. Datadog also has a 146% net retention in the first half of FY 2019, which is higher than New Relic’s Q4 2019 and Q1 2020 net retention rates of 131% and 109%, respectively. Using its FY 2018 revenue and recent price per share, we estimate Datadog’s P/S to be around 4.57, which is lower than New Relic’s 6.73 P/S despite having a faster YoY growth rate. We think that New Relic’s relatively much stronger FCF and gross margin positions than Datadog justify its premium valuation. Compared to Splunk that has an 8.49 TTM P/S and relatively similar gross margin yet higher FCF margin, for instance, New Relic trades lower at 6.73 P/S. Due to the recent issues involving management shakeup and increasingly heated competition, we feel that the stock is fairly priced today. New Relic shares have dropped by almost 30% since its Q1 earnings call. Given the management’s tendency to underpromise and overdeliver on its revenue guidance, there is also a high chance for New Relic to meet the expectations and trade upwards after Q2. However, we plan to maintain our neutral position until after two conditions are met: 1) new appointments are made to replace the outgoing executives. 2) the new product, New Relic One, acquires significant traction resulting in at least 5-10 PPS increase in currently-weakened Net Dollar Retention over the next two quarters."
4275167,21815,2019-07-16T09:19:27-04:00,"The increasing strategic importance of digitalization is a powerful tailwind for the company.Its SaaS business model enjoys huge gross margins and gives it plenty of opportunities for up-selling.There are some negatives, though, there has been, and will be, significant dilution and we see limited room for valuation multiple expansion.","We were impressed with APM (application performance management) company New Relic (NEWR) when we wrote about them over a year ago.But as impressed as we were (and still are) with the business model (which we described in some detail in the linked article), we did argue that the shares needed to cool off as they seemed fully valued, if not overpriced at the time. Well, since that article appeared in June 2018, the shares have given back 15%+ or so:They also dipped quite a bit below that in-between, enough for us to advise to jump in when we wrote another article in October last year, but that only worked to some extent, the shares are up just under 6% from the time of publishing that last article, which is a bit disappointing.The growth opportunities and the ways the company is addressing these we identified in our previous articles are still there and their combined effect can be summed up with a slide from the earnings deck:They introduced their new platform New Relic One which is aimed at:Software is increasingly dominating operations and its complexity is rising:Many customers have point solutions in monitoring the performance of their applications, but this then grows with the underlying complexity and misses the dependencies (Q4CC):What New Relic One provides is a unified view which captured the interconnections and dependencies and is curated with clients being guided at what metrics they have to watch (Q4CC):It looks like that integrated view catching dependencies is where the company's competitive advantage is resting on. Given the win and retention rates, they have a strong competitive position versus the legacy APM centric vendors.But there is a new class of competition emerging that (like New Relic) focuses on modern environment (cloud, containers, kubernetes, etc.), describing these on the Q4CC:And that's why, in the words of management, the New Relic One platform is a game changer because it runs at a pan enterprise level catching all these interdependencies.New Relic One will also consolidate the often large numbers of New Relic accounts that big customers have, which could be as high as 200+ (Q4CC):New Relic One also simplifies the number of tools so big customers do not have to switch so often between tools (Q4CC):New Relic One will be free for existing accounts and offered as a complementary view as to not uproot their existing products and assist them with the learning process.Nevertheless, there are some indications that New Relic hasn't cornered the market. For what it's worth, FinancesOnline compares New Relic with Dynatrace (NYSE:DT) and seems to come out slightly in favor of the latter, although this is likely to apply to the legacy APM solutions. Indeed, it chimes with Gartner's famous quadrant:One of the nice features of SaaS platform business models is the endless opportunities it provides to add bells and whistles and open up new revenue streams and opportunities for up-selling.This they have been doing, of course, adding new products like infrastructure, insights and Lambda.Additional functionality can be either:Three new products are scheduled for fiscal 2020 (which started already in April):SignifAI was acquired and this AI solution is aiming to significantly reduce the number of alerts customers get (up to 50K a day!). It's going to be part of New Relic One, but it's not ready yet.The SignifAI acquisition fits nicely in the unified perspective of New Relic One, from The New Stack:The company also integrates with a host of other solutions and open source technologies. There are several metrics that account for the land and expand strategy:From the earnings deck:The company also has a longer-term target operating model:Data by YChartsMargins have been trending up for a while. Operational margins are taking a bit of a hit because of the increased investment in R&D and S&A. Apart from the cost, it will also take some time getting these new people up to speed. They hired more than 500 people during the year and this year that will be somewhat less (so in percentage terms, the decline is likely to be significant).The company is significantly increasing its cash flow:Data by YChartsWhether the seemingly accelerated improvement will continue doesn't seem quite likely, at least not this year, as:Guidance for free cash flow this year is $55M-$65M which would consolidate recent gains but not add to them.Free cash flow comes almost entirely from stock-based compensation and it's not surprising there has been significant dilution:Data by YChartsThe company has $405.9M in long-term debt (0.5% senior convertible notes) and $744.7M in cash and equivalents.Data by YChartsOne should keep in mind that in addition to the 58.4M shares outstanding, there are 18M+ shares in additional dilution from incentive pay, a 30%+ dilution, from the 10-K:The senior notes will also convert but these are already included in the EV/S multiple, of course.Analysts expect an (non-GAAP) EPS of $0.60, rising to $1.08 next year, but it's still to early to value the company on an earnings basis.The company is still in the expansion phase, investing heavily in R&D, S&M and acquisitions, and so it should be, since it is already generating positive free cash flow and is faced with large market opportunities.The company has a history of earnings and revenue beats, and there is little reason to assume this will change anytime soon.The company hasn't yet reached the scale where it generates so much cash that it can start buying back shares and countering the (substantial) dilutive effects of incentive pay.Two metrics stand out, the terrific gross margins (85% in Q4) and the net dollar expansion rate of 131% which testify to the inherent profitability of the model. There is a lot of inherent operational leverage, but this is still mostly invested in growth.We see just a little room for valuation multiple expansion. While the company certainly isn't valued at the top end of the SaaS pyramid, 10x sales isn't exactly cheap either. They do have competition and debt, and there is still 30% dilution coming.That doesn't mean there isn't any upside in the shares, we think there is, market circumstances providing. Growth might slow down a bit, but will be very brisk for some time to come and the investments in R&D and S&M are tapering off this year so leverage is likely to improve at some point."
4283243,103480,2019-08-08T12:18:02-04:00,"Shares of New Relic crashed more than 30% after reporting Q1 results, despite beating Wall Street's top and bottom line expectations.
        The company's Q2 guidance came in below consensus, and calls for growth to decelerate five points to 25% y/y.
        Like many other SaaS companies over the past two quarters, New Relic cited sales execution and hiring issues as the primary drivers behind the lower forecast.
        Net expansion rate also fell to 109%, nine points weaker than 118% in the year-ago period.
        Despite the near-term weaknesses, New Relic remains at a multi-year low and is highly buyable at a valuation of ~5x forward revenues.","In a stunning reversal of fortunes, application monitoring company New Relic (NEWR) has crashed to new lows after it became the latest enterprise software company to report on ""sales execution issues"" - which is the worst thing for software investors to hear about. Despite performing ahead of expectations in the first quarter, New Relic noted some softness in sales momentum that impacted billings as well as a more developed competitive landscape. Once an investor favorite that ranked among the most expensive stocks in the software sector, New Relic has now essentially given up all of its gains for the year and is down 30% YTD:Of course, I'm of the opinion that any time there's blood in the streets, patient and opportunistic investors should be sniffing around (I deployed the same tactic last week in buying Zendesk (ZEN), where a small whiff of weakness in Europe caused a ~20% plunge in shares). It's important for us to assess two things: first, how bad is the last news from the company, and does the valuation drop overcompensate for the weakness?Let's address New Relic's valuation drop first. At present share prices around ~$57, New Relic has a market cap of $3.33 billion. After we net out the company's $768.9 million of balance sheet cash against $411.1 million of convertible debt, we arrive at an enterprise value of $3.08 billion. Here's how that stacks up against New Relic's latest guidance:Figure 1. New Relic FY20 guidance updateSource: New Relic earnings deckNote that New Relic's revenue range of $143-$144 million (+24-26% y/y) falls below consensus estimates of $146.0 million (+27% y/y), while also indicating four to six points of sequential deceleration relative to this quarter's 30% y/y growth rate. That indicates slightly steeper deceleration as well relative to this quarter, where the company showed four points of deceleration relative to 34% y/y growth in Q4. New Relic's full-year estimates disappointed as well - with the full-year forecast clocking in at $600-$607 million, bracketing consensus estimates of $606.2 million but lower at the midpoint. Regardless, at the midpoint of New Relic's latest FY20 guidance range, the stock currently trades at a mere 4.9x EV/FY20 revenues. Hands down, this is the cheapest entry point for New Relic to date. Take, for example, earlier this year when New Relic traded at an all-time high near $110 - at that time, New Relic was trading at slightly over 10x forward revenues. In my view, the slight guidance miss and the near-term sales warnings don't warrant the valuation slicing in half. New Relic is at the cheapest level it's been at in years, and I'm a strong buyer at these levels. It's worth noting that the dreaded condition of ""sales execution issues"" is not a permanent affliction. For example, SailPoint (SAIL) last quarter noted that it expected to face a sharp drop in billings due to insufficient sales hiring and inadequate coverage of large enterprise clients as the company shifted to focus on mid-market sales. In the same day that New Relic reported earnings, however, SailPoint's growth rates came in higher than its prior guidance and the company noted that it was rebuilding momentum in its sales staff.For companies with strong, category-leading products like New Relic, it's just a matter of time before the company hits its stride again.Let's now assess New Relic's latest results and its commentary around what's going on with its sales team. Here's a look at the company's Q1 financials:Source: New Relic 2Q19 earnings releaseIn and of itself, New Relic's first-quarter results aren't the problem. Revenues grew 30% y/y to $141.0 million, besting Wall Street's expectations of $139.7 million (+29% y/y) by a one-point margin. As previously mentioned, this quarter's growth rates represented four points of sequential deceleration.The problems lay underneath the hood. Beginning this quarter, we saw the weakest-ever performance in net expansion rates, which is a key measure of how SaaS companies are retaining and upselling into their current installed bases. Because upsells also cost less sales dollars than new business, expansion business is also critical to improving margins.Figure 3. New Relic business trendsSource: New Relic earnings deckAs shown in the chart above, the company's 109% net expansion rate sank nine points y/y, and remained lower than any other quarter in this nine-quarter window. On the bright side, however, the company's average ARR per paid business account rose to an all-time high of >$33,000, reflecting a stronger product mix.New Relic's sales issues developed over the course of the first quarter. Here's the commentary that CFO Mark Sachleben offered (emphasis added for key points) on the Q2 earnings call:In essence, New Relic shifted for the first time to a region-based sales team structure, which combined with U.S./EMEA weakness and insufficient sales hiring led to some deal slippage. Note that the Europe-based weakness isn't exclusive to New Relic; many companies, including Zendesk, have also reported weakness in the region - so we shouldn't disproportionately punish companies like New Relic for wider IT spending trends that are impacting the whole technology sector. Unfortunately, CEO Lew Cirne also drove the dagger deeper when he noted that the competitive landscape has become more challenging in response to an analyst question on the earnings call:It's worth noting, however, that New Relic remains the undisputed best-in-breed vendor in the monitoring space, with its primary competitors being mid-sized startups like Datadog. Earlier in March, New Relic's Leader status was re-confirmed for the seventh consecutive year by Gartner in its annual Magic Quadrant rankings, which carry plenty of weight with IT buyers. New Relic's premium positioning should allow it to muscle past competitive pressures, especially among large-cap enterprises. It's also worth noting that New Relic also remains a free cash flow positive company, which is a rare status among high-growth software companies. New Relic's generous cash balances plus its positive FCF gives it plenty of financial flexibility to invest in growth as it navigates through a challenging sales period. Over the trailing twelve months, New Relic generated a respectable 9% FCF margin. And despite this quarter's sales issues, both operating and free cash flow remained positive, albeit down from the prior year:Figure 4. New Relic FCFSource: New Relic earnings deckIn one swift drop, New Relic has moved from the top tier of enterprise software valuations to the bargain bin. In my view, the drop is a steep overreaction to macro-based weakness that basically every software company is experiencing in varying degrees, plus a company-specific sales hiring and re-organization issue that management has committed to solving over the next few quarters. Stay patient here and buy the dip."
