article_id,author_id,publish_on,summary,content
4357461,21815,2020-07-08T08:02:40-04:00,"The company ran into some execution problems as it focused on the introduction of its New Relic One platform last year.Now that these problems seem behind us and the platform could reignite growth, there are headwinds from the pandemic.While the shares aren't expensive, technically one might want to wait for a confirmed outbreak, as they are hitting important resistance.Longer term, we remain positive on the shares.","The shares of New Relic (NEWR) have been trading sideways for quite some time on slowing growth and execution problems. We think that these problems are behind us with the introduction of the New Relic One platform, which offers significant benefits of an all-encompassing view.We think that the company could revive its fortunes and the shares aren't expensive. However, short term, it is dealing with customers and potential customers facing considerable headwinds from the pandemic.We last wrote about New Relic, the APM (application performance monitoring) leader, a year ago, and quite frankly, the stock has disappointed since then, and even longer, as it happens:The stock has been basically been trading sideways in two and a half years, which is not something we'd expected. At first sight, the big decline in the share price in reaction to the Q1 2019 results (or more precisely, the guidance for the year) in August last year seems the turning point, and there is some data to back that up:Data by YChartsOperationally, the company stopped improving or even deteriorated (as for GAAP net income) in the last year or so, while revenue growth took another leg downwards from 30%+ to 20%.Data by YChartsCash flow growth slowed, but remained positive:The main reason for the disappointment was that the company was too focused on the introduction of New Relic One, which saw the light in May 2019. From the latest earnings deck:Apparently, the introduction was a complicated birth, and this led to execution problems which started to show up in the figures subsequently.But now that this introduction is in the rear-view mirror and management is aware of these execution problems, there is a good chance the company is being put back on the rails again, although the pandemic is throwing sand in the wheels here (see below). Here are the main initiatives that are making that happen:The evolution of New Relic is depicted in the following slide from the latest earnings deck:Some of the products that are recently introduced are:The AI solution goes through all the telemetry data that customers onboard on the platform and helps to reduce false alarms. This can really be a significant problem, as when something gets wrong, companies can receive thousands of alerts which in essence all stem from the same problem.The AI product sifts through that and brings it down to the essentials. So far, that seems to be working very well, as some customers have seen an 80% reduction.The Edge product with Infinite Tracing is (from Diginomica):It really cuts through the complexity by freeing customers from having to aggregate and inspect all traces. Instead, it automates the process (from company PR):Management revealed during the Q1CC that it has an exciting roadmap of upcoming products, so this isn't the last improvement we'll see. It's also necessary to keep the competitive edge the company has developed.The sales execution has been changed with new objectives like ARR, a focus on $100K+ customers and renewal yield. The process has been simplified as well as the market segmentation, and there was a lot of training as a result of the new product introductions.Once the New Relic One platform was available, management put emphasis on selling it, as platform customers use all three of its main vectors (application performance monitoring, infrastructure monitoring and log analytics).And since the last Investor Day in December 2019, there is a renewed focus on customers with an ARR of $100K+, and the company managed a decent result here with 67 new customers added in Q1 with ARR above $100K, despite demand tailing off in the last couple of weeks of the quarter.Corporate demand should be helped by the availability of New Relic One, providing a vision of APM and infrastructure and logs on a single pane of glass and even coming from the same database. The platform has multiple advantages:Indeed, this is what management argued on the Q1CC:So, management clearly has great expectations of the platform, and not without reason, as customers over $100K tend to have a higher net expansion rate and newer customers are proportionally more on the platform compared to older customers. Of the company's Q4 customers, half of the ARR is on the platform, while that figure is 1/3rd of ARR for overall customers.The impact was clear from March, as New Relic has customers in sectors that have been proportionally hit (airlines, tourism, hospitality, retail), although overall, this is a small percentage (10-15%) of its installed base.But selling cycles have trended upwards, as CapEx has been hit and some customers have asked for extended payment periods. Management has been really proactive here, coming up with a portfolio management approach that observes customer usage of the company's products as well as customer health.When risks are identified, a migration plan is set in motion, and this is repeatable so it gets more efficient over time. This obviously has an impact on ARR, but management deems it more important to preserve the long-term customer relationship.We agree here. It's basically like landlord lowering the rent or extending payment terms temporarily for customers in pandemic distress. Some smaller companies cannot even pay their bills at all.Overall though, the main drivers of New Relic - the digital transformation, the move to the cloud and the importance of operational resilience - remain in place and arguably have become more important still.Given the expected impact on upsells as well as the churn, the company's dollar net retention rate is likely to come under pressure in H1.New Relic withdrew guidance for the year and will only provide guidance for the next quarter (that is, Q1 2021), for which it expects revenue between $158 million and $160 million, non-GAAP operating income between -$3 million to breakeven and non-GAAP EPS between -$0.01 and $0.04. ARR growth is expected to be 13-14%.Management sees both a slowdown in close rates and a pick-up in churn, so Q2 figures are likely to be affected.Data by YChartsGross margin is already coming down a bit, and it will go to the high 70s in the subsequent couple of years as a result of the company sun-setting its own data centers and moving to the public cloud. This move does improve cash flow though, as it saves a considerable amount of CapEx.New Relic will keep on benefiting from its large cash position to keep investing in R&D and S&M (and even some in G&A), and will be hiring throughout the year.Data by YChartsAnalyst expect EPS of $0.13 this fiscal year (ending March 2021) and $0.43 for FY2022.The company has an iron clad balance sheet, having $805 million in cash and equivalents at the end of Q4 (up from $737 million at the end of Q3) and no debt. The share-based compensation is a substantial 16% of revenue, and this has led to considerable dilution:Data by YChartsShares are banging up an important resistance level though, and buyers might want to wait until that breaks:There are several reasons why we like the stock here:Against this are the headwinds from the pandemic, which have postponed up-sells and new customers, and the company has made some payment concessions to clients in distress."
4377336,103639,2020-10-02T10:30:35-04:00,"NewRelic is one of a small but important collection of software companies in the application performance management segment.This segment is growing in importance to enterprise customers, as enterprise IT environments become more complex and fragmented.The segment is oligopolistic in nature, meaning high levels of pricing power and high margins for the leading players.NewRelic has a stable and cash generative installed base, but has struggled with growth of late.  The stock has sold off and is priced attractively for a buyout.","This article was highlighted for PRO subscribers, Seeking Alpha's service for professional investors. Find out how you can get the best content on Seeking Alpha here.DISCLAIMER: This note is intended for US recipients only and in particular is not directed at, nor intended to be relied upon by any UK recipients. Any information or analysis in this note is not an offer to sell or the solicitation of an offer to buy any securities. Nothing in this note is intended to be investment advice and nor should it be relied upon to make investment decisions. Cestrian Capital Research, Inc., its employees, agents or affiliates, including the author of this note, or related persons, may have a position in any stocks, security or financial instrument referenced in this note. Any opinions, analyses, or probabilities expressed in this note are those of the author as of the note’s date of publication and are subject to change without notice. Companies referenced in this note or their employees or affiliates may be customers of Cestrian Capital Research, Inc. Cestrian Capital Research, Inc. values both its independence and transparency and does not believe that this presents a material potential conflict of interest or impacts the content of its research or publications.During the good old days, your enterprise software stack was pretty simple. Boxes from IBM or Dell or build-your-own depending on how cheap your CFO was. Some variant of Unix operating system or Windows NT if your CTO liked to spend his or her weekends in the office. Mail server from vendor A, file server from vendor B, an ERP system, some specialist stuff for your industry on top, all wired together with plenty of bespoke code written by an expensive consultant or the work experience kid, again depending on your CFO's wallet orientation.Well, that Dreamtime is over, if it ever existed. Today as everyone knows your plain vanilla enterprise stack is, well, raspberry ripple, rum & raisin and mint choc chip all swirled together, and worse, it all sits in various different bowls in different locations connected together by pipes of various kinds. Otherwise known as 'the hybrid cloud'. Which means some stuff at Amazon AWS, some stuff at Microsoft Azure, some stuff with Salesforce, some stuff in the basement room where Bob McShy The COBOL Guy lives and works, all interacting using something called microservices. Now, just to make things even more interesting, all users everywhere now use computers at home and in fact carry what in Bob's era would have been a supercomputer in their pocket, in the shape of their smartphone. So they all consider themselves tech-savvy and demand to be able to use all enterprise IT everywhere at all times and if something doesn't work then there is going to be A LOT OF CAPS in the internal emails to support. Enterprise IT has, in fact, become a nightmarish spaghetti puzzle.This is bad for most people but it is very good for some folks, including:The more distributed and fragmented that enterprise IT stack gets, the more you need APM software. Which then increases complexity still further. Which means ... oh you see where this is going.There are many companies that would claim part of the APM market but the key players soaking up market share are those four we name above. The market is as a result fairly concentrated and you can see the effect of that in the financials of these vendors. Each is growing, none are consuming cash in any big way (unusual in enterprise cloud software right now) and indeed DT is a prodigious producer of free cashflow.The hot stock in the above list is DDOG. It's a wonderful business with high revenue growth rates, highly visible recurring revenue and modest cash usage. We've variously been at Buy and Neutral on DDOG in our service and the stock has been good to us.DT is yesterday's hotrod but it still has some nitrous left in the bottle. Acquired in a grab-bag deal by renowned software investor Thoma Bravo, it was spun out and IPO'd in 2019, very successfully as it happens. We cover DT too and once again this name has been good to us.PD has been a mixed bag. The company has a narrow point solution built around alerting and in our opinion although the financial performance is solid it remains at an unexciting balance of modest growth and not-quite-cash-generative. The company lacks sparkle in its capital markets marketing and taking all those pieces together it's not surprising to us that the stock has yet to really shine. We've highlighted trading opportunities for this name and again we've enjoyed success with it.NEWR is relatively long in the tooth compared to the cloud hot stocks du jour. The company was established in 2008 and went public in 2014. Growing revenue at 50-60% p.a. in its early years as a public company, and consuming cash at rate of knots as a result, the business has slowed markedly in the last twelve months. Here's the slowdown in revenue growth since Q1 of the company's FY3/18.Source: YCharts, Company SEC Reports, Cestrian AnalysisThat 50-60% growth p.a. in 2015-16 has fallen to 21% p.a. on a TTM basis in the most recent quarter. Q1 of FY3/21 (the quarter ending 30 June 2020) showed growth of 15% vs. the same quarter a year back; so we expect that TTM growth rate to fall somewhat going forward. Deferred revenue growth, at 17% in the same quarter, supports that expectation.Commensurate with the slowdown in revenue growth, margins have improved. If you are spending less money chasing new customers, more revenue will fall through to the bottom line. TTM EBITDA margins stand at around 15% today vs. breakeven three years ago.EBITDA to cash conversion leaves something to be desired, mainly due to the company's degree of capitalization of spend.So at 15% TTM EBITDA margin the company sits at just 3% unlevered pretax free cash flow margin.The combination of slowing revenues and relatively low cashflow margin isn't ideal for cloud software stocks in the current environment. Here's how the stock price has moved lately.Source: TradingView.com, Cestrian AnalysisThe most recent drop came with the Q1 (quarter ending 30 June) earnings announcement and earnings call. The company declared that it was working on a substantial product revamp so that they could better interact with cloud-native enterprise applications and services; they also declared that revenue growth would remain low whilst investing in a product refresh. So the company told the market that growth will be low and cashflow margins will be low. Unsurprisingly the stock sold off.NEWR is in our view a very viable acquisition target. At yesterday's closing price of $57.35 the stock is valued at just 4.9x TTM revenue in exchange for 15% revenue growth. That makes NEWR one of the cheapest cloud stocks for its growth rate. Revenue is expected to grow a little faster than Alteryx (AYX) or Vertex (VERX) but whereas AYX trades at close to 20x TTM revenue, NEWR trades at just 4.9x.Source: Google Finance, YCharts, Company SEC filings, Cestrian AnalysisSo this is a superb set-up for a leveraged buyout by one of the usual software buyout leaders (eg. Thoma Bravo, KKR (KKR), Hellman & Friedman, etc). Low price, mid-teens growth, poor cashflow margins, company fallen from grace a little but not so far or for so long that some luster cannot be restored.Here, in a nutshell, is the LBO plan for NEWR. Observe NEWR datapoint in the matrix below. Buy company. Join board of directors. Have management move the datapoint to the right (by cutting operating costs and cutting profit leakage into working capital) and then upwards (by increasing revenue growth - by mechanical means such as price rises and contract changes, in addition to faster unit growth). Acquire a few smaller companies along the way with 100% debt funding, thus reducing the overall equity cost per unit of revenue and earnings. If the current management team prove incapable of or unwilling to deliver this plan, get a new management team. And once you have a company growing revenue at c.20%+ p.a. with pretax free cashflow margins of 15-20% - in other words when the existing management team or the new team you install have that dot move to be directly in the company of Salesforce (CRM), WorkDay (WDAY) and DT - sell the company.Source: Google Finance, YCharts, Company SEC filings, Cestrian AnalysisAnd the reason to do that is ... well look back to the first scatter plot. DT trades at a vastly higher revenue multiple. So if our buyer can get to work on NEWR and then sell it on not for the 6-8x TTM revenue that they paid (factoring in some acquisition premium), but at the 15-20x revenue multiple that DT commands; that's a great deal.The list of buyers will be long once the company is in this kind of shape. APM being the strategic battleground that it is, the final owners of this functionality are already jostling for position. Microsoft (MSFT) is cozying up to DDOG; NEWR to Amazon (NEWR's product is certified for simple deployment in the AWS environment); moreover we believe CRM will be an interested buyer in this segment, since they already acquired MuleSoft (MULE) to provide enterprise application integration functionality. IBM and others also ought to be interested. For all these reasons we believe a number of potential buyers are running the slide rule over NEWR right now.Whether a transaction takes place we don't know, of course. But a little signpost that says it might can be found here. If you scroll through the heart-warmingly retro ASCII text in that link you'll see the SEC filing wherein HMI Capital, a hedge fund with familial ties to Hellman & Friedman, and from whose windows in San Francisco you can see into the windows of Thoma Bravo, acquired 6.6% of NEWR in August this year. Now, as far as we can see, the last time HMI Capital bought 6% of a software company, it was Ellie Mae (former ticker ELLI) in November 2018. You can see that filing here. A few months later, Ellie Mae was bought out by Thoma Bravo. Who then applied the above buyout playbook - with spectacular results, as it turns out.Now, this is all probably coincidence and no doubt we are reading things here that don't exist. So let's take it back to basics regarding New Relic. Slightly faded software company. A ton of recurring revenue. 6x TTM revenue. Margins depressed. Enterprise value of $3bn or so. Perfect middle-market software buyout. End of basic analysis.In case we are wrong, we do see some downside protection in the NEWR stock chart. The stock has traded within an upward parallel channel for the last five years or so, save for a sustained breakout to the upside for about eighteen months in 2018-19, and a brief break to the downside as the Covid crisis hit. That lower parallel line you see below can, we believe, act as technical support for the stock.Source: TradingView, Cestrian Analysis.So in summary, we see upside from a potential acquisition, and a little downside protection from technical factors.All told, we rate NEWR 'Speculative Buy' and it features prominently in our M&A HitList, a new feature of our Marketplace service. We also own the stock personally with its buyout potential in mind.Cestrian Capital Research, Inc - 2 October 2020."
4375436,69905,2020-09-21T09:40:59-04:00,"New Relic's market is in high demand and rapidly expanding, although New Relic doesn't appear to be participating.Its growth rates are fizzling out at a rapid clip.Even at 5x forward sales, there's still not enough here to attract new shareholders to the stock.","New Relic (NEWR) trades for 5x forward sales.On the surface, New Relic appears to be very cheaply valued. However, the further we dig, the more challenging it becomes to find this investment attractive.New Relic was historically growing very fast, into a rapidly expanding market. However, right now, even though the market continues to expand, New Relic is being left behind, with its unattractive dollar-based new expansion rate.It will be difficult to attract new shareholder holders to this stock. Here's why:New Relic is an Application Performance Monitoring (''APM''). It allows customers to collect and analyze vast quantities of data flowing through and about their software.New Relic is well-positioned to benefit from companies' ongoing secular shift on their digital journeys.As companies are forced to digitalize and adopt cloud technologies in order to remain nimble, New Relic supports these customers by maintaining uptime and stability. Source: Fiscal Q4 2020 Investor PresentationDevelopers have demanding customers that require a rewarding online experience every time they engage with their brand, either through browsers or on mobile devices.To this end, the visibility into their software provided by the New Relic One Platform to analyze their applications and infrastructure creates the foundation for best-in-class digital experiences.Source: Shareholder Letter Fiscal Q1 2021Developers look to build attractive application experiences and through New Relic suite of products. Consequently, not only to monitor in real-time but to go beyond simply notifying teams when an issue occurs and to guide them towards what caused the issue and why.Source: author's calculations, **company guidanceMoving on, above we can see the undeniable trend that New Relic's growth rates are slowing down at a steady and consistent clip.If last year New Relic was a high growth story clocking in 30% y/y growth rates, right now New Relic just finished Q1 2021 with 15% y/y growth rates -- a marked difference.What's more, the company is guiding for 12% y/y growth rates for the quarter ahead.Even if we assume that New Relic is being conservative to allow for an easy beat next quarter, and we further conjecture that New Relic's Q2 2021 revenue growth rates reach 13% to 14% y/y revenue growth rates, we are still left with a company that has seen its growth rates halving over a period of 12 months. Moreover, right now, as many companies are supposedly benefiting from COVID and companies accelerating their digital journeys, that's clearly not benefitting New Relic.As an aside, as far as SaaS businesses go, it's highly surprising that New Relic is not able to offer investors full-year guidance. After all, one of the advantages of having a SaaS business model is to offer shareholders the predictability which investors badly crave.Source: Q1 2021 Press ReleaseAs a rough proxy for how attractive customers find New Relic's platforms we can cast our eyes on the table above where we see New Relic's ability to report high Dollar-Based Net Expansion Rates. With this important metric in mind, we can see that during Q1 2021 the figure came down from 109% in the same period a year ago, to flat 100% in Q1 2021.During the earnings call, management talked about COVID and the weaker economy playing a role and leading to its slightly underperforming. Having said that, if we compare this set of results with New Relic's close peer, Datadog's (DDOG) recently reported a dollar-based net retention rate of over 130%. This could mean that Datadog is taking market share away from New Relic, or that New Relic is having challenges in delivering strong execution in this highly very fertile environment. While investors are not being asked to pay a high multiple for New Relic, at just 5x trailing sales, this puts the stock in the bargain basement compared with many high flying Wall Street darling SaaS stocks, with many of its peers trading for north of 25x times trailing sales.For example, Datadog is being priced at 47x trailing sales, which puts New Relic's 5x trailing sales in the absurdly cheap territory.However, despite being cheap, it's not entirely without justification. In the past, I would have contended that any cheap stock, that it would only be a matter of time before investors would come to reappraise the stock at a higher multiple.However, the longer I invest, the more experience I gain, and the more I question those previous assertions of mine. Yes, stocks do mean reverse. Yes, value investing does work. But low valuation stocks don't always bounce back or at least in a timely manner.Source: SA PremiumConsider this, analysts estimate that New Relic is likely to report Q3 2021 and Q4 2021 at very close to 10% y/y growth rates. I believe this poses a problem for investors.Firstly, if those estimates are even close to accurate, that would imply a continued deceleration from the growth rates New Relic has recently reported.Secondly, investors will give a company guiding for close to 20% growth rates plenty of room for ''investing for growth strategy'' and to remain GAAP unprofitable for a prolonged period of time.However, once a company is reporting close to 10% y/y growth rates, investors will start to demand a clear path towards strong profitability. New Relic still has the shine from last year when it was growing at high 20s revenue growth rates. Consequently, for that sort of company a multiple of 5x sales is a bargain opportunity.However, it appears to be the case that New Relic may actually be eyeing up low teens growth rates in the near-term, and given that New Relic remains GAAP unprofitable, I fail to see much of a bargain opportunity here for new shareholders."
