article_id,author_id,publish_on,summary,content
4376974,35181,2020-09-30T07:36:52-04:00,YoY Q2 2020 revenue decreased by 2% due to reduced banking transactions and an acceleration of the company’s business transformation from product sales to SaaS.Recurring contract bookings are up by more than 50%. Some of that appears to be due to the company’s new e-Signature application.Investors dumped the stock in response to guidance withdrawal and admission of an accounting gaffe.The stock price is undervalued on a relative basis. This is a long-term buying opportunity.,"(Source: OneSpan)OneSpan Inc. (OSPN) combats identity fraud, primarily within the banking industry, where 60 of the top 100 global banks are using its products. The company is transforming from a hardware and perpetual licence software-based business model to cloud-delivered software services. But therein lies the problem for the most recent quarter. The pandemic is causing an acceleration of the business transformation which is blurring the financial picture for the company.On the surface, the performance appears to be pretty mediocre, with revenue decreasing by 2% YoY for Q2 2020. This is primarily the result of a faster-than-expected drop in hardware and perpetual license sales due to the pandemic. Of course, some of the lost product sales have migrated over to term license software or services. During the transition to Software-as-a-Service (SAAS), lower revenue is expected, along with margin compression, thus blurring the company’s performance.(Source: OneSpan)One encouraging factor is OneSpan’s diversification into adjacent markets, including electronic signatures, and verticals such as government insurance and digital healthcare. In particular, the company is making inroads with OneSpan Sign, the company’s electronic Signature application. For those readers not familiar with the business potential for electronic signatures, one only needs to have a look at DocuSign (DOCU), which would be a competitor in this area. DocuSign has been extremely successful with product portfolio and experienced 250% stock price appreciation in the last year alone, as opposed to OneSpan, whose share price has (only) grown by 50%. According to the company management, OneSpan Sign achieved a revenue growth of approximately 30% for the most recent quarter.Another encouraging factor is that OneSpan’s recurring contract bookings are up by more than 50% YoY. It should also be noted that the success of recurring contracts comes at the expense of perpetual licences and product sales.On the bearish front, OneSpan management indicated that it experienced a lower transaction volume from auto finance customers using its Secure Agreement Automation application. This is understandable given the economic environment.(Source: OneSpan)I should point out that auto sales have been improving through the summer and it is likely that there will be some financial improvement in the second half due to the recovering auto market. On the flip side, COVID-19 infections are on the rise and there are no new government subsidies in sight. As we head into the winter, there is significant danger to the economy which is already on the ropes.Another negative for OneSpan was the withdrawal of forward guidance for the rest of 2020. It was an action by company management that resulted in the stock price dropping overnight by ~40%.(Source: Yahoo Finance/MS Paint)In making the announcement, the company management cited poor visibility, expressing concerns regarding its banking customers in the Q2 2020 earnings call:Another black mark against the company, and also a likely contributor to the falling stock price resulting from the announcement that there was an error in previous financial reports:Needless to say, investors were upset with this announcement, and the disappointment was reflected in the earnings call Q&A session, and a lawsuit, actually several lawsuits, popped up as a result of this gaffe. The accounting error, in all likelihood, was partially responsible for the large drop in share price after the earnings call.There are numerous techniques for valuing stocks. Some analysts use fundamental ratios such as P/E, P/S, EV/P, or EV/S. I believe that one should not employ a simple ratio, and the reason is simple. Higher-growth stocks are valued more than lower-growth stocks, and rightly so. Growth is a significant parameter in discounted cash flow valuation.Therefore, I employ a technique that uses a scatter plot to determine relative valuation for the stock of interest versus the remaining 170+ stocks in my digital transformation stock universe. The Y-axis represents the enterprise value/forward gross profits estimate, while the X-axis is the estimated forward Y-o-Y sales growth.The plot below illustrates how OneSpan stacks up against the other stocks on a relative basis based on forward gross profits multiple.(Source: Portfolio123/private software)A best-fit line is drawn in red and represents an average valuation based on next year's sales growth. The higher the anticipated revenue growth, the higher the accepted valuation. In this instance, OneSpan is positioned well below the best-fit line, suggesting that the company is undervalued on a relative basis relative to its peers.There are several risks that investors should consider before investing in OneSpan. First of all, I view the current stock market action to be reminiscent of the dot.com era, immediately prior to the crash starting in 2000. Technology stocks were performing well beyond what many analysts considered acceptable valuations. It wasn't long before the market turned into a disaster, and the same could happen here, although I believe that there is much more substance behind the internet companies than existed 20 years ago.OneSpan’s performance is very much tied to that of the major banks, and they have already come out with warnings of increased loan loss reserves and expectations of further bankruptcies in the quarters ahead. The longer the pandemic persists, the lack of government subsidies, and possibility of a long deep recession or even a depression could severely impact the fortunes of banks and such fortunes will be passed on to OneSpan.OneSpan is an industry leader in identity verification primarily within the global banking industry, with 60 of the top 100 global banks as customers.(Source: OneSpan)OneSpan’s YoY revenue decreased by 2% in the most recent quarter, primarily as a result of pandemic-driven reduction in hardware/perpetual software licence sales and transition to a SaaS business model. The business transformation has blurred the financial situation to some extent. The pandemic did not help as the depression in certain industries, such as the auto industry, led to declining bank transactions and hence declining revenue for OneSpan. The bright side is that the economy is recovering to some extent. Sales within the auto industry have been improving quite nicely as the summer progressed.Currently, OneSpan has a stock price that I consider to be undervalued, primarily due to the perceived mediocre performance in Q2, withdrawal of guidance for the remainder of the year, and the accounting gaffe. I believe that this is a good time to be bullish on this company. The economy is recovering, bank transactions are improving, and OneSpan’s e-Signature business is performing quite well, up 30% YoY. For these reasons, I am giving OneSpan a long-term Buy rating. You may have to be patient with this one."
4318173,103130,2020-01-21T17:37:27-05:00,"A look at OSPN's financial performance from Q3 2019 earnings report .Brief discussion on impact of exchange rates.I no longer recommend shorting OSPN due to general market trajectory, but do not recommend a long position either.","One year ago, I wrote an update article on OneSpan (OSPN) detailing why I believed investors should initiate a short position on the cyber security company. That article was a follow-up on my original thesis that OneSpan was plagued by anemic revenue growth, thanks to a slow shift to a SaaS business model. The update article then provided evidence of falling deferred revenue (an important indicator of demand in the SaaS domain), weak overall revenue growth, eroding license revenue margins, and negative operating cash flows – all of which contributed to my rationale for shorting OneSpan a year ago.Before diving into the analysis of OSPN's financials, we should see how my short position recommendation fared.Data by YChartsBased on price action alone, my short recommendation appears to be dramatically wrong. OneSpan's share price spiked roughly 60% just two months after my previous article, and now sits 55% higher than its share price back when I recommended the short position.I clearly was wrong, but a benchmark comparison to the Technology Select Sector SPDR ETF (XLK) provides better context for how OSPN performed among peers. Data by YChartsOneSpan anomalously outperformed the technology sector benchmark in the first half of 2019, but then balanced out its annual performance by underperforming (relative to XLK) for the last three quarters of 2019.According to this Zacks earnings article from February 2019, OneSpan was ""expected to post quarterly earnings of $0.07 per share in its [then] upcoming report, which represents a year-over-year change of +40%."" The Zacks article also mentioned that revenues were ""expected to be $59.10 million, up 8.4% from the [then] year-ago quarter."" Apparently, OneSpan crushed its Q4 2018 earnings report, but then had earnings misses in subsequent quarters. Let's get into the financials to figure out why OSPN had a tumultuous 2019, and where the stock may be heading in 2020.To kick things off, below is a snapshot of the company's assets.(Source: Q3 2019 10-Q)Cash and equivalents fell nearly $22 million between the beginning of 2019 and end of Q3 2019, but was more than offset by gains in all other current asset categories, excluding contract assets. I searched for the cause of the decrease in cash and equivalents in the Q3 2019 earnings transcript, and found this explanation from the CFO:Since accounts receivable rose (significantly) while cash and equivalents fell, it seems that a chunk of orders arrived too late for OSPN to record the gains to cash, which would have led to decreases in accounts receivable for the Q3 report. With total current assets increasing by $6 million, there is no cause for alarm. The Q4 2019 earnings will show the increase in cash that would have occurred in the prior quarter if not for the late orders. Next is liabilities (I omitted the stockholders' equity section because it is not relevant to my analysis).(Source: Q3 2019 10-Q)For liabilities, the only category I care about is deferred revenue. As I mentioned in my previous OSPN article, deferred revenue is very important for evaluating SaaS companies. Since SaaS companies often receive upfront payments for future time periods, revenue cannot be realized until the time period has passed and the service has been provided. Thus, deferred revenue serves as a proxy for demand of a company's offerings, because an increase to deferred revenue means either new customers are purchasing subscriptions and/or existing customers are augmenting their current subscriptions. In my last article, I said that OSPN recorded $28.34 million in deferred revenue for Q3 2018. Compared to Q3 2018, deferred revenue has only risen 4% in the span of one year. I complained about the lack of deferred revenue growth last time, and once again, deferred revenue has failed to grow enough, only reaffirming my concern that OneSpan is unable to increase subscription revenue fast enough.(Source: Q3 2019 10-Q)Now, here are the revenues. Immediately, the gain in product and license revenue catches the eye. Quarter-over-quarter, license revenue grew a whopping 66%. I dug into the Q3 2019 earnings transcript to find out why the increase was so large, and learned that software revenue grew 95% for the period. After further digging, I found the answer to my question from the CEO in the Q&A section:Fortuitously for OneSpan, the meteoric rise of mobile transactions (i.e., Venmo) has created enormous demand for their mobile security offerings. The increase in revenue is great, but while license revenue grew 66%, services revenue only grew 18.8%, which begs the question: how steady will OneSpan's future revenues be? The issue with license sales is that it can be a feast or famine; OneSpan may be riding the mobile security wave through license sales, but once their customer orders in this niche saturate, then revenue gains will drop off sharply due to the one-time-payment nature of these transactions. OneSpan could offer frequent updates that customers would have to pay for, but that may lead customers to avoid upgrades, whereas the subscription model offers upgrades as part of the recurring fee, which helps justify the subscription in the customer's eyes.Moving onto cost of goods sold, license costs grew 55%. So, the 66% increase in license revenue was terrific, but the margins are not as impressive as the revenues. Speaking of margins, gross margin was 67%, which is a 1% increase from Q3 2018. Thus, gross margin has effectively been stagnant. OSPN's revenue patterns echo the same sentiments of concern I held a year ago in my previous article: the company is not embracing subscription revenue in a world where customers' business is increasingly becoming winner-take-all. To round up this section, here is a snapshot of operating costs.(Source: Q3 2019 10-Q)In my last article, I noted that sales/marketing expenditure increased $2 million in Q3 2018, while gross profit fell $2 million. I was concerned that OneSpan's sales force was ineffective and could not stimulate demand. If you fast forward, Q3 2019 sales/marketing expenditure fell nearly $2 million, while gross profit rose roughly $20 million. The boom in mobile security needs is the primary driver of revenue gains for OneSpan, but the sales force is clearly competent enough to capitalize on those tailwinds. Aside from that, the only other thing that sticks out in the table is positive operating income and net income, which is mostly a result of the large increases to revenue – not so much a result of lower operating costs.Below is a table of the company's operating cash flows.(Source: Q3 2019 10-Q)At first glance, you will notice that net cash used in operating activities is lower than the previous period. However, if you move upwards, accounts receivable tells the story. As the CFO mentioned in the earnings call, the timing of orders created a larger than usual balance in accounts receivable; if you correct for the accounts receivable situation, then OneSpan would have had positive net operating cash flows, which is a good sign for now – even if license revenues is the main cause for this.Let's briefly look at investing cash flows (below) before moving on.(Source: Q3 2019 10-Q)In my previous article, I mentioned how the cash used to purchase Dealflo may come back to haunt OneSpan if the company continued to experience negative net cash flows. That no longer seems to be an issue with the latest earnings results. OSPN did not use much cash beyond operating activities in the given period. For this period, they simply took the cash from the short term investments that matured and plowed it back into short term investments, which is nice because it serves as a liquidity buffer. In my last article, I cited exchange rates as a risk for OSPN, because 35% of its revenue is denominated in a currency other than USD, with much of the foreign currency revenue being in euros. (Source: XE)The Euro has become $0.03 weaker than the Dollar in the past year, but I believe this will merely be a minor inconvenience to OSPN in coming quarters. The Federal Reserve is content with keeping rates steady, while rates across Europe do not show signs of being lowered, meaning that EUR and USD are not likely to deviate far from each other in the near future. If anything, deriving more business from Europe is beneficial since lawmakers on the other side of the Atlantic have become zealous about cyber security and privacy, which is surely offering business opportunities, to companies like OneSpan, that far outweigh any risk posed by currency fluctuations at the moment. In my previous article, OneSpan had continued to struggle. It faced low liquidity following an acquisition that failed to contribute commensurately to revenue, its revenue growth was flat, and operating cash flows were negative. A year later, OneSpan is in a much better place. The company witnessed its software license revenue nearly double, boosting overall revenue by 66%. Assuming the vast majority of the accounts receivable balance is collected, OneSpan would technically have had positive net operating cash flows this period, which is a giant step in the right direction. However, the pink elephant in the room is subscription revenue. Most of the company's revenue gains came from license revenue, and while higher revenue alone is reason to celebrate, it is not as steady as subscription revenue, which means dramatic swings in future earnings results are a real possibility. Therefore, based on the improvements made in the last year and my continuing concern about the slow migration to subscription revenues, I recommend that investors avoid holding OSPN shares, but do not take on a short position due to the general upward trajectory of the markets at the moment."
