article_id,author_id,publish_on,summary,content
4383969,103480,2020-11-02T08:40:54-05:00,"Pegasystems reported a strong third quarter, with continued buildup of ACV, especially in cloud.
        The company now estimates that it is 60% underway with its cloud transition, and expects to be a nearly pure cloud company by early 2023.
        As Pegasystems' scale in the cloud has increased, so has its gross margin.
        Pegasystems' diversified base of corporate and public sector clients, plus its >$80 billion TAM, make it a worthwhile hold.","So far in the third quarter earnings season, it has been a bloody quarter for so-called ""legacy"" technology companies, especially those that are playing catch-up in the cloud. Look at SAP (SAP) - the German software giant best known for its ERP systems has sunk ~30% after it reported a slowdown in revenue growth owing to a slow pandemic recovery and unfavorable currency movements. Pegasystems (PEGA), another legacy software company that specializes in CRM and BPM (business process management) tools that is perhaps less-well known, has largely avoided sharing SAP's fate. The company just reported third-quarter results that show its cloud transition is still humming, as well as sales momentum that hasn't been overly hampered by the coronavirus.Pegasystems, in fact, benefits from the fact that it specializes in process automation tools that help businesses streamline and simplify portions of their workflow. Amid a pandemic that has thrown a wrench in the way we work, Pegasystems has reported that many of its clients are taking the opportunity to re-examine their work processes, which in many cases has led to a software-led redesign that has benefited Pegasystems sales.As a refresher to investors, Pegasystems believes its combined market opportunity in both CRM and BPM is an eye-popping $80 billion, which means the company is only just shy of ~1.5% penetrated into this market its current ~$1 billion annualized revenue run rate.Figure 1. Pegasystems TAMSource: Pegasystems Q3 earnings deckPegasystems may not be the newest and hottest SaaS play on the block, but right now with the market taking a risk-off attitude and with many high-growth tech stocks trading at valuations that have made news pundits whisper about a 2000s-style bubble, increasing your exposure to older and more profit/value-oriented software stocks may be a smart move for 2021.These are the bullish catalysts that can propel Pegasystems' stock higher:While I'm not as confidently bullish in Pegasystems as when the stock was trading in the sub-$100 levels earlier this year, Pegasystems still does represent good value. Its current market cap of $9.35 billion and enterprise value of $9.40 billion represents a 7.6x EV/FY21 revenue multiple versus Wall Street's $1.24 billion revenue consensus for FY21 (+18% y/y; data from Yahoo Finance). For a company growing ACV at >20% y/y and cloud ACV at >50% y/y, I think there's still room for upside. Let's now dig into Pegasystems' latest earnings in greater detail. The Q3 earnings summary is shown below:Figure 2. Pegasystems Q3 earnings Source: Pegasystems Q3 earnings releaseNow, at face value, Pegasystems' results appeared disappointing. The company's total revenue $226.0 million grew only 4% y/y, decelerated sharply from 11% y/y growth in Q2 (and before that, revenue had been growing at a 25% y/y pace in Q1), and missed Wall Street's mark of $249.9 million (+15% y/y) by a wide mark.However, the market is putting less stock in Pegasystems' near-term results because of the haziness caused by the cloud transition. As you can see above, the main culprit behind the revenue slowdown was a steep -31% y/y decline in software license revenue, while Pegasystems Cloud revenues grew 56% y/y. This is two points faster than Pegasystems' Q2 cloud growth rate of 54% y/y. What happens when a company flips its business from license to cloud is that lumpy revenue streams that used to get booked upfront are now spread over a longer period of time. Optically, Pegasystems' quarterly financials won't present a clean picture of its underlying fundamentals until the company gets closer to its early 2023 milestone of completing its cloud transition. Ironically - the better and faster that Pegasystems is at shifting its revenue base into the cloud, the more its near-term revenue will be negatively impacted. Instead, what investors should focus on is Pegasystems' continued buildup of ACV. Pegasystems ended Q3 with $777 million of ACV, up 21% y/y - matching the ACV growth rates in Q2 and Q1. Cloud ACV (meaning products that Pegasystems customers are choosing to host in Pegasystems' cloud, versus their own infrastructure), meanwhile, grew 57% y/y to $232 million - a point stronger than 56% y/y growth last quarter. And when we take a step back and look at Pegasystems' nominal ACV trends, we find that Pegasystems tacked on $30 million in annual business sequentially versus Q2 - which is more than the $27 million it added in Q2, and $24 million it added in Q1. Figure 3. Pegasystems ACV trendsSource: Pegasystems Q3 earnings deckOne major area of interest for investors is how the pandemic is impacting Pegasystems' sales - especially with the damage that COVID-19, especially in Europe, has done to SAP. The question astutely came up in the Q&A portion of Pegasystems' earnings call, and CFO Ken Stillwell answered (though a little less eloquently) that the company is as of right now not hearing of any negative customer impact from a supposed second wave. Per his remarks on the call:It's worth noting as well that Pegasystems counted among its customers a very high-profile public sector client: the U.S. census. The company's software was used to track digital responses to the 2020 census; Pegasystems' traction with federal engagements is a signal of its broad applicability across both commercial and public sector customers. Another positive indicator to watch is Pegasystems' margin profile. Though overall profitability is, again, impacted by the cloud transition, when we isolate gross margins for the cloud product alone, Pegasystems reported a huge improvement. In Q3'19, when Pegasystems' cloud business was only roughly half of its present size, its gross margin was only 49% - this quarter, cloud gross margins notched 64%, a 15-point improvement. The company cited the technical efficiencies that are gained through scale as the primary driver for the improvement. There is still head room for improvement, however, as Pegasystems noted its ultimate cloud gross margin target is in the mid-70s. Pegasystems continues to execute well in its cloud transition, which is more than halfway complete. Juggling large end-markets in CRM and BPM, and building up a steady ACV base alongside improving cloud gross margins, Pegasystems is a dark horse in the software sector that may prove a prescient play for a more cautious, risk-averse market."
4362457,103480,2020-07-30T14:40:14-04:00,"Shares of Pegasystems rallied ~10% after a strong second-quarter earnings release.
        Q2 revenues decelerated from the prior quarter as expected, but still came in above expectations.
        Most notably, Pegasystems' cloud ACV retained its 21% y/y growth rate, suggesting that a large part of Q2 deceleration was due to cloud shift.
        Pegasystems' end markets in CRM and BPM remain vast enough to guarantee a long growth runway.","Pegasystems (PEGA), the legacy software company with a hand in both CRM (customer relationship management) and BPM (business process management), has continued to prove itself as one of the most reliable value stocks in the software sector. Showing continued strength in its goal of converting toward a primarily cloud-based company, Pegasystems exhibited strength in its Q2 results - with total ACV continuing to grow in the low 20s, while cloud revenue growth rates are soaring above 50% y/y. Despite limited immediate post-market reactions, Pegasystems soared ~10% the day after reporting these results, marking one of its best one-day performances in recent memory:There were a couple key items for investors to watch heading into both this earnings quarter as well as the rest of the fiscal year. These are the items that will be driving the stock in the medium to long term:All of these indicators read positive in Q2, affirming the bullish thesis for Pegasystems. Recall that Pegasystems is addressing a massive >$80 billion combined TAM across both CRM and BPM, and that despite its lesser-known status among non-IT professionals in the software sector, Pegasystems counts among the largest blue-chip companies as well as public institutions in the world as its clients. Continue to stay long here.Let's now dive into the meat of Pegasystems' quarterly update. The financials are shown below:Figure 1. Pegasystems Q2 resultsSource: Pegasystems Q2 shareholder letterPegasystems' revenues grew 11% y/y to $227.4 million, beating Wall Street's expectations of $225.8 million (+10% y/y) by a one-point margin. Now, at first glance, the first fact that you may pick up on is that Pegasystems' revenues decelerated sharply from 25% y/y in Q1.However, in the revenue breakout by category, what you'll note is that one of the items dragging down Q2 growth is consulting (-12% y/y), which had been flat at +1% y/y in Q1. This decline is actually favorable for Pegasystems - as you can see in the table above, Pegasystems essentially performs consulting/onboarding for its clients at cost, and consulting is actually a drag on Pegasystems' gross margins. As software companies grow larger and strike partnerships with resellers, they typically aim to offload a lot of this lower-margin work to third-party vendors (often referred to as ISVs) that specialize in this type of work.You'll note that one of the benefits is that Pegasystems' GAAP gross margins rose to 66.3% in the quarter (68.6% on a pro forma basis, excluding stock comp), up a sharp 410bps from 62.5% in the year-ago quarter (+370bps pro forma).Key to note as well is that Pegasystems' cloud revenue grew 54% y/y (barely decelerating from Q1's 54% y/y growth pace) and encompassed 21.5% of the overall revenue mix, up from just 15.4% in the year-ago quarter. This rapid revenue mix shift to cloud is another non-threatening driver behind the revenue growth deceleration - moving customers from perpetual licenses over to recurring cloud subscriptions essentially ""robs"" from near-term revenues in favor of spreading out the bills over the recurring future stream of payments. Pegasystems noted that over 90% of new client onboards were cloud deals, with the remainder as perpetual licenses - indicating growing customer acceptance of the cloud model.We like the fact that Pegasystems' ACV (annual contract value, representing the sum of its recurring revenue) still continued to grow at 21% y/y to $738 million, on par with Q1's 21% y/y growth pace and adding a net-new $27 million ACV in the quarter.Figure 2. Pegasystems ACVSource: Pegasystems Q2 shareholder letterAnother key metric that investors should watch is Pegasystems' backlog - healthy software companies continue to build up deferred revenue/backlog as an indicator of future revenue growth. Pegasystems' total backlog in Q2 increased $63 million sequentially, indicating that the company's overall deal pipeline is healthy. Pegasystems' management commented on the earnings call that growing backlog in the middle quarters of the financial year, especially at this quarter's 30% y/y pace, is unusual as most heavy deal activity centers around the fourth quarter of the year.Figure 3. Pegasystems backlog Source: Pegasystems Q2 shareholder letterAlso important is the fact that Pegasystems' CFO Ken Stillwell continued to note that the coronavirus has had a negligible impact on Pegasystems' overall sales momentum, and he even suggested that some customers are taking the pandemic as an opportunity to rewire their IT stacks and invest in a solid, flexible BPM for the future. Per his remarks on the Q2 earnings call:CEO Alan Trefler also highlighted some major public sector wins in the year-to-date. As seasoned software investors know from other companies like Salesforce.com (CRM) and Microsoft (MSFT), landing high-profile public institutions is a signal of a successful software company, and government contracts can sometimes provide some of the most lucrative billings possible in the industry. In the year to date, Pegasystems has won some notable clients in Europe, including the German state of Bavaria (the second-largest in Germany with 13 million residents, or roughly equivalent to Pennsylvania or Illinois) as well as the British taxing equivalent of the IRS.On the profitability front - we've already discussed the lift to gross margins driven by the intentional withdrawal out of consulting activities. Operating margins benefited too, especially from the fact that Pega's sales teams are working remotely instead of traveling to clients. Pro forma operating margins in the quarter rose to -11.3%, up 440bps from -15.7% in the year-ago quarter. A reminder here that cloud is a near-term headwind for operating margins as well, as it robs from lucrative upfront perpetual license revenue streams - but Pegasystems is scaling toward profitability very quickly, and consensus is calling for pro forma EPS to break even both for the current full year ($0.14 consensus) and FY21 ($0.49 consensus), versus -$0.44 in the prior year. This is a company that's gaining operating leverage very quickly, and management has a near-term goal of hitting the so-called ""Rule of 40"".Stay the course on Pegasystems. There are a load of positive indicators in Q2, including robust cloud revenue growth accompanied by strong ACV/backlog growth, as well as notable public sector wins plus expanding margins."
4361015,103480,2020-07-27T11:07:15-04:00,"Pegasystems, an enterprise software vendor focusing on business process automation and CRM software, has largely been an ignored software stock.
        The company has executed a successful shift to the cloud and now has >75% recurring revenue.
        Unlike many SaaS peers, Pegasystems is dramatically improving its profitability with an eye toward hitting the Rule of 40.
        Shares are trading cheaply at ~6x FY21 revenues.","It's getting harder and harder these days to find true value in the software sector. Investors have dumped shares of retail, travel, financial, and energy stocks all year and re-invested everything back into tech stocks, sending valuations soaring sky-high to levels some would say they haven't seen since the dot-com bubble. Amid a field of very expensive SaaS counterparts, however, Pegasystems (PEGA) stands out as an older software name that - despite having enjoyed respectable ~24% gains since the beginning of the year - still hasn't gotten the same frenzied attention as most of its peers.The key pieces of the Pegasystems bullish thesis, in my view, can be summarized as follows:Similarly-growing comps, meanwhile, trade at substantially richer valuations. Here's a look at where other similarly-growing (high-teens growth) software stocks are currently trading:Stay long here and be patient for substantial upside. One of Pegasystems' main objectives over the past few years has to move its customer base onto a modern, cloud-based consumption model. As of Q1, 78% of Pegasystems' revenue is based on recurring/subscription-based deals, though cloud itself is a smaller part of that overall total (though fast-growing, at +57% y/y in Q1). The company's ACV, or annual contract value, has also reached $711 million as of the end of 1Q20, up 21% y/y:Figure 1. Pegasystems revenue mixSource: Pegasystems Q1 earnings letterAnd looking at the quarterly trends in ACV growth shows that ever since Pegasystems began focusing on recurring revenues a few years back, the company has continued to build up strong ACV each quarter. Cloud is the fastest-growing segment of Pegasystems' ACV - meaning more customers are shifting toward accessing Pegasystems' software through the internet rather than owning a term license and running the software locally.Figure 2. Pegasystems quarterly recurring revenue trendsSource: Pegasystems investor presentationTo emphasize its seriousness in expanding its cloud presence, Pegasystems has created a new C-suite level leadership position to oversee the company's go-to-market and overall corporate strategy, filling the position with an executive from Microsoft (MSFT) who was responsible for growing its Microsoft Dynamics cloud apps business.Pegasystems' increased recurring revenue mix not only helps to shelter its business from near-term shocks like the coronavirus, but also gives it a high degree of revenue visibility. The company noted in its Q1 earnings call that it has 90% visibility into its FY20 revenue guidance. Let's now dive into Pegasystems' most recent first-quarter results in greater detail. The earnings summary is shown below:Figure 3. Pegasystems Q1 earnings resultsSource: Pegasystems Q1 earnings letterPegasystems' revenues zoomed up 25% y/y to $265.6 million, beating Wall Street's expectations of $256.0 million (+20% y/y) by a solid five-point margin - considering the coronavirus impact in the month of March, that five-point beat is truly impressive. As noted in the prior section, growth in cloud ACV was one of the biggest contributors to Pegasystems' success.Ken Stillwell, Pegasystems' CFO, even noted that the company faced very little impact from the coronavirus:Wall Street consensus for Pegasystems, meanwhile, is calling for just 11% y/y growth in Q2 and 17% y/y growth in the full year FY20 - given the 25% y/y growth pace in Q1, I'd say Pegasystems has a very low bar to cross.We note as well that Pegasystems managed to slim down its operating losses (which are largely a result of the company shifting revenue from upfront licenses to recurring revenue streams) to a near-breakeven -9% margin, seven points better than -16% in the year-ago quarter. The company has benefited, like many of its peers in the enterprise software sector, from travel bans on its sales teams and the cancellations of costly customer events - though Pegasystems has commented that its sales teams are still 100% operational remotely and still handling new client engagements. A lot about Pegasystems stands out especially with most of the tech sector trading at absurd multiples. This is a company playing in an incredibly large >$80 billion market, with respectable >20% y/y revenue growth and impressive cloud conversion results. Patient investors should buy in and wait for the stock's valuation multiple to right-size."
4305746,52852,2019-11-12T12:42:58-05:00,"PEGA is undergoing a business model transition from up-front to recurring revenues.As a result, financials are difficult to understand and investors must trust management guidance.However, aggressive insider selling makes it difficult to own shares.PEGA remains a ""show me"" story until insiders start putting ""money where their mouth is"".","Did you read that recent story calling out McDonald's (MCD) new CEO, Chris Kempczinski, for not owning a single share of McDonalds? A few days after the negative press, Chris bought $500K of MCD shares. Yeah, very awkward. It is hard to look shareholders' in the eyes and say ""trust me"" when you have little skin in the game.One reason I like Pegasystems (PEGA) is because its CEO, Alan Trefler, owns over 50% of PEGA's stock. Alan is a very smart guy and a great technologist, but the stock's problem right now isn't that anyone doubts its technology. The problem is that its transition from an up-front to a recurring revenue model is making its financials very difficult to understand.Yes, it is true that we've seen many perpetual-to-recurring transitions play out in the public market before, for example Adobe (ADBE) and PTC (PTC). I've been involved with both transitions and I can tell you that each one comes with some degree of ""trust me"" from management. Understanding each transition requires a lot of management hand holding and a lot of modeling assumptions on the investor's part.The same is true for PEGA's transition. In PEGA's case, consensus 2019 revenue calls for +3.8% sales growth and a -3.2% operating margin (source: FactSet). However, management tells us that ACV is the best indicator of the company's growth and that metric has been growing around 20% a year. I find this metric reasonable, but I also keep in mind that this is a non-GAAP metric that is both opaque and not audited. According to my notes from the September 2019 Deutsche Bank Technology Conference, PEGA's CEO indicated that they could hit the Rule of 40 by 2022. This means sales growth plus profit margins could hit 40% by 2022, implying a very valuable business indeed. As of 2019, PEGA is more like ""Rule of 0.6"", so investors must have a certain amount of faith in management's guidance and ability to execute.PEGA is a high quality company and I try to give it the benefit of the doubt, but insiders' aggressive selling of the stock is eroding my trust in their guidance. As a professional investor and self-proclaimed ""educator of the public"", it is my duty to call them out on it.Investors who have followed PEGA for a while knows that PEGA's CFO, Ken Stillwell, is the key driver of the model transition narrative and guidance. Thus, it is especially worrying to see Ken aggressively reduce exposure to the stock since March 2019.(Source: FactSet)To double check that the above ""Historical Position in Pegasystems"" chart is correct for the company's CFO, I went directly to the source: the Form 4. Shown below, as of 11/1/2019, the CFO held 6,568 shares of PEGA after exercising options and selling 1,000 shares in the open market.(Source: FactSet SEC filing)There is nothing wrong with selling some of your stock awards, but it becomes concerning when executives are selling more than they are getting over time. In the Form 4 below, PEGA's CFO held 13,169 shares of PEGA on 3/4/2019.(Source: FactSet SEC filing)In other words, PEGA's CFO reduced his holding of PEGA by 50% in a very short period of time. As of the most recently filings, PEGA's CFO owns less than $500K of PEGA. I don't know about you, but if I had insider information and really felt confident that PEGA could reach the Rule of 40 by 2022, I would hold on to as much stock as I can!Unfortunately, PEGA's CFO isn't the only one selling shares.The chart below shows that PEGA's head of engineering, Mike Pyle, has been aggressively reducing shares since around November 2017. Coincidentally or not, that was just ahead of PEGA's more aggressive approach to transitioning to the recurring model, which resulted in 2018 revenue growth of 6.1%, half the growth rate of 2017.(Source: FactSet)PEGA Director, Rich Jones, has also been aggressively selling shares since May 2017. From May 2017 to now, this director sold ~110K shares worth ~$8M at current price levels.(Source: FactSet)In conclusion, although I would very much like to believe in PEGA's model transition story, in final analysis, it is difficult to see progress in its audited financials and key insiders are aggressively reducing their holding of PEGA shares. Until I can see it in the numbers, or until insiders start demonstrating more confidence in the stock, I will be sitting out on this one."
