article_id,author_id,publish_on,summary,content
3060166,63483,2015-04-09T14:06:46-04:00,"Major tailwinds include double-digit growth outlooks for enterprise CRM and BPM markets.Further margin expansion possible due to the company's highly scalable and capital-light business model.Large and diverse customer base dampens the company's exposure to any one industry, sector or country.Global presence means FX headwinds will persist going forward.DCF indicates Pegasystems is undervalued.","Pegasystems (NASDAQ:PEGA) is a provider of enterprise CRM and BPM software. Major tailwinds that will benefit the company's operating results include double-digit growth outlooks for the enterprise CRM and BPM markets. Due to the company's highly scalable and capital-light business model, further margin expansion is possible. Pega's large and diverse customer base dampens the company's exposure to any one industry, sector or country. Its global presence means that FX headwinds will persist going forward.Major tailwinds within enterprise CRM and BPM marketsAccording to research, the global CRM market is expected to grow at a CAGR of 15.5% over the 2013-2018 period. This growth is driven by the trend of businesses looking to collect, analyze and gain actionable insights regarding its customers from the data they collect, allowing them to make better financial and business decisions. The global BPM market is expected to grow at a CAGR of 17.9% over the 2014-2019 period. This growth is driven by corporations looking to manage their business processes better in order to lower costs and increase overall efficiency.Pegasystems addresses the needs of these markets through its Pega 7 platform. The company differentiates itself from large competitors such as IBM (NYSE:IBM) and Oracle (NYSE:ORCL) by unifying the entirety of its offerings on a single platform, whereas the aforementioned competitors have kept the majority of its product line (mostly from bolt-on acquisitions) separate. In other words, customers can access the company's CRM, BPM and other related software conveniently on one unified platform without any compatibility issues, which tend to arise when one uses software made by different vendors. Without a doubt, this presents an enticing value proposition to the company's existing and prospective clients. Hence, I am of the belief that the company would surely be a major beneficiary of the growth within the enterprise CRM and BPM markets going forward.Further margin expansion possible thanks to a highly scalable and capital-light business modelAs mentioned earlier, Pegasystems offers its suite of products through its Pega platform. Being a company that offers primarily software-based products, Pega's business model is highly scalable and capital-light, evident from its minimal capital expenditures and investment in working capital, as a percentage of sales, throughout most of its operating history. In addition, the company incurs incrementally lower cost when adding additional customers to its platform. For the reasons above, I believe that further margin expansion is a very likely possibility in the near term.Large and diverse customer base dampens the company's exposure to any one sector, industry, or countryThe company offers its products and services to a myriad of sectors, including the financial services, healthcare, insurance, communications, media, life sciences, manufacturing and the public sector. Therefore, this dampens the adverse impact on the company when any one sector experiences a downturn.Furthermore, the company sells to a growing client base that includes companies listed on the Global 2000. As a result, the company is not dependent on any one customer for a significant portion of its revenue, thereby lowering the potential adverse impacts to operating results stemming from customer desertion.In a geographical context, Pegasystems markets its products and services globally, where it derives only 55% of its revenue from the U.S., 6% from other Americas, 16% from the UK, 15% from other EMEA countries, and 8% from APAC (per fiscal 2014 data). Hence, any recession experienced by one region will have a relatively small impact on the company's overall operating results. As a result, expect the company's revenues, profits and cash flows to be stable going forward.Global presence means FX headwinds will persist going forwardDespite the merits of a global presence, it is not entirely a boon given that having operations worldwide exposes the company to foreign currency risk stemming from fluctuations within the FX market. The major recent development within said market is of course the strengthening of the U.S. dollar vis-à-vis other major currencies. This recent price appreciation can be attributed to the diverging monetary policy stance adopted by the Fed compared to its central banking peers. Although recent FOMC meetings have stemmed the strengthening of the greenback somewhat, the fact remains that the dollar is still trading at elevated levels relative to the same period a year ago, according to CNBC data. Given that the Fed has not entirely ruled out a late-2015 rate hike, expect further appreciation to occur as capital continues to flow into the U.S. in anticipation of rising yields. Considering its significant international operations, expect Pegasystems to continue experiencing FX headwinds going forward.ValuationAs seen in the above DCF model, company revenues are expected to grow at growth rates of 13% to 7% throughout the five-year projection period. This growth is supported by major tailwinds such as the double-digit growth outlooks for the CRM and BPM markets, which Pegasystems serves. Relative to historical rates, these projections are a tad low as they incorporate the adverse impact of FX headwinds. EBITDA margins are expected to gradually expand to 17% by the end of the projection period, supported by the highly scalable and capital-light business model that the company employs. The company currently trades at 19.3x LTM EBITDA. Using this figure, along with a 12% discount rate (due to the company size, offset slightly by the large and diverse customer base lending to stable and recurring cash flows), the model produces a fair value of $31 for Pegasystems, indicating that the company is trading at approximately a 40% discount to fair value as implied by the DCF model. My outlook on the company is hence bullish - investors are advised to initiate a long position at current levels."
1867881,25289,2013-11-28T09:50:07-05:00,,"In this article, I will feature one tech stock that has seen intensive insider selling during the last 30 days. Intensive insider selling can be defined by the following three criteria:Pegasystems (NASDAQ:PEGA) develops, markets, licenses, and supports software to automate business processes primarily in the United States, the United Kingdom, and rest of Europe.Insider selling during the last 30 daysHere is a table of Pegasystems' insider-trading activity during the last 30 days by insider.There have been 12,189 shares sold by insiders during the last 30 days. More details about the Rule 10b5-1 trading plan can be found from this link.Insider selling by calendar monthHere is a table of Pegasystems' insider-trading activity by calendar month.There have been 91,071 shares sold and there have been zero shares purchased by insiders this year.FinancialsPegasystems reported the third-quarter financial results on November 12 with the following highlights:OutlookPegasystems' license backlog totaled $268 million as of the end of the quarter, up $42 million or 19% from Q3 of last year.(Source: Investor presentation)CompetitionPegasystems' competitors include Guidewire Software (NYSE:GWRE), and TIBCO Software (NASDAQ:TIBX). Here is a table comparing these companies.Pegasystems has the second-lowest P/S ratio among these three companies.Here is a table of these competitors' insider-trading activities this year.Guidewire has also seen intensive insider selling during the last 30 days.ConclusionThere have been four different insiders selling Pegasystems and there have not been any insiders buying Pegasystems during the last 30 days. Three of these four insiders decreased their holdings by more than 10%. Pegasystems has an insider ownership of 54.31%.There is one analyst buy rating, three neutral ratings, and zero sell ratings with an average price target of $47.50. Pegasystems is trading at a P/E ratio of 46.52 and a forward P/E ratio of 33.95. The company has a book value of $6.72 per share and the stock has a dividend yield of 0.24%.Before entering short Pegasystems, I would like to get a bearish confirmation from the Point and Figure chart. The two main reasons for the proposed short entry are bearish analyst price targets, and the intensive insider-selling activity.Disclosure: I have no positions in any stocks mentioned, and no plans to initiate any positions within the next 72 hours. I wrote this article myself, and it expresses my own opinions. I am not receiving compensation for it (other than from Seeking Alpha). I have no business relationship with any company whose stock is mentioned in this article."
1859901,41741,2013-11-24T16:55:44-05:00,,"Shares of Pegasystems (NASDAQ:PEGA) have been on a steady path higher over the past year. So far this year, shares are up an impressive 116%, and are set to continue their run higher as the company continues to make a name for itself in automating business processes for corporations. In this particular niche, Pegasystems is number two in the market, behind only IBM (NYSE:IBM). In the past eight years, the company has grown revenues 24% annually. Over the next five years, the company is forecast to grow earnings at a 25% annual clip.PegaRULES!The company's PegaRULES Process Commander (PRPC) software provides a unified platform that enables customers to build enterprise applications in a fraction of the time it would take using the disjointed architectures offered by other software providers. This allows organizations to build, deploy, and change enterprise applications easily and quickly. It also eliminates the time and expense required to create lengthy policy manuals and system specifications by unifying business rules with business processes. The software delivers multi-channel, cross silo capabilities that bridge front and back-office, and is often used to rejuvenate legacy technology.The PRPC applications are able to be deployed via the Pega Cloud or on premise. The company then utilizes frameworks that allow customers to customize their software to fit their unique needs. The integration of the PRPC and frameworks allows Pegasystems to target Business Process Management (BPM), Customer Relationship Market (CRM), Dynamic Case Management (DCM), and Decision Management software markets.Another quarter, another big beatPegasystems crushed expectations in 3Q with a $0.16 beat on EPS. Revenues came in $5.47 million higher than expectations. Overall, revenues grew 22% Y/Y. This was driven by a 56.8% jump in licensing revenue. Pegasystems has beaten estimates in each of the last four quarters by a wide margin.So far this year, the company has delivered operating cash flow of $83.4 million. This is 187% higher than last year. Overall, net income for the first nine months of 2013 was $22.5 million, or $0.58 per diluted share, compared to net income of $1.5 million, or $0.04 per diluted share, for the first nine months of 2012.The other notable move last quarter was Pegasystems' acquisition of Antenna Software in October. This puts Pegasystems in the fast-growing mobility market. In order for Pegasystems to compete, its applications must be prepared for multiple mobile platforms and more than 250 different screen sizes. The goal for any company is to deliver business software to any channel and with the Antenna acquisition, Pegasystems is one step closer to that goal. According to the company, a few key benefits to this acquisition include:Product innovation and partnerships drive market share gainsEven with the stock on a tear of late, there could still be further room to the upside. This comes as the company just released Pega 7. This is the latest major version upgrade of the company's unified model-driven platform. This new version should greatly improve ease-of-use for its customers as well as increase market share.And thanks to this product innovation and superior products, Pegasystems has managed to partner with every major global system integrator and IT consulting firm. These strategic partnerships help boost sales and allow Pegasystems to be a core product offering. Its major partners include Accenture, Capgemini, Cognizant Technology, Infosys Technologies, PricewaterhouseCoopers, and Wipro. These industry leading partners, such as the management consulting leader, Accenture, and top accounting firm, PricewaterhouseCoopers, have given Pegasystems a new level of clout and ""street cred"" when it comes to growing its market share.These market share gains were evident at the first Pega Developer Conference that was held last month in Hyderabad, India. This conference was oversold with over 1,700 attendees from 52 organizations to learn about Pega 7 software. On the company's earnings call, CEO Alan Trefler highlighted two responses heard at the event (emphasis ours).Broadening its horizons increases its addressable marketPegasystems has thrust itself into the heart of a $30 billion market opportunity. Pega 7 and its solution frameworks allow the combination of Business Process Management, case management and various vertical application segments. Pegasystems is one of the few companies offer a combined solution and company's IT departments are realizing that they need to adapt to this changing market. According to CEO Alan Trefler:Thanks to this new combined solutions offering, Pegasystems is able to service many different industries. The company is seeing strong customer demand in:Overall, across all segments, the combination of business process automation, cross-channel customer experience, dynamic case management and verticals solutions really helps organizations improve agility and responsiveness. This is the core of what Pegasystems' software can accomplish.Competition remains the greatest threatThe threat to Pegasystems' business is competition. The company competes with IBM, Oracle, SAP, Tibco Software, EMC, OpenText, Salesforce, Microsoft and many other software vendors in one way or another. Some of those are very large and resource-heavy (in terms of cash and ability to borrow) companies. In any case, CEO Alan Trefler summed up why he sees his company as more innovative than the larger competitors.Further debunking the worry of competitive pressures is Gartner's latest Magic Quadrant for the CRM Customer Engagement Center. In this Magic Quadrant, Pegasysems is behind only salesforce.com when it comes to the completeness of vision. Pegasystems is only one of three companies that's considered a leader in Gartner's Magic Quadrant. Pegasystems also outranks Oracle on both ability to execute and completeness of vision.Gartner goes on to say that ""in the CRM space overall, Pegasystems has the best ability to model and predict a customer's behavior, create a workflow to support that customer, and to then associate the best action to execute with (and for) the customer."" To help counter the competitive pressures, Pegasystems has invested a combined $197.2 million in R&D over the past three years. The company has a 740 employees working on R&D efforts.The valuation is very appealing, suggesting 50% upsideIn looking at shares of Pegasystems, we see several things we like. License backlog continues to grow. It has grown from $226 million last year to $268 million as of the end of September. The company's cash balance has grown at an even faster rate. In the past year, total cash has increased 69% to $188 million. Total cash per share is now $4.97. Pegasystems has no debt.In looking at earnings, shares trades at 32x next year's earnings. With the company continuing to beat estimates, and the potential for the company to beat next year's EPS, we think its forward P/E is actually lower.Next year, the consensus is for EPS to come in at $1.50. We think this is low and forecast EPS to come in at $1.60 based on the company's strengths discussed above and its pattern of beating estimates. EPS of $1.60 puts its forward multiple at 30x. This is very reasonable considering the growth potential ahead for the company.On the other hand, EPS could come in even higher with margin improvement. Current gross margin is 69% and operating margin is 12%. There is definite room for margin expansion heading into next year. In the base case, if we assume that next year's (2014) EPS comes in at $1.60, and we get no multiple expansion (45x current p/e), that's still nearly 50% upside to $70.Prime beneficiary of the Affordable Care ActWe see Pegasystems as a key component to solving the issues related to the implementation of the Affordable Care Act. We all know that a main issue with the program has been the website and getting insured persons signed up. Pegasystems has successfully allowed Fallon Community Health Plan to implement and meet the requirements of the Affordable Care Act. According to the company (emphasis ours):Susan Taylor, Pegasystems' VP further added:As more health plans become aware of Pegasystems' solutions for implementation of the Affordable Care Act, we see Pegasystems signing up more health plans and growing its top- and bottom-lines. More health plan signups would cause us to raise our EPS estimate of $1.60 next year and provide further upside for shares.Bottom linePegasystems is an undiscovered gem in the software space. Even though it has a market cap of $1.8 billion, there are only 4 analysts covering the stock. We think the lack of coverage keeps many institutions out of the stock. They simply are not aware of the company and its potential. Even we were surprised that there have only even been 2 articles on Seeking Alpha about Pegasystems.Part of the explanation could be that 54% of the company is held by insiders. Average daily volume is only about 100k. The largest shareholder is Founder and CEO Alan Trefler. His 19.8 million share stake makes him a near billionaire. Most notable is that he is not on an automatic sell program and is holding onto his stake. Another billionaire that is invested in the company is Ken Fisher. His firm, Fisher Asset Management, has a 2% stake.Overall, it's tough to argue with the results Pegasystems has posted and with a strong balance sheet and plenty of tailwinds ahead, we see shares continuing their up and to the right trajectory.Disclosure: I have no positions in any stocks mentioned, and no plans to initiate any positions within the next 72 hours. I wrote this article myself, and it expresses my own opinions. I am not receiving compensation for it (other than from Seeking Alpha). I have no business relationship with any company whose stock is mentioned in this article."
508251,23407,2012-04-18T17:29:24-04:00,,"Across enterprises, IT executives are being asked to shift from building static user friendly databases with reporting to dynamic problem solving for C-level practices. The change isn't subtle or easily addressed given legacy information silos were often deployed without a focus on integration.Those haphazardly deployed databases, and their linear nature, are creating disruptive changes in how IT departments approach spending - particularly as those departments increasingly report to CFOs. Going forward, forcing C-level practices into pre-defined databases just won't meet the needs of companies increasingly interested in flexible and creative practice management. As a result, the process is increasingly merging - if not reluctantly - with practiceThis disruption is creating a lot of opportunity for software companies, such as Pegasystems (PEGA), which competes with Oracle (ORCL) and Adobe (ADBE) in process management and Salesforce (CRM), Microsoft (MSFT) and SAP (SAP) in customer relationship management.Shifting IT trends are creating opportunities to win and expand accounts.Pegasystem's model is built on winning business by offering case by case solutions and expanding those relationships over time. With more companies focused on unifying process with practice, the company is competing for more deals and inking more licenses than at any point in its history.Those opportunities cut across business intelligence, automation, performance and decision making - specific areas expected to enjoy double digit spending growth this year. Case oriented solutions, which provide a gateway to larger, more lucrative relationships, are also in vogue.Typically, Pegasystems customers have centered around financial services, healthcare and insurance companies, which have critical process environments. Call center conversations need to be managed and optimized, transactions need to be accurate and timely and rate quotes need to happen more quickly and easily. And, all of it needs to feed into better decisions and strategic planning.Process and practice sales are increasingly global, supporting maintenance and service revenue.These needs aren't limited by geography either, which has meant international demand for Pegasystem's software has grown. Overseas sales have climbed to 48% of overall revenue, up from 34% in 2009, thanks to both changing needs and a larger sales force.Those license agreements are increasingly term contracts, which offer revenue clarity by smoothing quarterly fluctuations. Exiting last quarter, Pegasystem's term license payments due jumped to $161.4 million from $90.9 million. And the company will recognize $37.7 million of such contracts in 2012.Of course, as more licenses are sold, maintenance and services revenue increases. In 2011, revenue from those two segments increased 40% and 21%, respectively.Typical of its competitors, Pegasystems enjoys strong margins too. Higher sales and 60% margins have the street expecting a 34% jump in EPS to $1.19 in 2012. For comparison, the company earned $0.57 in 2010. The higher cash flow has helped keep the company debt free and allowed it to amass nearly $3 per share in cash and equivalents.Given the ongoing trend for integrated - dare I say hybrid - process and practice solutions, the company is likely to outpace street estimates. If it does, sellers sitting on seven days worth of average volume short will be forced to cover, sending shares higher.Disclosure: I have no positions in any stocks mentioned, but may initiate a long position in PEGA over the next 72 hours."
