article_id,author_id,publish_on,summary,content
4376584,24361,2020-09-28T08:00:08-04:00,"COVID-19 has driven a sharp upturn in demand for PerkinElmer's ImmunoDiagnostic and Applied Genomics products, including RT-PCR kits, automated systems, and reagents.
        COVID-19 is likely to have a noticeable impact on birth rates, hurting the newborn screening business in 2021-2023.
        Lab demand for PCR kits should remain strong a while longer, and I believe PerkinElmer has won some new long-term business from this crisis.
        With PerkinElmer likely to hold at least a piece of the windfall, I've boosted my revenue and FCF growth expectations, but it's not enough to drive an attractive fair value.","It may be indelicate to talk about beneficiaries of a deadly global pandemic, but the reality is that COVID-19 has created an unexpected surge in business for many life sciences companies. In the case of PerkinElmer (PKI), while the recent demand for real-time PCR workstations and kits, liquid handling systems, RNA extraction kits, and so on will fade, I believe the company may hold on to some long-term benefits, as customers have now seen what EUROIMMUN tools can do, and some will likely become long-term customers.I expect at least a few more quarters of double-digit year-over-year revenue growth, and I’ve boosted my long-term revenue assumptions such that my long-term revenue growth rate moves up about a half-point to 6%. Longer-term opportunities remain in newborn testing (Vanadis), lab automation, lab informatics, and the OneSource management service, as well as EUROIMMUN test menu expansion. PerkinElmer is still not cheap by any standard approach, as is often the case with life sciences companies.At over 10% of revenue, newborn screening is both a significant business and a significant growth opportunity, but business has declined at a mid-single-digit rate in the last two quarters. I believe the first quarter was impacted by the start of the COVID-19 pandemic in the large Chinese market, and that impact has since intensified.Thus far, data from most developed economies indicates that COVID-19 is having a notice negative impact on pregnancies and projected near-term birthrates, as worries about infection, economic instability, and so on prove to be meaningful disincentives. The Brookings Institute has estimated that births could decline by 300,000 to 500,000 in the U.S. next year (a 10% decline at the midpoint), and the South China Morning Post has speculated that China could see a 900,000 decline in 2021 (a roughly 6% decline).That sort of decline would clearly have an impact on PerkinElmer’s testing business, given its significant global share. While the company could still see some uplift from an expanded testing menu in some markets and increased SMA testing in the U.S., the headwind is still real. On a more positive note, management has indicated that interest in the new Vanadis system remains strong, though installations have been frozen so far by the COVID-19 lockdowns.Where I believe PerkinElmer could see the biggest long-term benefit from the pandemic is in accelerating the growth of its EUROIMMUN business. With research and testing labs scrambling to get whatever equipment they could as quickly as possible, PerkinElmer has been able to put a range of equipment (RNA extraction kits, PCR workstations, automated liquid handling systems, et al) into the hands of new users.Many of these customers will go back to whomever they used before the pandemic, but management has noted winning some new business through this emergency, and the hurdle for adoption of new systems like the Axentis random access platform (coming out later this year or early next year) should be lower. Likewise, I believe PerkinElmer has won some business in areas like next-gen sequencing reagents that it will keep beyond the pandemic.It’s also fair to note that the demand for life science tools won’t disappear overnight. It seems fair to assume that population screening will remain necessary even after a vaccine (to assess the efficacy of the vaccine, among other things), and there will likewise be kits and tools needed by the numerous companies still working on therapeutics and vaccines for the virus.While the pandemic has provided a welcome bump for PerkinElmer, helping offset the double-digit decline it has seen in its non-COVID-19 business, it won’t fundamentally change the story for the long term. Yes, I believe the company is picking up some business in ImmunoDiagnostics and Applied Genomics that it will keep long term, but I don’t see that being enough to change the long-term trajectory of the business.With that boost, I expect long-term revenue growth closer to 6%. I likewise still expect a meaningful uplift in margin and FCF margin from 2019 to 2024 – margin was up eight points in the second quarter, and while that won’t be the new normal, it does highlight the positive impact of growth in the ImmunoDx and Applied Genomics segments on the overall business.Unfortunately, the mid-teens long-term annualized free cash flow I expect from PerkinElmer isn’t enough to really support a strong target price, and that’s a common issue in life sciences. So, I’m not all that surprised that the prospective long-term annualized total return appears to be on the high end of the mid-single-digits. That’s not terrible, and there could be some upside from greater adoption for Vanadis, EUROIMMUN, and OneSource, but it’s not enough to encourage me to buy today."
4083175,25120,2017-06-22T08:39:14-04:00,"PerkinElmer has made a great deal with the $1.3 billion acquisition of EUROIMMUN.While the deal does not come cheap, relative multiples look similar as this deal will provide diversification and a big boost to organic growth.I understand why investors like the deal, as the overall valuation has gotten a bit steep while leverage is quite high as well.Any sell-off to market-equivalent multiples, which translates into a $60 valuation, creates a buying opportunity in my eyes.","PerkinElmer (PKI) continues to shuffle around its portfolio. After selling its medical imaging business to Varex Imaging (VREX) earlier this year, PerkinElmer is now acquiring EUROIMMUN in what appears to be a great deal.Investors seem to like the deal as well given the price action of Perkin´s shares which rose to fresh highs. While I really like the portfolio shuffle which the company has made, I am hesitant to jump into the shares at these levels given the fact that shares trade at a decent premium based on forward adjusted earnings, and leverage ratios stands at fairly elevated levels. If shares re-test the low sixties, I will start buying into the much improved growth story.Portfolio TransformationPerkinElmer has reached an agreement to acquire German-based EUROIMMUN Medical Laboratory Diagnostics in a $1.3 billion all cash deal.EUROIMMUN focuses on autoimmune testing as well as tests for infectious diseases and allergies. These tests deliver $310 million in annual sales as the five year CAGR just comes in short to an impressive 20% annual growth number. A key driver of this has been China which is responsible for nearly half of sales, as 30% of revenues are generated in the European home market. On the deal call, Perkin´s executives praise the speed at which the company brings products to markets, and thereby is able to catch emerging trends.With the deal, PerkinElmer will gain expertise into autoimmune and allergy diagnostic markets and significantly increase exposure to China. Given this positioning and the solid growth, the 4.2 times sales multiple looks pretty reasonable. As a result of the relative appealing price, PerkinElmer sees non-GAAP earnings per share accretion to the tune of $0.28-$0.30 per share in 2018. On the call management indicated that adjusted EBITDA of the acquired activities will amount to $70 million this year which combined with an asset-light model and cheap cost of financing allows for this kind of accretion.This deal is substantially larger than the $276 million divestiture of the medical imaging business to Varex, in a deal which sheds $140 million in annual revenues. This deal, which was announced late in 2016, closed in the second quarter.Adding Growth To A Technology LeaderPerkinElmer is a very well-established business which operates across the globe despite the ¨modest¨ revenue base of $2.1 billion, with significant presence in Asia and Europe. The purchase of EUROIMMUNE will only improve this diversification in terms of geographical exposure as well as across the two main segments of the company.PerkinElmer is mostly organized under its discovery & analytical solutions business which generates $1.5 billion in sales. This business derives little over half its sales from life sciences, as food, environment and industrial end markets make up for the remainder of the sales. The strong positioning in this segment is driven by imaging, detection, software and service capabilities driven by PerkinElmer´s strong IP position, brands and good relationships.Typical products include chromatographs, sample introduction systems, atomic spectroscopy instruments, as well as organic elemental analyzers, among others.The other segment is the diagnostics business following 2016s restructuring. This $602 million business (based on 2016 revenues) provides early detection for genetic disorders from pregnancy to early childhood, as well as infectious disease testing. This segment furthermore included the flat panel X-ray detectors, the $140 million business which is now sold to Varex. In this article on Varex, I estimated the EBITDA power of the X-ray business at around $25 million, a fraction of the annualized EBITDA of $380 million in 2016 for all of PerkinElmer.What About The Asset Shuffles?PerkinElmer posted 4% organic growth in Q1 of 2017, driven by 2% organic growth in the discovery & analytical solutions business and solid 8% growth in the diagnostics segment.The company ended the quarter with $288 million in cash and $1.06 billion in debt, for a net debt load of roughly $770 million. If we take into account the $276 million proceeds for the X-ray business and account for the $1.3 billion acquisition, net debt will increase to $1.8 billion.The core business posted annualized EBITDA of $380 million in 2016. If we account for 5% organic growth, this number rises to $400 million. After subtracting $25 million estimated EBITDA of the X-ray business, and taking into account $70 million in EBITDA from EUROIMMUN, the pro-forma number rises to $450 million. With $1.8 billion in net debt, leverage ratios are pretty steep at 4 times. On the bright side, cash flow generation is solid and the underlying businesses are growing at a stable rate.The company guided for 2017 earnings of $2.80-2.90 per share, but note that these are adjusted earnings with GAAP earnings seen $0.64 per share lower, mostly driven by non-cash impairment charges. If we take into account the promised $0.29 per share accretion to 2018 earnings, the pro-forma earnings number comfortably exceeds $3 per share and might approach $3.25 per share if we account for some synergies and organic growth as well.That does not mean that shares are cheap as shares have risen to a high of $68 per share, in part driven by the favorable reaction in response to the deal. This means that shares trade at 21 times forward adjusted earnings, even as the balance sheet is a bit leveraged.There are good reasons to be upbeat as well. The pro-forma revenue base of roughly $2 billion will jump by 15%, but more important is that these sales are growing by 15-20% per year on average. This means that this deal alone boost the organic growth profile of all of PerkinElmer by 2-3% per annum!Note that the $1.3 billion deal comes at 4.2 times sales and nearly 19 times EBITDA. PerkinElmer itself was valued at roughly $7 billion in terms of the market value ahead of the deal. Including existing net debt of $770 million (ahead of X-ray deal closure) the $7.8 billion enterprise valuation came in at 3.7 times sales and roughly 20 times EBITDA as well. This means that the company is buying a company at roughly similar multiples, yet with a great positioning and much better organic growth rates.Final ThoughtsPerkinElmer is a great quality company although the growth has not been that impressive over the past decade. PerkinElmer has grown sales from $1.8 billion in 2007 to $2.1 billion in 2016, or to nearly $2.3 billion on a pro-forma basis. The company furthermore managed to buy back 10% of its shares outstanding, which translates into 40% cumulative revenue growth per share over the past ten years, equivalent to 3-4% per annum.That is solid, but not very impressive, so on the back of those achievements, one can question the multiples being attached to the business.On the bright side, PerkinElmer has a great positioning and should be able to outperform going forwards, as notably the recent deal really delivers on the potential to accelerate organic growth rate to 5% or more per annum. For that reason alone, investors think that the company made a great deal. Shares jumped 6% in response to the deal, increasing the value of the firm by roughly $450 million on the back of a $1.3 billion deal, giving a clear vote of confidence about the deal.I certainly like the deal as well, yet shares of PerkinElmer are not cheap at 21 times adjusted forwards earnings while leverage is high, following a near 30% run higher over the past year. While the current positioning is great, I have to take this run-up and valuation into consideration as the track record of the company is not that great over the past decade, although the current positioning looks rather strong.If shares retreat to market-equivalent multiples based on earnings power of $3.25 per share on an adjusted basis, I am a buyer at around $60, as leverage remains on the high side. For now I can only congratulate investors and management on a great deal, but I am not jumping aboard the momentum train following a great deal."
3276295,25218,2015-06-22T23:48:44-04:00,I searched for companies in the S&P 500 that are long overdue for dividend increases.The companies I have covered so far are PVH Corp. and Precision Castparts.The company I will be covering in this article is PerkinElmer.,"This is my final article in my three-part series covering S&P 500 (NYSEARCA:SPY) components that are long overdue for a dividend increase. Each selection has a small dividend because management has chosen to not increase the dividend. The dividends of each of the companies I have covered are not low because the dividend was cut or business was poor.In this article, I will cover PerkinElmer (NYSE:PKI), which is extremely overdue for a dividend increase. Up until the research I conducted for this article series, I had never even heard of PerkinElmer even though it is an S&P 500 component. PerkinElmer operates in the environmental and health care industries where they provide diagnostics, life sciences products and products for the testing air, water, food products, etc.[Images from PKI Investor Presentation]Currently PKI pays a $0.07/share quarterly dividend, which equates to a dividend yield of 0.52%. The following historical dividend chart shows that the dividend for PKI has not increased its dividend at all during the last 20 years.Did PKI choose buybacks instead?After seeing that chart, a logical question an investor might ask is ""Did PKI choose to allocate capital returns to share buybacks instead of increasing its dividend."" The answer to that question for the last five years for the most part has been a no, except for 2011 when PKI repurchased a small amount of shares. However, since 2011, the share count has been essentially flat and in the fourth quarter of 2014 on the conference call the PKI CFO noted that the company had spent $61.3 million on share repurchases during 2014.Over the last twelve months, PKI has paid roughly $31.7 million in dividends, which is roughly a 52% dividend/buyback ratio, which is significantly higher than the 1% dividend/buyback ratio for my previous article selection Precision Castparts (NYSE:PCP). Even though PKI repurchased some stock in 2014, the impact was only minimal in the overall picture of reducing the share count and I believe after twenty years a dividend increase is warranted.Did PKI see a decline in its business?Over the last five years, PKI has grown its revenues 23.83% and EBITDA has grown 16.10%. As the chart below shows, PKI has had slow but steadily increasing revenues every year for the last five years. EBITDA on the other hand has also increase, however, its path upward has been more volatile and with that volatility, I could see why management would not want to increase the dividend.Dividend Growth PotentialCurrently PKI has 113.4 million shares outstanding and pays an annual dividend totaling $0.28/share. Therefore each year PKI spends roughly $31.7 million [113.4 million *$0.28] on dividend payments. Over the last twelve months, PKI free-cash-flow has totaled $224 million, which I believe shows that PKI has enough free-cash-flow to support a slightly more than doubling of its dividend. Looking at the financials, I noticed that PKI has issued $26 million in stock over the last twelve months, and a portion of the share repurchase has gone to make up for stock that has been issued. I believe PKI should continue buying back stock, however, just enough to cover any stock issuance.For example, if PKI were to have repurchased around $26 million in stock to cover issuance over the last year, that would have left $35.3 million of the $61.3 million in repurchase funds available for dividends. Using FinViz, I found that the other dividend paying companies in the Medical Laboratories & Research industry with a market cap over $2 billion have an average dividend yield of 1.19%. Therefore, for PKI to get to the industry average, they would have to increase their quarterly dividend from $0.07/share to $0.16/share. Based on the current share count, PKI would pay around $72.6 million for the year. If they were to take the ""savings"" of $35.3 from only repurchasing issued stock, which would leave only $5.6 million [$72.6-35.3-31.7=5.6), that would need to come out of the $224 million in free cash flow that PKI has.How can Investors take action?Closing ThoughtsIn closing, I believe PKI has significant potential for dividend growth in the future, if management decides to allocate more to dividends instead of spending more on buybacks that are not moving the needle with the share count. I believe PKI can increase their dividend because it has steadily growing underlying businesses and has the financial capacity slightly more than double its dividend.While PKI has the ability to increase the dividend, do not hold your breath because the dividend has been the same for twenty years and management in the fourth quarter the CEO stated ""I think we feel pretty good about the capability we have to continue to do acquisitions and potentially buy back shares as well."" [Fourth Quarter Conference Call, linked above] Investors who own PKI and have options experience have the tools to use covered calls to generate more income.Disclaimer: See here."
4082392,101421,2017-06-19T12:47:19-04:00,"Medical diagnostics company PerkinElmer has agreed to acquire EUROIMMUN for $1.3 billion in an all-cash deal.EUROIMMUN is a major autoimmune testing firm with significant operations in emerging markets, including China.The deal provides a complementary set of capabilities and geographical distribution for promising cross-selling opportunities.Initial market reaction is highly positive on the deal and I agree with the sentiment.","Quick TakeMedical diagnostics and discovery company PerkinElmer (PKI) has announced an agreement to acquire EUROIMMUN Medical Laboratory Diagnostics AG for $1.3 billion in cash.EUROIMMUN is a leading autoimmune testing company with a growing business in infectious disease and allergy testing.The deal appears to be complementary in terms of providing both firms with respective geographic and product strengths, so should be a win for PKI shareholders.Target CompanyLubeck, Germany-based EUROIMMUN was founded in 1987 to provide a range of medical laboratory reagents to assist in the diagnosis of autoimmune and infectious diseases and allergies.Management is headed by founder and CEO Winfried Stocker.Below is a brief demo video about EUROIMMUN:(Source: EUROIMMUN US)EUROIMMUN has 2,400 employees, 14 international subsidiaries between 35 countries and has more than 60 distributors generating sales in more than 130 countries, ‘with approximately 45% of revenues in China, 39% in Europe, Middle East & Africa, 5% in the Americas and 20% in Rest of World.'Acquisition Terms and RationalePerkinElmer is paying $1.3 billion in cash for $310 million in 2017 revenues, a multiple of 4.2x. This is higher than a public company basket of firms in the NYU Stern Revenue Multiples dataset, which as of January 2017 showed an aggregate Price/Sales multiple of 3.34x for Healthcare Products companies.As of PKI’s April 2, 2017, 10-Q filing, the company had $288.3 million in cash and total liabilities of $2.1 billion.So, in light of PerkinElmer’s $7.3 billion market cap, this $1.3 billion deal represents a major transaction for the firm and will require it to add significant debt to its balance sheet to close the deal.PKI says the deal ‘is expected to be accretive to PerkinElmer’s 2018 non-GAAP earnings per share result by approximately $0.28 to $0.30. Additionally, PerkinElmer is reaffirming its 2017 revenue and earnings per share guidance.’One major strategic rationale for the combination is the relatively small penetration by EUROIMMUN in the Americas, at currently only 5%, which PKI intends to grow through offering EUROIMMUN’s industry-leading autoimmune testing services.Another important driver is EUROIMMUN’s 45% revenue base from sales in China, which PKI will want to tap to cross-sell its capabilities.As PKI stated in the deal announcement,With the new company under its wing, PKI will also round out a diagnostics portfolio for a variety of conditions including, autoimmune, infectious disease, gene analyses, reproductive health, allergy and genomics for oncology and other molecular tests.The overall market seems to like the deal announcement, with PKI trading up approximately 5% in early trading.At first blush, it appears the combination is a win-win, due to its complementarity, both geographically and product lines.I write about M&A deals and IPOs. Click the Follow button next to my name at the top or bottom of this article if you want to receive future articles automatically."
