article_id,author_id,publish_on,summary,content
4315835,24361,2020-01-08T15:20:57-05:00,"PerkinElmer has a new CEO and the company will be refocusing on consumables over capex equipment and really concentrating on food safety, diagnostics, and pharma services to drive growth.EUROIMMUN and Vanadis can both be growth drivers, but both have challenges that PerkinElmer will have to overcome.PerkinElmer looks likely to generate double-digit FCF growth on solid revenue growth and improving margins, but the valuation isn't very appealing.","In a strong market for life sciences, a market that has seen Sartorius (OTC:SARTF) jump more than 70% over the past year, Bio-Rad (BIO) more than 60% over the past year, and Thermo Fisher (TMO) over 45%, PerkinElmer's (PKI) almost 30% climb doesn't seem quite so special. Part of the issue is an ongoing challenge with the company hitting its growth and margin targets (it seems like it can do one or the other in a given period, but not both), but I believe the lack of leverage to bioproduction is a drawback as well. Although a new CEO and a shifted set of priorities could help the former, it doesn't look as though PerkinElmer management is contemplating a major near-term shift in the business mix.As is so often the case for me in life sciences today, I like the companies but not the valuations. Mid-teens annualized FCF growth would only support a mid-single-digit annualized return at today's level, so I can't really call this a favorite idea now. The stock has proven to be volatile over the last couple of years, though, so this is a name worth considering for a watch list.The new year brings a new CEO to PerkinElmer, with Prahlad Singh taking over from Robert Friel. While Friel did some good things in his tenure, the shares did lag other life science companies like Thermo, Waters (WAT), Mettler-Toledo (MTD), and Sartorius, and the company had a reputation for frequently coming up short of management's long-term growth and margin targets. PerkinElmer also had a reputation as a sort of stodgy company that played in the less exciting areas of life sciences (like instruments) and that was unwilling to take the plunge into more exciting emerging areas like sequencing and bio-production. I don't think that reputation was entirely deserved, particularly with recent forays into areas like autoimmune testing, but I also don't think it was an entirely unfair criticism.It doesn't sound like any major changes are on the way, and that makes sense given that Singh has been with the company for some time now. Instead, there are some evolutionary goals that I do believe can help improve the growth and margin profile of the business.For starters, management is prioritizing a shift toward more recurring revenue (from its current 66/34 mix), including more software, assay, and reagent revenue. This is a common initiative across the space; tools aren't nearly as profitable as the recurrent consumables/reagent streams they can produce, and the budgets for those consumables tend to vary a lot less from year to year.Management is also looking to intensify its focus on core opportunities in food, pharma, and diagnostics. These priorities don't surprise me. While industrial markets like oil/gas and chemicals can generate good margins in good times, they're deeply cyclical and not always quick to adopt new technologies. Likewise with environmental testing.Food testing, though, remains an attractive opportunity, with growth in the cannabis market and Chinese food safety testing. Diagnostics, too, is attractive for PerkinElmer, with industry-wide growth in autoimmune testing and company-specific growth drivers like increased penetration of EUROIMMUN into the U.S. market. As far as pharma goes, I think the company's best prospects are in its OneSource lab management service business. PerkinElmer offers a wide breadth of services and already counts all top-20 pharma companies as customers, but there's still significant potential to dislodge in-house service done by even its largest customers.Margins should improve with these initiatives. The service operations generate attractive margins, as do the diagnostics and genetic testing businesses. Management also believes there are some opportunities to do more organizational streamlining - improving both the customer experience (one point of contact instead of many) and reducing redundancies.The roll-out of Vanadis has been slower than expected, but the company added another 4 sites in the third quarter to end with 19 placements. As expected, PerkinElmer is trying to position Vanadis, a non-invasive prenatal testing technology, as a cheaper alternative to sequencing-based prenatal testing and a better alternative to biochemical testing. European healthcare systems seldom reimburse for sequencing-based testing (which costs almost 3x as much as Vanadis) except in high-risk situations, and Vanadis has already received some positive reimbursement decisions in Europe. Opportunities are likely more limited in the U.S. (where sequencing-based testing has a stronger position) and China is more of a toss-up - the company has a good market presence in China (helped by the EUROIMMUN business), but sequencing-based testing has garnered almost 20% share without reimbursement, so Vanadis usage may be limited to smaller hospitals.EUROIMMUN continues to perform well, with ongoing double-digit growth as the company both gains share in its core markets and benefits from underlying growth in testing for autoimmune and allergies. Growth in the U.S. remains a promising opportunity as the company puts more tests through the FDA regulatory process and better leverages its existing sales infrastructure. This business should also get a boost from the company's roll-out of an automated random-access platform by year-end - the current technology is labor-intensive and rivals like Bio-Rad have long had automated offerings.While it's not accurate to say that PerkinElmer couldn't get into bio-production if they wanted to (an attractive growth opportunity for Danaher (DHR), Sartorius, and Thermo), the cost would be very high and it wouldn't really fit with the rest of the portfolio today. With that, investors need to make their peace with the reality that diagnostics, lab services, and food testing are going to be the prime drivers for this business. Fortunately, those are businesses that can support attractive growth and margins, at least relative to the ""average"" business.I believe PerkinElmer could see growth accelerate in the high single-digits over the next couple of years, but I'm not modeling that as my base-case (as I said, this is a business with a long history of coming up short). With my base-case assumptions, my long-term revenue growth rate comes in between 5% and 6%, while meaningful margin and asset leverage can drive mid-teens FCF growth. I'd note, though, that PerkinElmer has had some issues with working capital management (related at least in part to its diagnostics businesses), so that's something to watch.Whether I use DCF or margin-driven multiple valuation approaches, I still arrive at basically the same conclusion - that PerkinElmer is not particularly cheap and looks priced for roughly mid-single-digit annualized returns. That's not uncommon in the life sciences space, but I'm not willing to push my luck on valuation here. Still, with the volatility that these shares have shown in the past, it would be a decent idea for a watch list, as a 20% pullback would create a much different value proposition."
4307103,104439,2019-11-15T14:29:22-05:00,"Excellent portfolio in the field of diagnostics and analytics for life sciences, environmental, food and industrial applications.Acquisition of Meizheng strengthens its presence in the food safety business with a significant market in China.The firm has maintained sound financial health for a good period of time, opportunities exist to further expand its gross margins.The Share looks fully valued but its strong performance and significant long term growth opportunities make it a buy.","PerkinElmer (PKI) maintains an attractive portfolio of analytical and diagnostic solutions for several industries. The name is 82 years old but the last ten years have majorly reshaped the firm. During this period the firm has significantly extended its portfolio by making several acquisitions and expanding its analytical solutions base. Although the top line grew at a modest pace of 6.7% cagr, PerkinElmer has firmly established a highly sustainable company. Broadly, the portfolio has active exposures in the life sciences market, environmental, food, and industrial markets and typically attains high single-digit profit margins. Earlier in October, PerkinElmer acquired Meizheng Group, a food safety testing company in China that has an addressable market$1 billion to $2 billion, this could be a significant addition to the firm’s portfolio that has a TTM revenue of $2.83 billion. In its last earnings call, the management expressed confidence in its growth businesses like EUROIMMUN, Vanadis, our Genomics business, Service Informatics, and Cannabis. These factors, despite its fully valued situation, shows an attractive long term proposition for portfolios that require exposure to growth businesses. Last month PerkinElmer’s then CEO Rob Friel introduced its new CEO during the earnings call, Prahlad Sing, who previously served as its COO. I believe that PerkinElmer will be an excellent investment for growth-seeking portfolios.PKI’s latest earnings showed that its diagnostics (contributes 40% of total sales) and analytical solutions delivered an organic growth rate of 6% and 4%, respectively. Year-to-date, the Americas and Asia-Pacific are up mid- single-digits while Europe is up low single-digits. Productivity and cost out actions helped expand the adjusted operating margin by 250 bps during the quarter, reaching 21.6%. The firm has expanded adjusted operating margins by 150 basis points year-over-year on a YTD basis. All these led to an EPS of $1.06, reflecting an18% growth compared to 2018 Q3 and $0.05 ahead of its guidance.In the diagnostics segment, the 6% growth was primarily driven by its immunodiagnostic and reproductive health franchises. EUROIMMUN and Tulip, PKI’s immunodiagnostics solutions led the way by delivering a low double-digit organic growth rate. Although EURPOIMMUN U.S. business continues to grow, China may become a large market too. The firm expects EUROIMMUN’s U.S. market share for AMA testing to reach 50% as testing ramps up. A growth in PKI’s genomics testing business led a mid-single-digit growth in its reproductive health market, the firm has expanded its coverage in the Asia-pacific region.Image: EUROBlotOne, Unique automation solution for the immunoblot work stationThe analytical solution segment’s 4% growth was led by high single-digit organic revenue growth in pharma biotech which was driven by its imaging and detection and informatics product lines, both were up double-digits in the quarter. As leading pharma and biotech companies actively shift to modern future-proof workflow solutions, PKI’s informatics business continues to gain more spotlight. But the market was slightly flat during the quarter which I believe to be a temporary situation. Besides these, the cannabis segment saw low single-digit growth moved by high cannabis demand.Meizheng’s net purchase price amounted to approximately $152 million, and the management expects to extract a double-digit return on invested capital by year four. Meizheng is headquartered in Beijing, and its product portfolio covers immunoassay, microbiology and molecular testing for food safety in prioritized end-markets grain, dairy, meat, and seafood. The firm said that it expects Meizheng to have approximately $30 million of revenue in 2019 with accretive operating margins. PKI believes that Meizheng has developed a reputation as a leading food safety testing company in China due to its current portfolio breadth, a strong culture of innovation and unparalleled customer intimacy.“Meizheng is a highly attractive and strategic asset, one that will play a pivotal role in our domestic food strategy in China as well as our broader long-term food strategy across the globe. Meizheng has developed a reputation as a leading food safety testing company in China due to its current portfolio breadth, a strong culture of innovation and unparalleled customer intimacy.”- Prahlad Singh, PerkinElmerIn the last couple of years, PerkinElmer has continued to have greater cost efficiency which is clearly reflected in its gross profit margin pattern. There have been at least 300 bps improvement in the cost of goods sold, and selling expenses are very well controlled. PerkinElmer expects 2019 full-year revenue of $800 million, representing 5% organic revenue growth, including a foreign exchange headwind of approximately $11 million versus a comparable prior period. I believe PKI is well-positioned to maintain its cost structure and attain its revised adjusted EPS target economically for the year which is increased to $4.07 ($1.32 in Q4). In the last four quarters, the firm had beat earnings estimates 3 times, the one other time results were in line with estimates.Source: Seeking AlphaIn my relative valuation approach, I took several competitors. These include Waters Corporation(WAT), Bruker Corporation (BRKR), Thermo Fisher (TMO), Agilent Technologies (A) and Merck (MRK). Although Price/Sales and EV/Sales medians show an undervalued situation, P/E shows that the firm is overvalued. A broad examination suggests that the firm is fully valued in the market, but it is not enough to discourage an investor who is seeking growth exposures. The firm has built a solid portfolio that targets several attractive industries, financials also look strong. Source: Seeking AlphaPerkinElmer has an excellent product portfolio that covers several diagnostic and analytical product markets. The firm has delivered strong results for a good period of time and continues to strengthen its position with business expansions. Although the firm looks fully valued in a conservative framework, the firm has high growth potential with its cutting edge products. Combining all the factors, PerkinElmer is a buy.Editor's Note: This article covers one or more microcap stocks. Please be aware of the risks associated with these stocks."
