article_id,author_id,publish_on,summary,content
4268443,103480,2019-06-05T12:28:52-04:00,"Shares of Pivotal Software suffered their worst day in history after reporting Q1 results, dropping well over 40%.Though the company exceeded expectations on Q1 revenues and EPS, it also cut its full-year revenue outlook to 15-17% y/y growth.The majority of this guidance cut, however, is in services revenue - which carries a very low margin and is of lesser importance than subscription revenues.Pivotal Software cited a lengthening of deal cycles in a ""complex"" technology landscape as the major impetus of the revenue slowdown.","Immediately after its public offering and spinout from Dell, PaaS company Pivotal Software (PVTL) seemed like an incredibly promising stock. Pivotal's flagship Cloud Foundry offered developers a cloud-native platform on which to build their applications, and it claimed some of the world's largest blue chips like T-Mobile (TMUS) among its customers. Shares nearly doubled from their IPO price of $15 to an all-time high near $30.Now, however, Pivotal's story has somewhat soured. The company's ~50% y/y subscription growth rates from last year have dampened, and alongside Q1 earnings results, management has initiated a deep guidance cut for the rest of FY20. This sent shares reeling, with Pivotal's stock dropping more than 40% in its worst day yet:Data by YChartsMost stocks warrant a second look when they hit fresh 52-week lows, and Pivotal Software is no exception. In my view, investors now have a chance to snap up shares of Pivotal at a bargain-basement valuation. At the company's present market cap of $2.93 billion, and after netting out $854 million of cash on its balance sheet, Pivotal Software is trading at an enterprise value of $2.08 billion. It's true that Pivotal's guidance cut is disappointing. But even against this lowered view, Pivotal trades at an incredibly low valuation multiple of 2.73x EV/FY20 revenues:Figure 1. Pivotal guidance updateSource: Pivotal 1Q19 earnings releaseFor a company that's still growing subscription revenues in the ~40% range, while also improving its margin profile, this valuation multiple seems untenable. Pick up shares of Pivotal on the dip and wait on the rebound.There's no doubt that Pivotal's guidance cut was shocking. Here's where the key figures stand now, versus where they were at the end of Q4:Here's what CEO Robert Mee had to say on the Q1 earnings call on the revenue slowdown:Unfortunately, Pivotal's situation reminds investors too sharply of a similar situation at Cloudera (CLDR) last year, when the Hadoop company reported sales execution issues (specifically on renewal deals) and its stock got sliced in half, a loss from which Cloudera has not yet recovered.But here's why Pivotal is different: underlying subscription growth is still strong. You'll notice that of the ~$40 million cut to the full-year guidance outlook, Pivotal's subscription revenues only received $12 million of that cut on the bottom end and $9 million on the top end, worth 2-3 points of growth. The majority of the outlook cut came from the professional services business.Investors essentially shouldn't care how much revenue Pivotal brings in from professional services, as it's essentially a pass-through revenue stream with nearly zero incremental margin. Of course, every software company offers professional services and implementation offerings in order to onboard new customers and support existing ones, but these tertiary services are not drivers of cash flow.Here's a perfect illustration from Pivotal's Q1 results:Figure 2. Pivotal 1Q19 revenue trendsSource: Pivotal 1Q19 earnings releasePivotal's total revenues grew 19% y/y to $185.7 million, surpassing Wall Street's expectations of $184.1 million (+18% y/y) but decelerating sharply from last quarter's 27% y/y growth rate. You'll notice, however, the underlying mix shift in revenues: while subscription revenues grew 43% y/y to $128.9 million, services revenues actually declined by -13% y/y to $56.9 million. The subscription revenue mix this quarter was 69%, eleven points better than 58% in 1Q19.This has tremendous gross margin implications. While Pivotal's subscription revenues carry a 93% GAAP gross margin, services revenues only contribute an 8% gross margin. So while Pivotal's revenues grew at 19% y/y, cost of revenues remained essentially flat. GAAP gross margins, meanwhile, zoomed up to 67.4%, up 550bps from 61.9% in the year-ago quarter. One of the major critiques against Pivotal post-IPO was the fact that it carried a gross margin deficit relative to other SaaS peers due to its high proportion of services revenues; now, both its Q1 results and guidance update point to a reduced subscription mix (implying higher future gross margins). In essence, Pivotal's bad news on guidance has a silver lining.Here's how CFO Cynthia Gaylor explained the drop in services revenues on the Q1 earnings call:The bottom line here: Pivotal's guidance cut is less about a slowdown in momentum of the overall business. Instead, it seems that Pivotal has shifted more of its hopes into its higher-margin renewal revenue streams. The company's net retention rate this quarter was a sky-high 143% (indicating huge upsets within the existing installed base), as customers increased the number of workloads running on the Pivotal Cloud Foundry platform. Yes, it's true that new customer installs are lagging (as evidenced by lower services and implementation revenues), but Pivotal's issues are not parallels of Cloudera, which specifically cited renewal problems.Of the huge guidance cut that Pivotal issued alongside Q1 earnings, only about a quarter was attributed to subscription revenues. The majority of the revenue elimination was on the professional services side, which is ""dead weight"" from a margin perspective and was the primary reason Pivotal's gross margins lagged behind other SaaS/PaaS peers.While Pivotal's hints at sales execution issues and deal cycle lengthening are certainly disappointing, we can still point to the fact that Pivotal's subscription revenue growth in Q1 is still north of 40%, and even after the FY20 guidance cut, subscription growth is still expected to be in the mid-30s. The ~40% drop in share prices is a massive overreaction, and patient investors have an opportunity to scoop up shares of a misunderstood stock at fresh 52-week lows."
4250971,21815,2019-03-26T04:44:34-04:00,"It's rare to see a fast-growing PaaS company, especially one that is a market leader selling at under 6x sales.The company is enjoying fast growth, expanding margins and it is on its way to becoming profitable.Its customers are happy and keep buying more, given a net dollar expansion rate of 149%.","We reported earlier about Pivotal (PVTL), the DevOpp platform company which we described in that earlier article. DevOpp platforms speed up development of apps and hence increase the productivity of developers, of which Pivotal is the pioneer and the market standard (based on the number of Fortune 100 clients).The company sold off on a tiny revenue miss in its Q4 2019 (its fiscal year ends at the end of January) and somewhat disappointing guidance but we think that the shares are fairly attractively valued and offer an opportunity here after a little selloff.Below you see how the company fared on some basic metrics:Data by YChartsNot untypical for a SaaS (or in this case, PaaS, platform as a service) company in the early innings of development, you see solid revenue growth but operational losses, especially on a GAAP basis.The advantage of such cloud platforms is that it is easier to update and add features, or even whole new products. The main products are:PFS will be available by the end of the year, PKS has already been introduced for almost a year and is experiencing solid growth. More than 100 customers are already on PKS which has a lower ASP which gives the company access to more and different type of customer, accelerating growth.According to management, PKS offers state of the art Kubernetes (Q4CC):This is of course what management argues, it certainly doesn't have the field all to itself (a competitor here is Red Hat (NYSE:RHT)), but it did develop PKS with the help of VMware (VMW) and Google (GOOG) (NASDAQ:GOOGL).The platforms are able to install security updates without downtime so users are no patch deficient, considerably enhancing security, which leads management to claim that its platforms are secure by default (Q4CC):The key growth metric is subscription growth, which was 55% (y/y) with the subscription customer base growing 18% in the quarter (adding 9 customers in the quarter, 58 during the year).Subscription revenue reached 66% of total revenue, up from 56% a year ago. The rest of the revenue is brought in by services, like Labs. Selling services is strategic as it helps land customers and helps them to set up and speeds usage up. Subsequent requests, expansions and services are often provided by partners.This points to another route of growth through an ecosystem of partners and here the company is widely serviced. In the first place one thinks of Dell (DELL) and VMware, with the former still having a majority stake in the company as it was spun out of VMware in 2013 (which was owned by EMS which bought the company in 2012 which Dell acquired). This is of considerable help, even with its newer products (Q4CC):From the Q4CC:And then of course another route to sell more is to increase sales to existing customers, which is what the company is doing very convincingly given the net dollar expansion rate of 149%.The market reacted badly to the Q4 figures (although that's probably more the result of guidance than the actual results) but the company is producing solid progress, especially in large accounts (Q4CC):Given the sky-high dollar net expansion rate, customers clearly like what the company offers and the market is still in the early innings, so we're not terribly worried here.From the Q4CC:The consensus Q1 revenue estimate was 190M so the Q1 guidance could be the reason the shares sold off.Data by YChartsThe chart above are GAAP figures. The company is of course basking in rising gross margins as subscriptions (93% gross margin) are growing way faster than services (which actually declined 3% for the quarter and have gross margins of 17%). With respect to operating margins (Q4CC):There is clear leverage (on a non-GAAP basis) on the basis of which management predicts Q1 fiscal 2021 break-even that is in four quarters.Data by YChartsCash flow is steadily increasing and there is little to worry about given the stash of cash ($702M at the end of Q4) that the company acquired with its IPO. Operational cash flow was even positive in Q4 ($8M) although seasonality might have something to do with that.Data by YChartsWhile the company isn't yet profitable, 7x sales TTM or not even 6x for this year's revenue are fairly modest multiples for a platform company like this and it's a lot cheaper than where it has been earlier in the year.Some sale pressure has no doubt come from the expiration of IPO lock-up shares and options. But still, we think this multiple has some room to expand, which is something we can't say for a host of other stocks we look at.These days we don't often come across a company that still seems pretty reasonably valued and even offers some room for multiple expansion, let alone one that operates in a fast-growing field and is considered the market leader.A 6x sales multiple seems to be a bit of a bargain considering the company's subscription revenue is still growing at 40-50%. The market is still fairly young and the company is well established with happy customers, given the net dollar retention rate of a whopping 149%.Gross margins are still expanding pretty significantly as high margin subscriptions grow much faster than services, and there is strong underlying operational leverage which will bring the company to profitability in the medium future (a year or so). What's not to like?"
4206224,103480,2018-09-14T06:17:16-04:00,"Pivotal Software's stock lost 20% after reporting disappointing Q2 results, despite beating Wall Street's expectations on both the top and bottom line.Revenue growth even accelerated two points from last quarter, and guidance also exceeded consensus expectations.Investors are getting jittery ahead of a mid-October lockup expiration, leaving shares vulnerable to a selloff as insiders are released to sell for the first time.With share of Pivotal up 54% over the past six months, selling shares now - while they sit at an ~8x forward revenue multiple - is tempting.","Last quarter it was up 20%, and this quarter, it's down 20%. Pivotal Software (PVTL), despite reporting strong Q2 results that featured both a modest revenue acceleration as well as respectable beats against Wall Street consensus estimates, tanked after earnings in the stock's worst one-day performance yet. Pivotal's post-earnings crash is a subtle reminder to growth investors that winners don't stay winners forever.I liked Pivotal earlier on in its IPO. The company distinguished itself by being a PaaS play - a rare niche in a market environment that has been deluged by front-end SaaS applications, with a noticeable gap in back-end infrastructure IPOs. I've always favored PaaS and IaaS technologies to be stronger investments - they are harder to rip out of an enterprise IT stack and generally face much less competition. Consider another recent IPO like Ceridian (CDAY), an HCM platform, and the mention of its name also calls to mind a dozen of its competitors, such as Workday (WDAY) or Oracle (ORCL) HCM Cloud. Though Pivotal has its fair share of competition, it has far fewer clones.To top it off, Pivotal was cheap immediately post-IPO, as it wasn't a strong performer right out of the gate. Back then, investors were worried about the relationship with Dell (DVMT), which spun out Pivotal from its portfolio in the IPO, but recently, Dell's own plans for an initial public offering have quelled the fears that it would try to pull the kind of reverse merger threat it posed to VMware (VMW).As a result of this, as well as strong results in Q1 (and arguably also in Q2, despite the market reaction), Pivotal has performed well post-IPO. Even after accounting for this quarter's drop, Pivotal at $23 is still up more than 50% from its IPO price of $15:PVTL data by YChartsBut this means it's also no longer cheap. At its current post-Q2 share price, Pivotal has a market cap of $5.92 billion; after netting out the company's $671.7 million of cash and zero debt (it's had a clean balance sheet since the IPO), the company has an enterprise value of $5.25 billion.Here's where the company's full-year guidance landed after this quarter's earnings. Note that the refreshed range of $647-653 million in revenues is a touch higher than Wall Street's consensus of $646.5 million:Figure 1. Pivotal Software FY19 guidanceSource: Pivotal investor relationsAgainst the $650 million midpoint of this updated revenue outlook, Pivotal Software is currently trading at a valuation of 8.1x EV/FY19 revenues. That's about one turn cheaper than where Pivotal traded at the end of last quarter (where shares jumped 20%), and as I noted then, it's cheaper than the bulk of high-growth SaaS companies, many of which are now traded at double-digit revenue multiples.But there's one upcoming catalyst that gives me pause: Pivotal Software's lockup expiration, which is set to occur on October 17 (as per NASDAQ). With shares up more than 50% since the IPO at $15, insiders may be tempted to let go of their holdings. The biggest shareholders are Silver Lake Partners and Dell - the former is likely to cash in on at least some gains; the latter is fairly unpredictable. Whether or not these holders end up selling, the fear of that outcome will likely drive tremendous selling pressure in October.I'm a fan of Pivotal Software's product and its growth story, but do believe that there will be a better opportunity to buy into the stock at a cheaper price in October, after the lockup pressure subsides. Stay on the sidelines until then.Here's a look at Pivotal's Q2 results:Figure 2. Pivotal Software 2Q19 resultsSource: Pivotal investor relationsRevenues grew 30% y/y to $164.4 million, actually accelerating by two points over last quarter's revenue growth rate of 28% y/y. Pivotal also exceeded Wall Street's revenue expectations of $158.2 million (+26% y/y) by a respectable four-point margin.Despite the beat, investors were looking for more. Last quarter, Pivotal had absolutely obliterated Wall Street's expectations - against expectations for 16% y/y growth, Pivotal delivered 12 points of upside at 28% y/y growth. Exiting the fourth quarter of FY18, Pivotal had generated sub-20% growth - so it's comforting that in this quarter, the company was able to exceed 30% growth. This gives me confidence in investing in Pivotal at a later date - just not right before the lockup expiration.What probably threw investors off this quarter, however, was a shortfall in billings. For subscription businesses, billings is actually the longer-term view on a company's growth pipeline. Pivotal's CFO danced around the subject by claiming the shortfall on deal timing:The miss, however, caused some Barclays to note that Pivotal ""will be in the penalty box with investors for the time being."" The CFO's outlook that Q3 would continue to be challenging on the billings front also doesn't help sentiment. As a result, it's possible that revenue growth may see a dip in the short term.On the bottom line front, however, Pivotal delivered some cheerier news. Gross margins hit 62.8% in the quarter on a GAAP basis, up sharply from 55.3% in the year-ago quarter. Pivotal attributed the growth to both a larger mix of subscription revenues (59% of revenues this quarter versus 51% in the year-ago quarter) as well as robust 93% subscription gross margins.Pivotal's margin in the low 60s is still below most software companies because it has always had a larger share of services revenues than most SaaS/PaaS companies due to its leaning on Pivotal Labs, which is essentially a consultative software development offering that helps clients to onboard onto the Pivotal Platform. However, with management's expectation that services revenues would ""grow in the mid-single digits"" alongside much faster subscription growth, its services revenue mix would decline over time and result in higher margins.Pivotal's operating losses also thinned down to -$35.4 million, representing an operating margin of -21.5%, 850bps better than -30.0% in the year-ago quarter, thanks largely to the gross margin gains. Pro forma EPS of -$0.06 also edged out over Wall Street's expectations of -$0.09.The bottom line on Pivotal Software: on the surface, the company produced good results, with accelerating revenue growth and a strong gross margin gain that led to an earnings beat. With the commentary on a billings slowdown, however, investors are right to fear that Pivotal's growth may slip again to the mid-teens in the back half of the year, which would be a return to its growth rates in the back half of FY18.Perhaps even more threatening than the billings miss is a lockup expiration coming next month that gives inside investors the ability to cash in on paper gains of more than 50%. I'd wait for the dust to settle here before diving in."
4210479,21136,2018-10-08T12:58:49-04:00,"When PVTL's 180-day lockup period expires on October 17th, pre-IPO shareholders and company insiders will be able to sell large blocks of currently restricted shares for the first time.We believe they will be eager to cash in - PVTL has a 30% gain from IPO.Aggressive, risk-tolerant investors should consider shorting shares of PVTL before October 17th.","The 180-day lockup period for Pivotal Software Inc. (PVTL) ends on October 17, 2018. This date marks the point when the company’s pre-IPO shareholders and insiders can sell large blocks of currently-restricted stock for the first time. More than 37 million shares are currently restricted, and any significant sales could flood the secondary market for PVTL and cause a sharp, short-term downturn in share price.Trading in Pivotal Software has been volatile during the last six months. The stock was priced at $15 and closed on the first day of trading at $15.73. PVTL has a return from IPO of 30%.Pivotal Software offers its integrated solution through a combination of its cloud-native application platform and various services within the U.S. The company calls their proprietary platform Pivotal Cloud Foundry (PCF), and the company markets it as having the capability to streamline and accelerate software development by cutting through the complex methods necessary to build and deploy applications. The company’s strategic services enable this accelerated process for clients.(Source: S-1/A)The Pivotal Cloud Foundry is currently in use in a wide array of industries including government, consumer, communications, technology and media, healthcare and insurance, financial services, industrial and business services, and automotive and transportation.Pivotal Software markets its products and services through its own sales force and outside partners. In addition, Pivotal Software maintains go-to-market and commercial relationships with VMware (NYSE:VMW) and Dell Technologies (DVMT). The company also works closely with Microsoft (NASDAQ:MSFT) and Google (NASDAQ:GOOG) (NASDAQ:GOOGL) to ensure adequate cloud infrastructure to meet the needs of its clients.The company serves a variety of clients including Merrill Corporation, CoreLogic, Country Financial, Orange, Dish, Bloomberg, Comcast, The Home Depot, Humana, and the U.S. Internal Revenue Service, Sundance, Liberty Mutual, and Ford Motor.Business overview was sourced from the firm's S-1/A.Pivotal Software reported the following highlights for the end of the first quarter for fiscal 2019 ended May 4, 2018:Financial highlights sourced from the company's website.CEO Robert Mee has served in his position since August 2015. He was part of the company’s founding team and began as the SVP of Products and Research and Development. His previous experience comes from positions at DellEMC.President William Cook was also a member of the founding team. Prior to joining Pivotal Software, Mr. Cook held senior positions at the Greenplum Division of DellEMC. He previously held positions at companies including Sun Microsystems.Management bios were sourced from the company's website.The industry for open-source projects and developing app software is intensely competitive. Pivotal Software faces such competition on a variety of levels: open-source offerings, legacy application infrastructure, and middleware. Companies offering these products and services include Microsoft Azure, Google Cloud Platform, Amazon (AMZN) Web Services, IBM (IBM), RedHat, and Oracle (ORCL).The underwriters for Pivotal Software priced its IPO at $15 per share, within its expected price range of $14 to $16. Its six-month performance on the NYSE has been volatile. The stock closed on its first day of trading at $15.73, and it remained fairly steady until June. The price spiked beginning on June 4 and ended at a high of $28.91 on June 15. The price decreased to $22.57 on July 30 and rose again to $28.78 on September 12. Shares now trade around $19.When PVTL's 180-day lockup period expires on October 17th, the company's pre-IPO shareholders and insiders will have the opportunity to sell large blocks of currently-restricted shares for the first time. This group of shareholders includes a host of individuals and corporate entities.(Source: S-1/A)We believe that these individuals and corporate entities will be eager to sell at least some of their currently-restricted holdings and cash in on gains - PVTL has a 30% return from IPO. Significant sales of currently-restricted stock could flood the secondary marketplace and cause PVTL's share price to take a sharp, short-term downturn. Aggressive, risk-tolerant investors should consider shorting shares of PVTL ahead of the lock-up expiration on October 17th. Interested investors should cover short positions late in the trading session on October 17th or during the trading session on October 18th."
