article_id,author_id,publish_on,summary,content
4181362,103480,2018-06-13T12:11:22-04:00,"Pivotal Software had its first major breakout after posting Q1 earnings, rising more than 20% on the news.The company beat expectations on the top and bottom lines, with a strong acceleration on the top line to 28% y/y growth and upbeat guidance for the year.Pivotal's CEO also declared the company to be independent of Dell.At 9.1x forward revenues, Pivotal Software is fully valued and has little upside left.","When it went public in late April at just $15 per share, Pivotal Software (PVTL) never seemed like it could eventually become an investor favorite. Shares popped just 4% on the first day of trading, one of the weakest IPO performances of the year and certainly a disappointing performance for a PaaS company of its scale. Now, however, after Pivotal released its first-quarter earnings report (and the first earnings release since it went public), the company seems to have found its footing. As with most maiden earnings releases, Pivotal's release set a strong tone with Wall Street and provided an extremely upbeat view for FY18 that wasn't previously baked into Wall Street's models.As a result, shares are up more than 20%, capping off a strong recent trading pattern for Pivotal that has the shares up to nearly 2x its IPO price. Pivotal is now neck-and-neck with the other high-profile software companies that went public this year in terms of post-IPO performance:PVTL data by YChartsPerhaps even more importantly than the upbeat results and guidance - Pivotal's CEO, Rob Mee, declared on a pre-earnings phone interview the following: ""We are not at all dependent on the Dell Technologies portfolio,"" as reported by MarketWatch. Recall that prior to its IPO (and still today), Pivotal Software has a majority owner in Dell. Companies with an association to Dell have been in rocky waters this year, such as VMware (VMW). With Dell struggling to manage down its huge $50 billion debt load, the fate of its subsidiaries (reverse merger scares tanked VMware earlier in the year) has been left largely unknown. Though we still can't be sure of Dell's intentions, Mee's statement makes it easier for analysts to view Pivotal as a standalone company independent of its relationship to Dell.The question now for investors is: Does Pivotal Software have any upside left? When shares sputtered post-IPO, they were trading at just 6x forward revenues, and I believed Pivotal Software to be one of the recent software IPOs that hadn't yet appreciated to their full potential.Now, however, shares are looking quite richly valued. At its post-earnings share price of $26, Pivotal Software has raced ahead to a $6.53 billion market cap. After netting out the $645.5 million of cash on its balance sheet, Pivotal Software is left with an enterprise value of $5.88 billion.Along with its Q1 release, Pivotal Software also released FY19 guidance that took analysts by surprise. The company guided to $642-$649 million in revenues for the year, representing 27% y/y growth at the midpoint. Analysts were expecting only $622.0 million, or 22% y/y growth.Against the midpoint of Pivotal's upside guidance range, the company currently trades at 9.1x EV/FY19 revenues. While this isn't expensive relative to the other 2018 software IPO cohorts, especially against names like DocuSign (DOCU) that have rallied sharply, it's certainly an expensive multiple against the broader software sector, especially for sub par growth in the high 20s. Here's where other mid-cap software companies growing in the high 20s/low 30s are currently trading:BOX EV to Revenues (Forward) data by YChartsIn my view, Pivotal Software has limited upside left after its robust post-earnings rally. Though the results were strong and the guidance for the year even better, the upside announced in Q1 has effectively already been priced into Pivotal's shares. The company already is trading three turns higher than in the early days of the IPO, and when the market turns south again, Pivotal is especially vulnerable given its recent rally. Recall also that the company's lockup expiration has not yet come due (it's slated for mid-October, according to Nasdaq), so there are definitely plenty of downside catalysts in the stock's near future. Now is a good time to lock in gains on Pivotal stock and sit on the sidelines until shares come back down to earth.Let's take a look at the company's Q1 results:Figure 1. Pivotal Software Q1 earningsSource: Pivotal Software investor relationsRevenues grew 28% y/y to $155.7 million, greatly eclipsing analyst expectations of $140.4 million (+16% y/y) by a staggering 12 points. Note, however, that in the first earnings quarter after going public, companies often show the largest gap to Wall Street's expectations because analysts' targets haven't yet been shaped by guidance or a reliable historical pattern. Going forward, the gap between expectations and results should dwindle.It's important to note as well that Pivotal's growth rates accelerated sharply from the 18% growth rate at which the company exited Q4. However, I have trouble believing that this growth rate will hold. Recall that Pivotal Software's growth pattern over the last year has been extremely erratic. In Q1 of last year, Pivotal Software also had its best growth rate (38% y/y), but in the second through fourth quarters, respectively, Pivotal grew at only 20%, 17%, and 18% y/y.Of course, last year's discrete quarterly growth rates are not a perfect way of extrapolating this year's results. But if Q1 continues to be Pivotal Software's best quarter as it was last year and the following quarters slip again below 20% growth, Pivotal may have trouble hitting the 27% y/y growth implied in its revenue guidance range for the year. It essentially needs to hold the 28% growth rate in the current quarter if it wants to hit that target. Unlike most software companies that guide conservatively for the year and allow themselves some room to decelerate in the back half of the year, Pivotal Software seems to have set an ambitious target which has some attainment risk.Of course, Pivotal management would tell you that they have an extremely clear view into near-term results. The company's CFO noted the following on the earnings call (emphasis mine):Still, however, I can't help but to think that there is some execution risk involved with setting a full-year growth target that's in line with this quarter's growth rate.On the earnings front, Pivotal Software showed similar strength. The company managed to reduce its operating loss margin on a GAAP basis to just -21.5% in the quarter, significantly improved from -39.9% in 1Q18. All of Pivotal Software's operating expense categories came down as a percentage of revenues, particularly sales and marketing, its largest opex line item. Note also that general and administrative spending actually fell 11% y/y, which is an encouraging sign of good spend discipline as companies typically show larger overhead spending post-IPO.As a result, Pivotal Software's pro forma EPS of -$0.10 in the quarter showed decent upside against analyst expectations of -$0.13 in the quarter. The company also managed to generate $4.5 million in operating cash flows, up from a loss of the same magnitude in the year-ago quarter.Despite the strong results in Q1, I believe Pivotal Software's shares to be fully valued with little room left for upside. The primary reasons are two-fold - first, at 9.1x forward revenues, the company already trades at a robust premium relative to other similarly-sized software companies in its growth category, and second, though Pivotal Software's guidance for the year contained plenty of upside to Wall Street's current models, there's definitely risk to hitting its target if there's any deceleration whatsoever in the year.Pivotal Software's shares are priced with no room for error, making the risk-reward profile look extremely unattractive. Stay on the sidelines for this name."
4228524,103480,2018-12-15T13:54:59-05:00,"Pivotal Software posted an excellent third-quarter earnings report that beat Wall Street's expectations on the top and bottom lines.The company also managed to accelerate subscription revenue growth by two points to 53% y/y.The company has also notched one of the highest dollar-based net retention rates in the software sector.At the same time, the company is gradually thinning out its losses and achieving stronger operating margins.With a much lower valuation after the autumn rout and the October lockup expiration out of the way, Pivotal has cleared all obstacles for a recovery in its share price.","Though the correction in the high-growth software sector has been a painful experience, it has created a lot of attractive buying opportunities in names that were previously expensive. Moving forward into 2019, investors should focus on stocks that check off the following requirements, as these stocks are best positioned for a rebound: high revenue growth (>30% y/y), reasonable losses and a path to improving margins, and a valuation that is well off peak.Pivotal Software (PVTL) is one such name. Last quarter, Pivotal was an extremely unattractive investment. Its share price had rocketed to the mid-$20s and was approaching a double-digit revenue multiple, while its revenue growth also saw a noticeable deceleration from the prior quarter. To top it all off, Pivotal was also facing a lockup expiration in October that put plenty of pressure on the shares.This quarter, however, its prospects have brightened dramatically. Subscription revenue growth has picked up again, profitability is strong (at least, it's not losing as much money) and the lockup expiration is in the rearview mirror. Pivotal's stock is also well off peak, with shares down more than 40% from peak values.PVTL data by YChartsIn my view, Pivotal has hit a bottom, and investors should position themselves for a rebound in this stock in mid-2019.The foremost bullish driver behind Pivotal is its now-cheap valuation, thanks to the beating it has received over the past several months. Let's take a deeper dive into where the company is currently trading.At Pivotal's present share price of ~$18, the company has a market cap of $4.68 billion. If we net out the $665 million of cash on its balance sheet, we arrive at an enterprise value of $4.02 billion.Figure 1. Pivotal guidanceSource: Pivotal earnings releaseFor the current year, Pivotal has guided to a midpoint of $658 million in revenues (we note also that its fourth-quarter guidance has upside of about ~$3 million, or 2 percentage points, versus Wall Street's expectations).Let's assume that Pivotal manages to grow revenues at 25% y/y next year, marking a five-point deceleration from this quarter's total revenue growth rate of 30% y/y. This gives us a revenue forecast of $822.5 million, indicating that Pivotal is trading at approximately 4.9x EV/FY19 expected revenues. For a company that is growing presently at ~30% y/y with >50% y/y growth in subscription revenues, I'd say that's a bargain. PaaS stocks like Pivotal have often traded at cheaper valuation multiples than peers, but in my view, Pivotal is worth at least 6x EV/FY19 revenues, implying a price target of $25 and 39% upside from current levels.Here's a look at Pivotal's full third-quarter results:Figure 2. Pivotal 3Q18 earnings resultsSource: Pivotal earnings releaseTotal revenues grew 30% y/y to $168.1 million, surpassing Wall Street's expectations of $164.1 million (+27% y/y) by a respectable three-point margin. Subscription revenue growth, however, was even stronger, growing 53% y/y to $100.8 million. Note also that subscription revenue growth accelerated two points over last quarter's 51% y/y growth, which is a significant accomplishment for a company with Pivotal's fairly sizable run rate.Driving a large portion of the company's growth this quarter was upsells into the existing installed base. Pivotal reported a 150% dollar-based net retention rate this quarter, which is one of the highest in the SaaS sector. On the Q3 earnings call, CFO Cynthia Gaylor even cautioned investors that Pivotal's retention rate was so high that it may naturally decline over time:Moreover, the company's continued shift into subscription revenues has led to a significant lift in gross margins. Subscription revenues hit 60% of total revenues this quarter, up nine points relative to the prior-year quarter, producing a seven-point increase in gross margins to 67% as shown in the chart below:Figure 3. Pivotal gross margin trendsSource: Pivotal earnings deckAt the same time, Pivotal was also able to drive meaningful improvements in operating expenses as well. Sales and marketing expenses, R&D costs, and general and administrative spending each fell one point as a percentage of revenues relative to the year-ago quarter, as shown in the chart below:Figure 4. Pivotal operating margin trendsSource: Pivotal earnings deckAs a result, pro forma operating losses thinned down to -$14.8 million, much better than -$25.0 million in 3Q18, and operating margins ticked up to -9%, a ten-point improvement over -19% in the year-ago quarter.Pivotal's pro forma EPS of -$0.05 also beat Wall Street's expectations of -$0.08. In addition, the company's year-to-date cash flow losses have also pared down significantly:Figure 5. Pivotal OCFSource: Pivotal earnings releaseYear-to-date operating cash burn is down to just -$13.3 million, compared to a loss of more than -$100 million in the prior year. Recall also that Pivotal has a huge $665 million cash balance - at its current burn rate, Pivotal is far from running out of liquidity for several years. This is an example of a company that has a clear path to profitability, while also showing terrific growth in subscription revenues.Pivotal Software is exactly the type of high-quality, recurring-revenue software business that investors should latch onto in a market downturn. This isn't a ""growth-at-all-costs"" stock - alongside robust top-line growth, Pivotal Software is also making huge improvements to its unit economics while shrinking down its cash burn to virtually nothing.This is also a company that has plenty of greenfield sales opportunities - as in, many of Pivotal's prospective customers don't currently have a competing solution installed. The company estimates its 2021 TAM at $80 billion, indicating that it has only fractionally penetrated its addressable market:Figure 6. Pivotal TAMSource: Pivotal earnings releaseWith Pivotal's valuation now at under 5x forward revenues, which is significantly cheaper than in the past, being bullish on this stock is virtually a no-brainer. Stay long on this name."
4169078,104326,2018-05-03T09:18:35-04:00,"Pivotal’s IPO reaped in more than $550 million and earned it a valuation of nearly $4 billion.The company still fell short of high expectations, however, performing well but not making the huge splash many expected it to.The forthcoming surge in cloud computing all but ensures a healthy market for Pivotal to grow in.","Investors across the market had incredibly high expectations for Pivotal Software (PVTL:NYSE), a tech firm that many expected to generate one of the biggest market debuts this year. The recent hysteria and hubbub surrounding the so-called forthcoming pivot to the cloud doesn't appear to be enrapturing investors as many once hoped, however, as Pivotal Software’s relatively lukewarm debut fell far short of expectations.Despite the somewhat chilly reception of its IPO, however, Pivotal Software is only down, yet not out. The company’s shares were still trading up after its debut, which earned it a mammoth valuation, and Pivotal Software isn’t going anywhere soon. This means it could be a lucrative buy for investors who are willing to wait and play the long game. Here are the fundamentals that investors will be keeping their eyes on as they try to determine how the tech firm will fare in the immediate future.It should be of little surprise to investors interested in Pivotal Software that the company had incredibly high expectations surrounding its market debut, especially since it has some lofty ambitions of its own that it aims to bring to fruition over the coming years.The aspiring tech company specializes in cloud computing, and has been banking a great deal of its success on predictions that industries across the world would soon be making a huge pivot to the cloud. With mammoth tech companies like Microsoft (NASDAQ:MSFT) going crazy about the cloud, it’s not hard to see why such a pivot was predicted. Companies like Pivotal may have to wait just a bit more before they have their day in the sun, however. While investors are indeed interested in the cloud, their interest only goes so far as of yet.With an opening range of $15.11 to $16.80 during its IPO, it was expected that Pivotal would reap in a healthy sum of capital from its endeavor and that it did indeed. Pivotal’s IPO brought it in some $555 million, and earned the company an impressive market capitalization of roughly $3.9 billion. With such huge sums like that behind it, tech investors can rest reassured that Pivotal Software won’t be ditching the marketplace anytime soon, even in light of investors' relatively tepid interest in cloud computing at the moment.Those who are dismissing the cloud already are soon to be regretful, too. Pivotal Software’s long-term strategy of banking on the growth of cloud computing is still incredibly well-founded, given that the cloud computing market is projected to reach a mammoth $411 billion by 2020 alone. This should indicate to investors that there’s incredible potential for growth in Pivotal Software, but should also serve as a warning that the company’s industry will be incredibly packed with competition that it will need to overcome before attaining long-term success. These competitors include the high and mighty of software including: Microsoft, Google (NASDAQ:GOOG) (NASDAQ:GOOGL) and Amazon (NASDAQ:AMZN).However, to its advantage, Pivotal has partnerships with all three of these companies, particularly with its popular Pivotal Cloud Foundary software. This gives it a unique insight into customer behavior, and an understanding of which cloud service they prefer and why. For example, Pivotal has one hundred joint engagements with Microsoft Azure cloud and so works with Microsoft's customers.One other distinct advantage it has over its competitors is that Pivotal allows businesses to work with apps in Java, the preferred language of many coders, meaning they don't have to relearn any skills to work with Google, Microsoft or Amazon, which gives customers the luxury of switching between these cloud providers with ease.The long-term fundamentals of the company’s finances may give some investors pause, too. Pivotal Software has incurred net losses every year since it was formed, after all, and investors will be looking for growing revenue figures to offset such losses if they’re to latch their horse to Pivotal’s wagon for the long haul in the market.Not all the news surrounding its net losses is bad, however. According to the prospectus, the company filed with the SEC, its net losses have been down in recent years, shrinking impressively from $232 million in 2017 to $163 million in fiscal 2018. If those losses keep shrinking, expect investors to jump aboard Pivotal’s ship with glee.Investors should also know Pivotal has some friends in high places. Dell (DVMT) has a massive economic interest in Pivotal Software’s success, after all, and could prove instrumental towards its future. Pivotal’s CEO has opened up about navigating the complex corporate politics that come with being a member of the Dell family, and it’s worth noting that, thus far, Pivotal’s team of executives seemed to have done a fairly good job of remaining an independent and effective member of a much bigger corporate family.Pivotal Software’s forging of lucrative relationships with such companies as Boeing (NYSE:BA) and Liberty Mutual should prove to investors the company has some serious potential. As long as the company’s net losses continue to shrink at such rates as they did from 2017 to 2018, investors aren’t likely to concern themselves too much with who owns Pivotal, outside of clamoring for more shares themselves.Don't let the lukewarm IPO dissuade you. For investors interested in long-term growth, Pivotal is definitely a worthwhile consideration. The growth of cloud computing seems ceaseless, and sooner rather than later the market is going to be banking big on companies like Pivotal Software."
4165162,23690,2018-04-24T11:01:31-04:00,Pivotal Software came public last week at $15 and traded quietly on their debut.Their very rapid growth in high-margin SaaS is being masked by their shift away from providing professional services.This provides a rare opportunity to buy one of the key names in enterprise cloud infrastructure at a good price.Our IV suggests the shares can reach $34 in the next year.,"Pivotal Software (NYSE:PVTL) went public on Friday at $15/share. The offering didn't get a resounding vote from the markets. Unlike other recent enterprise software deals, this one ended quietly at $15.75.We think PVTL is likely to do well at these levels. Partly because investors focused on ""slowing growth"" in revenues. That misses the most valuable aspect of the growth story - services revenues are actually declining YoY while software subscription revenue growth remains robust.The table below illustrates the underlying dynamics. Note not only the growth in SaaS revenue but also the overall increase in gross margin. With 90% margins on the SaaS business, this is the one we want to grow.Source: SEC filings and IPO CandyOur IV estimate (below) suggests the shares may see $34 in the next year.When we say ""big and ugly"" we mean that in a good way. Enterprise IT is a very complex beast. Enterprises have legacy applications, individual and global architectures, multiple databases and transactional systems and need a high level of security, monitoring, and compliance.Being productive in such an environment is an ever-present challenge. Over the years there have been waves of technology in this space. In the very early days, we had ""Computer-Aided Software Engineering"" or CASE which spawned an array of tools and techniques that saw some adoption.In the 1990's this shifted to ""model-based development"" led by companies like Rational Software, which ultimately was acquired by IBM (NYSE:IBM). During the same period, large companies started to shift away from mainframes thanks to distributed software infrastructure from companies like BEA Systems which was acquired by Oracle.For the past decade, most new trends in development have been toward lighter frameworks, speed and ""agile"" development methods. At the same time, the infrastructure has shifted yet again to the cloud led by providers like Amazon (NASDAQ:AMZN) (AWS) and now Microsoft (NASDAQ:MSFT) (Azure).A whole crop of ""cool"" infrastructure technology providers have come public including Twilio (NYSE:TWLO), MuleSoft (NYSE:MULE), MongoDB (NASDAQ:MDB), Nutanix (NASDAQ:NTNX), ServiceNow (NYSE:NOW), Zendesk (NYSE:ZEN), Okta (NASDAQ:OKTA), Atlassian (NASDAQ:TEAM), Coupa (NASDAQ:COUP), Tableau (NYSE:DATA), ZScaler (NASDAQ:ZS) and New Relic (NYSE:NEWR) to name a few! These stocks have mostly done VERY well.Today enterprises are looking for ways to exploit the advantages of these new development technologies to increase productivity and be able to leverage the cloud for their own business needs.At a very high-level PVTL provides 1) a development framework and approach, 2) a set of development tools and 3) a deployment platform that works on top of mainstream services like AWS and Azure.If you want a more complete ""feel"" for the PVTL platform you can learn more by just skimming the portal to the documentation: Pivotal DocsAs long as Pivotal continues to grow their subscription revenue the investment case is strong. It's recurring and much higher margin than the services business which is more appropriately performed by large partners like Anderson Consulting, PWC, or IBM.Source: SEC FilingsInvestors worry about what Dell may do with the rest of the shares they own. This ""overhang"" may be part of the reason for the lack of post-IPO performance. The Dell stake also might make it harder for a natural acquirer like IBM or Oracle to make a move on PVTL.At these levels, PVTL offers attractive risk/reward - especially versus some of the other infrastructure software names that have moved up sharply and trade much closer or even above our IV estimates.Source: SEC Filings and IPO Candy"
