article_id,author_id,publish_on,summary,content
4164628,103480,2018-04-22T09:56:32-04:00,"Pivotal Software priced its IPO at $15, raising $555 million.Shares opened for trading at $16.75, but sold off during the day to give up nearly all of their gains. Shares closed up only 4% at $15.73 on Day 1.This is the first software IPO of the year not to see double-digit jumps from the IPO price.Pivotal trades at 5.8x forward revenues, one of the lowest valuation multiples for a recent tech IPO.","Pivotal Software (NYSE:PVTL) was supposed to be one of two subsidiary companies to go public during the week of April 16. The other, AT&T's (NYSE:T) Latin America unit Vrio (VRIO), withdrew its IPO at the last minute citing unstable market conditions. It seems Vrio may have been prescient with its decision, as Pivotal Software's IPO on April 20 was met with the most subdued response among tech IPOs this year thus far.Pivotal initially priced its IPO in a range of $14-16, ultimately pricing right in the middle at $15. Every tech IPO this year thus far - Zuora (NYSE:ZUO), Dropbox (NASDAQ:DBX), and Zscaler (NASDAQ:ZS) has been able to raise their range and price above it. And after getting off to a modestly decent start, opening for trading at $16.75 (a 12% pop), Pivotal's shares gradually skidded throughout the course of the day to give up essentially all of its gains:PVTL Price data by YChartsAll told, it ended the day at a 4% pop - if you could even call it that. In comparison, Zscaler popped 43% in its IPO, Dropbox 36%, and Zscaler 106%. Among these recently public cloud peers, it seems that Pivotal is getting the short end of the stick.The lack of enthusiasm for Pivotal doesn't seem to be a function of distaste for its business model. The Pivotal Cloud Foundry, a subscription-based cloud PaaS platform, has amassed a top-tier customer base and is essentially in a similar business as MuleSoft (NYSE:MULE), which recently got bought out by Salesforce (NYSE:CRM) for a stunning ~16x forward revenue multiple ($6.5 billion).Rather, it seems that investors are skittish regarding the company's relationship with Dell. Though Pivotal's S-1 filing explicitly states that none of the IPO proceeds will be channeled to Dell (which has been trying to come up with ways to pay down its massive ~$50 billion-plus debt load), and Pivotal management has been interviewed as saying that the company runs independently of Dell, it is still far from being a standalone company.To drive the point home further - as per Pivotal's final prospectus, Dell still owns 70% of the company post-IPO and 96% of the voting power, through its supervoting Class B shares. Pivotal is essentially a wholly controlled subsidiary with a small slice of its shares trading in the open market. Dell itself is a core piece of its business, providing Pivotal with a large source of its revenues. Taken from the ""Risks"" section of Pivotal's prospectus:All told, with a modest valuation, Pivotal Software looks like it might have some investment potential. However, investors might want to wait until the dust clears, as the shares may see rocky trading in the first couple of weeks. The uncertainty of Dell's relationship with Pivotal will likely always cast a cloud over this stock. I believe 6x EV/FY18 revenues, or a price target of $16.50, represents a fair value for Pivotal in the medium term. There will likely be an opportunity to buy if shares continue to sink to the $14-15 range.The softness of Pivotal Software's IPO is, more likely than not, due to Pivotal-specific concerns, and not a softening of demand for cloud/technology IPOs as a whole. As we look ahead to DocuSign (DOCU) and Smartsheet (SMAR) next month, we're likely to see the steam pick back up.Here's how the chips fell in the Pivotal IPO:The selling shareholder by the way is the industrial conglomerate GE (NYSE:GE), whose new CEO John Flannery is in the process of divesting assets and raising cash. GE is only selling a portion of its shares, however, and is holding on to approximately four-fifths of its stake. Also interesting is the fact that Ford Motors (NYSE:F) has 17.5 million shares in the company (worth just shy of $300 million).DellEMC and Silver Lake Partners, however, will still control 96% of the company's votes through their supervoting Class B shares. Here's how the cap table looks post-IPO:Source: Pivotal Software finalized prospectusWith 250.3 million shares outstanding in the company post-IPO, and shares currently trading at $15.73, Pivotal has attained a market cap of $3.94 billion on its first day of trading. After netting out the company's $20 million of debt, $73 million of cash on the balance sheet, and $465.8 million in net proceeds Pivotal expects to raise from the IPO (a net cash position of $519 million), the company has an enterprise value of $3.42 billion.Assuming 15% revenue growth for the coming year, Pivotal currently trades at 5.84x EV/FY18 revenues:Source: Author-created chart; market cap taken as of close of trading on April 20; data from public filingsAt first glance, Pivotal's valuation looks rather cheap, especially when considering that fellow PaaS company MuleSoft just got bought out at ~16x forward revenues. Another PaaS comp, Twilio (NYSE:TWLO), currently trades at 7x forward revenues:TWLO EV to Revenues (Forward) data by YChartsA couple notes on Pivotal's valuation, however. The first observation is that Pivotal's growth over the past year has been rather erratic, making it difficult to pinpoint a revenue estimate for the coming year. Here's a look at Pivotal's string of quarterly results:Source: Pivotal Software finalized prospectusYou'll notice that the company saw 18% growth in the most recent quarter (Q4, ending February 2), 17% growth in Q3, 20% growth in Q2, but 38% growth in Q1. Pivotal could see another growth spike this year, or it could continue its decelerating trend - until we get clearer guidance from the company, assuming that growth decelerates to ~15% is a good starting point.The second observation to note is that unlike most software companies, Pivotal has a heavy tilt toward services revenues - the low-margin consulting fees it earns from its Pivotal Labs division. The good thing is that Pivotal is gradually tilting more of its revenue mix into its high-margin subscription revenues (56% of revenues in Q4, the highest historical subscription mix), but the fact that services revenues are done essentially at cost makes them far less valuable than subscription revenues. Case in point: in Q4, Pivotal generated $58.3 million in services revenue, but those revenues cost $49.8 million to produce, or a gross margin of less than 15%.Thus, a lower revenue multiple for Pivotal Software makes sense versus other PaaS companies that have nearly all subscription revenues. As I previously said, 6x forward revenues ($16.50) is a good benchmark for the stock. As the company tilts more into subscription revenues (but decelerates its growth in doing so), it could curry a higher valuation from the market.Don't buy Pivotal Software just yet, as it seems the stock needs some time to consolidate and get over initial jitters before finding a support level (much like Stitch Fix (NASDAQ:SFIX) when it went public last fall). Pivotal Software will probably likely never trade at the sky-high valuation multiples of other software IPOs (Dropbox is at 9x forward revenues; Zscaler is at 16x forward revenues) due to its services-heavy revenue and uncertain Dell relationship. However, Pivotal does have a compelling business that should be bought if the stock does dip low."
4162002,103480,2018-04-10T04:41:00-04:00,"Pivotal Software has updated its S-1 filing to specify an IPO of 33.1 million shares at $14-$16.
        Based on the midpoint of this range, this implies a $497 million IPO.
        Pivotal's initial pricing range implies a market cap of between $3.5 billion to $4.0 billion.
        This would value Pivotal Software at between 5.1x to 5.9x forward revenues, a fairly standard revenue multiple for a software company with its growth profile.","Pivotal Software (PVTL), a PaaS company and a subsidiary of Dell Technologies (DVMT), has updated its S-1 filing with its latest pricing range and share offering. The company initially filed its IPO registration a few weeks back, a bit more stealthily than most software companies of its size - with the market zooming in closely on the IPOs of Dropbox (DBX) and Spotify (SPOT), there wasn't much room for anything else in the IPO headlines.Nevertheless, with Pivotal's ~$510 million in revenues in FY18 (the calendar year ending February 2018), Pivotal Software is one of the larger software companies to go public. A typical high-growth software startup is typically only touting between $150-$200 million in revenues prior to its public debut - the approximate hurdle at which bankers typically counsel companies to have crossed before making a public offering. With Pivotal Software offering 33.1 million shares at an initial pricing range of $14-$16, it's indicating an IPO of $497 million at the midpoint of that price - a fairly sizable deal. The issue with Pivotal Software isn't necessarily its valuation - which we'll cover in the next section, as an update to my original article covering Pivotal Software's business and growth trajectory. The initial IPO pricing actually sets a fair valuation for the company, one that opportunistic investors can still gain from. The issue is with Dell.As a reminder, Dell is doing everything it can to try to cull down its $50 billion debt load, which with the Trump tax bill's new limitation on interest deductibility to just 30% of EBITDA, is no longer optimal in its capital structure. The IPO of Pivotal Software was initially assumed to be a fundraising tactic for Dell's debt - though we note that a ~$500 million raise would barely scratch the surface of Dell's debt mountain.In Pivotal Software's S-1 filing, its ""use of proceeds"" section nullifies that hypothesis, saying that all proceeds raised will be used internally within Pivotal Software. That's a huge plus for those contemplating an investment in Pivotal. Yet even though Pivotal's assets aren't being gutted just yet, the association with Dell currently leaves a black mark across all its public subsidiaries. VMware (VMW) investors, in particular, are extremely flippant about Dell's proposed ""reverse merger"" that would absorb VMware and use its cash flows to pay down Dell's debt. Secureworks (SCWX), a cybersecurity company that's also majority Dell-owned, recently tanked due to a severe decline in gross margins and poor guidance. The poor performance of Dell subsidiaries in the public markets as of late - as well as the uncertainty that Dell could do something adverse in the future, as it's doing to VMware - is sure to cast a question mark over Pivotal's IPO. After Pivotal Software sells its 33.1 million Class A shares to the public, there will be 74.8 million total Class A shares and 175.5 million Class B shares in the share pool, according to Pivotal's refreshed S-1. This makes for total outstanding common stock of 250.3 million shares.Class A and Class B shares have equal economic weighting, but Class B shares (which will be 100% owned by Dell) are supervoting shares with 10 votes, whereas Class A shares will have one. This gives Dell ownership of 70% of the company, but 96% of the voting power. Pivotal will essentially be a publicly traded and wholly controlled subsidiary, with other investors just along for the ride.With 250.3 million common shares outstanding post-offering (the IPO is proposing to sell 13% of the stock into public float), Pivotal Software will have a launching market cap of between $3.5 to $4.0 billion, depending on where (and if) it prices within its given range of $14-$16.The midpoint of this range gives Pivotal a market cap of $3.76 billion, and is shown in the valuation table below:Source: author-created chart; data from public filingsNetting out Pivotal Software's $73.0 million of balance sheet cash and giving credit to the $465.8 million in net proceeds Pivotal expects to raise from the IPO (as stated in the S-1, and based on midpoint pricing of $15), and adding the company's $20 million of debt, Pivotal Software is proposing to go public at an enterprise value of $3.24 billion.If we assume Pivotal Software grows revenues by 15% in FY19 (last quarter revenues grew by 18% y/y, so this seems a reasonable deceleration. Note that total revenues are growing slower than Pivotal's subscription revenues, which grew 58% y/y last quarter and are increasingly becoming the focus of the business), we arrive at an estimated forward revenue of $585.9 million.This puts Pivotal Software at a 5.53x EV/FY19 revenue multiple, with low and high ends of the $14-$16 pricing range implying a valuation spectrum between 5.1x-5.9x forward revenues.This is a fair multiple for a software company with Pivotal's growth profile. Other PaaS companies like Twilio (TWLO) also trade at roughly 6x forward revenues, though Twilio has a much faster growth rate. For an IPO, however, Pivotal's initial pricing seems a bit aggressive and will probably produce less of a ""pop"" on the first day of trading than usual. Companies like Dropbox and Zscaler (ZS) were initially priced at lower than 5x revenues (though the initial range was ultimately extended, and the stocks have soared since). This further underlines the point that Pivotal strays from a traditional startup IPO, and Dell/Pivotal are trying to raise the maximum amount of capital possible.Though Pivotal Software has an attractive financial profile, its pricing range doesn't leave much of a margin of error for early investors. I predict that Pivotal Software's IPO - already priced so closely to a ""fair valuation"" - won't produce as big of a pop as other technology IPOs this year, especially with the cloud of Dell over Pivotal's shoulder.Of course, Pivotal's pricing range is still fluid - it could still lower or raise that range, or price outside of that range altogether. An IPO should be imminent within the next 2-3 weeks, so we'll know for sure shortly. But at the current moment, I don't think I'll be tripping over myself to buy a slice of Pivotal when the Dell-related unknowns are so overwhelming."
4163782,102994,2018-04-18T14:13:53-04:00,"Pivotal Software, largely owned and controlled by Dell, will begin trading on the NYSE April 20. It aims to raise around $500 million by selling 33.1 million shares at $14-$16.Money raised by Pivotal will stay with Pivotal. But the IPO provides a way for cash strapped Dell and investor Silver Lake Partners to monetize at a later date.Private equity firm Silver Lake Partners owns 24% of Dell and a substantial stake in Pivotal. Analysts say that Silver Lake is looking for better returns on its Dell-related investments.In February, Dell filed form 8-K with the SEC stating that it is exploring strategic alternatives to monetizing and optimizing its structure. The impact on Pivotal is unknowable.Pivotal's Cloud Foundry platform which helps enterprise software developers build products  that run on private and most major public clouds is gaining customers quickly and may be as important in the future as Oracle and IBM are today.","Pivotal Software (PVTL) is expected to start trading on the New York Stock Exchange on Friday. When the startup was spun off from EMC in 2013, the New York Times called it a well-financed competitor to Amazon (NASDAQ:AMZN) Web Services. It boasted $1 billion working capital on its balance sheet and 1600 employees on day one. The majority of its shares were owned by EMC, VMware (NYSE:VMW) and General Electric (NYSE:GE). Since then it has brought on Michael Dell, Dell Technologies (DVMT), private equity firm Silver Lake Partners, (instrumental in funding Dell’s acquisition of EMC,) Ford (NYSE:F), and Microsoft (NASDAQ:MSFT) as investors. As we approach the IPO, Pivotal's major shareholders are Michael Dell, Dell Technologies, Silver Lake Partners Investment Funds and EMC each with 351,028,548 beneficially owned shares according to the S-1 filing. Other significant shareholders (greater than 5%) include VMWare (VMW) (also controlled by Dell), ""An Affiliate of General Electric,"" and the Ford Motor Company which own 88,416,325 shares, 38,830,152 shares and 35,033,418 shares respectively. Of these, GE has said it would be selling part of its allotment in the IPO.It's worth noting that Pivotal has two classes of shares, Class A and Class B. Though they are valued the same from a financial perspective, Class B shares, which will be owned only by Dell, have 10 votes per share while Class A shares will have one vote per share.From the S-1:In other words, Pivotal will be a ""controlled company"" as defined by the corporate governance rules of the New York Stock Exchange. That being said, Pivotal's S-1 states,This was likely stated to assuage would-be investors' fears of the opposite; however, Pivotal, and even Dell, have no control over what Silver Lake might do after the IPO if it wants to reduce its investment in Dell and the companies it controls.In January 2018, Bloomberg News reported that Silver Lake Partners may be seeking an exit from Dell. It goes to follow that if Silver Lake decided to sell a significant amount, or all, of its Pivotal shares, at once, the stock price would likely tumble.Dell went from being a $7 billion private tech company to one of that became markedly bigger when it acquired data center conglomerate EMC in 2015 for $67 billion. Needless to say, it did a good amount of borrowing. Dell seemed to be comfortable with making payments on its debt until recently. Things changed when the new tax law took effect earlier this year. Instead of being able to deduct actual interest expenses, it can now deduct interest expenses limited at 30 percent of its income. Moreover, according to Credit Insights, Dell has a new, unanticipated, additional tax bill (on cash and other assets held overseas) of around $480 million per year over the next 5 years, and as much as $6 billion over time.These new taxes affect Dell's financial agility. While it's reasonable to believe that Dell wouldn't want to take from, or negatively affect, its young offspring (Pivotal), even if things got tough, the mere possibility of that happening should spook investors. We have seen this happen when it comes to the relationship between Dell and VMWare over and over again.Were it not for the aforementioned, Pivotal's success in positioning itself as ""the platform on which modern enterprise software will be built"" is extremely attractive. The tools it offers on its open source based Cloud Foundry Platform-as-a-Service which enable developers to build applications that work across, and on, all major public clouds -- Amazon Web Services, Google (NASDAQ:GOOG) (NASDAQ:GOOGL) Cloud Platform, Microsoft Azure -- and company-owned private clouds are almost unrivaled. They are used by six of the 10 largest automobile manufacturers, seven of the top 10 banks, and half of the 10 largest insurance companies. Pivotal, which was spun-off from EMC, in 2013 has grown quickly. Its revenues have grown from $280.9 million in FYE 2016, to 416.3 million in FYE 2017, to $509.4 million in FYE 2018.Its profits have grown impressively from $93.5 million in FYE 2016, to $181.9 in FYE 2017 to $281 million in FYE 2018. Its gross margins have grown from $33 million to $44 million to $55 million from 2016-2018.Here are the vitals: Source: Pivotal's S-1Though Pivotal is still losing money, it's to be expected of a 4 year old start-up. (There are articles indicating that Pivotal was founded much earlier, but they are confusing its origins from consulting company Pivotal Labs which EMC acquired in 2012.)Pivotal would be an easy buy on its opening day buy if the price was right ($14-$15) and the possibilities of Silver Lake Partners, and maybe even Dell, flooding the market with shares over the next year weren't so great. As it is, it's probably worth waiting for that to happen and buying the stock at that time at a bargain. Pivotal's Cloud Foundry has a solid chance of becoming the foundational platform on which modern applications are built and being based on open source software it presents an excellent alternative to anything AWS, Google Cloud Platform Microsoft and Oracle (NYSE:ORCL) have to offer. Tempting as it is, I'd recommend staying on the sidelines for now."
