article_id,author_id,publish_on,summary,content
4353969,104952,2020-06-15T17:35:40-04:00,"Amid the pandemic in Q1, revenue grew by ~33% while ARR surpassed $1 billion, further demonstrating the secular tailwind for the business.RingCentral is very well-positioned to win in the UCaaS and CCaaS markets. Its deep partnership with Avaya will only accelerate market share gains.RingCentral saw a triple-digit increase in activities for its differentiated MVP platform. We expect to see similar traction for its Avaya Cloud Office offering in and beyond Q2.","RingCentral's (RNG) shares have been up by over 50% since our first coverage six months ago, where we highlighted the secular growth opportunity considering RingCentral's strengthened market leadership in UCaaS (Unified Communication as a Service), due to its deep partnership with legacy player Avaya (AVYA). Currently, we see some near-term as well as long-term catalysts around the stock. Overall, we believe that RingCentral should continue to benefit from the partnership and the secular tailwind in the unified and contact center markets across the mid-market and enterprise. We maintain our overweight rating on the stock.Secular growth in cloud communications will continue to drive mid-market and enterprise market share gains, with shelter-in-place trends further accelerating adoptions across healthcare, financial services, and education sectors. RingCentral's outperformance in Q1 despite the COVID-19 situation indicates that it continues to benefit from the secular tailwind in cloud communications. In Q1, revenue grew by 33% YoY, driven by a staggering 52% increase in the mid-market and the enterprise revenues. Furthermore, the total value of >$1 million ACV deals was also up 30% YoY, driven by deals like Mutual of Omaha and Aveanna Healthcare, both are amongst the largest players in insurance and healthcare consecutively.(source: Q4 2019 slide)Moreover, RingCentral has also been conservative in its guidance, noting last quarter that Q1 revenue growth would only be between 28% and 29% instead of 33%. With that in mind, as the company recently revised the growth guidance for the FY 2020 to be between 24% and 25%, we think that there is a possibility for more surprises in the next few quarters as the secular tailwind continues, with the company expecting to land more Avaya-related deals in Q4.Furthermore, RingCentral's differentiated offerings and Avaya partnership will well-position it to continue leading the UCaaS market. As we have discussed in the first coverage, the Avaya partnership should continue to be the key growth driver for the business.(Avaya Cloud Office. source: Avaya x RingCentral partnership presentation)Given the joint go-to-market and product development of Avaya Cloud Office, RingCentral has a differentiated offering in a captive market as it leverages Avaya's client base. As it stands, 90% of Fortune 100 are Avaya's customers. It also has over 4,000 sales reps, service reps, and partners across +180 countries. Avaya will also be very determined to succeed in the partnership, considering its declining market share in the legacy communication. Having seen the onboarding of over 1,700 channel partner agents to sell Avaya Cloud Office in Q1, we feel optimistic that adoptions should further accelerate beyond Q2 as well.(MVP - Source: ringcentral.com)On the other hand, adoption for the MVP (Message Video Phone) platform has also been solid. The differentiated platform has a built-in enterprise-grade team messaging and video meeting features. In Q1, RingCentral landed Cornell University, which has +15,000 users, as an MVP client. Detroit Lions also came on board as it leveraged RingCentral MVP for its virtual NFL draft in April. Furthermore, the increased usage volume in Q1 has also demonstrated the offering's strong enterprise product-market fit, which we believe should increase the net retention and expansion longer term. As CEO Vladimir Shmunis commented, RingCentral saw a triple-digit increase across all the key usage metrics in Q1:There are minimal risk factors in RingCentral, which we believe are significantly overshadowed by the overall growth prospect. The guidance for FY 2020 took into account further churns in the SMB segments across retail, travel, and the hospitality sectors, which have been impacted by the pandemic. In Q1, RingCentral saw elevated churn in these sectors, with some of the clients also requesting to renegotiate payment terms. Compared to the previously given guidance, the management will expect a 100 bps decrease in the expected FY 2020 revenue growth.Considering its deep moat and disruptive offerings, RingCentral is well-positioned, in our view, to be the market leader not only in UCaaS but also in CCaaS longer term. In CCaaS, it should see strong competition from Five9 (FIVN), which also has seen the secular tailwind in the business and recently landed AT&T (NYSE:T) as a client. Five9 has been trading at ~18x P/S in recent times.(P/S upward trend, driven by the secular tailwind for FIVN. source: stockrow)At the current 22-23x P/S, we think that the price is fair, as it reflects not only RingCentral's strong moat and fundamentals but also the secular tailwind for cloud communications and the business's resilience amid the pandemic.(P/S upward trend, driven by the secular tailwind for RNG. source: stockrow)Given the catalysts, we believe that the 24-25% growth guidance for the full year is conservative and that the expected non-GAAP operating margin of 9.6-9.7% is realistic. The stock may trade at +24x P/S upon the likely outperformance in Q4, driven by the Avaya-related deals. Considering the ~88 million shares count, ~$1.1 billion of revenue, and maintained ~24x P/S, we maintain an overweight rating on the stock, with a target price of ~$300."
4374981,105308,2020-09-17T15:24:52-04:00,"Despite dipping by nearly 40% during March's COVID-19 selloff, shares have rebounded to new highs, trading at around double their price compared to last year.Management updated its guidance, pointing towards FY2020 Revenue growth of 28%, which, based on its historically prudent estimates and past performance, is more than likely to, again, beat.At the same time, the stock's current valuation is a bit hard to justify. Even under a favorable scenario, shares offer little to no margin of safety.We are likely to be more interested in the stock below $200, amid higher expected returns.","The beauty of recurring cash flows allows both management teams to better execute their plans based on their predictability, and investors to more accurately project their future returns, based on a more narrow range of potential future financials. As a result, subscription-based companies have always been expensive, trading at a significant premium. Add in the factor of rapidly growing revenues, and valuations can easily break through the roof.While rushing towards such stocks to get behind their ongoing rally is a risky investment strategy, completely avoiding SaaS growth stocks just because their valuation is ""high"" is also wrong. Investors have missed out on numerous opportunities on the grounds of a pricey valuation multiple. At the same time, pricing rapidly growing companies is hard. A single variable can easily change their long-term growth trajectory, and hence their expected returns.One such company we want to take a look at today is RingCentral (RNG). Thankfully, the company has been on the path of delivering a more substantial bottom line, which should make it easier for us to assess if shares remain investable at their current price. Despite dipping by nearly 40% during March's COVID-19 selloff, shares have rebounded to new highs, trading at around double their price compared to last year.Source: Google FinanceIn this article, we will:Capitalizing on the ever-increasing demand for better and more efficient communication and collaboration software solutions for businesses, RingCentral has been on a prolonged expansion trajectory, continuously growing its client base. As we mentioned earlier in regards to cash flow predictability, RingCentral has posted no single quarter whose turnover is not higher than the one before it, since its IPO. Moreover, while many SaaS companies' growth gradually declines, amid maturing, RingCentral's sales growth levels have remained robust, currently featuring an LTM (Last Twelve Month) revenue growth of 32.4% YoY, with little to no signs of a slowdown.As the company keeps on refining and enriching its ecosystem, its revenues should keep on expanding both from selling additional services and adding new customers. For example, during Q2, the company announced RingCentral Video (RCV), a reimagined video meeting experience, to benefit from the current working environment's needs for distanced communication. The argument that the space is highly competitive and saturated can be made, with Microsoft (NASDAQ:MSFT) Teams and Zoom (NASDAQ:ZM), for example, dominating the space. However, RingCentral's management is aware, and thus not directly competing, but rather integrating its suite of solutions. For instance, by launching RingCentral PBX for Microsoft Teams, with Direct Routing integration, Microsoft Teams users can have access to more robust cloud PBX capabilities without ever having to leave the Teams interface.Due to strong contributions from mid-market and enterprise customers, the company's Q2 results beat its very own guidance. The company expected revenue growth of around 27%, which would still be quite impressive. Instead, the actual figure at 32% further reassured investors that the company's growth rate remains robust. As a result, management updated its guidance, pointing towards FY2020 Revenue growth of 28%, which, based on its historically prudent estimates and past performance, is more than likely to, again, beat. Further, this financial year also marks the first in which the company is about to deliver a solid bottom line. RingCentral has technically always been profitable, though by reinvesting the entirety of its gross profits towards operating expenses and R&D, its income statement has been mostly breaking even over the past few years. A substantial EPS guidance should indicate that investors are to start enjoying tangible returns, driving value through higher free cash flow due to higher net income. Source: Investor PresentationNow let's assess this updated data, along with reasonable growth estimates, in order to assess whether the stock remains investable, despite almost doubling YoY.Over the past few years, management's guidance, which influences consensus estimates, has been humble, which has resulted in the company beating every single quarter in terms of revenue growth. As a result, it's quite likely that RingCentral's revenue growth guidance of around 27% is too prudent, considering the company's current growth.Source: Seeking AlphaStill, we are going to estimate two different, gradually declining revenue growth rate scenarios. The first assumes a more prudent case, in which revenue growth starts decelerating from around 28%, around in line with management's guidance. In the second one, we assume an overall more favorable case to compare the difference in the possible investor returns.Assuming that revenues decline, as shown in the graph, investors are likely to see the following revenue growth:Keep in mind that these estimates indicate considerable deceleration, which is not in line with the company's current performance. However, it's better to retain reserved expectations, in our view. Source: AuthorConsidering that the market is valuing the company based on its future potential profitability, the current forward P/E of 276, based on the company's EPS guidance, is altogether not meaningful. Instead, let's assume a probable net income margin of around 10%. In 2025, that equates to around $326M. We believe that this is quite a reasonable estimate, considering that RingCentral's gross margins have been well above 70% since 2015.Further, we assume that the company will not issue any additional shares since its cash pile should start growing organically. Our net income estimate equates to an FY2025 EPS of $3.70. Based on our growth rates, net income margins, different future valuation multiples, and the stock's current price ($250), current investors are likely to see the following annualized returns:Shares would have to trade at a sky-high P/E ratio in order for investors to see any meaningful gains. A sky-high P/E ratio is quite likely, as investors could be pricing the stock for a net income margin expansion towards 20%. However, it's worth noting that amid a lower valuation, current investors face no margin of safety.Source: AuthorNow, let's consider a more optimistic scenario, where RingCentral beats its own guidance, as usual, and delivers a slower revenue growth deceleration, as displayed below:Source: AuthorFurther, along with a more optimistic scenario in which we assume net income margins of 15%, FY2025's EPS comes out at $6.17. Plugging in the rest of the numbers, and we get the following potential returns, this time:As you can see, while the total investor return potential significantly improves, shares offer, again, a poor margin of safety, under more humble valuations. Investors are likely to see limited returns amid a future (2025) P/E below 60.Source: AuthorRingCentral is a rapidly growing company, beating its top-line estimates consistently. Its Q2 results were promising, showing less deceleration than expected. We believe that the company's path to profitability is a positive advancement, as dilution should cease, amid positive, organic free cash flows.At the same time, the stock's current valuation is a bit hard to justify. Even under the more favorable scenario, as we projected, shares must be trading at a P/E ratio of 70+ in the medium term for investors to be adequately rewarded. That's quite a risky bet since the company is operating in a very competitive sector, with companies like Google (NASDAQ:GOOG), Microsoft, Zoom, Slack (NYSE:WORK), Cisco (NASDAQ:CSCO), and others, offering similar suites of products. Should the company's growth lag amid increased competition, current investors have no tangible capital returns to hang on too, and hence no margin of safety.Overall, we like RingCentral's growth and future profitability, but we don't feel the same about the stock's current valuation. Its future surplus of extraordinary returns seems to be already captured, as shares are priced for perfection. In fact, despite Q2's excellent beat and raise, RingCentral's stock remained flat over the next few weeks days, as such a robust performance seems to be already priced in. Hence the minimal margin of safety going forward. We believe that shares offer a limited upside in the medium term, despite the company's rapid growth. We are likely to be more interested in the stock below $200, amid higher expected returns."
