article_id,author_id,publish_on,summary,content
4307514,104608,2019-11-18T13:02:19-05:00,"RingCentral reported a strong Q3 with revenue well above expectations.Their recent partnership with Avaya and expanded relationship with AT&T could propel revenue growth higher in 2020.Valuation remains at a premium, but rightfully so as this is a premium company.","RingCentral (RNG) reported another very strong quarter, something I think investors have become accustomed to over the past few reports. Revenue growth remains very strong at 34% and the raised guidance gives investors more confidence about the long-term growth trajectory.In addition, RNG talked more about their recent exclusive partnership with Avaya (OTC:AVYA), as well as their expanded relationship with AT&T (T). While both of these new events remain in early stages, it could set the company up for revenue growth accelerating in 2020 in addition to potentially more partnerships along the way.While valuation remains at a premium, I think the stock remains a long-term buy, even at these levels. Investors will always pay up for successful companies and even if valuation were to pull back a bit, the company's superior revenue growth can continue to drive stock outperformance.Data by YChartsRNG is one of the leaders in the UCaaS, or Unified Communications as a Service, market. This segment of the market focuses on the transformation of enterprise communication as it evolves from traditional landlines to newer forms of communication. RNG utilizes its cloud-based approach in order to provide flexible and cost-effective services to support an ever-changing workforce. Employees are becoming more mobile, and RNG is capturing the ""bring-your-own device"" market shares.Enterprises have rapidly moved away from traditional landlines and towards newer forms of communication, including online meetings, team collaboration, telephony, and video conferencing. RNG assists with delivering the newer forms of communication, and its cloud-based offerings enable the company to deliver more transparent revenue streams.Source: Company PresentationThe new forms of communication are here to stay. Yes, voice communication is still the dominant form of enterprise communication, but there is an increasing number of new communication forms. For example, RNG held a study surveying 2,000 customers, of which 44% said voice was their main method of communication. However, both team messaging and text followed closely behind. This demonstrates the changing landscape and need for enterprises to develop modern communication platforms.Q3 was a very strong quarter with revenue again growing 34% to $233 million, well ahead of consensus expectations for $221 million. Subscription revenue continues to drive growth, representing over 90% of revenue and growing 33%. The software revenue stream is very valuable for SaaS companies as it is highly predictable and recurring in nature, thus giving investors more confidence in placing a higher revenue multiple on the company.Source: Company PresentationThe company closed more than 30 $1+ million deals during the quarter, demonstrating their continued success moving up the market. The larger the contracts they win, the more likely this clients will turn into recurring and sticky revenue streams. I think as the company continues to scale, we will see more larger deals, which will ultimately improve the company's visibility into their revenue stream.RNG recently announced a newly formed partnership with Avaya where they will become the exclusive public UCaaS solution marketed and sold by Avaya. While contribution from this partnership is not expected to hit until late 2020, their product is expected to launch in Q1. Given the size and scale of Avaya in the communications market, this could propel RNG's revenue growth higher over the next few years.In addition, RNG announced they expanded their AT&T partnership which could add even more fuel to their revenue growth profile. RNG will become the lead UCaas provider for AT&T and the combination of two large relationships have given investors greater confidence in the longer-term trajectory of the company's growth profile.Source: Company PresentationWhile margins continue to be strong, non-GAAP operating margin of 9.3% during the quarter was largely in line with expectations and management's guidance. However, with the recent additions of Avaya and AT&T, I would expect margin expansion to remain minimal as RNG invests heavily into further expanding these relationships and accelerating revenue growth.The large revenue beat combined with strong margins led to EPS of $0.22 during the quarter, which was slightly ahead of expectations for $0.19.Source: Company PresentationQ4 revenue was guided to $238-240 million, or 26-27% growth and was slightly above consensus expectations. The company has historically guided a little conservative and I think we could see some upside to these numbers as RNG has gained significant traction in the market after signing their two large deals.For the full year, management raised revenue guidance to $888-890 million, up from $874-877 million. The 32% growth for the full year was raised slightly more than the Q3 beat. Non-GAAP operating margins were left at 9.1-9.2%, which is probably right given the investments the company will look to make in their recent large signings.The stock has moved up nearly 10% since reporting earnings given the recent signings with Avaya and AT&T as well as better than expected earnings. This name just became a little more challenging to value because of the potential for revenue acceleration next year. Investors typically place a higher valuation on companies who can accelerate their revenue growth, something we could see RNG accomplish in 2020.Data by YChartsThe challenge with RNG's valuation compared to other UCaaS and CPaaS competitors is that RNG now trades at a significant premium. One could argue that Twilio (TWLO) or Five9 (FIVN) could be better investments given a more reasonable valuation. At RNG's current level, it is challenging to see their forward revenue multiple expand much more. Rather, the company will need to rely on providing strong revenue growth to drive stock outperformance.Data by YChartsEven when looking at other leading revenue growth software names in the market, RNG's stock is not cheap.With a current market cap of $14.30 billion, cash balance of $580 million and debt of $380 million, the company has a current enterprise value of $14.10 billion. Using management's recently 2019 revenue guidance of $888-890 million, we can start to build out 2020 and 2021 revenue expectations.I think revenue growth will accelerate from the 32% growth expected in 2019 because of both the newly formed partnership with Avaya and the expanded relationship with AT&T. By becoming their exclusive UCaaS providers, RNG has put themselves in a position to rapidly scale, expand, and potentially land new partnerships along the way.Assuming revenue grows 35% in 2020 and 30% in 2021, we could see 2020 revenue of $1.2 billion and 2021 revenue of $1.55 billion. This would imply a 2020 revenue multiple of ~11.8x and a 2021 revenue multiple of ~9.1x. While these multiples are not completely out of line, they are still an expensive price to pay for the expectation of accelerating revenue growth.Yes, I do think the stock will be a winner next year and over the long-term. However, valuation is a little excessive at this point. For investors who are able to ride the wave of higher-valued companies, I think RNG is an excellent option.The stock's valuation could be a weakness if we start to see the market turn sour. Typically ,the higher-valued software names are the first ones to see their valuation pull back quite a bit. If this were to happen, I think investors would quickly put more money into the name on the basis of revenue acceleration and strong partnerships. Even after the recent 10% run up post earnings, I think the stock remains a long-term buy."
4305406,104952,2019-11-11T11:06:43-05:00,RingCentral has had a great FY 2019 so far. Subscription revenues grew atmid-30% YoY as of Q3. Contact Center solution also picked up major traction.Avaya's partnership will strengthen RingCentral's moat going forward. It is a lower-risk way to receive a secular growth exposure from the global UCaaS demand.RingCentral's up-selling and upmarket move as a result of AT&T's and Avaya's partnerships will also boost gross margin and raise switching costs.,"RingCentral (RNG) continues its solid run in FY 2019 with another outperformance in Q3. Aside from beating all the estimates, the company also recorded a $233.35 million of quarterly revenue, which represents a record-high guidance beat by ~5%.We maintain our bullish position in RingCentral. The long-term outlook appears very solid, particularly driven by the company's increasing overall moat strength as a result of its strategic partnerships with AT&T and Avaya. Meanwhile, the demand for UCaaS (Unified Communications-as-a-Service) platform continues to drive adoptions of RingCentral's mid-market and enterprise solutions across some maturing verticals. With a 34% top-line growth YoY across the board, the company has also not shown any signs of slowing down.In the competition landscape, RingCentral competes with other first-time UCaaS players such as 8x8 (NYSE:EGHT) and Vonage (NASDAQ:VG) and also legacy system players such as Comcast (CMCSA) and Cisco (CSCO).Source: G2CrowdGiven the primary nature of telephony communication demand, we believe that there are more untapped opportunities beyond the estimated $61.9 billion UCaaS market. RingCentral's largest market has been the SMB market where the greenfield demand for telephony communication is primarily addressed by UCaaS/cloud-based services.The enterprise market, on the other hand, is also interesting due to the higher vendor lock-in effect that creates a strong moat. As RingCentral penetrates the enterprise market further and increases the adoption of its contact center UCaaS, the company will need to overcome a key obstacle. The bulk of the work in converting enterprise companies into clients will involve a company-wide digital transformation to replace the legacy phone system offering for the most part. In that sense, the cost and operational burden to enter such a market are relatively also high. Consequently, the strategic partnerships with AT&T and Avaya will allow RingCentral to directly access their enterprise client base and to efficiently retain them.The key highlights in Q3 were RingCentral's strategic partnership with Avaya and extended relationship with AT&T. We believe that these enterprise-focused deals are major moat-enhancing moves. The former will allow RingCentral to immediately tap into Avaya's global install base. Consequently, the latter will allow RingCentral to extend its footprints in the domestic enterprise market.With the partnerships, RingCentral will not only diversify its revenue channel but also raise its clients' switching costs by up-selling and moving upmarket. As of Q3, RingCentral generated almost 91% of its subscription revenue from RingCentral Office solution, which targets the regular business needs of an end-to-end VoIP solution. Avaya's dominance in the hosted enterprise contact center market globally also means that RingCentral now has strategic access to Avaya's massive install base where it can directly market its RingCentral cloud-based Contact Center solution.Source: RingCentral's 10-QUltimately, RingCentral will receive instant exposure to the growing UCaaS demand across 180 countries that Avaya has already been in. Historically, RingCentral has always focused on North America, where it generates 95% of its revenue. Considering Avaya's know-how and global presence, we see the partnership as a lower-risk approach to unlock the rest of the $50 billion TAM opportunities abroad and also to diversify RingCentral's revenue geographically.Our view is that the cloud-based VoIP communication is a massively fragmented market where a lot of competitors can coexist with roughly similar offerings given the relatively mid-to-high switching cost. In the long term, we see a potential disruption danger from Zoom (ZM), wherein the company's viral marketing tactics and cross-platform video conferencing technology innovation are superior to most of the competitors we see, including RingCentral. As it stands, Zoom's dominance in video conferencing today will limit RingCentral's potential upside in that area.Compared to its peers in the VoIP communication market, RingCentral's superiority in both gross profit margin and revenue growth have set the stock to trade at a much higher premium with a 16.32 TTM P/S. Its peers, such as Five9 (FIVN) and 8x8, trade at 11.7 and 4.94 TTM P/S respectively.With such a profile, RingCentral is certainly not cheap, though its strong moat and fundamentals should justify the stock as a solid long-term buy. Considering the unchanged TTM P/S of 16.32, outstanding shares of ~82.97 million, and the expected FY 2019 revenue of $889.52 million, we are setting a conservative price target of ~$175 per share by the end of the year."
4285433,104608,2019-08-14T08:08:30-04:00,"RingCentral reported another strong quarter with revenue growing 34% and was well ahead of consensus expectations for 28% growth.Management raised their guidance, now implying ~30% growth for the full year.Valuation continues to trade at a premium and rightfully so given strong revenue growth and outlook.","RingCentral (RNG) unsurprisingly reported another strong quarter with revenue and EPS coming in well ahead of expectations and management's previous guidance. RNG is the leader in the UCaaS market and has rightfully deserved to trade at a premium to the market and near the higher-end of SaaS companies. Even with the stock near an all-time high, growth remains very impressive, with revenue growing 34% during the quarter, well ahead of consensus expectations for ~28% growth.Management also raised their 2019 guidance which now demonstrates revenue growing ~30% compared to consensus expectations for ~28% growth. In addition Q3 revenue guidance was better than expected. With the company firing on all cylinders and continuing their market-leading growth, there are few questions to why the stock is trading near all-time highs including trading up over 10% since reporting earnings.Data by YChartsWhile I was previously a bit neutral on the name post-Q4 earnings, I believe the company has demonstrated two very strong quarters of growth and guidance raises, reinforcing their leadership position and demonstrating why they deserve to continue to trade at a premium valuation. The stock was pretty flat from mid-February to mid-April, but after posting strong Q1 and Q2 earnings, the stock is up nearly 35% since then.Even with the recent run-up, I believe there is still upside remaining in this name. While it might not be the most opportune moment to put new capital to work, investors who current hold this name in their portfolio should not look to trim their position as there is still upside to current prices. RNG's current premium valuation will stay for quite some time and investors should look forward to a successful second half of the year.RNG is one of the leaders in the UCaaS, or Unified Communications as a Service, market. This segment of the market focuses on the transformation of enterprise communication as it evolves from traditional landlines to newer forms of communication. RNG utilizes its cloud-based approach in order to provide flexible and cost-effective services to support an ever-changing workforce. Employees are becoming more mobile, and RNG is capturing the ""bring-your-own device"" market shares.Source: Company PresentationEnterprises have rapidly moved away from traditional landlines and towards newer forms of communication, including online meetings, team collaboration, telephony, and video conferencing. RNG assists with delivering the newer forms of communication, and its cloud-based offerings enable the company to deliver more transparent revenue streams.Source: Company PresentationThe new forms of communication are here to stay. Yes, voice communication is still the dominant form of enterprise communication, but there is an increasing number of new communication forms. For example, RNG held a study surveying 2,000 customers, of which 44% said voice was their main method of communication. However, both team messaging and text followed closely behind. This demonstrates the changing landscape and need for enterprises to develop modern communication platforms.Q2 was a strong quarter with revenue growing 34% to $215 million, well ahead of consensus expectations for ~$205 million. Software subscription revenue continues to impress, growing 33% to $195 million during the quarter and now represents around 90% of total revenue. Guidance for subscription revenue was only for $185.5-187.5 million and the strong beat here demonstrates the underlying strength in the business. The software revenue stream is very valuable for SaaS companies as it is highly predictable and recurring in nature, thus giving investors more confidence in placing a higher revenue multiple on the company.Source: Company PresentationThe company also continues to move up the market and gain more share with larger enterprises. During Q2, there were 30 deals with total contract value reaching the seven-figure total. The larger clients and contracts are a positive sign for more sustainable and recurring revenue growth as larger enterprise revenues are typically stickier and are less likely to leave.Gross margin continue to remain healthy at 76.7% during the quarter and are likely to remain in the high-70's over the long term. Given a majority of their revenue is software based, their operations naturally have a higher gross margin (given software does not have as many cost of goods sold compared to hardware products).Source: Company PresentationIn addition, RNG continues to impress on operating margins, posting an operating margin of 9.5% during the quarter compared to management's previous guidance 8.3-8.5%. Combined with the strong revenue beat, this led to EPS for the quarter coming in at $0.21, ahead of expectations for $0.15-0.17 and consensus expectations for $0.16.Source: Company PresentationManagement also provided guidance for Q3 which includes revenue of $220-222 million (27-28% growth) with subscription revenue of $200-202 million (27-28% growth). This appears to be somewhat conservative given the company's history of exceeding their guidance range and Q2 revenue just coming off a 34% growth quarter. Operating margins are expected to be 9.2-9.4% leading to EPS of $0.18-0.20.Management also raised their guidance for the full year to include revenue of $874-877 million (30% growth) compared to their previous guidance for $862-866 million (28-29%). Remember to start the year, management originally guided to 26-28% growth. With Q2 revenue coming in ~$10 million ahead of their previous guidance, management's recent 2019 guidance raise is pretty similar to the amount they just beat by, implying they could be leaving a little conservatism in their guidance.While the recent run-up has led to the stock trading near all-time highs, valuation is not completely unreasonable. The company continues to report revenue growth of 30%+ and even with the recently raised guidance, it appears conservative and beatable for the rest of the year.RNG currently trades ~12.5x forward revenue, a considerable premium to some other UCaaS and CPaaS competitors such as 8x8 (EGHT) and Vonage (VG). However, RNG is moving closer to Twilio's (TWLO) valuation and rightfully so. Their premium revenue growth and history of beating and raising guidance warrants a premium valuation.Data by YChartsRNG's current market cap is ~$11.5 billion and with a net cash balance of ~$200 million, the company has an enterprise value of ~$11.3 billion. Management's recently raised revenue guidance of $874-877 million now represents ~30% growth for the year. I believe the company will be able to beat this given they just beat Q2 revenue guidance by ~$10 million and they could end the year with revenue closer to $900 million.Assuming revenue decelerates a little bit in 2020 to ~28% growth, we could see 2020 revenue of $1.15 billion. Using the current $11.3 billion enterprise, this implies a valuation of under 10x revenue.Data by YChartsWhile 10x forward revenue is not cheap by any means, there are several software companies throughout the market that trade at higher valuations given similar revenue growth and margin profiles. While I am not advocating RNG should trade at 20x forward revenue, I believe there is some room for their multiple to expand if the company is able to consistently produce impressive revenue growth and raise guidance along the way.Given the stock is near all-time highs, this might not be the best moment to build a new position in the name, however, long-term investors should look to add on any future dips and hold onto the name. While it seems tempting to sell and realize some profits in this name, I believe guidance remains somewhat conservative and beatable for the rest of the year. Another impressive quarter and beat and raise could lead to the stock reaching $160 by the end of the year.Risks to RNG include increased competition from both EGHT and VG. As the competitors continue to grow in size, they will begin to compete for a similar customer cohort which may cause RNG's revenue growth to decelerate quicker than anticipated. In addition, being a highly valued name based on forward revenues, it is subject to large corrections in the market. We have seen the tech market as a whole self-correct over time as revenue multiple continues to reach new levels."
