article_id,author_id,publish_on,summary,content
4247678,104608,2019-03-11T05:50:44-04:00,"RingCentral remains the leader in the UCaaS market and continues to trade at a premium valuation, near all-time highs.Q4 revenue and earnings came in ahead of consensus and management's expectations, sending shares up over the next few days.2019 guidance was well above consensus estimates, yet Q1 guidance seems conservative and beatable.Valuation has pulled back a bit from pre-correction highs, but tech valuations in general have remained suppressed compared to late 2018 highs.","RingCentral (RNG) remains the leader in the UCaaS market and has earned its premium valuation. I have previously discussed RNG, and in August, I noted investors should look to take a profit, and then in November, I recommended picking up some shares at a more reasonable valuation. As you can see from the chart below, post-Q2 earnings, the stock was at a high point.After watching the stock fall in late September and October, valuation receded quite a bit and made it very tempting to purchase more shares. After a very strong beat in Q4 and encouraging guidance, the stock popped again and reached its all-time highs.Q4 revenue came in well above both consensus expectations and management's quarterly guidance. Management also provided 2019 guidance above consensus estimates and now appears to be on pace to overachieve its $1 billion 2020 revenue goal. The stock remains a winner over the past year, similar to its competitors in the UCaaS market, notably 8x8 (EGHT) and Vonage (VG).Data by YChartsRNG popped over 6% following the Q4 earnings report and 2019 guidance. However, after quickly reaching the all-time highs, the stock seems to have hit a top and has dropped a bit since. For now, it seems like expectations are fully priced in, and it could be challenging to find a ton of upside from here. However, over the longer term, RNG will continue to perform well, and we could continue to see the stock returns demonstrate outperformance.RNG is one of the leaders in the UCaaS, or Unified Communications as a Service, market. This segment of the market focuses on the transformation of enterprise communication as it evolves from traditional landlines to newer forms of communication. RNG utilizes its cloud-based approach in order to provide flexible and cost-effective services to support an ever-changing workforce. Employees are becoming more mobile, and RNG is capturing the ""bring-your-own device"" market shares.Source: Company PresentationEnterprises have rapidly moved away from traditional landlines and towards newer forms of communication, including online meetings, team collaboration, telephony, and video conferencing. RNG assists with delivering the newer forms of communication, and its cloud-based offerings enable the company to deliver more transparent revenue streams.Source: Company PresentationThe new forms of communication are here to stay. Yes, voice communication is still the dominant form of enterprise communication, but there is an increasing number of new communication forms. For example, RNG held a study surveying 2,000 customers, of which 44% said voice was their main method of communication. However, both team messaging and text followed closely behind. This demonstrates the changing landscape and need for enterprises to develop modern communication platforms.Q4 was another very strong quarter for RNG, delivering revenue growth of 34% and subscription revenue growth of 38% excluding AT&T (NYSE:T). Revenue also beat consensus estimates of ~$182 million. This is very impressive considering RNG is the largest player in the UCaaS market ($189 million in Q4 revenue). It primarily competes with other UCaaS players such as EGHT and VG.RNG continues to move up the market and enter into the enterprise landscape. In fact, the company closed a record number of seven-figure total contract value deals this past quarter, which included its first eight-figure deal. This is a great sign for RNG, and the enterprise market tends to be a bit stickier with higher recurring revenue and larger contract values.Source: Company PresentationGross margin expanded ~60bps to 77.5% compared to 76.9% in the year-ago period. Gross margins are likely to remain in the high-70s range even as the company's growth eventually decelerates. This is because of the cloud-based and subscription revenue streams. This type of revenue has significantly lower costs compared to the hardware counterparts.Source: Company PresentationDuring Q4, RNG posted operating margins of 9.2%, which were significantly ahead of management's guidance of 7.9-8.1%, ultimately leading to an EPS of $0.23. EPS was ahead of management's estimate for $0.17-0.19 and above consensus expectations for $0.18.Source: Company PresentationManagement provided guidance for Q1 which included revenue of $191.5-194.5 million, representing 27-29% growth. This seems somewhat conservative given the company's 30%+ growth rate each quarter in 2018 and Q4's revenue growth of 34%. However, management's Q1 guidance came in above consensus estimates for 23-24% growth.What's impressive about the Q1 guidance is the software subscription growth of 28-30%. Although the full-year guidance is 26-28% (implying deceleration throughout the year), management remains confident in the long-term growth potential of software subscriptions.For the full year, management guided to revenue of $847-859 million, representing growth of 26-28%, and software subscription revenue of $775-785 million, representing growth of 26-28%. Full-year revenue guidance came in well ahead of consensus expectations for $823 million.The strong Q4 results reinforced RNG's premium valuation and justify why it is currently trading near all-time highs. The company's continued 30%+ revenue growth and even higher software subscription revenue growth demonstrate its ability to retain market leadership and its ability to continue to take market share.Currently, RNG trades at nearly 9.5x forward revenues, a significant premium to competitors in the UCaaS and CPaaS industry. Revenue growth is above a majority of its competitors, and the company does have a significant market share, however, which warrants the premium valuation.Data by YChartsOn Friday, RNG's market cap was ~$8.3 billion. With a net cash balance of ~$200 million, the company had an enterprise value of ~$8.1 billion as of Friday's closing price of $101.89.Management guided to subscription revenue of $775-785 million for FY19, representing a growth rate of 26-28%. To be conservative, I will assume RNG does not beat and raise throughout the year, but instead just comes in at the high end of guidance. Assuming $785 million in FY19 subscription revenue and deceleration to 20% growth in FY20 (which could be a terrible guidance), we could see subscription revenue of ~$945 million.Doing the same thing for total revenue, management guided to $847-859 million, also representing a 26-28% growth. Assuming this decelerates to 20% growth in FY20, we could see RNG's 2020 revenue of $1,025 million, eclipsing management's longer-term 2020 revenue target of $1 billion.Using total revenue of $1,025 million and Friday's enterprise value of ~$8.1 billion, RNG is currently trading at just under 8x revenue. If investors continue to believe RNG should trade at a premium, which I believe is true, we could see the company's multiple remain around 9x at the end of 2019, thus there could still be some upside remaining throughout the year.Despite the 2020 revenue multiple slowly reaching 9x as the year progresses, management's 2019 guidance seems somewhat conservative. If RNG is able to beat and raise revenue, just like it has in the past, we could see the stock price continue to outperform the market.Risks to RNG include increased competition from both EGHT and VG. As the competitors continue to grow in size, they will begin to compete for a similar customer cohort which may cause RNG's revenue growth to decelerate quicker than anticipated. In addition, being a highly valued name based on forward revenues, it is subject to large corrections in the market. We have seen the tech market as a whole self-correct over time as revenue multiple continues to reach new levels."
4223121,104608,2018-11-19T00:33:19-05:00,"RingCentral has corrected ~20% over the past few weeks, much like many other premium valued tech names.Strong Q3 earnings gave management the confidence to raise full-year guidance.Conservative 2019 subscription revenue guidance results in 7x multiple, a reasonable price to pay for this high growth name.","RingCentral (RNG) remains the leader in the UCaaS market and has earned their premium valuation. I previously wrote an article noting valuation appeared to be a bit stretched, given the stock was trading near all-time highs. Now down over 20% since my article, I think valuation has stepped down to more realistic levels and a strong Q3 earnings report reinforces the long-term thesis.RNG reported subscription revenue growing 38% in Q3, accelerating from 34% growth last year and even accelerated from 32% last quarter. The stock remains a winner over the past year, similar to their competitors in the UCaaS market, notably 8x8 (EGHT) and Vonage (VG).RNG data by YChartsRNG popped over 15% the days following their strong Q3 earnings report. However, market turbulence and consistent uncertainty about where the global economy is going have caused the tech sector to underperform as of recently. RNG has not been subject to any different treatment, with the stock closing on Friday at similar levels prior to their Q3 report.RNG is one of the leaders in the UCaaS market or Unified Communications as a Service. This segment of the market focuses on the transformation of enterprise communication as it evolves from traditional landlines to newer forms of communication. RNG utilizes their cloud-based approach in order to provide flexible and cost-effective services to support an ever-changing workforce. Employees are becoming more mobile and RNG is capturing the ""bring-your-own device"" market shares.Source: Company PresentationEnterprises have rapidly moved away from traditional landlines and moved towards newer forms of communication, including online meetings, team collaboration, telephony and video conferencing. RNG assists with delivering the newer forms of communication and their cloud-based offerings enable them to deliver more transparent revenue streams.Source: Company PresentationThe new forms of communication are here to stay. Yes, voice communication is still the dominant form of enterprise communication, but there is an increasing number of communication forms. For example, RNG held a study of 2,000 customers and 44% said voice was their main method of communication. However, both team messaging and text followed closely behind. This demonstrates the changing landscape and need for enterprises to develop modern communication platforms.Q3 was another very strong quarter for RNG, delivering revenue growth of 33% and subscription revenue growth of 38% excluding AT&T (NYSE:T). This is very impressive considering RNG is the largest player in the UCaaS market ($174 million in Q3 revenue). This compares to other leading UCaaS players such as EGHT ($81 million in FQ2) and VG.Source: Company PresentationGross margin expanded ~100bps to 77%, compared to 76% last year and 77% last quarter. Gross margins are likely to remain in the high-70's range even as the company's growth eventually decelerates. This is because of their cloud-based and subscription revenue streams. This type of revenue has significantly lower costs compared to their hardware counterparts.Source: Company PresentationManagement also raised their full-year guidance by $13 million at the midpoint, resulting in a 32% revenue growth range (compared to 29-30% previous growth range). Subscription revenue was raised by $9.5 million at the midpoint, now representing a growth of 30-31%, slightly below the 32% growth seen in Q3. Core subscription revenue, which excludes AT&T, is now guided to 36%, up from 34-35%. This shows that the AT&T revenue stream is still a drag on the company; however, revenue growth remains very healthy.The strong Q3 results reinforced RNG's premium valuation and the 20% pullback from recent highs provides investors a great opportunity to build a position at this level. The 30%+ revenue growth and impressive margin targets reinforce the premium valuation compared to the broader software communications market.Currently, RNG trades at nearly 9x forward revenues, a significant premium to competitors in the UCaaS and CPaaS industry. RNG's revenue growth is above a majority of these competitors and they do have a significant market share, however, which warrants the premium valuation.RNG EV to Revenues (Forward) data by YChartsWhen looking at forward revenue compared to their closest competitors, EGHT and VG, RNG trades at a 4-5 turn premium. This is a significant premium considering RNG's top-line growth in Q3 (33%) easily beat EGHT (19%) and VG (~15%) when it came to direct UCaaS revenue (VG competes in the UCaaS, UPaaS, and CCaaS markets).Google Finance reported RNG's market cap on Friday at $6.14 billion. With a net cash balance of ~$215 million, RNG had an enterprise value of $5.9 billion as of Friday's closing price of $76.40.Management guided subscription revenue to $606-608 million for F18, representing a growth rate of 30-31%. Let's assume for F19, the growth slightly decelerates to 25%, implying subscription revenue of ~$760 million. Total revenue is guided to $664-667 million, representing a growth rate of 32%. Again, let's assume this growth rate decelerates to 25%, which would imply total revenue of ~$832 million.Using management's subscription and total revenue guidance and my implied F19 25% growth rate, RNG trades at a F19 revenue multiple of 7.8x at the midpoint (subscription revenue only) and 7x (total revenue). I believe a ~8x F19 revenue multiple is warranted because of RNG's above industry-average revenue growth and significantly larger market share.RNGs 20%+ correction over the past few weeks has made valuation a bit more tempting. With revenue growth accelerating in Q3, margins remaining healthy, and management remaining optimistic about future growth, now could be a great time to build a position in this name. Trading ~$75, RNG provides investors a great long-term investment with the ability to buy on any dips related to the broader market volatility.Risks to RNG include increased competition from both EGHT and VG. As the competitors continue to grow in size, they will begin to compete for a similar customer cohort which may cause RNG's revenue growth to decelerate quicker than anticipated. In addition, being a highly valued name based on forward revenues, this name is subject to large corrections in the market. We have seen the tech market as a whole self-correct over time as revenue multiple continues to reach new levels."
4186471,20521,2018-07-10T19:52:44-04:00,"RingCentral has successfully leveraged the growing opportunity within SaaS.Last year, the market was abuzz with rumors that tech giants including Google and Amazon were interested in acquiring RingCentral for its services.So far, RingCentral has managed to stay independent.","According to a MarketResearch report, the global mobile VoIP market is a fast growing one. According to the researcher, the low cost of calls offered by VoIP providers are driving growth in the industry. Billion-Dollar Unicorn RingCentral (NYSE:RNG) offers these SaaS-based communication services to small business. Recent results suggest that it's doing rather well so far.San Mateo, California,-based RingCentral was founded in 2003 by Vlad Shmunis and Vlad Vendrow. It offers hosted phone systems through its flagship products RingCentral Office, RingCentral Mobile, and RingCentral Internet Fax. Its core offering RingCentral Office is a VoIP service that enables businesses to connect teams in different locations. The service comes with advanced features such as multi-extension business phone systems, fax service, unlimited calling, and pre-configured phones. Its Mobile offering provides customers with access to a single local or toll-free number that connects their existing phone lines as virtual extensions. It also offers additional services such as an Internet fax product, a virtual Meeting room, and a collaborative platform called Glip. I had met Vlad Shumnis a few years ago when he explained how the business grew into becoming a ""business-in-a-box idea.""RingCentral earns revenues through monthly subscriptions. For its recently reported first quarter, revenues grew 34% over the year to $150 million. Revenues were ahead of market expectations of $145.4 million. EPS of $0.16 grew 77% over the year and was ahead of the Street's forecast of $0.12 for the quarter.By segment, software subscription revenues grew 32% over the year to $136.96 million. Revenues from other sources more than doubled to $13.3 million.For the current quarter, RingCentral expects revenues of $154.5-$156.5 million with an EPS of $0.14-$0.16. The Street had forecast revenues of $155.65 million with an EPS of $0.15. It expects to end the year with revenues of $638-$647 million and an EPS of $0.61-$0.65. The market was looking for revenues of $642.8 million with an EPS of $0.62.RingCentral was privately held until 2013. It had raised $45 million from investors prior to listing. Its initial investors included Akkadian Ventures, Hermes Growth Partners, RTP Ventures, Scale Venture Partners, Khosla Ventures, Silicon Valley Bank, DAG Ventures, Cisco, and Sequoia Capital. In 2013, it went public by raising $97.5 million in an IPO that valued it at $790 million.RingCentral continues to expand its market presence through additional offerings. Earlier this quarter, it announced the launch of RingCentral Collaborative Contact Center solution, an offering that transforms the way organizations manage customer engagement. The new service integrates contact center features with team messaging, thus enabling communication and collaboration across agents and supervisors on a real-time basis to resolve customer issues efficiently.It also announced the release of RingCentral Pulse, another innovative solution that provides intelligent bots that monitor critical call center metrics in real time. The offering is able to send alerts and notifications automatically to key stakeholders within the team using RingCentral Glip. The service helps improve quality of service offered by organizations to their customers.Finally, it launched RingCentral Collaborative Meetings, a virtual meeting solution that provides integrated team messaging, online meetings, video conferencing, screen sharing, and task management. The service is available on a standalone basis as well as a part of the RingCentral Office solution.Its innovative products have helped RingCentral achieve the leading position in the 2018 IHS Markit UCaaS Leadership Scorecard released earlier this year. Last year, Synergy Research also rated RingCentral as the worldwide market share leader in both revenues and subscriber seats, significantly ahead of its competitors 88, Shoretel, and Vonage Business.RingCentral attributes its success to its open collaborative platform that helps organizations empower their global and distributed workforce to work anywhere, anytime, and on any device. The company believes that the rise of cloud-based solutions will lead to the demise of legacy providers like Avaya and help RingCentral grow to a $1 billion business by 2020.RingCentral has successfully leveraged the growing opportunity within SaaS. Gartner had ranked RingCentral's offerings the most complete in the industry with its execution matched only by Verizon (NYSE:VZ). Last year, the market was abuzz with rumors that tech giants including Google (NASDAQ:GOOG) (NASDAQ:GOOGL) and Amazon (NASDAQ:AMZN) were interested in acquiring RingCentral for its services. So far, RingCentral has managed to stay independent. I would like to know how does the company plan to expand in the future? What additional services is it looking to add, and what players is it looking to acquire to add those capabilities?RingCentral had priced its shares at $13 apiece for the listing. Today, its shares are trading at $74.95 with a market capitalization of $5.9 billion. It had touched a 52-week high of $81.20 earlier last month. The stock has been climbing steadily from the 52-week low low of $34.10 nearly a year ago."
3644786,91945,2015-11-04T13:03:16-05:00,"RingCentral has become the leader in cloud-based business communication.It has doubled its revenue since its IPO, and margins have expanded as well.While the company's share price is up over 100% in the last year, it looks to have a lot more room to expand as management further improves operations.","RingCentral (NYSE:RNG) has grown operations tremendously in its short tenure as a public company, benefiting its share price greatly. In the third quarter, the company continued to expand margins and grow market share as demand for its mobile-centric communications software increases. With optimistic forward guidance, its share price could further appreciate in coming months.In the most recent quarter, revenues came in at $76.8 million, topping estimates for $74.6 million. Furthermore, the company reported a net loss of $6.3 million, also exceeding estimates that called for as much as a $25 million loss.RingCentral experienced total organic revenue growth of 35% annually, with its Office business, optimized towards small businesses, growing 48% to over $220 million in annual revenue, according to management.The company specializes in mobile-centric software that intends to replace the way businesses communicate. It utilizes cloud-based technologies, and is currently the leading cloud communications platform on the market today.Its software is unique in the sense that it attempts to integrate core-communication like voice, text, and audio into its platform so businesses can operate remotely and stay equally as connected as they would be operating in the same place at once. In essence, it is trying to solve the challenges that modern companies face, and by looking at the earnings results, it is catching on.RingCentral now has users in over 140 countries, with local calling numbers available in as many as 70 countries. Additionally, large enterprises have chosen the company to handle all of their global needs.For example, in its most recent earnings call, management stated that Medallia, a leading provider of customer experience management solutions, is using RingCentral in its Palo Alto, New York, Buenos Aires, London, Paris, and Hong Kong offices. The platform has proven effective on a global scale, and testimonial will only further expansion.Similarly, RingCentral has great relationships with service providers AT&T (NYSE:T), BT (NYSE:BT), and TELUS (NYSE:TU). RingCentral is the only business communications company with major carriers reselling its platform.Since late 2013, revenues have nearly doubled. This is accompanied by operating margins that expanded by 1,200 basis points on a trailing twelve month measure over that time. These results signal two things. First, demand for the product is evident, and with management's innovative thinking, RingCentral has the ability to continue to capture market share.Additionally, the company is scaling nicely, as margins are improving alongside higher growth. Management claims that the company will soon operate at a profit on a consistent basis, which will only further benefit shareholders.RingCentral is obviously only in its infancy, but it operates in a market that is sure to grow in coming years. The ways businesses operate and communicate in 2015 are much different than at the turn of the century, and communication is still ever-evolving. RingCentral has managed to become the market leader in cloud-based business communication, and with further innovation, it looks to remain in its current status.The company's share price is up close to 100% over the last year, but improvements have been fueled by growing operations. There looks to be a lot of value left in this company, meaning it could double again in the next year if management keeps up its efficiency. RingCentral trades at a market cap just over $1 billion, and presents an attractive buying opportunity currently, offering a lot of growth as cloud-based communication is further adopted by global businesses."
