article_id,author_id,publish_on,summary,content
4375467,35401,2020-09-21T10:49:22-04:00,SharpSpring is a fast growing SaaS company.SHSP trades at a low multiple of revenue at 3x.Peer HubSpot trades at 12x revenue and is growing at the same rate.,"SharpSpring (SHSP) is a SaaS software company displaying fast revenue growth trading at a low Enterprise Value / Revenue multiple of 3x on 2021E sales. Its closest competitor is HubSpot (HUBS) that trades at 12x 2021E sales with approximately the same revenue growth rate as SharpSpring. Granted HubSpot has more scale and is making money, but SharpSpring has higher growth potential as a small firm and a clear path to profitability.SharpSpring is a cloud-based marketing technology company. The SharpSpring platform is designed to improve the way that businesses communicate with their prospects and customers to increase sales. The Company's flagship marketing automation platform uses advanced features such as web tracking, lead scoring and automated workflow to help businesses deliver the right message to the right customer at the right time. The SharpSpring platform is designed and built as a Software as a Service (or SaaS) offering. The company provides its products on a subscription basis, with additional fees charged if specified volume limits are exceeded by its customers.SharpSpring primarily sells to small to mid-sized digital marketing agencies which then resell its products to their end customers. The company sells 3-packs and 10-packs which allow its digital marketing agency customers to resell to 3 and 10 end customers respectively. SharpSpring is the low-price leader in the industry and its products sell for roughly 1/10 the price of HubSpot or Marketo, another large marketing automation vendor (owned by Adobe (NASDAQ:ADBE)). For a while, SHSP was catching up in terms of functionality as SharpSpring is only 6 years old compared to HubSpot which is 18 years old. At this point, SharpSpring has essentially caught up product-wise and this is confirmed by high third-party ratings of its software. The digital marketing agency market is large with an estimated 100,000 English speaking digital marketing agencies in the world. SharpSpring has about 2,000 of these currently and HubSpot has a similar number, as well. SharpSpring also sells directly to some enterprises with about 500 customers of this type currently.SharpSpring's customers are by and large small businesses, many of which have suffered from the pandemic. The company had a 50% revenue growth target for 2020 coming into the year, but this has declined to 30% due to the COVID-19 situation. Organically, the company should have 20% growth this year, the remaining coming from an acquisition of Perfect Audience in Q4 2019. The Perfect Audience platform is a product and service offering to small businesses for display retargeting. Perfect Audience is designed for rapid deployment and offers customers an easy-to-use interface to implement and optimize campaigns across all major networks and devices.The turmoil in the Small and Medium sized business (""SMB"") segment can be seen in some of SharpSpring's metrics. Net Dollar Retention Rate, which includes churn and upsell, dipped to 92% in the 2nd quarter from a 99% rate last year. New customers added to the platform came in at 276 versus 321 in Q1 and 290 last year. These customers were a little bigger than usual so annualized recurring revenue (""ARR"") did not suffer as much as its retention metrics.HubSpot also serves this market and its revenue growth slowed from 31% in Q1 2020 to 25% in Q2 and is predicted to slow further to 21% in Q3 and 17% in Q4. Analysts forecast revenue growth to be 21% in 2021, very close to the 20% forecast for SharpSpring.So where is SharpSpring on profitability? The company decreased its operating loss last quarter to $900,000 from a loss of $2.5 million in the previous quarter. This was caused by a significant uptick in gross margin to 74% from 66% last quarter and 71% last year. In addition, the company cut costs in sales and marketing (less travel expenses, a common theme in many companies) and in research and development (due to the relative competition of its product capability). SharpSpring believes that a) the gross margin improvement is sustainable and b) they can operate on a leaner model in the future. There is tremendous operating leverage in the business as it has high gross margins, it is growing very fast, and it has fully built out its product set (after 6 years of development).SharpSpring's peer group of SaaS companies trades at much higher multiples than it does. Most SaaS companies trade at 6 - 8x sales and above. As mentioned earlier, HUBS trades at 12x sales. A 12x sales multiple on SharpSpring's 2021 sales of $36 million would imply a $442 million market cap for SHSP or $38 per share, a near quadruple from its current $10.50 share price. At a more pedestrian 8x sales, SHSP would trade at $26 per share, a 150% uplift from current levels. While the company is currently slightly unprofitable today, 20% operating margins in a few years are not out of the question with 20%+ revenue growth, 74% gross margins, and tight operating expense control.A takeover by a larger entity is also a possible outcome. There have been several takeovers in the space, the largest recent one being Adobe's purchase of Marketo. As this category of software has multiple products and facets, it is very difficult for new entrants to get into the space. It would be much easier for a larger entity to make a bite-sized purchase of SharpSpring than to attempt to build a comparable product.What risks are there in this situation? The first is a non-obvious one, as the company is located in Gainesville, Florida, it is difficult to attract seasoned talent. New employees out of the University of Florida are easy to come by, but it is difficult to get a seasoned vet to relocate there. This risk may be tempered by the fact that most people are working from home anyway so it may not be necessary to relocate at all. Second, SharpSpring is a young company with a new customer base which leads to higher churn than a more established group of customers. As time goes by, this will become a smaller issue as well. Finally, SharpSpring sells to the SMB market which is in a tough spot right now. Many small businesses are closing or tightening their belts due to the pandemic. The good thing for SharpSpring is that its software is the engine that drives sales at these companies, and will be one of the last things that go in a cost cutting exercise. Finally, liquidity is currently somewhat of an issue for institutional buyers as SHSP only trades 85,000 shares a day on average. However, if I am right about the rerating of this stock, then liquidity will improve dramatically, perhaps not to the extent of APPS which went from trading 100,000 shares a day at $1.80 to trading 7 million shares a day at $32, but a large increase in its own right."
4372722,35181,2020-09-04T19:57:05-04:00,"Strong performance during the pandemic with Q2 2020 YoY revenue growth of +31.7% while gross profit increased 39%.This company has $15 million in cash and should be ample to tide it through pandemic and recession.The stock is one of the most undervalued on a relative basis.Despite the positive factors, the very negative free cash flow margin of -36% makes investing in this company a difficult proposition.","SharpSpring, Inc. (NASDAQ:SHSP) is a small player in SaaS-based marketing automation tools, allowing customers to nurture potential customers from an early stage of contact until they become qualified sales leads. The company competes against much larger players such as HubSpot (HUBS) and Salesforce.com (CRM).There are several things that I like about SharpSpring, including its performance so far during the pandemic, the improved gross margin, and its very low stock valuation. The company had a very good YoY Q2 2020 revenue growth of 31.7% in a difficult economic environment. The revenue growth does include results from recently acquired Perfect Audience, an online advertising retargeting company.The company management appears to be committed to improving margins, and in the most recent quarter, the gross profit margin jumped 6% from 66% to 74%, primarily as a result of increased product price increase, expanding customer base, and the acquisition of Perfect Audience.(Source: Portfolio123)SharpSpring ended the quarter with more than $15 million in cash and cash equivalents, which should be enough for the company to survive the pandemic and recession and still be in good shape. The strong cash position is a result of the combination of reduced spending, 10% salary cuts, bonus suspensions, drawing down $1.9 million on its line of credit, $1.6 million tax refund, and a $3.4 million loan from the Small Business Association under the SBA Paycheck Protection Loan program.The plot below illustrates how SharpSpring stacks up against the other stocks on a relative basis based on forward EV/Sales versus forward revenue growth. Note: Please refer to a recent article for more information on the scatter plot-relative valuation technique.(Source: Portfolio123/private software)SharpSpring is situated well below the best fit line on the scatter plot, suggesting that the stock is extremely undervalued on a relative basis relative to its peers based on expected future revenue growth and its forward sales multiple.The industry metric that is often used for software companies is the Rule of 40. It is an industry rule of thumb that attempts to help companies ascertain how to balance growth and profitability. For a further description of the rule and calculation, please refer to one of my previous articles.(Source: Portfolio123/MS Paint)In SharpSpring's case:Revenue Growth + FCF margin = 25% - 36% = -11%SharpSpring fails miserably on the Rule of 40, suggesting that it does not have a healthy balance between growth and profitability. Note that this metric is calculated on a trailing-twelve-month basis. The extremely negative free cash flow margin of -36% makes investing in this company a non-starter for me.This level of negative free cash flow ultimately requires the company to refuel on a regular basis, either via share dilution or increased debts. In SharpSpring’s case, it has been diluting shares over the years.(Source: Portfolio123)The figure below illustrates why share dilution is not a good thing. The three charts show sales divided by the number of diluted shares for SharpSpring, HubSpot, and Salesforce.com over the last five years.From the above charts, you can see that SharpSpring’s competitors have consistently grown sales per diluted share over the years, while SharpSpring has not. This lack of growth is not beneficial to shareholders.Share dilution traces back to negative free cash flow, which currently sits at -36%. Let’s keep in mind that this is a very small company, and some “chunkiness” in results should be expected. But the negative free cash flow can’t be explained away by the size of the company. The phenomenon has persisted for many years and has to be built into the company management style. SharpSpring needs to do better if it wants my vote of confidence.SharpSpring is a small player in SaaS-based automated marketing tools, allowing companies to engage with customers at an early stage in their relationship. The idea is to nurture the company/customer relationship to the point where it becomes a qualified sales lead.SharpSpring has a lot of things going for it, including great revenue growth in a difficult economic environment, a large pool of cash that will allow it to survive the pandemic and recession, and a very low share price valuation.Despite these positive attributes, the company has one glaring issue, and that is its extremely negative free cash flow margin of -36%. This causes it to fail the Rule of 40 software metric by a wide margin and, ultimately, has translated into share dilution. Despite fairly substantial sales growth, the sales growth per diluted share has been stagnant. Therefore, I am providing a neutral rating for this company. I look forward to the day when SharpSpring takes positive action in improving its free cash flow."
4350565,104952,2020-05-28T11:53:21-04:00,"Despite market validation, the overall growth opportunity seems unattractive.As a $20 million-a-year SaaS CRM business, SharpSpring's 17% recurring revenue growth in 2019 is below par.Growth may not be sustainable. The business burned through ~3 million and 8 million of OCF in the last two years, which were 20% and 36% of revenues consecutively.","In our view, SharpSpring (SHSP) has a valid SaaS offering that fits into its agency niche marketing automation CRM market. However, we see limited upside potential in the business due to the market saturation, competition, and the scalability of its go-to-market. Despite our long-term bullish view on the SaaS CRM market in general, we found it difficult to be bullish on SharpSpring.The company’s unique value propositions are its agency-focused business and the low price of its offering. As we have mentioned, these propositions seem to be valid for now. Overall revenue growth has been steady at 20% to 25% in recent times as the company continues to land new clients.(source: the company’s Q1 2020 presentation)Moreover, with the company confidently expecting revenue of $31 million at the end of the year, growth would accelerate to ~37%. More recently, the company also acquired PerfectAudience, an online advertising retargeting company formerly owned by Marin Software (MRIN). The acquisition presents some strategic values, considering the company’s large client base of digital marketing agencies. An enriched bundled marketing automation and retargeting offering, for instance, will allow the company to increase its pricing. Indeed, the company already increased its expansion price by ~37% to $275 per month in Q1, without affecting its growth.(source: perfectaudience.com)Furthermore, there are some immediate competitive insights the company can get out of the acquisition, considering PerfectAudience’s existing relationships with HubSpot (HUBS), the company’s fiercest competitor in its niche to-date. For instance, SharpSpring now has strategic access to PerfectAudience’s customers that are also HubSpot clients.The marketing automation, which is part of the greater CRM space, is a highly competitive and saturated space. As a result, while the growth has been steady, the limited upside potential in the digital marketing agency niche industry concerns us.(source: company’s Q1 earnings call slide)Many successful players in the CRM/marketing automation space, such as Pardot or Marketo, have historically tapped into high-valued verticals such as the mid-market and the enterprises while maintaining mainstream adoptions across industries. Based on these success stories, a CRM/marketing automation appears to be a market where the players do not differentiate themselves by building industry-specific offerings to develop their niches. In some cases, they also either had disruptive offerings leveraging new technologies such as AI/machine learning or highly efficient go-to-market approaches, which ended up driving the acquisition premiums. Aside from the diversification of the client base, these strategies often resulted in accelerated, expansionary growth.(source: company’s Q1 earnings call slide)We do not see these differentiations in SharpSpring. We believe that its agency-focused offering is replaceable by that of the niche market leader HubSpot. Furthermore, its move towards a higher-touch go-to-market model will potentially be irrelevant to its price leadership and SMB strategies. Even at present, go-to-market has not been efficient. Gross margin is below par at ~67%, while many strong SaaS companies we covered have at least +80% gross margins. (source: company’s Q1 earnings call slide)Consequently, while SharpSpring has steady growth, it is relatively lackluster compared to other SaaS players within the context of the market, scale, and size. For instance, SharpSpring grew its revenue by ~25% last year, though the growth in the recurring portion was merely 17%. HubSpot, on the other hand, still records +30% growth while having a much larger operation.(source: stockrow)At the moment, we are also uncertain whether the growth will be sustainable. Operating losses widened by 46% last year alone with no visible path to cash-flow profitability. Moreover, to support its cash-burning operations, the company had raised over $23 million in the last two years at the expense of sizable dilutions for shareholders.SharpSpring’s positioning and offering, while valid, do not present an attractive and sustainable growth opportunity. The business has a lackluster growth, profitability, and cash flow generation. A similar +$20 million-a-year SaaS business in the marketing/CRM sector, Buffer, for instance, has been growing strong and self-sustaining for years while consistently achieving over 25% EBITDA margin. Due to the questionable upside potential and moderate fundamentals, SharpSpring looks risky enough despite the attractive ~4.5x P/S. As it stands, we found it difficult to be bullish on the stock."
4326157,35181,2020-02-21T11:25:44-05:00,"SharpSpring has made a small improvement to the net dollar retention rate metric, but it is still very substandard.Free cash flow margin is atrocious.Revenue growth is slowing noticeably.Disruptive business model has its benefits but profitability isn't one of them.","In my previous article on SharpSpring, Inc. (SHSP), I was not impressed by the company's underlying fundamentals.Today, I am back to review SharpSpring's progress in the areas that I identified as being underwhelming, specifically net dollar retention rate and SG&A expenses.In reviewing the latest quarterly results, it appears that the company has made a little progress on the net dollar retention rate, but it is still very substandard. There has been no progress in reducing SG&A expenses. And also of concern is the slowing revenue growth.In a side-by-side comparison with HubSpot (NYSE:HUBS), its main competitor, HubSpot wins hands down. Therefore, I am retaining my neutral rating for SharpSpring.SharpSpring has recognized for some time that customer retention is a problem. For instance, in the 2019 Q1 earnings call, management stated:Despite ongoing efforts to improve net retention, very limited progress has been made. It was reported in the 2019 Q3 earnings call that the quarterly net dollar retention rate was approximately 96% as opposed to the 94% reported in the previous quarter. Now keep in mind that this is a quarterly figure. If I understand this correctly, the annualized figure would be in the low 80% range. Compare this statistic to HubSpot, which has an annualized dollar retention rate of 100.7%.(Source: HubSpot)Commenters in my previous article were quick to point out that HubSpot sells directly to businesses while SharpSpring focuses on Agencies that act as a middleman. Fair enough, but SharpSpring does sell directly to businesses and has found them to have the highest attrition.I think it is fair to say that SharpSpring has a leaky bucket that needs to be fixed.In SharpSpring's latest Investor Presentation, the company management presents a very high revenue growth picture of 52% CAGR from 2016 to 2019.(Source: SharpSpring)This is a very misleading statistic as revenue growth in 2015, immediately after SharpSpring was acquired in an acquisition, was well in excess of 100%. In Q3 of 2019, revenue growth has dropped to 17%.HubSpot, on the other hand, grew revenue at a rate of 50+% in 2015 and has retained a growth rate in excess of 30% in 2020.(Source: Portfolio123)Another area of major concern is the level of cash burn. I measure cash burn using the SG&A expense margin. For SharpSpring, the SG&A expense margin is 111%. (Note SG&A expense includes R&D.)(Source: Portfolio123)SharpSpring is spending more on SG&A than it is receiving in revenue. In the long term, this plays out in one of two ways: either increased debt or shareholder dilution.(Source: Portfolio123)In fact, both are occurring. Shareholder dilution of 27% occurred in 2019 and total debt to total equity also increased. Investors should expect more of the same as time goes on.Perhaps the most telling fundamental of all for this company is the free cash flow margin which is -41%.(Source: Portfolio123)How does SharpSpring compare to HubSpot for this very important metric? HubSpot has a 12% free cash flow margin, steadily increasing over time and positive since 2016.(Source: Portfolio123)The last observation that I am going to make today is that the cost of customer acquisition is going in the wrong direction. From 2019 to the present, the CAC has gone from $4,500 to $10,800.2015 Q3:2017 Q4:2018 Q4:2019 Q1:2019 Q2:2019 Q3:SharpSpring is a small company with annual revenue of approximately $23 Million. Most SaaS companies are still privately held at this stage of growth and I believe that this may be one of the issues that SharpSpring has to overcome. Significant growth will be required in order to compete with the big boys such as HubSpot, but to get there will probably require cash infusions. If the company was private, this would mean a round or two of venture capital. But since the company is publicly traded, investors should expect a fair amount of shareholder dilution, especially since the company management is spending a fair amount more than it is taking in with revenue.I see most factors working against this company. This includes an extremely high SG&A expense margin, one of the worst free cash flow margins I have ever seen, poor customer retention and increasing customer acquisition cost. There are other companies out there, such as HubSpot, with significantly better metrics. Therefore, I am giving SharpSpring a neutral rating."
