article_id,author_id,publish_on,summary,content
3920436,54942,2016-02-24T11:45:34-05:00,"TransUnion is a recent IPO that focuses on the credit risk and consumer risk solutions businesses providing big data analytics to consumers and businesses.We think the company has a superior management team that is ahead of the other two large bureaus in differentiation and growing despite regulatory headwinds.TRU had several growth levers that it is currently pulling including international growth, new product launches, continued vertical penetration, and new verticals.","TransUnion (NYSE:TRU) is the leading provider of risk and information solutions helping businesses optimize their risk-based decisions while enabling customers analytical tools to help manage their personal financial information. It is one of the three largest credit bureaus with a primary function of providing information services to businesses to help them grant credit and market to their customers.The Marmon Group spun off TransUnion in 2005 although it remained private. Several years later, Madison Dearborn Partners, a private equity firm, acquired a majority stake. Just two years later, GS Capital and Advent International acquired it for $3 billion. In June of 2015, they decided that the business was ready for the public market, conducting a $765 million IPO.The credit risk industry is a secular growth theme as more consumers seek credit and alternative financing. TransUnion has key client verticals including financial services with nine of the top 10 banks as clients, top insurance firms, and healthcare. The company has several unique data assets and is nicely positioned to take advantage of high-growth geographical regions such as India, Africa, and Southeast Asia.(Source: Investor Presentation)US Information ServicesTransUnion is unique in the credit risk industry given that it has a comprehensive and distinct data set. The amount of data and the cost of accumulating such a large data set create a sustainable and marketable product. In addition, we think it differentiates the company from other credit and risk analytics businesses. The amount of resources it would require for another to accumulate and re-create such an asset is immense, creating a significant barrier to entry. Many of these types of data assets are rare and can only be purchased on infrequent occasions. In addition, it typically acquires large amounts of data back from its customers and then re-aggregates it through its existing data set and sells back to those companies, creating a virtuous cycle to which new entrants cannot compete.Much of the segment is centered on the online data service providing consumer credit bureau information such as payment data on credit cards, mortgages, home loans, and auto loans for use in financial services, insurance, and the healthcare industries. The remainder of the division includes a credit marketing services business that markets lists of prospects via mail, email, or mobile for the credit and insurance markets. And lastly a decision services platform to automate decisions in real-time while the customer is engaged, opening a new checking account or credit application for example.We believe that the decision services segment is likely to be a near-term growth engine for the segment. The real-time automated decision algorithms allow fast-decision making at the customer engagement level. Companies use this product in order to quickly evaluate business and credit risks and close opportunities in real-time before the customer has a chance to change their minds. Typically, businesses derive a significant amount of high-margin revenue from their financing arms as well as preventing bad debt expenses, namely in their healthcare vertical.We believe the CreditVision product creates a differentiated solution to companies. This is a ""trended risk"" product which uses historical consumer credit behavior to detail credit risk profiles at a more granular level. For instance, it uses algorithms to better understand the differences in two consumers' credit profile that may have the same credit score. While we think the actual product exists at the competition in various other formats, the company has been able to reinvigorate the uses for the product, creating new interest in the space. We think this inventive and imaginative approach is indicative of the company's innovative management culture.Growing The CRA BusinessThe consumer reporting business has been plagued by technology and regulatory disruption over the years by free credit reports and third-party firms (LifeLock, Credit Karma, etc.). But TransUnion has been able to grow much faster than its peers (Equifax (NYSE:EFX) and Experian (OTCQX:EXPGY)) through a different strategy for the consumer-facing market.It has been able to use non-traditional data in order to augment its core consumer credit data, particularly when it comes to thin-file credit-seekers. These are consumers that do not have a long enough credit history to make an accurate assumption. In these cases previously, the consumer would receive an N/A or some variation until more credit history was obtained. But TransUnion's use of alternative data sources such as rental history, gym and other club membership payment, subscriptions, debt, driving records and other public records, etc., allows it to supplant the credit history through its algorithm and make a determination.The company bolstered this segment in 2014 when it acquired L2C, one of the first predictive analytics businesses that used alternative data sources. It also acquired DHI, an insurance risk analytics business later the same year, augmenting its capabilities. TRU was nearly two years ahead of its competition in moving into this space, further emphasizing its innovative management culture and thinking.We think the consumer credit cycle is in an upturn following years of stagnation during and after the financial crisis. Lending standards have loosened considerably in the last few years, which, when combined with very low interest rates, have helped TransUnion inflect organic growth towards 6-7%. Some of the risks of the macro trend reversing or rising interest rates, we think, are overblown. Consumer spending remains tepid and under-cycle average, thus, we think it is already incorporated into the share prices of the credit bureaus. If anything, the risk is to the upside should the macro slowdown reverse and consumer spending pickup.Revenue Growth StrategyWe think the company continues to be ahead of its peers in acquiring unique data sources and services that enhance its product offerings. Through its own R&D efforts along with key inorganic growth moves, we think TransUnion will continue to benefit from innovation in its reporting and predictive scoring utilizing its big data and strong technology platforms. As the company continues to build its technology capabilities, we think it should be able to capture a broader set of data for predictive insight, including from its own product sets (CreditVision).Revenue should also be driven by generating more revenue from existing customers and verticals. We think the company is likely to develop new tools to further penetrate these existing verticals in order to be able to market to a larger opportunity set. An example of this would be its eScan technology, acquired in late 2013. This solution helps hospitals and healthcare providers reduce uncompensated care costs by identifying patient coverage after services were provided. This acquisition augmented its existing products that included an upfront eligibility and ability to pay estimation service. But it moves the company into a larger market opportunity by identifying insurance and ability to pay during the stay.In addition to further penetrating existing verticals, we think there is a large opportunity to advance into other verticals that are underserved by the credit reporting agencies. There are many ancillary markets that are very close and adjacent to existing verticals, especially within the financial services industry. These include rental application and verification services, a recent product launch for the business. We believe that it will continue to identify key areas of need and capitalize on these deficiencies through product innovation or acquisition-based expansion.Lastly, TRU's international growth story is impressive. Instead of growing widespread, it typically picks and chooses its end-markets in order to expand into the higher-growing and better-positioned (emerging middle classes) markets. Most market entries are typically accomplished by establishing joint ventures or partnerships with local players. Its Indian story is the most compelling established through the partnership with CIBIL where it co-founded the first Indian bureau in 2001. Ownership in the business has risen to 66% from approximately 12% in 2001. These emerging economies are driving the need for credit bureau data with a fast-expanding middle class, increased fraud, new regulations, and a larger percentage of banking services available to larger population. (Source: Investor Presentation)ValuationWhen the company went public, it was highly indebted with nearly $3 billion of liabilities including senior notes, capital leases, and revolver issuance. The proceeds of the IPO, approximately $765 million, were used to reduce that debt outstanding to $2.25 billion. Management reduced its expensive senior PIK notes and refinanced other notes at lower interest costs. The reduction lowered its leverage to 4.6x, still an elevated level in the current macro environment.The shares are not a deep value by any means given the 18x forward earnings and 14x ttm EV/EBITDA. But we believe the business model is highly defensible with significant long-term capital appreciation potential as it expands internationally and launches new products and services domestically. Our model consists of a medium-term revenue growth forecast of 7-8%, which we derive from 4% core business growth, 2.5% new product and innovation growth, plus 2% emerging markets growth, partially offset by some foreign exchange.On an adjusted EBITDA basis, we think TRU can grow at low-double digits as the cost savings from recent efficiency and Project Spark initiatives can be used to expand margins. In addition, we see free cash flow increasing due to the cessation of significant technology investment and no further recurring corporate expenses reducing capex requirements that have been elevated the last three years.Our base case calls for EBITDA to grow to nearly $700 million by 2018, from $527 million in 2015. On free cash flow, we expect growth to $250-260 million by 2017 from $177 million last year. This added free cash flow should allow for additional growth investments but mainly to continue to delever the balance sheet. Net debt reduction is a primary driver of our valuation. We expect leverage to fall to under 4.0x by the end of the current year and possibly lower than 3.0x by the end of 2017.We have a $33 price target for year-end based on an 11.5x multiple, down from the current 14.3x ttm EV/EBITDA rate. The multiple has been on the wane lately so we wanted to bake in some further contraction as the near-term opportunities pass and growth eventually slows. We contrasted the model with a $650 million EBITDA target to account for the macro slowdowns and a 9.5x multiple which returned a $24 price target, for downside of just 5%.ConclusionShares of TransUnion responded favorably to the company's fiscal fourth-quarter results, but we think the long-term opportunity in the business is very positive. That should continue to benefit from an overall secular growth trend towards more financing and real-time credit monitoring/analysis. The market is still taking a cautious approach to those businesses with excessive leverage on the balance sheet. Should the macro picture slow materially and we enter a recession, the shares are likely to impacted. However, as of now, it appears we are in an uptrend in its end markets with consumer financing growing at a moderate pace. We believe as TRU de-levers its balance sheet quickly over the course of the next year to 18 months, the shares will de-risk and move higher."
3358175,87196,2015-07-26T16:46:07-04:00,TransUnion is part of an oligopoly of credit reporting agencies.Big Data is the new paradigm.There are lots of opportunities in emerging markets.The company has a competitive advantage with an economic moat.The stock is still trading near its IPO price.,"TransUnion (NYSE:TRU) is a buy, and here's why.Big Data is the new paradigm, and it's only getting bigger. On top of that, more countries are going to need what TransUnion offers. Emerging markets, anyone?TransUnion is one of the three largest credit reporting agencies in the U.S. Experian (OTCQX:EXPGY) and Equifax (NYSE:EFX) are the other two, effectively making this industry an oligopoly. You've probably used one, or all three, to look at your credit score and credit reports. But TransUnion makes its money selling your data to companies that want consumer reports, risk scores and other information to determine what kind of credit risk you are.The Chicago-based company launched its initial public offering June 25, making it the last credit agency to go public. It sold approximately 29.5 million shares for $22.50 a share, raising $664.8 million - making it one of the biggest IPOs of the year.On their first day of trading, the shares jumped 13% to $25.40. A month later, they've inched down to $24.89. Unlike Fitbit (NYSE:FIT), whose IPO was also in June, TransUnion's stock hasn't doubled in price. But I predict Fitbit is a flash in the pan, and that TransUnion's slow-and-steady approach will win this race.The key to big profits at TransUnion is its prevalence in financial Big Data. This is an asset that is hard to reproduce. And the company has a lot of consumer data - more than 30 petabytes of about more than one billion customers.""To put that staggering figure in context, it is roughly 2% of the total amount of information carried on the Internet on a daily basis, according to an estimate cited by the National Security Agency in 2013,"" reported Motley Fool.Data is where it's at. It takes a lot of time and money to build a huge proprietary database, making it hard to recreate. Companies are willing to pay a lot of money to access good data, and many great business models have been built on this idea.Currently, the company says it provides credit information and information management services to approximately 45,000 businesses and 500 million consumers worldwide. And more want to use it every day. Landlords need to see a credit report before they rent an apartment, and cell phone network providers expect it before they let you open an account.This treasure trove of data gives TransUnion what Warren Buffett calls an economic moat. Like a castle's moat, an economic moat presents new competitors with a huge barrier to entry into the industry. The moat - in this case, the high cost of acquiring all this data - makes it near impossible for another firm to build the contacts and data that the Big Three already have. This increases TransUnion's ability to maintain a competitive advantage and protect its long-term profits and market share.The big problem with TransUnion is that it keeps posting losses. For the fourth quarter of 2014, the company reported revenues of $303.4 million, but a $13.5 million loss. For the March quarter, revenues were $353.1 million, but it still lost $4.4 million.On an annual basis, 2014 revenues grew 10% to $1.3 billion. That gives the company a price-to-sales ratio (P/S) of 3.07, which is low compared to that of its competitors. The price-to-sales for Equifax is 5.01, while that of Experian is at 3.65. The ratio means the company is undervalued in relation to the revenue it generates. For all of 2014, it posted a loss of $12.5 million. However, it has a very high gross margin of 62%.The pattern of loses was partly due to the rise in administrative expenses, such as maintaining a staff to combat data breaches and the cost of following the many forms of compliance law in the many different countries TransUnion does business in. The company has said it has a cost management strategy that includes ""strategic sourcing, labor management, streamlining back-office functions and improving overall processes.""I believe that in the long run, growth in revenue is likely to outpace the increase in costs, and the company will eventually turn profitable.Goldman Sachs says TransUnion will use money from the IPO to reduce its total debt-to-EBITDA from a multiple of 7.5 to between 5 and 6. This will reduce the debt by approximately $620 million. The company anticipates about $86 million in interest cost savings.The reduction in interest expense, coupled with TransUnion's organic revenue growth in international markets and declining spending on business optimization and technology infrastructure initiatives should increase the company's free cash flow.My advice is to buy TransUnion and hold it for the rest of 2015.Editor's Note: This article discusses one or more securities that do not trade on a major U.S. exchange. Please be aware of the risks associated with these stocks."
3330425,21136,2015-07-17T09:42:43-04:00,"The 40-day IPO quiet period for TRU expires on August 4th, 2015; on August 5th, TRU's heavy hitting underwriters will have a first chance to release reports on the firm.TRU's influential syndicate includes BofA Merrill Lynch, Deutsche Bank, Goldman Sachs, J.P. Morgan Securities, Credit Suisse, Wells Fargo, and others; positive news from them could boost TRU's stock price.Current research shows that a stock may produce above-market returns of close to 3% in anticipation of the conclusion of the quiet period.Given TRU's solid early market performance and promising fundamentals, we suggest investors buy TRU early to take full advantage of both the event and the opportunity for further upside.","The 40-day IPO quiet period for TransUnion (NYSE: TRU) expires on August 4th, 2015. The company held its IPO on June 25, 2015, with a midpoint price range of $22.50 per share.Consumers recognize TransUnion as one of the three major credit reporting agencies in the United States. The company also provides information and risk solutions to consumers and businesses.The company's stock price rose 13 percent on its first day of trading, and the price remains steady at $25 to $26 per share. The company raised $665 million from the IPO.Long-term investors can expect a bump in TransUnion's stock price within a few days of the quiet period expiration. We suggest buying in early to take full advantage of this likely increase.Company Overview: Major US Credit Reporting AgencyTransUnion is well-known as one of the three major credit reporting agencies in the United States. Experian (EXPN) and Equifax (NYSE:EFX) make up the other two agencies. TransUnion also delivers decision-making solutions to businesses throughout the world. Companies embed the solutions into their workflow, which helps them obtain new customers along with the ability to identify whether customers have the ability to pay for services rendered. The solutions TransUnion offers include customer portfolio risk assessment software, debt-collection solutions and software that helps prevent potential fraud.We previewed the IPO here, as well as the IPO quiet period expiration, for our premium subscribers. You can sign up for this service at the bottom of the article.Market Forecast: Large and Growing DemandCurrently, TransUnion provides 90,000 data sources with an average annual growth rate of 25 percent. The sources are used to obtain financial information for over one billion consumers worldwide. Consumers include financial institutions, public repositories, private companies and their databases along with private sector customers.The healthcare, insurance and financial services industries continue to rely on TransUnion for access to fast and accurate credit information. With new banking regulations, small-to-medium sized businesses and consumers now use alternative lending platforms such as peer-to-peer and balance sheet lenders for their financing. TransUnion supports those lending platforms with comprehensive credit information along with risk assessment tools that analyze customer's employment and credit information.Overview of Company Financials: Increasing Revenues, Decreasing LossesTransUnion reported earnings for the quarter ending March 31, 2014, of $353 million. According to the company, that was an increase of 16 percent compared to the same quarter last year. The company also reported an increase of 20 percent in its earnings before income taxes depreciation amortization, which came in at an adjusted $114 million. The margin on the company's EBITDA was 32.3 percent, which was a 90 basis points increase compared to the same time last year, according to TransUnion.However, the company reported a net loss of $4.4 million for the first-quarter of this year. The company did decrease its losses from the first-quarter of last year when the company reported a net loss of $13.5 million. Investors considering taking a long position in TransUnion should recognize the company has not reported a net profit in the past four quarters; however, the company has increased revenues since Dec. 31, 2012.Risk Factors Mitigated By Very Few CompetitorsThe company reports a substantial amount of debt, which could hurt its overall stock performance now and in the future. According to the company, the debt's book value totaled $3 billion, as of March 31, 2015. Analysts do point out the company has reduced losses with respect to net income and revenues continue to increase year-over-year.TransUnion faces little to no competition in the credit reporting industry. The other major credit reporting bureaus, Experian and Equifax, essentially work in tandem with TransUnion, making it difficult for any new entrants in the market to compete with any of the companies. TransUnion points out that it owns several proprietary datasets, holding vital consumer credit information, along with driver violation histories and healthcare records, which any new competition would find impossible to emulate.Conclusion: Buy TRU Ahead of Quiet Period ExpirationCurrent research shows that a stock may produce above-market returns of close to 3% in anticipation of the conclusion of the quiet period. Given this likely boost on the horizon for TRU (supported by a powerful underwriting team), we suggest investors buy in ahead of the event to take full advantage of potential gains.TRU's heavy hitting syndicate, including Bank of America Merrill Lynch (NYSE:BAC), Deutsche Bank Securities (NYSE:DB), Goldman Sachs (NYSE:GS), J.P. Morgan Securities (NYSE:JPM), Credit Suisse Securities (NYSE:CS), Drexel Hamilton, Evercore Group, Loop Capital Markets, RBC Capital Markets, Stifel Nicolaus, and Wells Fargo Securities (NYSE:WFC) will likely seek to capitalize on the stock's recent growth through the release of positive reports on August 5th.The impending event, along with TRU's solid early market performance and promising fundamentals, is another reason to buy into the growing firm."
