article_id,author_id,publish_on,summary,content
4334234,20715,2020-03-25T17:23:00-04:00,"TransUnion is one of the three main credit reporting agencies in the United States.The company has seen solid earnings and revenue growth in recent years, and its management efficiency measurements are above average.The stock recently hit support in the $52.50 area and appears to be ready to rally.","Most of us are probably familiar with TransUnion (NYSE:TRU), the company is one of the three largest credit reporting agencies in the United States. It's also prominent in international credit reporting, serving customers in approximately 30 countries around the world.From a fundamental perspective, TransUnion has performed very well over the last few years, and up until this recent pullback in the overall market, the stock was performing well too. Over the last few months, the company saw its stock drop by almost half from its February high. Investors are likely concerned about the economy slowing due to the coronavirus shutdown and whether TransUnion will be able to maintain the growth levels it has posted over the last few years.The company has seen its earnings grow by 24% per year over the last three years, and they grew by 14% in the fourth quarter. The company is set to report Q1 2020 results toward the end of April. Analysts are looking for earnings growth of 16.7% for the quarter and 14% for the year.TransUnion's revenue has grown by 17% per year over the last three years, and it grew by 12% in the fourth quarter. Analysts are looking for revenue to grow by 10.2% for the first quarter and by 7.8% for 2020 as a whole.The return on equity for the company is at 25.9%, and that is well above average. The profit margin is also well above average at 27.9%. The current P/E ratio is just over 23, and that is higher than average right now.I have been watching TransUnion's chart for a few months, and the reason the stock was on my radar in the first place was due to the fundamental indicators laid out above. Now, that the stock has fallen, the chart looks as if there is a buying opportunity at hand.TransUnion peaked at $101.07 back on February 19 and that was the same day that the S&P peaked. From that day through the low on March 23, the stock fell 48% from the high. The low on March 23 was $52.50 and that is a price range that stood out on the weekly chart. The December '18 low was at $51.89 and the opening price that week was $52.49. The same price area served as a low in February '18 when the stock had a temporary pullback to $52.67.Looking at the weekly overbought/oversold indicators for TransUnion, we see that both the 10-week RSI and the weekly stochastic indicators were in oversold territory last week. Going back to the stock's IPO date of 6/25/2015, there have only been four instances where both indicators were in oversold territory at the same time - the current one, two instances in the fourth quarter of 2018, and in February 2016.In 2016, the stock rallied over 65% in approximately five months. When the oscillators were in oversold territory in October '18, the stock did drift approximately 18% lower until eventually bottoming in December. From the December '18 instance, where the RSI and stochastics were both in oversold territory, the stock rallied over 50% in the next seven months.With TransUnion's fundamental indicators as strong as they are, I expected to see the sentiment indicators skewed toward the bullish side. When I pulled up the overall analysts' ratings and the short interest ratio, they weren't as skewed to the bullish camp as I expected. There are 18 analysts covering the stock at this time with 12 ""buy"" ratings, five ""hold"" ratings, and one ""sell"" rating. This puts the buy percentage at 66.7%, and that falls toward the bottom part of the average range.The current short interest ratio is at 2.3, and that is a little below average and does indicate slightly more bullish sentiment than the average stock. The average short interest ratio is in the 3.0 range.Looking at the sentiment from a contrarian perspective, I normally like to find stocks that have more pessimism than what we see with TransUnion, but the sentiment isn't so bullishly skewed that it should hold the stock back. If the buy percentage was up above 80% and the short interest ratio was below 2.0, I would be a little more concerned.As with any stock right now, there is a certain degree of risks for the company and how the economic downturn could impact its earnings and revenue. For TransUnion, the biggest risk is that companies see a slowdown in credit requests. Two big areas where an economic slowdown could hit TransUnion are the mortgage business and auto loans. If these two areas slow down tremendously around the world, it could mean a big hit to revenues and earnings.Given TransUnion's strong fundamentals and the support in the $52.50 area, I look for the stock to rally in the coming months. I see it rallying at least back up to the $85 range over the next six to nine months.Keeping the concerns mentioned above in mind, I would set a target of $85 on the upside and would suggest a stop at the $50 area. If the stock reaches the upside target, I would reevaluate where the overbought/oversold indicators are, where the sentiment indicators are, and where the long-term moving averages are at that time."
4176007,101421,2018-05-21T18:39:44-04:00,TransUnion has agreed to acquire iovation for an undisclosed amount.Iovation provides device identity and consumer authentication solutions.The deal is one of a continuing series of technology acquisitions by TransUnion as it bolsters its anti-fraud capabilities.,"Credit data provider TransUnion (TRU) has announced an agreement to acquire iovation for an undisclosed sum.Iovation has developed device identity and consumer authentication technologies to enhance fraud prevention functionalities for businesses.TRU stock has performed extremely well in the past 12 months and the firm continues on its acquisitive path to bolster its technology capabilities and market reach.Portland, Oregon-based iovation was founded in 2004 to develop multi-factor business to consumer fraud reduction systems.Management is headed by founder and CEO Greg Pierson, who was previously CEO of ieLogic and a consultant with Accenture (ACN).Below is an overview video of iovation’s approach to dynamic authentication:(Source: Iovation)Iovation’s primary offerings include:Investors have invested at least $16 million into iovation since inception and include Intel Capital (INTC), Sapphire Ventures, Global Founders Capital and EPIC Ventures.According to a 2017 market research report by Stratistics MRC, the global identity and access management market is expected to reach nearly $21 billion in 2022.This represents a CAGR of 14.8% from 2016 to 2022.The main drivers for this expected growth will be continued growth in mobility and growth in the Internet of Things.Within the industry, the Audit, Compliance and Governance segment is forecasted to have the highest growth followed by Public Sector and Utilities.Major competitive vendors that provide identity management systems include:TransUnion didn’t disclose the acquisition price or terms and didn’t file an 8-K or disclose a change in financial guidance, so the deal is likely a non-material amount for TRU’s market capitalization of over $12 billion.TRU is acquiring iovation to bolster its anti-fraud and identity management capabilities.As TransUnion CEO Jim Peck stated in the deal announcement,Over the past 12 months, TransUnion’s stock has risen dramatically, from $42.00 per share to around $69.00, a 64% increase, as the chart below indicates:(Source: SEEKING ALPHA)Concurrent with the iovation deal announcement, TransUnion also announced the acquisition of Healthcare Payment Specialists, a company ‘that helps healthcare providers identify and recover Medicare reimbursements that they otherwise wouldn’t have received.’TRU has been an increasingly active acquirer of technology companies. I’ve previously covered two 2017 acquisitions here and here.Management isn’t shy about making what appear to be smaller ‘team and technology’ acquisitions as it tries to improve its risk identification and reduction capabilities.In the past 12 months, the stock has risen at a much faster rate than the overall market, so it looks like investors are rewarding management’s results and moves to improve its offerings.Its most recent report resulted in a 10% stock price increase after management raised full-year guidance and announced a deal to purchase Callcredit in the UK for $1.4 billion.As long as TRU can avoid the disastrous data-breach pitfall of its competitor Equifax (EFX), the stock may have more to run.Editor's Note: This article discusses one or more securities that do not trade on a major U.S. exchange. Please be aware of the risks associated with these stocks."
4112940,101421,2017-10-11T12:02:14-04:00,Transunion has acquired eBureau for an undisclosed sum.eBureau has created software that enables lenders to more quickly model risk for customers and prospects.The bolt-on deal for Transunion will add capabilities to its Prama offering and will be combined with Transunion's large data assets to help clients better understand repayment risk.,"Financial information company Transunion (TRU) has announced the acquisition of eBureau for an undisclosed amount.eBureau provides predictive analytics for companies in B2B and B2C markets to help them acquire customers, identify and manage customer risks and maintain ongoing customer relationships.Transunion acquired eBureau to help its clients reduce the time to create new risk models, and combine its platform with Transunion’s extensive data assets to offer more comprehensive market intelligence.Saint Cloud, Minnesota-based eBureau was founded in 2004 to develop software solutions driven by data analysis to assist enterprises in making better-informed decisions about prospects, customers and financial risks.Management is headed by founder and CEO Gordy Meyer, who was previously president and CEO at RiskWise.Below is an overview video of eBureau’s system:(Source: eBureauLLC)eBureau’s primary offerings include solutions to:eBureau raised $43 million in private investment from venture capital firms such as Redpoint, Tenaya Capital and Split Rock Partners.Neither company disclosed the acquisition price or terms and Transunion didn’t file an 8-K or disclose a change in financial guidance, so the deal was likely for a non-material amount and closed on October 2 , 2017.The combination of eBureau with Transunion will add a ‘rapid-model-development platform’ to Transunion’s offerings, which will enable customers to reduce the time to build customized risk models from months to days.eBureau will be integrated into Transunion’s Prama system, which is marketed to lenders evaluating repayment risks for consumer and business loan applicants.As Transunion stated in the deal announcement:So, Transunion hopes to combine its data assets with eBureau’s easy-to-use and transparent modeling system to improve client modeling capabilities and reduce credit losses.Financial services firms in the risk space have been acquiring technologies and startups at a fast pace in recent quarters.These startups represent a new generation of entrepreneurs who have created systems that include many different inputs about a person’s risk profile, or a business’s revenue stream.Entrenched financial firms have proven themselves less than adept at changing with new technology development, but sharp management teams are instead acquiring promising startups as bolt-on assets to expand their offerings without disrupting their existing businesses.Additionally, these legacy firms have large, in-house data assets that can be accessed by new technology platforms to supercharge their value to clients.I expect to see continued acquisitions like this as financial firms react to a rapidly changing environment for service offerings.I write about M&A deals, public company investments in technology startups, and IPOs. Click the Follow button next to my name at the top or bottom of this article if you want to receive future articles automatically."
4102882,101421,2017-08-30T05:34:07-04:00,TransUnion has acquired Datalink Services for an undisclosed sum.Datalink searches driver and vehicle registration records to provide updated risk data to insurers and non-insurer clients.TransUnion will need to combine the data with a robust analytics system to compete with existing industry players like LexisNexis.,"Personal information tracking firm TransUnion (TRU) has acquired Datalink Services for an undisclosed amount.Datalink, which operates as Compass Driving Records, collects data on vehicle and individual driving records.TransUnion acquired Datalink to provide data to insurers and non-insurer clients to help them better assess risk. It will need to combine that data with strong machine learning-based real-time analytics to fully realize the value from the acquisition.Sacramento, California-based Datalink was founded in 2001 to provide auto insurers and non-insurance providers with driver pre-screening data and DMV records.Management is headed by President Mark Haddy, who has been with the firm since October 2008 and was previously VP Technology at First Advantage, a human resources screening firm.Compass’ primary offerings include two products with nationwide coverage:Additionally, Compass provides the following capabilities for California only:(Source: Datalink)Neither company disclosed the acquisition price or terms. TransUnion didn’t file an 8-K and didn’t issue any change in forward financial guidance, so the deal appears to have been for a non-material amount.TRU is adding Datalink to its DriverRisk solution, which is aimed primarily at the insurance industry by providing market participants with a range of driver and vehicle data. Notably, the Datalink system also will be marketed to ‘other industries that meet Drivers Privacy Protection Act requirements.’As Mark McElroy, EVP and head of TransUnion’s insurance business unit stated in the deal announcement:The insurance industry has been pushing for, and getting, greater visibility into driver offenses, and increasing risk premia accordingly.LexisNexis’s Risk Solutions unit is a competitive provider of similar data and analytics services to insurers, so with the Datalink buy TransUnion wants to go head-to-head in what appears to be a lucrative market.However, just providing data won’t be enough to compete well. TransUnion will need to marry that data with powerful analytics, ideally using current machine learning technologies to not only provide insight into past behavior, but also adapt to conditions in real-time, and in an automated manner.By combining data with higher-level services and selling those capabilities to insurers and non-insurer institutions, TransUnion will be able to fully realize the value of the Datalink acquisition.So, the deal has much promise, but TransUnion will likely need to invest in a full solution set to compete effectively against the likes of LexisNexis and others.I write about M&A deals, public company investments in technology startups, and IPOs. Click the Follow button next to my name at the top or bottom of this article if you want to receive future articles automatically."
3980916,99406,2016-06-09T04:35:37-04:00,"TRU lags peers in all profit metrics.
        Innovation and growth are still strong at TRU.
        The group, along with most stocks, look very expensive at all time high valuations.","TransUnion(NYSE:TRU), one of the 3 major credit agencies along with Equifax and Experian, has been a public company since June of 2015.In honor of that one year anniversary I wanted to dive in and learn more about the company, how they make money, what they do beyond just credit scores and reports, and if the stock is worth investing in.ResultsTRU has grown sales at a blistering pace since 2012 when it was purchased by private investors that included Goldman Sachs.Profitability was slow coming though, although the company did eke out a tiny profit in 2015. Operating income looks like it is moving in the right direction along with some noise from non-operating expenses.Let's dive in further and see if we can uncover what is really going on.DebtI hate when I stumble upon an interesting company and start my research, only to discover that the company has been marred by a recent private equity transaction that did little but heap a mountain of debt on the company while enriching the purchasing and subsequently selling shareholders.This picture tells me that the company got another 1 billion in debt for the privilege of changing owners. Sure, the IPO proceeds were used to pay down debt but it is still 600 million higher than it used to be.But Greg, you might say, look at the other things in that chart, assets and SE. In comparison to 2011, everything looks so much better now! Forget about the debt and have a margarita!Are things really better for the company or did the PE guys just put lipstick on a pig?The operating data is interesting. What I see is that the most important segment of the company, USIS, has gone nowhere since 2013. Consumer Interactive has doubled though and it was likely a focus of the previous owners since it is the highest margin business segment. You can see at the bottom it is 36.6% compared to 16.6% for USIS and 7.9% for international in 2015.From a pure balance sheet perspective things are also interesting. For companies that have acquired a lot or been manipulated in some way, I always like to back out goodwill from the assets to get a better sense of what is going on.Remember that Goodwill is nothing, it is not a building or software, just a necessary accounting fiction.Assets not including goodwill are 2463.3 compared to liabilities of 3076.8 for a ratio of .80. Equifax(NYSE:EFX) has a ratio of .89, better but not amazing. Fair enough.Where's The Beef(profit)?The real problem I see with TransUnion comes when we try to answer the question of ""Is the company actually making money?""TransUnion has average gross margins of 62.4% over the past 3 years. I cannot find data going back further than this.The most direct comparison one can use is Equifax, the other US based major credit firm in similar lines of business.Experian is UK based and thus their information is more difficult to compare directly. Equifax had gross margins over the same time frame of 65.9%.But here is the interesting part, TransUnion had a net profit margin of -1.2% over that same time frame while Equifax had a net profit margin of 15.2% averaged over those 3 years.So basically, Equifax made money the past three years and TransUnion did not.Why?One possible explanation is higher Depreciation & Amortization charges. TransUnion had D&A costs of $298 million in 2015 versus $198 for Equifax, despite the fact that TRU is 3 times smaller than Equifax if we go by market cap.Readers will remember that D&A are non cash expenses that can sometimes obscure things to the point that a company looks less profitable but is really generating more cash flow than the net income line would indicate.Another interesting thing is that Equifax has an interest expense equal to about a third of what TRU has, again contrasted with the fact that Equifax is three times larger.Int exp. is 2.4% of revenues for EFX and 8.89% for TRU. Combined with the slightly higher gross margins, you can see where we are going here.ValuationEFX is at 21.5 times forward earnings and TRU at 22.4. Price to sales has TRU cheaper at 3.67 versus 5.11.EFX has grown EPS at 13.8% the last five years and TRU is projected to grow at 12.08% but considering the company is not really profitable, those projections should be taken with a large grain of salt.EFX pays a dividend and TRU does not. EFX has a 5 year div. growth rate of 15.58%.Recent ResultsRecent results paint a much more positive picture than I have outlined talking about the past. In each of the last two quarters TRU has beat expectations on revenue and EPS and looks on pace to have the most profitable year in recent memory, although that is not saying much as you saw above.TRU is doing all the right things and capitalizing on the big data trend. All their US segments are growing 10%+ in revenue with international lagging at 7%.A recent upgrade of all credit agency stocks by Deutsche bank cited increasing mortgage volumes and a weaker dollar. I am in the camp that over the next few years mortgage volumes will fall as the World climbs out of negative rates and the US goes up in rates ever so slowly, even if they only do one a year.Combined with the overheated auto sector loan sector having to come back to reality, I am skeptical about TRU's long term future earnings although this year appears to be on track to be solid.ConclusionWhile TRU is clearly in an uptrend of late, I am not yet convinced. I still think that the other two credit agencies have better operating histories, metrics, and more scale that TRU.That being said, TRU is innovating at a rapid pace and continues to grow fast and leverage their big data in new ways.Yet, I continue to worry that the company is having a breakout year that will not continue and the profitability metrics are still well behind competitors.The group as a whole looks expensive but I would be more than willing to pay TRU's current price, given their growth rate, if only I had more faith.I look forward to continued improvements in TRU so that they can get me over the cliff and convince me to hop aboard their big data train."
