article_id,author_id,publish_on,summary,content
2841626,24105,2015-01-23T13:41:06-05:00,Properly analyzed the Xerox balance sheet has zero net debt.Xerox trades at 7.3 times owner's cash flow.Xerox will benefit from earnings tailwinds in the form of share repurchases and lower interest payments.Xerox is misunderstood because earnings are much less than cash flow and the balance sheet contains hidden assets.Xerox should trade at 10 times owner's cash flow which would produce a price 39% higher than Wednesday's close.,"I wrote about Xerox (NYSE:XRX) two years ago in this article when it was trading at $6.69 and still consider it to be attractive for value investors. Wednesday, it closed at $13.58 and it currently pays a 25 cent per share dividend. It recently sold a division for $1 billion and appears to have bought back $1 billion worth of its own stock in 2014.Balance Sheet - I think that XRX tends to be misunderstood for several reasons, one of which is the balance sheet. A cursory glance at the balance sheet (based on the most recent quarterly financials filed with the SEC) reveals $1 billion in cash and $7.7 billion in debt. I focus on net debt (debt minus cash) and so I would ordinarily assume that net debt was $6.7 billion. However, XRX is a company which finances the sale of its own equipment and carries financing receivables on its balance sheet. Thus, XRX is actually in the financial business as well as the equipment and business service businesses. It makes perfect sense for XRX to borrow against these receivables. The receivables are constantly reviewed for loan loss potential and write downs are taken when appropriate. The $4.3 billion in XRX financing receivables should be offset against gross debt to calculate net debt. When added to balance sheet cash, the value of interest in an affiliate and the $1 billion realized after the end of the quarter by the sale of a line of business, the offsets equal the debt and net debt winds up at zero. I think that this analysis is legitimate in part because financing receivables can be converted into cash (as XRX has done in the past), and are assets which could be sold without adversely affecting the core business. This is not a case in which XRX has simply classified normal receivables as financing receivables. XRX has a separate balance sheet item for accounts receivable and that account is actually much larger than accounts payable. Thus, there is no sign that XRX is somehow moving ordinary short-term receivables into the financing receivables category.Owner's Cash Flow - I tend to focus on ""owner's cash flow"" which is a loose measure of the amount of cash available for dividends and share repurchases. It is an approximation of the amount of cash that would be available annually to an individual if he or she owned the entire company. I calculate owner's cash flow adding after tax earnings, depreciation and amortization and subtracting capital expenditures. This calculation is somewhat similar to the ""funds from operations"" metric used on equity REITs. I have generally favored companies trading at less than 10 times owner's cash flow. In the case of XRX, I have taken the numbers for the first nine months of 2014 and annualized them. Thus, I have added earnings of $830 million and depreciation and amortization of $1,070 million and subtracted capital expenditures of $277 million to get owners cash flow of $1633 million for the nine months or an annualized $2,177. Since XRX has zero net debt, I have simply used market cap ($15.78 billion) to calculate the ratio of 7.3. This is one of the lowest ratios I have seen recently and it is similar to the low ratios of stocks like Microsoft (NASDAQ:MSFT) and Apple (NASDAQ:AAPL) when they were about to shoot up in price. XRX is like a REIT which is trading at 7.3 times FFO, an extraordinarily low valuation. One way to think about this is that XRX is producing an owner's cash flow yield of 13.7%. Thus, XRX can use 4% of its cash for dividends, use another 5% for share repurchases and still have 4.7% left at the end of the year. XRX is paying a low dividend at this time but that may change. It also has a large share repurchase program. A 13.7% owner's cash flow yield is extremely attractive in the current low yield environment.Tailwind #1 (Repurchases) - As noted above, in its last conference call, XRX noted that it planned to buy back a total of $1 billion worth of stock in 2014 (as of the end of the third quarter it had bought back roughly $730 million worth). In the first nine months of 2014, XRX reduced share count by nearly 5% and it was doubtlessly knocked down further (probably nearly an additional 2%) in the fourth quarter. Share repurchases financed by cash flow add no costs to the company so that the same operational numbers produce more earnings per share due to the reduced share count. We may see this pattern emerge with XRX as it has with other high cash flow tech companies.Tailwind #2 (Lower Interest Expenses) - XRX has some debt which it incurred in the past and is still on its books at high interest rates. Its most recent annual report reveals substantial amounts of debt at interest rates of 9.0%, 8.25% and 7.2 %. Recently, XRX has been able to borrow at rates as low as 2.8%. As the old high cost debt matures (I assume that XRX is not able to prepay at attractive terms) it will be replaced by much lower cost debt or simply retired by cash flow and total debt reduction. In any case, interest expense should experience a long-term decline.Why XRX Is Misunderstood - I always prefer to have some idea of why a company is not trading at levels inconsistent with my valuation. In this case, I think that there are several reasons. First of all, the earnings of XRX do not really give a good indication of cash flow. Depreciation and amortization are huge non-cash charges against earnings and are much larger than capital expenditures. I have seen this situation with a number of large tech companies and it can lead to depressed share prices but it is almost always corrected as the share price increases. The second factor is the balance sheet confusion described above. Actual net debt is really a lot lower than the net debt sometimes presented in financial calculations. Finally, XRX is still thought of as a company which manufactures copiers. In fact, it is now primarily a business service company with a more stable cash flow, relatively ""sticky"" client relationships and less potential for ruinous price competition.Conclusion - I think a conservative valuation for XRX would be 10 times owners cash flow (as calculated above). This would produce a share price of $18.75 or a 39% increase from the present level."
2839116,23471,2015-01-22T00:52:00-05:00,"XRX is not suitable for Defensive Investors or Enterprising Investors following the ModernGraham approach.
        According to the ModernGraham valuation model, the company is undervalued at the present time.
        The market is implying only 3.06% earnings growth over the next 7-10 years, considerably lower than the rate the company has seen in recent years.","Xerox Corporation (NYSE:XRX) should attract investors initially because of its consistent earnings growth over the last several years. However, Benjamin Graham, the father of value investing, taught that the most important aspect to consider is whether the company is trading at a discount relative to its intrinsic value. It is through a thorough fundamental analysis that the investor is able to make a determination about a potential investment's merits. Here is a look at how Xerox Corporation fares in the ModernGraham valuation model.The model is inspired by the teachings of Benjamin Graham, and considers numerous metrics intended to help the investor reduce risk levels. The first part of the analysis is to determine whether the company is suitable for the very conservative Defensive Investor or the less conservative Enterprising Investor, who is willing to spend a greater amount of time conducting further research.In addition, Graham strongly suggested that investors avoid speculation, in order to remove the subjective elements of emotion. This is best achieved by utilizing a systematic approach to analysis that will provide investors with a sense of how a specific company compares to another company. By using the ModernGraham method, one can review a company's historical accomplishments and determine an intrinsic value that can be compared across industries.XRX data by YChartsDefensive Investor - Must pass at least 6 of the following 7 tests: Score = 4/7Enterprising Investor - Must pass at least 4 of the following 5 tests or be suitable for a defensive investor: Score = 3/5Valuation SummaryKey DataBalance Sheet - September 2014Earnings Per ShareEarnings Per Share - ModernGrahamDividend HistoryXRX Dividend data by YChartsConclusion:After reviewing the data, it is clear that conservative value investors may wish to seek other opportunities. The Defensive Investor is concerned with the low current ratio, short dividend history, insufficient earnings growth over the last ten years, and high PEmg and PB ratios, while the Enterprising Investor has concerns with the high level of debt relative to the current assets. As a result, both investor types would find the company to be too risky to proceed. That said, any investor willing to speculate about the future of the company may go ahead with the next step of the analysis, which is a determination of the company's intrinsic value.When calculating an estimate of intrinsic value, it is important to consider the historical earnings results, along with the market's implied estimate for future growth. Here, the company has grown its EPSmg (normalized earnings) from $0.58 in 2010 to an estimated $0.93 for 2014. This level of demonstrated growth is fairly strong, and significantly higher than the market's implied estimate of only 3.06%. As a result, Xerox Corporation appears to be significantly undervalued at the present time."
2517585,21798,2014-09-24T10:15:09-04:00,"Xerox has successfully transformed itself, but needs to increase revenue for the long-term.The stock is attractively undervalued relative to the S&P 500.The stock is likely to see gains over the next year on earnings growth.","Xerox (NYSE:XRX) has been in the process of reinventing itself over the years. The company was previously known for primarily producing copiers and other business equipment. However, Xerox has transformed into an information technology services company, similar to the way IBM Corporation (NYSE:IBM) has transformed. Services now comprise 57% of Xerox's revenue. Both companies have struggled to grow revenue in 2012, 2013, and again this year. That could be the result of the highly competitive nature of the information services industry. Xerox will need to find a way to increase revenue again to support earnings growth over the long-term.Xerox's stock has had a good run for most of 2014, rising from about $10 to around $14. This performance was supported as the company exceeded earnings estimates for the past two quarters. Xerox is expected to increase revenue slightly next year over this year's expected revenue. However, next year's expected revenue of $21.22 billion is still lower than the revenue of $21.6 billion back in 2010. The stock should perform well if revenue continues to increase to support increased earnings growth over the long run.Xerox still sells business equipment such as printers, copiers, and scanners. However, the company also now handles services that we use daily and perhaps take for granted. For example, Xerox handles toll-road and municipal parking transactions. The company also handles the filing of medical claims, paying bills, and the mortgage application process. Xerox handles information technology to improve other businesses' daily operations in various industries such as: energy, education, government, healthcare, manufacturing, insurance, transportation, and retail. The company's growth going forward is likely to come from various services in these industries.Strength in ValuationCurrently, the stock is undervalued as compared to the S&P 500. Xerox is trading at 11.4X next year's expected earnings, while the S&P 500 is trading at 16.9X next year's expected earnings. The company is also undervalued as compared to the Information Technology Services industry which is trading with a forward PE of 12.2. Investors are giving Xerox a below average valuation mostly likely because revenue has declined for the past few years. However, if the company can meet/exceed its earnings estimates over the next year, I think that the stock is likely to increase from these valuation levels. Xerox has met/exceeded its earnings estimates for the past four quarters. If the company can achieve this for the next four quarters, then the stock should perform well.Prospects for GrowthXerox is banking on Business Process Outsourcing (BPO) and document outsourcing for revenue growth going forward. These businesses have higher growth rates than the Information Technology Outsourcing (ITO) business. Therefore, Xerox sees BPO and document outsourcing as the driver of revenue growth for the future. Currently, Xerox is expected to achieve revenue of $21.12 billion for 2014 and $21.22 billion for 2015. This is lower than last year's revenue of $21.44 billion. The company can get by with this stagnant revenue growth through 2015 by focusing on higher margin businesses and cutting costs to increase earnings. However, the company needs to increase revenue growth to support earnings growth for the long-term.Earnings are expected to increase by 1.8% this year and 8.1% next year. The company's current undervaluation should allow the stock to increase approximately by 8.8% (2015 EPS of $1.20/price of $13.65) over the next year if earnings expectations are met. If the company exceeds expectations for most of its quarters over this time, then I would expect the results to be even better. Xerox also rewards shareholders with a modest dividend of 1.9%."
2357655,69395,2014-07-30T09:39:30-04:00,Now is a good time to review my investment thesis for Xerox from a value standpoint.Here I'll provide a description and views on main business units.The attractiveness of the valuation from an absolute value perspective is apparent.,"Investment ThesisXerox Corporation (NYSE:XRX) is increasingly a business services company. The printer business (""Document Technology"") is an ex-growth cash cow and will continue to generate cash for a long time. It is attractively priced in absolute terms, and has a shareholder-friendly strategy of returning capital through dividends and buybacks.Investment Thesis ReviewServices Business: The Services Segment grew revenues 3% in 2013 and now represents 55% of total revenues. Its contribution at the PBT level is even higher. Some of the increase in contribution is due to the fact that Document Technology shrank slightly, but as long as the overall profitability remains stable to slightly improving, the revenue quality of the overall business is improving - which is a positive.2009-13 Services Segment RevenueSource: Xerox Annual Report.This segment is an attractive business composed of Business Process Outsourcing (59% of Services revenue), IT Outsourcing (13% of Services revenue) and Document Outsourcing (28% of Services revenue). These are long-term contracts with high renewal rates (85-90%) and the company has a strong pipeline of new opportunities. Document Outsourcing (managed printing services, or ""print as a service"" if you want to be promotional) is probably a lower quality business, but the company is incredibly well positioned here given its legacy. It is also worth noting that other outsourced printing companies such as Vistaprint (VPRT) trade at very rich multiples (11x LTM EBITDA and 30x LTM P/E - although to be fair, FY1 multiples look decent if they achieve the growth at 8.3x EBITDA and 14x P/E).Document Technology: The Document Technology segment shrank by 6% in 2013, and profitability fell to $966m (9% below 2012), almost as low as it was in 2009. I am still of the view that the era of the ""paperless office"" is still a long way away, so I think this profit stream will continue to be sustainable for a long time. It's certainly not a growing market, but it is a market that needs to be served and few serve it better than Xerox.Attractive Absolute Valuation: Maybe the below will sound like a contradiction to what I previously wrote on the bias of cost basis, but I think it is more about ""knowing where you stand"" than anything else. Here are some key valuation metrics for Xerox with the change in the metric since my last review of this position (Nov. 4, 2013, which was when I bought the shares) in parenthesis.EPS: $0.92 (+0.2%)Price/LTM Earnings: 14.2x (+32%)Price/FY1 Earnings: 12.0x (+27%)EV/LTM EBITDA: 8.2x (+17%)EV/FY1 EBITDA: 6.7x (+11%)EV/Revenues: 1.1x (+20%)EV/FY1 Revenues: 1.1x (+17%)Source: Company filings and CapitalIQ.At first glance, it looks like the valuation part of the investment thesis is poorer across the board now - by about 20%. One the one hand, this is a nice problem to have and one that should hopefully be a recurring one for any value investor. On the other hand, it would be preferable for the near 30% price appreciation experienced to date to be a result of an improving business, rather than a richer valuation. In any event, the valuation remains attractive on an absolute basis. At a 12x forward P/E, the implied earnings yield is over 8%. That is a very acceptable base case, and there is a lot of optionality here with valuation re-rating (there is a long way to go before getting to ""market"" levels) and some growth in the long term once the slow decline of the Document Technology business settles.The dividend yield has now fallen below 2%, but I would not be surprised to see the company raise its dividend at some point. The share repurchasing has been aggressive, which is the right thing to do with a depressed valuation. It would be nice to see a shift in favor of more dividends and less repurchases if the valuation continues to increase at this rate.Shareholder-Friendly Strategy: One of the first thing that attracted me to Xerox was that it had a decent dividend yield. I see that as a sign of sensible valuation (assuming it's sustainable) and a shareholder-friendly management. Combined with the aggressive share repurchase program, it is very clear that the management has a strategy of returning capital to shareholders. The chart below compares cash flow from operations to the major uses of cash for the last five years.2009-14 Cash from Operations and Its UsesSource: Company filings and Capital IQ.With the exception of the large acquisition of Affiliated Computer Services (now known as Xerox Business Services), the company has had a moderate and disciplined M&A strategy. That acquisition bolstered the services business and seems to have been a good one. They do enough M&A that I have not had the time to analyze each one specifically, but given the company's heritage, it seems as if they are being appropriately opportunistic here. I like the optionality it creates.Other Considerations: The company makes a lot out of their ""Annuity-Based Business Model"" (now 84% of revenues). I certainly like that about the business model in general - recurring revenues are a nice thing. It strikes me as a bit promotional, despite the fact that I think it is true. I wonder if it is a legacy of the printer business where selling the ink cartridges was always where all the money was made - one of the real classic ""razor/razor blade"" business models.ConclusionThe original investment thesis still holds and this investment should stay in the portfolio (which is good, since it has only been nine months). This is a nice business worth owning for the long term. Given current valuation and profitability, I would expect it to generate an overall return of about 100% over the next 10 years (implied by 8% earnings yield, assuming a bit of degradation), which would be a good outcome.In more general terms, I think this is a decent investment to hold in the event of a downturn. The printers business could surely suffer, but the services business should be resilient. There are some concerns around the consumer financing (the company lends people money to buy its products) to which most of the debt is related, but the balance sheet is strong and credits should be fairly safe.Disclosure: The author is long XRX. The author wrote this article themselves, and it expresses their own opinions. The author is not receiving compensation for it. The author has no business relationship with any company whose stock is mentioned in this article."
