article_id,author_id,publish_on,summary,content
877421,24491,2012-09-20T02:33:45-04:00,,"Dividend growth investing is lots of fun, especially when investors have a systematic dividend analysis process to separate dividends that are safe from those that are not. To help the financial advisor and individual investor from falling into the traps of yesteryear, we've created a forward-looking assessment of dividend safety in our innovative, predictive dividend-cut indicator, the Valuentum Dividend Cushion™. We use our future forecasts for free cash flow and expected dividends and consider the company's net cash (or debt) position to make sure that each company is able to pay out such dividend obligations to you -- long into the future. In this article, let's evaluate the investment merits of Xerox (NYSE:XRX), as well as its dividend under this framework. For an in-depth assessment of Xerox's intrinsic value via our DCF process, please click here.Investment ConsiderationsReturn on Invested CapitalXerox's DividendXerox's dividend yield is about average, offering a 2.2% annual payout at recent price levels. We prefer yields above 3%, and don't include firms with yields below 2% in our dividend growth portfolio.We think the safety of Xerox's dividend is good (please see our definitions at the bottom of this article). We measure the safety of the dividend in a unique but very straightforward fashion. As many know, earnings can fluctuate in any given year, so using the payout ratio in any given year has some limitations. Plus, companies can often encounter unforeseen charges (read hiccups in operations), which makes earnings an even less-than-predictable measure of the safety of the dividend in any given year. We know that companies won't cut the dividend just because earnings have declined or they had a restructuring charge that put them in the red for the quarter (year). As such, we think that assessing the cash flows of a business allows us to determine whether it has the capacity to continue paying these cash outlays well into the future.That has led us to develop the forward-looking Valuentum Dividend Cushion™. The measure is a ratio that sums the existing cash a company has on hand plus its expected future free cash flows over the next five years and divides that sum by future expected dividends over the same time period. Basically, if the score is above 1, the company has the capacity to pay out its expected future dividends. As income investors, however, we'd like to see a score much larger than 1 for a couple reasons: 1) the higher the ratio, the more ""cushion"" the company has against unexpected earnings shortfalls, and 2) the higher the ratio, the greater capacity a dividend-payer has in boosting the dividend in the future.For Xerox, this score is 2.6, revealing that on its current path the firm can cover its future dividends with net cash on hand and future free cash flow. The beauty of the Dividend Cushion is that it can be compared apples-to-apples across companies. For example, Wal-Mart (NYSE:WMT) scores a 1.4 on this measure. Also, for firms that have a score below 1 or that have a negative score, the risk of a dividend cut in the future is certainly elevated. In fact, the Valuentum Dividend Cushion caught all dividend cuts in our non-financial coverage universe, except for one, which subsequently raised its dividend above pre-cut levels (meaning it shouldn't have cut it in the first place). The Dividend Cushion also caught the recent cuts by JC Penney (JCP) and SuperValu (NYSE:SVU). We use our dividend cushion as a key decision component in choosing companies for addition to the portfolio of our Dividend Growth Newsletter (please see our links on the left sidebar for more information).Now on to the potential growth of Xerox's dividend. As we mentioned above, we think the larger the ""cushion"" the larger capacity it has to raise the dividend. However, such dividend growth analysis is not complete until after considering management's willingness to increase the dividend. As such, we evaluate the company's historical dividend track record. If there have been no dividend cuts in 10 years, the company has a nice growth rate, and a nice dividend cushion, its future potential dividend growth would be excellent, which is not the case for Xerox. We rate the firm's future potential dividend growth as good (though we're not modeling in dividend increases). The board seems reluctant to raise the dividend, despite excess projected cash flow capacity.And because capital preservation is also an important consideration, we assess the risk associated with the potential for capital loss (offering investors a complete picture). In Xerox's case, we think the shares are fairly valued, so the risk of capital loss is medium. If we thought the shares were undervalued, the risk of capital loss would be low.All things considered, we'd wait for a dividend increase or a pullback in the shares to consider Xerox a nice income play.Disclosure: I have no positions in any stocks mentioned, and no plans to initiate any positions within the next 72 hours. I wrote this article myself, and it expresses my own opinions. I am not receiving compensation for it (other than from Seeking Alpha). I have no business relationship with any company whose stock is mentioned in this article."
748681,22130,2012-07-25T15:27:33-04:00,,"Xerox (NYSE:XRX) was hammered on second-quarter earnings, primarily on weakening growth and reduced guidance. Shares closed the day at $6.70, resulting in a TTM P/E of 7.2. The company expects full-year 2012 GAAP earnings per share of 92 to 97 cents and full-year adjusted earnings per share of $1.07 to $1.12.With second-quarter revenue down 1% year over year, the investor is faced with the awkward question: what is a no-growth situation worth? The company anticipates repurchasing between $0.9 and $1.1 billion worth of shares for the year, from its abundant cash flow. Can buybacks create value, in the absence of growth?OverviewFrom the 10-K:An Analogous SituationExperience with P&C Insurer Chubb (NYSE:CB) illustrates the possibility of a positive outcome from a no-growth, heavy buyback scenario.For the five years from 2006 to 2011, earnings decreased 7.9%, annualized. The P/E ranged from 6 to 14, averaging 8.5. Buybacks reduced share counts by an average 7.2% per year, while tangible book value increased 11.2% annually. Share prices, which tend to follow tangible book, seesawed with the market, but on average increased 4.4% annually.Value creation, defined as the increase of tangible book value, plus dividends received, proceeded at 12.6% per year. I started in September 2009, using LEAPS as a substitute for share ownership, and achieved an IRR of 35% over a period of almost three years. Buy and hold for the same period would have generated an IRR of 12.8%.There was much talk of headwinds: the soft market in commercial lines, the increased catastrophe risk, the declining interest rates, the dangers of asbestos and environmental liability, the exposure to Directors and Officers Liability raised by the financial crisis, etc. It kept a lid on P/E multiples, that's for sure. But the buybacks created value.Valuing Growth/No GrowthBen Graham proposed a formula: P/E = 8 + 2G, where G is growth. A company with a growth rate of 2% would command a P/E of 12, under that line of thinking. Graham's formula is accurate, but only at low-growth rates.A regression analysis on modern data developed a Graham-style formula of P/E = 11.7 + 0.7G. I prefer this version for growth over 3.5%, and switch to it when projected growth exceeds that level.Labeling XRX as a no-growth situation, and using the midpoint of GAAP guidance for 2012, $0.95 X 8 = $7.60, round to $8. On a long-term basis, and perhaps after a reset, I see growth of 3.5%. $0.95 X 14.2 = $13.Buyback Ad InfinitumMy original hypothesis when opening a position in XRX relied on the idea that buybacks would continue indefinitely, with modest growth. Management expected to deliver about $10 billion of cash flow over a 5-year period, and absent better uses of the cash, could be expected to spend about $1 billion per year on buybacks.The thinking was, that if Mr. Market would not pay up for the shares, buybacks would create value, along the lines described above for Chubb.Putting the above assumptions into a spreadsheet, together with a variable growth assumption and a P/E dependent on growth, I experimented with various scenarios. I assumed that reported earnings would be 65% of cash flow, that 50% of cash flow would be used for buybacks, and that the initial cash flow would increase consistent with growth, if any. I allowed an estimate of average buyback price for the first year: thereafter, share prices (and buyback cost) reverted according to the valuation formula discussed above.The results are very sensitive to the assumptions. At zero growth, if the market permits management to buy back shares at $6.70 for 1 year, reversion to a P/E of 8 will give a pop of 25% to 30% from that price.If growth resumes at a rate of 3.5%, and buybacks continue for one year at the current price, reversion to a P/E of 14 would make this a doubler, or better, from where it lies.Playing it from Where it LiesAfter initiating a position at a price above $10, I reacted to a drop in share prices by doing a vertical call spread, long July 6 calls, short July 7s. That's the equivalent of selling a put at $7, and after the shares closed Friday at $6.70, I'm the proud owner of additional shares.One possible strategy, and a common one among put sellers, would be to turn around and sell calls at 7 on the newly acquired shares.However, buybacks are expected to be loaded toward the end of this year, based on cash flow considerations. If the share price stays down, value creation would be relatively rapid. With that in mind, now would not be a good time to give away the upside on this exposure.XRX January 2014 3 Calls have a relatively low time cost associated with maintaining a position. Swapping my current holdings for the LEAPS, I can reduce the capital devoted to the situation and wait patiently to see how this plays out.DividendXerox dropped the dividend in February 2001 and restored it in December 2007 at 17 cents per year, paid quarterly, for a yield of 2.5% at Friday's closing price.The payout ratio is 18%, and the dividend may be regarded as secure. Dividends take a back seat to acquisitions and buybacks. Given the history of dropping the dividend, and lack of a regular increase, the shares will not be attractive to dividend-oriented investors.Thoughts on GrowthXerox as presently constituted is the result of a large acquisition - ACS (American Computer Services) in 2010. That's the origin of the Services segment, where the company expects future growth to occur. I owned ACS at the time, attracted by a 5-year revenue growth rate of 9.7%.Checking pro-forma results for the combination, as disclosed in the 10-K, 2009 revenue was $21,082 million, and advanced to $22,626 for 2011, for an annualized growth rate of 3.6%. Combined segment margins on the same basis increased from 7.2% to 9.2%.Under the circumstances, it's not unrealistic to look for growth to resume at 3.5%, when the global economy stabilizes in a growth mode.DebtXerox finances customer leases as a profitable way of supporting Technology sales. This activity is conducted with borrowed money. Assuming a 7:1 leverage ratio of debt to equity as compared with finance assets, the company distinguishes between financial debt and core debt.On that basis, core debt is 29.6% of shareholder equity.The ratio of earnings to fixed charges and preferred dividends stands at 2.67. General Electric (NYSE:GE), by way of comparison, reports a ratio of 2.04. Xerox limits its financing activities to what is directly supportive of its primary business, while GE has permitted finance to wander into other areas.Miscellaneous Analytical ObservationsServices margins have come under pressure, due to the cost of ramping for large new contracts. It's possible to think of the increased expense as an investment in future income. In any event, margins are expected to increase as revenue from the new contracts comes on line.A slowdown or reversal in the Technology segment improves cash flow, since capital formerly devoted to financing the activity is returned to cash.MIF (machines in the field) is increasing, and installations are still running strong. The MIF metric is indicative of the future annuity type supplies and service revenue from machine sales, and it bodes well for that stream of income.The company provides a wealth of information on signings and sales pipeline. Investors who want to track progress can maintain spreadsheets on a continuing basis and form an impression of future potential.The company regularly does small bolt-on or fold-in acquisitions. Given the cash flow available for the purposes, this strategy can reliably add to growth, or augment capabilities in selected areas of expertise.R&D expenditures are approximately $700 million per year, or 3.1% of revenue. The expense has been declining, both in % and in absolute terms. The company has the ability to stay ahead of the curve in technology areas where it has a stake. As such, it  may be able to gain share against weaker rivals.The strategy of hardware companies moving into software or data services operations, whether by acquisition or internal growth, is very common. XRX was relatively early to the game, and paid a fair price for ACS. Hewlett-Packard (NYSE:HPQ) may have been excessively zealous in cutting expenses on its acquisition of EDS. Clearly it overpaid for Autonomy, and very possibly it mishandled integration. Computer Services Corporation (CSC) is floundering. The caliber of competition suggests taking share is possible.Disclosure: I am long XRX, HPQ, CB, GE."
611441,21798,2012-05-23T08:19:33-04:00,,"As I looked down at a desk at work, I noticed a calculator with the Xerox (NYSE:XRX) brand on the front facing. That prompted me to do some research to see if the company was still in business (the calculator looked like it was from 1985). That's when I remembered that the commercial with the Michelin Man was actually advertising for Xerox. That made me think, could Xerox be in the position that Apple (NASDAQ:AAPL) or IBM (NYSE:IBM) was in just before their successful comebacks?Apple made a comeback due to significant innovation. It is known for its Macbooks, iPods, iPads, iPhones, etc. When I hear the name Apple, I think of smart thinking, innovation and well-designed devices. When I hear the name Xerox, for some reason, the old yellow robot from the Muppet Movie comes to mind.IBM was able to reinvent itself by focusing its business on information technology. This move has made the company very successful in growing revenue, earnings and stock. I think that Xerox is now in a position to either become a successful turnaround story or turn into another Eastman Kodak (EKDKQ).Xerox just doesn't have a modern stand-out image anymore. The company needs something to propel it to above average earnings growth. The recent commercials do suggest that Xerox can better handle information technology, while allowing other companies to do what they do best. However, something is wrong when the company is only expected to grow earnings annually at 5.2% for the next five years. This is significantly below the average expected earnings growth of the S&P 500 of 10.29%.Maybe Xerox needs to more effectively get the message across to potential customers. I think the next Xerox commercial should feature some of the companies that Xerox has been helping and show how much it has helped. For example, feature employees of a few of these companies saying one sentence, ""Xerox has helped me save X amount of dollars by handling our outsourcing.' It should have 5 people from 5 different companies say this one sentence. Then, the next commercial could show 5 different people from another set of companies saying that sentence. This would get the message out to other potential businesses, better than the Michelin Man throwing tires or papers flying through a wind tunnel.I found an old Xerox commercial from 1979. This commercial shows how innovative the company was back then. Xerox needs to get back to being innovative, not just in its daily operations, but also in marketing its business. The current commercials are just not accomplishing this, in my opinion.The company is clearly undervalued, as it trades under its book value per share. It has solid cash flow and pays a dividend of 2.3%. I think it is on the verge of something great if management can execute properly. The company now needs to find a way to grow earnings at 10% per year or more to have a chance of beating the performance of the S&P 500 for the future. We need to see something better from the company for this to happen. Will it be the next IBM or Apple turnaround story, or the next bankrupt Eastman Kodak? Ms. Ursula Burns, now is the time to make your company great.Disclosure: I have no positions in any stocks mentioned, and no plans to initiate any positions within the next 72 hours."
598241,29891,2012-05-17T15:12:21-04:00,,"Xerox (NYSE:XRX) operates in the business equipment industry. I think this stock is highly undervalued by up to 72% or even more. Below are my calculations using a FCFF model, multiples comparison and other interesting facts and threats.Discounted Free Cash Flow ValuationIn this article I will run you through my DCF model. In particular I will be using free cash flow to the firm FCFF model to evaluate the stock. Feel free to share your opinion regarding the assumptions I made for this valuation.Let's start with the top line. XRX recorded $22.63B in revenue in 2011, which represented 4.59% growth year/year. In 2012, however, I predict that the company will record modest growth from 2011 to $22.93B (+1.34%), and 2.27% growth in 2013. I predict 2% growth for the next four years.Coming down to the cost side I predict COGS to be 64%, SG&A - 22% and EBIT margin 9-11% of the revenues for the projected period. Interest expense should stay at around 5.5% of the long-term debt. I forecast taxes to be 26% on average for the projected period.Then I subtract increases in working capital and capital expenditures. I model working capital to increase 10% of the revenue increase per annum. Capital expenditures should be approximately 37% of net income.This model uses WACC to discount FCFF backwards to find out the present value. Beta of this stock is 1.57. I project the WACC to be 10.73%.To get the value of the firm we need to discount the projected FCFF by WACC and add the terminal value at the end of the five-year period by calculating a perpetuity with growth of 2% and 10.73% WACC.I get the value of equity by subtracting the market value of debt and adding back current cash and marketable securities.Equity value per share is $12.40, which means the stock is 72% undervalued.Multiples ValuationXRX is also undervalued in terms of P/E (8.00) compared with the industry (13.99) and to one of the biggest direct competitors, Canon Inc. (NYSE:CAJ), which P/E is 15.83. On the other hand, it is similarly valued in terms of P/E, as Hewlett-Packard (NYSE:HPQ) - 7.71.The situation is similar in terms of P/S. XRX has P/S ratio of 0.43, which is lower than the industry average 0.65 and CAJ - 1.12, but slightly higher than HPQ - 0.35.Analyst ratingsThe median analyst target price for XRX is $9, which shows more than 25% upside potential. In the last 30 days four analysts have increased the EPS revisions for the current year and two analysts for the next year.More positive factsThreatsFinancial data taken from Yahoo Finance.Disclosure: I have no positions in any stocks mentioned, and no plans to initiate any positions within the next 72 hours."
732941,29891,2012-07-19T13:07:22-04:00,,"Xerox Corporation (XRX) is scheduled to report its Q2 2012 results on July 20, 2012, before the market opens. The street expects EPS and revenue of $0.26 and $5.60B, respectively.In this article I will recap the historical results of the company, its latest EPS estimates vs. surprises, the latest news from XRX and the news from its closest competitors.Recent EPS Actuals vs. EstimatesThe company has met or beaten analysts' estimates in the last four quarters. In the last quarter it reported $0.23 EPS, in-line with analyst estimates.The consensus EPS estimate is $0.26 based on 8 analysts' estimates, just below $0.27 a year ago. Revenue estimates are $5.60B, just below $5.61B a year ago. The median target price by analysts for the stock is $8.50.Average recommendation: OverweightSource: MarketwatchLatest NewsFCFF ValuationOn May 17, 2012, I have published an article which says that Xerox looks highly undervalued. The article explains the FCFF valuation with all the assumptions required for calculations which come to conclusion of $12.40 price of the share.However, it all comes down to the assumptions and the main one here is ""I predict 2% growth for the next four years"". The market currently is discounting the stock much more. I would agree that this assumption is on the optimistic side, considering the management and competitive environment.CompetitorsAccenture (ACN), Canon (CAJ), Hewlett-Packard (HPQ), and International Business Machines Corporation (IBM) are considered major competitors for Xerox and the table below provides the key metrics for these companies and the industry.The chart below compares the stock price changes as a percentage for the selected companies and S&P 500 index for the last one year period.XRX data by YChartsCompetitors' Latest DevelopmentTechnical Overview The stock has a market capitalization of $9.80B and is currently trading at $7.27 with a 52 week range of $6.55 - $10.41. The stock's year-to-date performance has been -7.62%. It is currently trading below 20, 50 and 200 SMA.Sources: Yahoo Finance, Google Finance, Marketwatch, Finviz, Reuters.Disclosure: I have no positions in any stocks mentioned, and no plans to initiate any positions within the next 72 hours."
