article_id,author_id,publish_on,summary,content
4378906,102661,2020-10-13T15:39:00-04:00,"In spite of pandemic-related office-closures, Xerox still managed positive FCF in Q2 and expects positive FCF through the end of the year.
        With at least $300M of share repurchases planned before the end of FY '20, management remains committed to shareholder returns including the dividend whose yield presently hovers around 5%.
        The company’s post-sale business model offers operating characteristics that provide protection for the dividend, even in light of current circumstances.
        With Carl Icahn “doubling-down” on his Xerox bet recently, income investors, skittish to invest in this old “legacy” name, may wish to take a second look.","In August, activist investor Carl Icahn recently doubled-down (metaphorically speaking) on his investment in Xerox (XRX) and now holds more than 25M shares, or ~12% of the company (based on 213M shares outstanding). His initial stake in 2015 left some analysts perplexed; although Mr. Icahn noted at the time that he felt shares were undervalued.With the dividend yield hovering around 5%, should long, income-driven investors follow Mr. Icahn’s lead?I did, in fact, assume a long position recently. My decision was, in part, influenced by certain second quarter results that I found surprising (in bold):The company’s ability to “eke out” a positive Q2 FCF result, and to forecast positive FCF through the end of the year, in light of present circumstances – circumstances that arguably should affect their “workplace-reliant” business much, much more than other organizations – struck me as a rather bullish signal. The signal becomes stronger in the context of management’s confidence to re-start share repurchases despite continued pandemic-related uncertainty.The company’s somewhat optimistic guidance is buoyed by:Thus, while all Xerox investors have been treated to a roller-coaster ride so far in 2020 (down ~31% YTD as I write this), perhaps shares have been unfairly punished.Figure 1: Xerox Share Performance Trailing 12-Months (“TTM”)Source: InveyoCertainly, as the pandemic meanders along, one expects that Xerox’s business will continue under stress; and that stress will undoubtedly contribute to increased dividend risk. However, the company’s legacy structure and operating characteristics offers a more nuanced perspective – one that may entice income investors.Despite forays into certain adjacent areas, particularly related information technology markets, Xerox remains a printing company. To that end, the business model relies upon post-sale revenues – “...which [include managed print services], equipment maintenance services, consumable supplies, and financing, among other elements [associated with printing equipment sales]”. These sales are the heart of Xerox, pumping 77% of revenues, or more than ~7B, in FY ’19. While post-sales revenues have been declining roughly (6%) per year in absolute terms, results have been fairly steady as a proportion of total sales.Figure 2: Post-Sale Revenue as a Percentage of Total RevenueData Source: Annual Report FY ‘16, Annual Report FY ‘19 Post-sale revenues are also the company’s most profitable stream and management notes, in the context of its post-sale model, that “...there [are] low annual capital expenditures (less than 2 percent of revenues) required to support our current business model.” Accordingly, the company is at a point where it has built out its operation such that “...these factors result in stable gross margins and operating margins as well as strong and stable cash flow generation.”Readers might counter that the value of this high-profit, low capital investment revenue stream is offset by the “slow death” on the top-line. It is not an unreasonable point; however, I would point out that it would take about 30 years for the post-sale business to drop below $1B in revenue per year if the average annual rate of decline of (6%) holds.But, will Xerox’s post-sale model simply wither away and die, even if it takes a long time to do so? The pandemic has cut into the business significantly in 2020, with post-sale revenue down nearly (34%) in Q2 due to the impact of office closures. But, predictably, there are arguments to support a stabilization within the business:Figure 3: Xerox Revenue by Equipment SegmentSource: Xerox Earnings Presentation Q2 FY ‘20Logically, drawing upon the preceding arguments, Xerox’s robust engine of post-sale cash flow will likely continue to provide support for shareholder returns via dividends and buybacks for quite some time.So far, the company has weathered everything the pandemic has thrown at it. Although, it would be foolish to think the situation could not get worse; and therefore, it would be foolish to think the worst is behind the company as they close out FY ’20. However, management offers investors that “...[they] have modeled numerous scenarios to ensure that [they] have flexibility no matter how the pandemic continues to impact global business.”It may be easy for many investors to dismiss Xerox, as the company has struggled to find its footing in a 21st century information technology landscape. On that point, it worth noting that the company is pushing into tangential areas that add value around its printing core, such as workflow automation and digital packaging. Further, Xerox is actively researching technologies that can serve to make the company even leaner, including sensors and AI-enabled support services, both of which can drive operating efficiencies. Therefore, even if these bets merely slow the company’s top-line decay, shareholders might nonetheless be treated to reasonable returns. This is to say Xerox can represent a profitable opportunity even if it remains in an overall state of decline. With Carl Icahn doubling-down on his bet, skittish income investors might be wise to take another look."
4377252,69945,2020-10-01T17:08:39-04:00,"XRX has committed to return at least 50% of free cash flow from continuing operations to shareholders.XRX has been paying just over 5% in dividends annually and buying back substantial stocks.With the stock price lower, XRX stock buybacks will be even more meaningful.","The mantra of the buy and hold investor is to get into companies and follow them along for the ride to the top of their industry, hopefully, securing some of the profits for yourself. That's a nice thought, but clearly, it can't be the only way to invest.Today, I want to look at Xerox Holdings (NYSE:XRX), the venerable copy-machine giant whose best years were decades ago. Looking at the company's technological development in the 1970s and 1980s, along with their dominant position in the office space, the only thing more appealing than the company they were is the company they would've been now if everything had gone right.Instead of just lamenting the road not taken, we're going to look through Xerox Holdings as it exists today and see if what's left of this company has anything to offer us at the current prices. As it turns out, it just might.In keeping with Xerox's storied past, the company sells hardware involved in scanning, printing, duplication, and general multi-function devices. In addition, Xerox offers print management software and digital printing solutions. No longer the leviathan they were in the 1980s, they remain about $9 billion in revenues and $4 billion in market capitalization.A market leader like the Xerox of yesteryear commands a mighty premium, but not being a market leader also means there is a lot more room for growth. Xerox is still well thought of by many companies and can keep growing back into a big player.And while the history is interesting, we're not buying a story, we're buying a company. In analyzing Xerox, it is most useful to examine the company from a value proposition, with an eye toward the possibility of a rebound.We've got a bargain PE ratio of about 4 on trailing earnings. The Forward PE is 15 on the basis of analyst projections for 2020 and back down to 8.3 in 2021. Breaking down the balance sheet shows sub-one Price/Book value, another desirable feature.source: most recent 10-Q from EdgarThose are some nice numbers at a $4 billion market cap. Goodwill is still a fairly large portion ($3.9 billion) of overall market cap, but unlike a lot of companies, Xerox has been doing an excellent job of turning some of that goodwill into profitability in discontinued operation.Continuing operations are the most important thing here, however, and here's why: Xerox has committed to return at least 50% of free cash flow from continuing operations to shareholders. In recent years that's meant about $213 million in dividends, and some healthy buybacks, and any hopes for this as an income stock rest on them being able to sustain that.Source: 2019 10-K from EdgarAs you can see, there was a bit of a hiccup in income from continuing operations a few years back, but the company has since recovered. Analyst estimates for revenue and earnings suggest that in the next few years, there should be more than enough continuing operations to sustain the dividend, though how much buyback can come with it is yet to be seen.That's something of a shame because the share price is a lot lower and we'd get more bang for our buck buying back, if the revenue supports it. The 2019 buyback saw 289,000 shares at $37.00, and the price is now half of that. This is a tremendous way to return value to shareholders, especially at these prices.In conclusion, the current price includes slightly over a 5% dividend yield, which is not bad, on a stock that is below its book value and has nice earnings going forward. Xerox is not some hyper-growth stock, but for a long-term holding, there is a lot to like about the steady income and equity growth possibility."
4376161,67113,2020-09-24T14:36:42-04:00,Shares remain 50%+ down from their 2020 highs.We do believe that we will get a convincing return to the office but when is anyone's guess.Xerox has a fight on its hand in the near term. It must continue to shed costs aggressively.,"Xerox (XRX) popped up from a screener we ran where the objective was to find companies with attractive valuations and which also paid out high dividend yields compared to the industry in which they operate. In saying this, Xerox has been a poor investment for many investors over the past two decades or so. The firm's share price is still nowhere near its 1999 highs and despite the dividend, many investors continue to hold a paper-loss in their portfolios.We wrote about Steelcase (SCS) recently and discussed how the ""office"" will be affected in the future. Although we see a return to the ""office"" eventually for many employees, short-term trends are definitely illustrating that remote-work will more than likely increase. Before the pandemic hit, practically all industries were in the middle of transforming their paper-based processes to the cloud and we do not see this changing any time soon. Suffice it to say, large firms will continue to advance their digital infrastructure and they will want their employees to take full advantage of this. When we see this mass-return to the office is another question entirely.As this digital transformation continues, it is taken for granted that Xerox's printer business will continue to face headwinds. However, the company will continue to avail the digital tailwinds from the other side of its business. This really is the issue for Xerox. Although management refrained from giving any type of accurate bottom-line guidance for 2020, it does believe that significant free cash flow generation will continue to be the norm for some time to come.Despite the probable 60%+ drop in earnings this year, Xerox is committed to keep on rewarding its shareholders through its dividend and buyback (roughly 50% of expected free cash flow). What is the message here? Well, if the company has the wherewithal to keep on generating cash through the rough times, this bodes well for next year and beyond. Why? Because the firm can go out and use this cash to acquire more assets (as they will be cheaper) to bring in more sales and earnings for the firm.For example, just look at how book value has been trending. Currently, the firm's book value comes in at $5.477 billion, but yet when the firm had sales of $2.2+ billion more (2017), the book value came in at $5.26 billion. This trend speaks to Xerox's much stronger financials we are seeing being played out at present.On the long-term chart of XRX, it is difficult to ascertain future direction. Shares, for example, at the end of 2019 failed to break above their 2007 highs. This means, we possibly have a long-term double top or a bullish ascending triangle in play. To ascertain which pattern has the most possibility of playing out, we go to the dividend and cash flow metrics to see how they have been trending.The optimal conditions for any dividend are when we have trends of:Over the first two quarters of this year, EBIT and margins dropped sharply which spiked the interest coverage ratio between the 4 and 6 range. Operating cash flow also took a hit due to this trend in the first two quarters. What we remain focused on is the health of Xerox's profitability metrics coming into 2020 and whether we can return to these trends over the next few quarters. Profitability was definitely on the rise coming into this year which is why analysts are predicting a robust snapback in earnings in 2021.With respect to the firm's balance sheet, Xerox has been deleveraging for quite some time now. The latest quarter saw a debt to equity ratio of 0.4 which is the best number we have seen at Xerox for quite some time.The two main risks we see with respect to Xerox's dividend are the following.Therefore, to sum up, Xerox is cheap but obviously cheap for a reason. At its present valuation (forward p/e of 7.6) and with a dividend of 5.6%, value investors are sure to be attracted. The technicals though remain unclear and there are clear risks in the near term especially if earnings remain subdued. The question now is whether Xerox can recover the bullish trends it had coming into 2020. A significant earnings beat in Q3 would go a long way in convincing the many investors who remain sceptical at present."
4376504,20599,2020-09-27T09:21:33-04:00,"Xerox Holdings is looking at a paperless future and has actively started offering its IoT and AI solutions to a wide variety of industries.Wall Street maven, Carl Icahn, has recently picked up 4 million shares at an average price of $17.Though the company is likely to face challenges in the near term, its long-term outlook holds promise.","One look at the financials and analysts' ratings of Xerox Holdings (NYSE:XRX) is enough to suggest that the company is operating in a shallow market and that it is better to track it rather than invest in it. Why then is the cult investor and XRX's 10% owner, Carl Icahn, picking up its stock like there's no tomorrow?Image Source: Guru FocusIcahn has picked up about 4 million shares between August 7, 2020, and September 9, 2020, at an average price of about $17. So what gives? Why is Icahn tanking up on XRX despite its stagnant prospects?Here's my analysis:A paperless office saves time and money, reduces wastage, helps the environment, and optimizes on office space. Moreover, documents can be archived over the cloud, and there's adequate cybersecurity available to protect them from hacking. Businesses around the world are going paperless, and this is the most obvious hit to XRX's fortunes. These days many businesses are shut because of COVID-19, so this is further driving down the demand for printers, photocopying machines, and related equipment. This translates to a cruel double whammy for XRX.The COVID-19 impact has been very severe on the company's financials. As of Q2 2020, XRX had managed to open just 50% of its facilities. The management team did not provide the 2020 guidance because there is too much uncertainty going around.Image Source: XRX's Income Statement on SAThe company's revenues have been sliding since 2015, and it has been slashing its SG&A and R&D expenses to generate a reasonable operating income. It plans to save $450 million in costs in 2020. What's interesting is that despite a disastrous Q2 2020, the company scraped through with positive operating cash flows of $34 million. It also repaid $313 debt from its cash reserves.The management team has disclosed to the SEC that the decline in office printing is a significant risk factor (p. 63) and that the paperless trend will not reverse. It also fears increasing tariffs because of protectionism in the post-COVID-19 era. XRX has developed AI- and IoT-based solutions for a variety of industries and has witnessed revenue growth in that vertical. The company also manufactures liquid metal 3D printers, which are said to have solid potential in the long term.Image Source: XRX Q2 2020 PresentationIn Q2 2020, XRX's service revenues formed 41% of its total revenues. This percentage should grow in the future. As the company is reeling from COVID-19's impact, there's little point getting into its finances or benchmarking these with prior quarters or years. The idea is to focus on prospects.Let's talk a bit about how XRX's 10% owner, Icahn, makes his money from investing.Icahn is referred to as a contrarian investor in market circles because his philosophy is to buy stocks when no one wants them. Typically, he aggressively picks up laggard stocks with poor P/E ratios, which he is convinced about. Once he has a sufficient percentage of shares, he begins calling for general meetings or asset disinvestments to maximize shareholder returns.You may also be aware that he did his best for a Xerox-Hewlett Packard (HPE) union in 2019 but failed. With Icahn around, investors can expect XRX to be in the news going forward.XRX is likely to operate in a shallow market and perhaps with several virus-related disruptions in the near term. It will also be impacted by rising global tariffs because of the protectionism we are about to witness going forward. Other near-term risks include the elections and the possibility of a U.S.-China cold war.That said, the company's prospects hold promise in the long term because of its focus on AI and IoT services, and 3D printing. The stock is currently available at $18.9, which is near its five-year low of about $14.90.But what overrides everything else is Icahn's purchase of 4 million shares in the last 40 days.*Like this article? Don't forget to hit the Follow button above!"
