article_id,author_id,publish_on,summary,content
3849136,33291,2016-01-29T17:59:24-05:00,I initiated coverage on Xerox in the fall of 2015.Several new developments have occurred since I last covered the name and this morning I was asked if this stock was 'dead money.'Q4 earnings are out and I discuss the results and the key metrics that you need to know.,"When I initiated coverage on Xerox (NYSE:XRX) this fall, I stated the following:Source: Flickr.comI concluded that the stock wasn't dead, but recently I was asked if the stock is ""dead money."" Since it had been months since I checked in, I said I would have a look. I assume the prompt from the inquiry stemmed from the just reported quarterly earnings that came out Friday morning. In this article, I discuss the performance. But there have been some developments in the name since I last covered it. Most notable activists are taking a stake.First, we know that Carl Icahn has been upping his stake and will be getting some of his people into management at the company. We learned also that the company will be splitting into two separate companies. Remember in the quote above, I cited the strategic review. This split is a result; it will separate into two independent, publicly traded companies, one focusing on document technology and the other on business process outsourcing. On that note, just how are these two 'new' companies performing now?So turning to performance, which has been pitiful of late and is the reason shares have declined, shows that there are still declining revenues. Revenue as a whole came in at $4.65 billion and missed estimates by $80 million. Further, this was down 7.6% year-over-year. Ouch! Of course, as I have discussed in-depth in other articles, the strong dollar has plagued companies with international business. Thus, we need to look at revenues on a constant dollar basis. Doing so, we still see revenues were down 5% year-over-year. That is still a huge negative. Revenue from the company's ""services"" business was $2.6 billion, down 3%, (flat in constant dollars) with margins at 9.4%. Revenue from the company's ""document technology"" business was $1.9 billion, down 13% on an absolute basis or 10% in constant dollars. Margin's narrowed to 11.8%.So revenues declining are never a good thing, nor are slimming margins. So how about earnings? Well, I can first say that total expenses were well over 90% of revenues and operating margin was pressured. Gross margin was 31.3%, and selling, administrative and general expenses were 19.0% of revenue. Considering revenues and expenses, the company saw an earnings of $0.27. Now, we need to factor in some items and in doing so, we see that adjusted earnings came in at $0.32 per share. This actually beat estimates by $0.04, but is down from a year ago. That said, the company did generate strong cash flow of $878 million.So what to do? Well, I have to be honest here, I'm not happy with declining revenues and pressured margins. I think the company split is a strong way to generate some life for shareholders. The outlook for 2016 is better than I expected. It is looking for GAAP earnings of $0.66 to $0.76, whereas adjusted earnings will be $1.07 to $1.20. Operating cash flow will be $1.3 billion and $1.5 billion and free cash flow will exceed $1 billion. Further, the company announced that its board of directors declared an 11% increase in the company's quarterly cash dividend to $0.0775 per share. So is Xerox dead-money? No, not at all. The yield is well in excess of 3% and I am tempted to be a buyer here.Note from the author: Christopher F. Davis has been a leading contributor with Seeking Alpha since early 2012. If you like his material and want to see more, scroll to the top of the article and hit ""follow."" He also writes a lot of ""breaking"" articles that are time sensitive. If you would like to be among the first to be updated, be sure to check the box for ""Real-time alerts on this author"" under ""Follow."""
3860196,80285,2016-02-03T09:30:00-05:00,"Icahn has been successful in getting three board seats in the Business Process Outsourcing company, and is involved in the search for a new CEO.
        On a sum-of-the-parts valuation, Xerox's valuation is not attractive enough.
        Of the two separate future companies, the BPO Company is clearly a higher quality business with more potential.
        Document Technology arm could be bought out at a premium by competitors such as HPQ. Otherwise, a tax-free spin-off should create M&A opportunities in the future.
        Although most factors are aligned for value creation, shares are not sufficiently low to generate satisfactory returns. Hence, selling puts may be a superior strategy.","After being bearish on Xerox (NYSE:XRX) for the most part of last year, I signaled that Icahn's involvement could catalyze a reversal for the company, whose shares had fallen nearly 30% before the spike today. With last week's news, we re-evaluate Xerox's prospects going forward.Xerox's Board of Directors (BoD) and management has capitulated by giving Carl Icahn three board seats on the to-be-created BPO company. He has also been allowed to assign an observer/advisor to be involved in the search for a new CEO. This is great news as it means Ursula Burns, Xerox's CEO whom we do not have a favourable opinion of, will not be running the new BPO company. However, upon closer scrutiny we do not believe Xerox's shares have enough value at these levels despite its positive prospects.Carl Icahn In The Driving SeatAccording to the formal agreement signed between Icahn and Xerox's management, the activist investor is getting more than what the press release would suggest. Other than three board seats and an advisor/observer in the search for the new CEO, Icahn also has the power to approve the nomination for another board member, solidifies his control over the board.The composition of the new board is as follows: Icahn will designate three board members and Xerox's current board will select two existing members to join the BoD of the BPO company, with four new independent external directors being nominated by the current board. Icahn has the power to approve the nomination of one of these four new directors. Also, the new CEO, whom Icahn's staff will have an active role in the search and select process, will be among the four new board members.Therefore, Carl Icahn essentially has the power to select/choose five board members (including the CEO), putting him squarely in control of the board. Furthermore, given that only a maximum of two current directors can join the new board, we are confident that the appalling corporate governance seen in Xerox will not continue at the new BPO company. Hence, we think investors should stick with the smart money as long as Icahn remains invested. Furthermore, value-destroying CEO Ursula Burns is likely to stay with the DT company, which should make the BPO company a clear choice out of the two.We note that Icahn first took his positions in late November, before increasing his stake in December. From the regulatory filings, we can derive that his average cost is $10+/share, roughly 11% higher than the current share price. One has to believe that this implies Icahn believes the company could be worth far more on a sum-of-the-parts basis, provided that Xerox is separated into two companies with no major issues.The SplitNow that Xerox has clearly defined the split into two companies, one comprising of the BPO segment and the other comprising of the Document Outsourcing (NYSE:DO) and DT segments. Traditionally, BPO and DO have been reported as a single 'Services' segment in Xerox's disclosures, and hence there is some difficulty determining the value of these businesses as separate entities. However, there are clues and characteristics that can help us derive a close estimation of what they might be worth separately.The Document CompanyThe 'Document Company' will consist of the DT and DO businesses. The DT segment of the company generates a larger amount of cash flow due to Xerox's large installed base of printers which enable them to collect regular fees for maintenance and supplies. Xerox also has an internal financing arm that allows customers to purchase large printing equipment on credit terms. (The receivables are usually securitized and sold off at a discount). The DT segment generated roughly $7.4B in revenue for FY2015 at a segment EBIT margin of 11.8%. The segment has been shrinking for the past couple of years both in terms of revenue and margins.(Source: Author's Work)The DT business is already in run-off mode due to the large number of competitors, alternative printer models and the mature stage of the industry. There is strong competition throughout the supply chain from entry-level printing to high-end printing equipment and services. As a result, revenue has declined significantly but margins are holding fairly steady due to streamlining and cost-cutting initiatives.From FY2014 to FY2015, Revenue declined roughly 12% in actual-currency terms, but the decline was markedly less at 8% in constant-currency. Looking at the trend in past years, we think DT revenue will experience an organic decline of 6% - 8% for the next three to five years, in-line with recent performance, before tapering off at a terminal decline rate of roughly 3% - 5%. Assuming margins remain steady, we would conservatively value the DT segment between 4x and 6x FY2015 EBIT, which would give it a value between $3.51B and $5.27B. I think these assumptions are on the lower end and creates a margin of safety from a bull's perspective.Next, we move on to the Document Outsourcing business. Here it gets a little difficult to derive segment data because DO is reported together with BPO as a single 'Services' segment. However, note that the Services segment was created with the acquisition of ACS in 2009, which added the BPO business to Xerox's overall portfolio. Therefore, we can go back and get a sense of the DO margins before the acquisition.From Xerox's disclosures, it would seem that the BPO business has a far higher margin than DO.(Source: Author's Work)In 2008, DO generated $3.83B in revenue and $302M in operating profit (or EBIT), which means segment margin was 7.9%. In FY2009, DO margins fell to 6.7% due to a steep fall in usage of black-and-white printers and a 2-point hit from currency fluctuations. Since then, the printer mix has shifted significantly to mid and high-end color printers, which should have slowed margin shrinkage. The addition of the BPO business brought the combined Pro-Forma FY2009 Services margin to 10.75%, which means BPO had an EBIT margin of 13.1% on its own in 2009. It's clear at this point that DO has far lower margins than BPO and the latter is clearly the more attractive part of the Services segment. It is no wonder that Icahn had his eyes on the to-be-created BPO company.Given that Services margin has declined slightly since 2009, we assume both businesses have experienced similar magnitudes of margin decline. We also take into account the fact that BPO has grown from comprising 58% of Services revenue in 2009 to 68% of Services revenue in FY2015. Accordingly, with FY2015 Services EBIT margin at 8.1%, we estimate BPO margins to be between 10% - 11% and DO margins to be 4.5% to 5.5%. Taking the mid-point of these margins, the DO business would have generated EBIT of $163M in FY2015. Given that DO revenue has been largely flat in the past couple of years with some slight declines, we assume revenue will decline modestly at 2% - 3% annually for the foreseeable future. In this case, we think the business is appropriately valued at between 7-9x FY2015 EBIT, which gives us a range of $1.14B to $1.47B.The BPO CompanyLastly, we value Xerox's crown jewel: the growing BPO services segment. As per our previous analysis, we take the midpoint of our 10%-11% EBIT margin estimate, which gives us a FY2015 EBIT of $722M. BPO revenue was down 2% in constant-currency but had been showing signs of signs of growth (albeit slowing) in the past few years. The BPO business has benefited from Obamacare legislation requiring hospitals to run more efficiently, and the overall trend towards automating business functions to allow for cost-savings. However, management has done a poor job in terms of project management as there have been significant cost overruns and margin pressures in recent years. Hence, we believe the BPO company has far more potential if motivated and competent management are put in place.Despite management's figure of projected '5%' growth, we feel one should be more conservative when on the long side. We would look at the segment as if revenues remain flat. Hence, we value the BPO business conservatively at 9-11x FY2015 EBIT, which gives us a range of $6.50B to $7.94B.Bringing the three values together, Xerox could be worth an estimated $11.15B to $14.68B. After deducting net debt, we end up with a range of $6.31B to $9.84 which hovers right around Xerox's current share price of ~$9.Where Is Value Created?By now, some readers will have grave questions about my EBIT assumptions, because when added together they exceed Xerox's consolidated EBIT for 2015. This is due to some unallocated costs such as restructuring expenses, amortization of intangible assets, impairments and others. In the end, the numbers I presented do not demonstrate a compelling bull case.The valuation of each segment allows us to understand each business better as we take into account the different factors and their historical figures. More importantly, this shows that based on a set of very conservative assumptions, the numbers do not work from a bullish perspective, and that there isn't sufficient upside from the current share price. Note however, that we have derived this numbers without taking into account the improvements that will likely happen with a motivated and competent management, which we think Icahn will surely put in place. Therefore, any incremental improvements should be directly accretive to the value of the BPO Company. In other words, the 'math' does not check out.However, one needs to take into account the qualitative variables. Most of the time, making or losing money comes down to an analysis of factors and how each one is likely to play out. Particularly in Xerox's case, there are a number of variables that are crucial to the bull case.Firstly, the new management of the BPO Company will need to implement structural changes to undo previous mistakes. Xerox's BPO business has a large backlog with $11.5B in total contract value (TCV) signings this year alone. The ability to monetize these projects at a higher margin will be the key to Xerox's performance. In this case, Icahn is a motivated owner and we should see a competent CEO installed and given the appropriate incentives. Moreover, with Icahn having control over the board, corporate governance should be strong and the sort of 'paying for inferior performance' at Xerox should disappear.Also, we await the release of more detailed segment disclosures that should allow for us to estimate the value of each company more accurately. The margins and cash flows are particularly important, although we may not get an accurate estimate of Pro-Forma cash flows until after the separation. Also, with the BPO contract renewal rate falling significantly to 74% this quarter, investors should be concerned if this indicates a deterioration in the business. We are being told that the lower renewal rate was due to a large contract coming due and that it was uneconomical to renew at the asking terms. I think this explanation is sufficient for now, but would be gravely concerned if the renewal rate does not recover to above 85% next quarter.Next, the Document Company is likely to receive M&A offers either in the lead-up or after spin-off, which should enhance shareholder returns. With margins in Managed Print Services and related areas shrinking, competitors are eager to consolidate to cut costs and take advantage of scale. To that end, we think the Document Company could be a good fit for HPQ given the overlap in printer manufacturing and commercial print services. The global footprint of both companies also allow HPQ to consolidate and enlarge their reach with a larger customer base whilst eliminating duplicate corporate functions to cut costs.The last and perhaps most important factor is how the company's liabilities and cash will be split. I mentioned in previous articles that Xerox has an unfunded pension and health liability of $3.3B - how that is dividend among the two companies will be crucial. The same logic goes for Xerox's $6.4B in debt. However, if Icahn loves his money, which we think he does, the BPO company is not likely to be burdened with too many liabilities as the veteran is no stranger to winning behind-the-scenes negotiations. However, one can never be too certain and we will have to monitor proceedings closely.ConclusionOverall, Xerox remains in decent shape for now as the company continues to generate ~$1.2B in free cash flow annually. However, it is clear that a tremendous amount of cash has been wasted by management on unaccretive acquisitions in the past few years, whilst continuing to pay themselves huge bonuses even overall performance deteriorated significantly.Prior to Icahn's involvement, some readers on SeekingAlpha had prophetically commented that Xerox was ripe for activist intervention, and it is certainly happening in full force now. However, we would caution against excess optimism - the market was initially optimistic before turning extremely bearish on Xerox's share price, implying that the marginal investor does not believe in the turnaround story yet. The facts are that Q4 bought about good news with Icahn's involvement, but also a continued fundamental deterioration - Xerox experienced falling BPO renewal rates, free cash flow and year-on-year margin declines.To sum it all up, we think Xerox's future prospects are positive but the current share price does not present sufficient upside. However, we would be a buyer at 8 or less. Given Xerox's high implied volatility percentage currently, we think Jan 2017 puts with a strike price of $8 are the best instrument to express this view. The puts are currently trading for $75 per option, which means the break-even point excluding commission is $7.25/share. It essentially allows one to buy Xerox shares at $7.25 for a small collateral amount, and a bonus of earning the entire premium if Xerox's share price stays above $8."
